k,Name,in_iM,gene_weight,Regulator,Function,Category
35,Unc_4,False,0.0260631324,,Uncharacterized iModulon 4,Uncharacterized
68,Sulfur Metabolism,False,0.0252343039,,Kegg Map that displays the transport and metabolism of sulfur,Sulfur Metabolism
71,PDIM;PGL Synthesis,False,-0.0214164729,,Manually annotated iModulon that captures genes associated with PDIM and PGL synthesis,Virulence/Persistence
22,SG_3,False,-0.019455210400000002,,Single Gene iModulon 3,Single Gene
54,Unc_7,False,-0.0164802887,,Uncharacterized iModulon 7,Uncharacterized
64,Mce1R,False,0.0157844051,mce1R,Transcription factor that regulates the mce1 virulence operon,Virulence/Persistence
7,GroEL-GroES Complex,False,-0.014312922,,Gene Ontology Term specific to the bacterial chaperonin complex,Amino Acids
36,Fumarate Reductase,False,0.0132345408,,iModulon enriched with the Fumarate Reductase Gene Ontology term,Central Carbon
70,Lsr2,False,0.0130984458,lsr2,Sequence independent transcription factor that controls a wide variety of genes,Antibiotic
28,WhiB1,False,-0.0122002671,whiB1,"Transcription repressor that is redox responsive, found to be nitric oxide sensitive",Redox
18,Unc_1,False,-0.0117804095,,Uncharacterized iModulon 1,Uncharacterized
43,LysG,False,0.0114391631,lsyG,Transcription factor that controls the expression of LysE and requires lysine or histidine for activation ,Amino Acids
16,Mce3R,False,0.0110514723,mce3R,Transcription factor that regulates the mce3 virulence operon,Virulence/Persistence
63,SG_9,False,0.0110489512,,Single Gene iModulon 9,Single Gene
77,Central Carbon Metabolism,False,-0.010993676400000001,,iModulon enriched with the Central Carbon Metabolism KEGG pathway,Central Carbon
66,M-box,False,-0.0106813819,,Magnesium activated non-coding sRNA that regulates the function of genes associated with metal metabolism and virulence,Metal Related
72,Unc_8,False,0.0106131321,,Uncharacterized iModulon 8,Uncharacterized
41,Unc_5,False,-0.0105823134,,Uncharacterized iModulon 5,Uncharacterized
34,MbcA+Rv3249c+Rv3066,False,-0.010079162000000001,mbcA and Rv3249c and Rv3066,"iModulon that maps to the intersection of the Rv1990c, Rv3249c, and Rv3066 regulons",Virulence/Persistence
79,WhiB4/IdeR,False,-0.010042844300000001,whiB4 or ideR,iModulon that maps to the union of the Rv3681c and Rv2711 regulons,Redox
59,Rv0576,False,0.0098225724,Rv0576,Possible ArsR family transcription factor that regulates genes related to virulence,Virulence/Persistence
2,IniR,False,0.0097194871,iniR,Transcription factor that regulates the expression of the ini operon (iniBAC),Antibiotic
26,EspL KO,False,-0.0096634916,,Single Gene iModulon that captures EspL knockout,KO
33,SG_4,False,0.0095453412,,Single Gene iModulon 4,Single Gene
75,Unc_9,False,0.0087700911,,Uncharacterized iModulon 9,Uncharacterized
14,SG_2,False,-0.0086913866,,Single Gene iModulon 2,Single Gene
0,SigH,False,-0.0086851493,sigH,Sigma Factor involved in heat shock and oxidative stress response,Virulence/Persistence
20,FasR,False,0.008224970600000001,fasR,Transcription factor that controls the expression of fatty acid metabolism genes,Fatty Acid/Cholestrol
42,Nicotinate Metabolism,False,-0.0081323064,,iModulon enriched with the nicotinate and nicotinamide metabolism KEGG pathway,Central Carbon
3,PyrR,False,-0.0074795142000000005,pyrR,Transcription factor that regulates the expression of pyrimidine nucleotide operons,Nucleic Acids
15,BkaR,False,-0.0073183311000000004,bkaR,Transcription factor that regulates genes related to branched-chain keto-acid metabolism,Central Carbon
32,Unc_3,False,0.006916235000000001,,Uncharacterized iModulon 3,Uncharacterized
24,Salicylate Induced,False,-0.0068424257,,Manually annotated iModulon where genes were found to change expression when exposed to salicylate,Metal Related
53,Rv1776c+WhiB4,False,-0.0067815642,Rv1776c and whiB4 ,iModulon that maps to the intersection of the Rv1776c and Rv3681c regulon,Redox
47,SG_7,False,0.0064432977,,Single Gene iModulon 7,Single Gene
45,SigD,False,0.0063614635,sigD,Sigma Factor that governs the expression of ribosomal genes and plays a role in virulence,Virulence/Persistence
49,Rv1828/SigH,False,0.0060288171,Rv1828 or sigH,iModulon that maps to the union of the Rv1828 and Rv3223c regulons,Redox
23,PrpR,False,-0.0057956875000000005,prpR,Transcription factor that is involved in catabolism of short chain fatty acids via gloxylate and methylcitrate cycle,Central Carbon
57,SG_8,False,-0.0057937412,,Single Gene iModulon 8,Single Gene
31,ArgR,False,-0.005710221000000001,argR,Transcription factor that regulates the L-arginine biosynthesis pathways,Amino Acids
61,Nucleic Acid Hydrolysis ,False,-0.0056464396,,iModulon enriched with the Nucleic Acid Hydrolysis KEGG pathway,Nucleic Acids
13,SG_1,False,-0.005615197000000001,,Single Gene iModulon 1,Single Gene
55,WhiB7,False,0.0054638041000000005,whiB7,Transcription factor that connects systems for redox homeostasis and antibiotic resistance,Antibiotic
37,Rv3095,False,0.0054134849,Rv3095,iModulon labeled with predicted regulon with unknown function,Unknown Function
10,RicR,False,0.0054121526,ricR,Copper responsive transcription factor that regulates metal metabolism genes,Metal Related
12,Mycofactocin Synthesis Pathway,False,0.0052747911000000005,,Manually annotated iModulon that captures multiple genes associated with mycofactocin metabolism,Fatty Acid/Cholestrol
8,IdeR,False,0.0052418687,ideR,Metal-Dependent DNA-Binding protein that controls genes related to iron metabolism,Metal Related
65,SG_10,False,0.0051955183,,Single Gene iModulon 10,Single Gene
76,SG_13,False,-0.0050697407,,Single Gene iModulon 13,Single Gene
6,MarR,False,-0.0046920912,marR,Transcription factor that regulates the response to acid stress,Acid Stress
67,Peptidoglycan Biosynthesis,False,0.0046000949,,iModulon enriched with the Peptidoglycan biosyntehsis KEGG pathway,Central Carbon
44,SG_6,False,0.0044949233,,Single Genes iModulon 6,Single Gene
29,Blal,False,-0.0036355047,blaI,"Transcription regulator that regulates genes associated with antibiotic transport, detoxification, and cell wall function",Antibiotic
40,KstR2,False,0.0034582778000000003,kstR2,Transcription factor that regulates a small regulon related to cholesterol utilization,Fatty Acid/Cholestrol
62,Rv2488c,False,-0.0034450688,Rv2488c,LuxR family transcription factor that regulates genes associated with virulence,Virulence/Persistence
52,DevR-2,False,-0.0034205603,devR,Transcription factor that is one of the primary regulators of hypoxia onset response,Redox
9,SigK,False,0.0032748076,sigK,Sigma Factor involved in the production of antigenic proteins,Unknown Function
19,WhiB6,False,-0.0031372636,whiB6,Transcription factor that regulates ESX-1 system membrane transport proteins,Redox
39,SigC,False,-0.0031176403,sigC,Sigma Factor that plays a role in organism virulence and lethality,Virulence/Persistence
50,Unc_6,False,-0.003071336,,Uncharacterized iModulon 6,Uncharacterized
48,Leucine Related,False,0.0030232994000000003,,Manually annotated iModulon with gene related to leucine metabolism,Amino Acids
56,Fatty Acid Biosynthesis,False,-0.0028063257,trcR and Rv1776c and whiB4 ,"iModulon that maps to the intersection of the Rv1033c, Rv1776c, and Rv3681c regulons",Fatty Acid/Cholestrol
25,Rv0078+Rv2034,False,-0.0026059929,Rv0078 and Rv2034,iModulon that maps to the intersection of the Rv0078 and Rv2034 regulon,Antibiotic
27,Unc_2,False,-0.0024771859,,Uncharacterized iModulon 2,Uncharacterized
74,SG_12,False,-0.0024120016,,Single Gene iModulon 12,Single Gene
30,HPT-2b Induced,False,-0.0023418083,,iModulon regulates many genes that are activated by HPT-2b (1-hydroxy-5-R-pyridine-2(1H)-thiones),Metal Related
17,VirS,False,-0.0021026738,virS,Transcription factor that is activated and responds to acidic environments,Redox
5,DevR-1,False,-0.0018118113,devR,Transcription factor that is one of the primary regulators of hypoxia onset response,Redox
21,MprA,False,0.0017560483,mprA,Transcription factor that regulates multiple stress responsive genes,Virulence/Persistence
38,SG_5,False,0.0014588591,,Single Gene iModulon 5,Single Gene
1,Polyketide Synthase Complex,False,0.0013360657,,KEGG Map related to the synthesis of type II polyketide backbone ,Fatty Acid/Cholestrol
60,Rv0681,False,-0.0010259538,Rv0681,"Transcription with previously unknown function, regulates core fatty acid response",Unknown Function
58,Zur,False,0.0009907334,zur,Transcription factor that is activated by and regulates the metabolism of zinc,Metal Related
69,Rv0135+Rv1019,False,-0.0008265739,Rv0135c and Rv1019,iModulon that maps to the intersection of the Rv0135c and Rv1019 regulons,Nucleic Acids
4,WhiB4,False,0.0005374053,whiB4,Redox-Responsive transcription regulator that regulates protection response during infection,Redox
73,SG_11,False,0.0003832159,,Single Gene iModulon 11,Single Gene
51,PhoP,False,-0.00033251550000000003,phoP,"Transcription factor that controls response to redox/acid stress, hypoxia, and virulence",Virulence/Persistence
11,EccE1 KO,False,0.000300404,,Single Gene iModulon that captures EccE1 knockout,KO
46,Rv2621c,False,0.0002278768,Rv2621c,iModulon labeled with predicted regulon with unknown function,Unknown Function
78,Positive Regulation of Growth,False,8.21978e-05,,iModulon enriched with the Positive Regulation of Growth Gene Ontology term,Growth
