k,Name,in_iM,gene_weight,Regulator,Function,Category
70,Lsr2,False,0.0290201361,lsr2,Sequence independent transcription factor that controls a wide variety of genes,Antibiotic
79,WhiB4/IdeR,False,-0.0211829155,whiB4 or ideR,iModulon that maps to the union of the Rv3681c and Rv2711 regulons,Redox
31,ArgR,False,0.0211504118,argR,Transcription factor that regulates the L-arginine biosynthesis pathways,Amino Acids
46,Rv2621c,False,0.0191565938,Rv2621c,iModulon labeled with predicted regulon with unknown function,Unknown Function
17,VirS,False,-0.0179374712,virS,Transcription factor that is activated and responds to acidic environments,Redox
45,SigD,False,-0.0169712766,sigD,Sigma Factor that governs the expression of ribosomal genes and plays a role in virulence,Virulence/Persistence
18,Unc_1,False,-0.014234338800000001,,Uncharacterized iModulon 1,Uncharacterized
9,SigK,False,-0.0129877314,sigK,Sigma Factor involved in the production of antigenic proteins,Unknown Function
49,Rv1828/SigH,False,-0.0126088747,Rv1828 or sigH,iModulon that maps to the union of the Rv1828 and Rv3223c regulons,Redox
36,Fumarate Reductase,False,0.012276271200000001,,iModulon enriched with the Fumarate Reductase Gene Ontology term,Central Carbon
32,Unc_3,False,-0.0118443553,,Uncharacterized iModulon 3,Uncharacterized
54,Unc_7,False,-0.0118038058,,Uncharacterized iModulon 7,Uncharacterized
78,Positive Regulation of Growth,False,-0.0116101168,,iModulon enriched with the Positive Regulation of Growth Gene Ontology term,Growth
68,Sulfur Metabolism,False,-0.010836327500000001,,Kegg Map that displays the transport and metabolism of sulfur,Sulfur Metabolism
34,MbcA+Rv3249c+Rv3066,False,0.0096881351,mbcA and Rv3249c and Rv3066,"iModulon that maps to the intersection of the Rv1990c, Rv3249c, and Rv3066 regulons",Virulence/Persistence
65,SG_10,False,-0.0095376438,,Single Gene iModulon 10,Single Gene
67,Peptidoglycan Biosynthesis,False,-0.0095030451,,iModulon enriched with the Peptidoglycan biosyntehsis KEGG pathway,Central Carbon
59,Rv0576,False,-0.0092461264,Rv0576,Possible ArsR family transcription factor that regulates genes related to virulence,Virulence/Persistence
2,IniR,False,0.0090933408,iniR,Transcription factor that regulates the expression of the ini operon (iniBAC),Antibiotic
10,RicR,False,0.0090741211,ricR,Copper responsive transcription factor that regulates metal metabolism genes,Metal Related
16,Mce3R,False,-0.0089541485,mce3R,Transcription factor that regulates the mce3 virulence operon,Virulence/Persistence
55,WhiB7,False,0.0080169213,whiB7,Transcription factor that connects systems for redox homeostasis and antibiotic resistance,Antibiotic
73,SG_11,False,-0.007722126300000001,,Single Gene iModulon 11,Single Gene
41,Unc_5,False,-0.0076565566,,Uncharacterized iModulon 5,Uncharacterized
29,Blal,False,-0.0075794877,blaI,"Transcription regulator that regulates genes associated with antibiotic transport, detoxification, and cell wall function",Antibiotic
43,LysG,False,-0.007268601,lsyG,Transcription factor that controls the expression of LysE and requires lysine or histidine for activation ,Amino Acids
76,SG_13,False,0.0068016274,,Single Gene iModulon 13,Single Gene
50,Unc_6,False,-0.0066666891,,Uncharacterized iModulon 6,Uncharacterized
51,PhoP,False,0.0065215654,phoP,"Transcription factor that controls response to redox/acid stress, hypoxia, and virulence",Virulence/Persistence
23,PrpR,False,-0.0064727255,prpR,Transcription factor that is involved in catabolism of short chain fatty acids via gloxylate and methylcitrate cycle,Central Carbon
44,SG_6,False,-0.0064523072,,Single Genes iModulon 6,Single Gene
20,FasR,False,0.0064014785,fasR,Transcription factor that controls the expression of fatty acid metabolism genes,Fatty Acid/Cholestrol
58,Zur,False,0.0063737573,zur,Transcription factor that is activated by and regulates the metabolism of zinc,Metal Related
63,SG_9,False,0.0063403477,,Single Gene iModulon 9,Single Gene
61,Nucleic Acid Hydrolysis ,False,-0.0063126627,,iModulon enriched with the Nucleic Acid Hydrolysis KEGG pathway,Nucleic Acids
57,SG_8,False,-0.0061950002,,Single Gene iModulon 8,Single Gene
38,SG_5,False,0.0059194846,,Single Gene iModulon 5,Single Gene
24,Salicylate Induced,False,0.0057932251,,Manually annotated iModulon where genes were found to change expression when exposed to salicylate,Metal Related
37,Rv3095,False,-0.0055782527,Rv3095,iModulon labeled with predicted regulon with unknown function,Unknown Function
42,Nicotinate Metabolism,False,-0.0054613024000000005,,iModulon enriched with the nicotinate and nicotinamide metabolism KEGG pathway,Central Carbon
26,EspL KO,False,0.0052834710000000005,,Single Gene iModulon that captures EspL knockout,KO
7,GroEL-GroES Complex,False,0.0052078275000000005,,Gene Ontology Term specific to the bacterial chaperonin complex,Amino Acids
11,EccE1 KO,False,-0.0051228877,,Single Gene iModulon that captures EccE1 knockout,KO
1,Polyketide Synthase Complex,False,-0.0049961923000000005,,KEGG Map related to the synthesis of type II polyketide backbone ,Fatty Acid/Cholestrol
22,SG_3,False,-0.0048598599,,Single Gene iModulon 3,Single Gene
4,WhiB4,False,0.0046308962,whiB4,Redox-Responsive transcription regulator that regulates protection response during infection,Redox
30,HPT-2b Induced,False,0.0043061506,,iModulon regulates many genes that are activated by HPT-2b (1-hydroxy-5-R-pyridine-2(1H)-thiones),Metal Related
56,Fatty Acid Biosynthesis,False,0.0042280489,trcR and Rv1776c and whiB4 ,"iModulon that maps to the intersection of the Rv1033c, Rv1776c, and Rv3681c regulons",Fatty Acid/Cholestrol
77,Central Carbon Metabolism,False,0.0042093801,,iModulon enriched with the Central Carbon Metabolism KEGG pathway,Central Carbon
6,MarR,False,-0.0041442332,marR,Transcription factor that regulates the response to acid stress,Acid Stress
62,Rv2488c,False,0.0039201369,Rv2488c,LuxR family transcription factor that regulates genes associated with virulence,Virulence/Persistence
47,SG_7,False,0.0036064819000000002,,Single Gene iModulon 7,Single Gene
48,Leucine Related,False,-0.0034963646000000003,,Manually annotated iModulon with gene related to leucine metabolism,Amino Acids
3,PyrR,False,0.0034308284,pyrR,Transcription factor that regulates the expression of pyrimidine nucleotide operons,Nucleic Acids
13,SG_1,False,0.0033086676,,Single Gene iModulon 1,Single Gene
53,Rv1776c+WhiB4,False,0.0031850566,Rv1776c and whiB4 ,iModulon that maps to the intersection of the Rv1776c and Rv3681c regulon,Redox
71,PDIM;PGL Synthesis,False,-0.0030809506,,Manually annotated iModulon that captures genes associated with PDIM and PGL synthesis,Virulence/Persistence
25,Rv0078+Rv2034,False,-0.0027607446,Rv0078 and Rv2034,iModulon that maps to the intersection of the Rv0078 and Rv2034 regulon,Antibiotic
27,Unc_2,False,-0.0027325733,,Uncharacterized iModulon 2,Uncharacterized
66,M-box,False,-0.0025150087000000002,,Magnesium activated non-coding sRNA that regulates the function of genes associated with metal metabolism and virulence,Metal Related
19,WhiB6,False,-0.0023713165000000002,whiB6,Transcription factor that regulates ESX-1 system membrane transport proteins,Redox
12,Mycofactocin Synthesis Pathway,False,-0.0022080058,,Manually annotated iModulon that captures multiple genes associated with mycofactocin metabolism,Fatty Acid/Cholestrol
64,Mce1R,False,-0.002108805,mce1R,Transcription factor that regulates the mce1 virulence operon,Virulence/Persistence
40,KstR2,False,-0.0020993971000000003,kstR2,Transcription factor that regulates a small regulon related to cholesterol utilization,Fatty Acid/Cholestrol
5,DevR-1,False,0.0019714145,devR,Transcription factor that is one of the primary regulators of hypoxia onset response,Redox
33,SG_4,False,-0.0017501885000000001,,Single Gene iModulon 4,Single Gene
0,SigH,False,0.0013544329000000001,sigH,Sigma Factor involved in heat shock and oxidative stress response,Virulence/Persistence
35,Unc_4,False,0.0012841687,,Uncharacterized iModulon 4,Uncharacterized
28,WhiB1,False,-0.0011713731000000001,whiB1,"Transcription repressor that is redox responsive, found to be nitric oxide sensitive",Redox
75,Unc_9,False,-0.0010958722,,Uncharacterized iModulon 9,Uncharacterized
60,Rv0681,False,-0.0010053996000000001,Rv0681,"Transcription with previously unknown function, regulates core fatty acid response",Unknown Function
72,Unc_8,False,-0.0009266174,,Uncharacterized iModulon 8,Uncharacterized
69,Rv0135+Rv1019,False,-0.0008485917,Rv0135c and Rv1019,iModulon that maps to the intersection of the Rv0135c and Rv1019 regulons,Nucleic Acids
21,MprA,False,-0.0007693766,mprA,Transcription factor that regulates multiple stress responsive genes,Virulence/Persistence
52,DevR-2,False,-0.0006854304,devR,Transcription factor that is one of the primary regulators of hypoxia onset response,Redox
39,SigC,False,-0.00041894160000000003,sigC,Sigma Factor that plays a role in organism virulence and lethality,Virulence/Persistence
14,SG_2,False,-0.00039252920000000004,,Single Gene iModulon 2,Single Gene
74,SG_12,False,-0.0003475304,,Single Gene iModulon 12,Single Gene
8,IdeR,False,-0.0002352904,ideR,Metal-Dependent DNA-Binding protein that controls genes related to iron metabolism,Metal Related
15,BkaR,False,-0.000109407,bkaR,Transcription factor that regulates genes related to branched-chain keto-acid metabolism,Central Carbon
