k,Name,in_iM,gene_weight,Regulator,Function,Category
31,ArgR,True,0.2507080545,argR,Transcription factor that regulates the L-arginine biosynthesis pathways,Amino Acids
68,Sulfur Metabolism,False,0.0203128046,,Kegg Map that displays the transport and metabolism of sulfur,Sulfur Metabolism
65,SG_10,False,0.019676239,,Single Gene iModulon 10,Single Gene
7,GroEL-GroES Complex,False,-0.018677402500000002,,Gene Ontology Term specific to the bacterial chaperonin complex,Amino Acids
40,KstR2,False,0.0164067955,kstR2,Transcription factor that regulates a small regulon related to cholesterol utilization,Fatty Acid/Cholestrol
24,Salicylate Induced,False,-0.016356267100000002,,Manually annotated iModulon where genes were found to change expression when exposed to salicylate,Metal Related
56,Fatty Acid Biosynthesis,False,-0.014967260500000001,trcR and Rv1776c and whiB4 ,"iModulon that maps to the intersection of the Rv1033c, Rv1776c, and Rv3681c regulons",Fatty Acid/Cholestrol
26,EspL KO,False,0.013042799400000001,,Single Gene iModulon that captures EspL knockout,KO
35,Unc_4,False,-0.012464774900000001,,Uncharacterized iModulon 4,Uncharacterized
45,SigD,False,-0.0116420748,sigD,Sigma Factor that governs the expression of ribosomal genes and plays a role in virulence,Virulence/Persistence
44,SG_6,False,-0.011468717600000001,,Single Genes iModulon 6,Single Gene
73,SG_11,False,0.0114224646,,Single Gene iModulon 11,Single Gene
11,EccE1 KO,False,-0.011270013800000001,,Single Gene iModulon that captures EccE1 knockout,KO
20,FasR,False,-0.0109908121,fasR,Transcription factor that controls the expression of fatty acid metabolism genes,Fatty Acid/Cholestrol
16,Mce3R,False,0.010980831600000001,mce3R,Transcription factor that regulates the mce3 virulence operon,Virulence/Persistence
59,Rv0576,False,0.0107170574,Rv0576,Possible ArsR family transcription factor that regulates genes related to virulence,Virulence/Persistence
71,PDIM;PGL Synthesis,False,0.0103413512,,Manually annotated iModulon that captures genes associated with PDIM and PGL synthesis,Virulence/Persistence
13,SG_1,False,0.0103306859,,Single Gene iModulon 1,Single Gene
66,M-box,False,0.010325860400000001,,Magnesium activated non-coding sRNA that regulates the function of genes associated with metal metabolism and virulence,Metal Related
12,Mycofactocin Synthesis Pathway,False,0.0101782743,,Manually annotated iModulon that captures multiple genes associated with mycofactocin metabolism,Fatty Acid/Cholestrol
30,HPT-2b Induced,False,-0.0101464241,,iModulon regulates many genes that are activated by HPT-2b (1-hydroxy-5-R-pyridine-2(1H)-thiones),Metal Related
32,Unc_3,False,0.0090549334,,Uncharacterized iModulon 3,Uncharacterized
53,Rv1776c+WhiB4,False,-0.0087726617,Rv1776c and whiB4 ,iModulon that maps to the intersection of the Rv1776c and Rv3681c regulon,Redox
54,Unc_7,False,0.008455650700000001,,Uncharacterized iModulon 7,Uncharacterized
38,SG_5,False,0.0082921221,,Single Gene iModulon 5,Single Gene
14,SG_2,False,-0.0082548867,,Single Gene iModulon 2,Single Gene
27,Unc_2,False,-0.0078106238,,Uncharacterized iModulon 2,Uncharacterized
43,LysG,False,-0.0078043934,lsyG,Transcription factor that controls the expression of LysE and requires lysine or histidine for activation ,Amino Acids
55,WhiB7,False,0.0075286284,whiB7,Transcription factor that connects systems for redox homeostasis and antibiotic resistance,Antibiotic
50,Unc_6,False,0.007128243,,Uncharacterized iModulon 6,Uncharacterized
52,DevR-2,False,0.0069869422,devR,Transcription factor that is one of the primary regulators of hypoxia onset response,Redox
1,Polyketide Synthase Complex,False,0.0068977768,,KEGG Map related to the synthesis of type II polyketide backbone ,Fatty Acid/Cholestrol
9,SigK,False,0.0065247999,sigK,Sigma Factor involved in the production of antigenic proteins,Unknown Function
78,Positive Regulation of Growth,False,-0.006497714700000001,,iModulon enriched with the Positive Regulation of Growth Gene Ontology term,Growth
4,WhiB4,False,0.0064747754000000005,whiB4,Redox-Responsive transcription regulator that regulates protection response during infection,Redox
36,Fumarate Reductase,False,-0.0064255119,,iModulon enriched with the Fumarate Reductase Gene Ontology term,Central Carbon
72,Unc_8,False,-0.0063078622,,Uncharacterized iModulon 8,Uncharacterized
42,Nicotinate Metabolism,False,0.0062277832,,iModulon enriched with the nicotinate and nicotinamide metabolism KEGG pathway,Central Carbon
61,Nucleic Acid Hydrolysis ,False,-0.0058747546000000005,,iModulon enriched with the Nucleic Acid Hydrolysis KEGG pathway,Nucleic Acids
51,PhoP,False,-0.0058557047000000004,phoP,"Transcription factor that controls response to redox/acid stress, hypoxia, and virulence",Virulence/Persistence
23,PrpR,False,-0.0058341692,prpR,Transcription factor that is involved in catabolism of short chain fatty acids via gloxylate and methylcitrate cycle,Central Carbon
10,RicR,False,0.0057522921000000005,ricR,Copper responsive transcription factor that regulates metal metabolism genes,Metal Related
46,Rv2621c,False,0.005649591000000001,Rv2621c,iModulon labeled with predicted regulon with unknown function,Unknown Function
79,WhiB4/IdeR,False,-0.0055703689,whiB4 or ideR,iModulon that maps to the union of the Rv3681c and Rv2711 regulons,Redox
67,Peptidoglycan Biosynthesis,False,0.005426194200000001,,iModulon enriched with the Peptidoglycan biosyntehsis KEGG pathway,Central Carbon
57,SG_8,False,0.0053970385000000004,,Single Gene iModulon 8,Single Gene
41,Unc_5,False,0.0051716937000000004,,Uncharacterized iModulon 5,Uncharacterized
60,Rv0681,False,0.0050488177,Rv0681,"Transcription with previously unknown function, regulates core fatty acid response",Unknown Function
21,MprA,False,-0.0050110183,mprA,Transcription factor that regulates multiple stress responsive genes,Virulence/Persistence
49,Rv1828/SigH,False,0.0048943499,Rv1828 or sigH,iModulon that maps to the union of the Rv1828 and Rv3223c regulons,Redox
8,IdeR,False,-0.004843565,ideR,Metal-Dependent DNA-Binding protein that controls genes related to iron metabolism,Metal Related
34,MbcA+Rv3249c+Rv3066,False,-0.0045400728,mbcA and Rv3249c and Rv3066,"iModulon that maps to the intersection of the Rv1990c, Rv3249c, and Rv3066 regulons",Virulence/Persistence
48,Leucine Related,False,-0.004273582000000001,,Manually annotated iModulon with gene related to leucine metabolism,Amino Acids
25,Rv0078+Rv2034,False,-0.0042225163000000005,Rv0078 and Rv2034,iModulon that maps to the intersection of the Rv0078 and Rv2034 regulon,Antibiotic
70,Lsr2,False,0.0041543674,lsr2,Sequence independent transcription factor that controls a wide variety of genes,Antibiotic
3,PyrR,False,0.0039773652,pyrR,Transcription factor that regulates the expression of pyrimidine nucleotide operons,Nucleic Acids
5,DevR-1,False,-0.0039406411,devR,Transcription factor that is one of the primary regulators of hypoxia onset response,Redox
64,Mce1R,False,-0.0039232692,mce1R,Transcription factor that regulates the mce1 virulence operon,Virulence/Persistence
47,SG_7,False,0.0036890966,,Single Gene iModulon 7,Single Gene
69,Rv0135+Rv1019,False,-0.0036724423000000003,Rv0135c and Rv1019,iModulon that maps to the intersection of the Rv0135c and Rv1019 regulons,Nucleic Acids
39,SigC,False,-0.0033489201,sigC,Sigma Factor that plays a role in organism virulence and lethality,Virulence/Persistence
62,Rv2488c,False,0.0032772215,Rv2488c,LuxR family transcription factor that regulates genes associated with virulence,Virulence/Persistence
75,Unc_9,False,-0.0031224190000000004,,Uncharacterized iModulon 9,Uncharacterized
77,Central Carbon Metabolism,False,0.0028377354000000002,,iModulon enriched with the Central Carbon Metabolism KEGG pathway,Central Carbon
63,SG_9,False,0.0027730528,,Single Gene iModulon 9,Single Gene
28,WhiB1,False,-0.0026394663,whiB1,"Transcription repressor that is redox responsive, found to be nitric oxide sensitive",Redox
29,Blal,False,0.0025929714,blaI,"Transcription regulator that regulates genes associated with antibiotic transport, detoxification, and cell wall function",Antibiotic
0,SigH,False,0.0022417183000000003,sigH,Sigma Factor involved in heat shock and oxidative stress response,Virulence/Persistence
33,SG_4,False,-0.0022137280000000003,,Single Gene iModulon 4,Single Gene
17,VirS,False,0.0021644131,virS,Transcription factor that is activated and responds to acidic environments,Redox
19,WhiB6,False,0.0019585253,whiB6,Transcription factor that regulates ESX-1 system membrane transport proteins,Redox
2,IniR,False,0.0014423102,iniR,Transcription factor that regulates the expression of the ini operon (iniBAC),Antibiotic
58,Zur,False,-0.0008844724,zur,Transcription factor that is activated by and regulates the metabolism of zinc,Metal Related
74,SG_12,False,-0.0008168644000000001,,Single Gene iModulon 12,Single Gene
76,SG_13,False,-0.000804862,,Single Gene iModulon 13,Single Gene
6,MarR,False,0.0005709975,marR,Transcription factor that regulates the response to acid stress,Acid Stress
37,Rv3095,False,0.0005558898,Rv3095,iModulon labeled with predicted regulon with unknown function,Unknown Function
15,BkaR,False,0.0004352882,bkaR,Transcription factor that regulates genes related to branched-chain keto-acid metabolism,Central Carbon
18,Unc_1,False,-0.0001816622,,Uncharacterized iModulon 1,Uncharacterized
22,SG_3,False,0.00012822000000000002,,Single Gene iModulon 3,Single Gene
