k,Name,in_iM,gene_weight,Regulator,Function,Category
30,HPT-2b Induced,True,0.08460090270000001,,iModulon regulates many genes that are activated by HPT-2b (1-hydroxy-5-R-pyridine-2(1H)-thiones),Metal Related
12,Mycofactocin Synthesis Pathway,False,-0.0786312807,,Manually annotated iModulon that captures multiple genes associated with mycofactocin metabolism,Fatty Acid/Cholestrol
10,RicR,False,-0.0727214281,ricR,Copper responsive transcription factor that regulates metal metabolism genes,Metal Related
41,Unc_5,False,-0.051732942600000005,,Uncharacterized iModulon 5,Uncharacterized
44,SG_6,False,-0.0514625799,,Single Genes iModulon 6,Single Gene
74,SG_12,False,-0.0466565612,,Single Gene iModulon 12,Single Gene
63,SG_9,False,0.0459316407,,Single Gene iModulon 9,Single Gene
7,GroEL-GroES Complex,False,-0.0455278318,,Gene Ontology Term specific to the bacterial chaperonin complex,Amino Acids
57,SG_8,False,-0.0432713952,,Single Gene iModulon 8,Single Gene
40,KstR2,False,0.042499222,kstR2,Transcription factor that regulates a small regulon related to cholesterol utilization,Fatty Acid/Cholestrol
50,Unc_6,False,-0.0411231056,,Uncharacterized iModulon 6,Uncharacterized
15,BkaR,False,0.0406298139,bkaR,Transcription factor that regulates genes related to branched-chain keto-acid metabolism,Central Carbon
61,Nucleic Acid Hydrolysis ,False,0.0403269005,,iModulon enriched with the Nucleic Acid Hydrolysis KEGG pathway,Nucleic Acids
13,SG_1,False,0.039572940300000005,,Single Gene iModulon 1,Single Gene
75,Unc_9,False,-0.0377093412,,Uncharacterized iModulon 9,Uncharacterized
33,SG_4,False,-0.0366618227,,Single Gene iModulon 4,Single Gene
11,EccE1 KO,False,0.0357136179,,Single Gene iModulon that captures EccE1 knockout,KO
47,SG_7,False,-0.0355392181,,Single Gene iModulon 7,Single Gene
54,Unc_7,False,-0.031526733,,Uncharacterized iModulon 7,Uncharacterized
52,DevR-2,False,0.0308723316,devR,Transcription factor that is one of the primary regulators of hypoxia onset response,Redox
55,WhiB7,False,-0.0295740032,whiB7,Transcription factor that connects systems for redox homeostasis and antibiotic resistance,Antibiotic
4,WhiB4,False,-0.0286572158,whiB4,Redox-Responsive transcription regulator that regulates protection response during infection,Redox
45,SigD,False,-0.027996888,sigD,Sigma Factor that governs the expression of ribosomal genes and plays a role in virulence,Virulence/Persistence
17,VirS,False,0.0274492782,virS,Transcription factor that is activated and responds to acidic environments,Redox
1,Polyketide Synthase Complex,False,-0.027334294000000002,,KEGG Map related to the synthesis of type II polyketide backbone ,Fatty Acid/Cholestrol
72,Unc_8,False,0.0240418123,,Uncharacterized iModulon 8,Uncharacterized
39,SigC,False,-0.0235132977,sigC,Sigma Factor that plays a role in organism virulence and lethality,Virulence/Persistence
59,Rv0576,False,0.0225751368,Rv0576,Possible ArsR family transcription factor that regulates genes related to virulence,Virulence/Persistence
24,Salicylate Induced,False,-0.021772676300000002,,Manually annotated iModulon where genes were found to change expression when exposed to salicylate,Metal Related
69,Rv0135+Rv1019,False,-0.0215057,Rv0135c and Rv1019,iModulon that maps to the intersection of the Rv0135c and Rv1019 regulons,Nucleic Acids
48,Leucine Related,False,-0.0206326168,,Manually annotated iModulon with gene related to leucine metabolism,Amino Acids
23,PrpR,False,-0.0205319853,prpR,Transcription factor that is involved in catabolism of short chain fatty acids via gloxylate and methylcitrate cycle,Central Carbon
73,SG_11,False,-0.0188009323,,Single Gene iModulon 11,Single Gene
9,SigK,False,0.017868285600000002,sigK,Sigma Factor involved in the production of antigenic proteins,Unknown Function
67,Peptidoglycan Biosynthesis,False,-0.0161476392,,iModulon enriched with the Peptidoglycan biosyntehsis KEGG pathway,Central Carbon
58,Zur,False,-0.014201621800000001,zur,Transcription factor that is activated by and regulates the metabolism of zinc,Metal Related
43,LysG,False,-0.0141040426,lsyG,Transcription factor that controls the expression of LysE and requires lysine or histidine for activation ,Amino Acids
68,Sulfur Metabolism,False,0.013557090400000001,,Kegg Map that displays the transport and metabolism of sulfur,Sulfur Metabolism
19,WhiB6,False,-0.013551278000000002,whiB6,Transcription factor that regulates ESX-1 system membrane transport proteins,Redox
3,PyrR,False,-0.0134839205,pyrR,Transcription factor that regulates the expression of pyrimidine nucleotide operons,Nucleic Acids
22,SG_3,False,0.0120123469,,Single Gene iModulon 3,Single Gene
66,M-box,False,0.011696909,,Magnesium activated non-coding sRNA that regulates the function of genes associated with metal metabolism and virulence,Metal Related
62,Rv2488c,False,-0.0111181738,Rv2488c,LuxR family transcription factor that regulates genes associated with virulence,Virulence/Persistence
78,Positive Regulation of Growth,False,0.0110929689,,iModulon enriched with the Positive Regulation of Growth Gene Ontology term,Growth
31,ArgR,False,0.0108467491,argR,Transcription factor that regulates the L-arginine biosynthesis pathways,Amino Acids
26,EspL KO,False,-0.010822795500000001,,Single Gene iModulon that captures EspL knockout,KO
29,Blal,False,-0.0103883596,blaI,"Transcription regulator that regulates genes associated with antibiotic transport, detoxification, and cell wall function",Antibiotic
21,MprA,False,0.0096522764,mprA,Transcription factor that regulates multiple stress responsive genes,Virulence/Persistence
16,Mce3R,False,-0.0085838514,mce3R,Transcription factor that regulates the mce3 virulence operon,Virulence/Persistence
49,Rv1828/SigH,False,-0.0085440485,Rv1828 or sigH,iModulon that maps to the union of the Rv1828 and Rv3223c regulons,Redox
64,Mce1R,False,0.008055406000000001,mce1R,Transcription factor that regulates the mce1 virulence operon,Virulence/Persistence
32,Unc_3,False,-0.007659822,,Uncharacterized iModulon 3,Uncharacterized
46,Rv2621c,False,-0.0076076488,Rv2621c,iModulon labeled with predicted regulon with unknown function,Unknown Function
79,WhiB4/IdeR,False,0.0074262263,whiB4 or ideR,iModulon that maps to the union of the Rv3681c and Rv2711 regulons,Redox
0,SigH,False,0.007414599500000001,sigH,Sigma Factor involved in heat shock and oxidative stress response,Virulence/Persistence
28,WhiB1,False,-0.007137168,whiB1,"Transcription repressor that is redox responsive, found to be nitric oxide sensitive",Redox
37,Rv3095,False,-0.0071280999000000005,Rv3095,iModulon labeled with predicted regulon with unknown function,Unknown Function
5,DevR-1,False,-0.0064398774,devR,Transcription factor that is one of the primary regulators of hypoxia onset response,Redox
18,Unc_1,False,0.0062949396000000005,,Uncharacterized iModulon 1,Uncharacterized
70,Lsr2,False,0.0061927443000000006,lsr2,Sequence independent transcription factor that controls a wide variety of genes,Antibiotic
71,PDIM;PGL Synthesis,False,0.0059898718,,Manually annotated iModulon that captures genes associated with PDIM and PGL synthesis,Virulence/Persistence
27,Unc_2,False,-0.0058810214,,Uncharacterized iModulon 2,Uncharacterized
20,FasR,False,-0.0053220187,fasR,Transcription factor that controls the expression of fatty acid metabolism genes,Fatty Acid/Cholestrol
65,SG_10,False,0.0052753466,,Single Gene iModulon 10,Single Gene
38,SG_5,False,-0.0047632634,,Single Gene iModulon 5,Single Gene
25,Rv0078+Rv2034,False,-0.0046341977,Rv0078 and Rv2034,iModulon that maps to the intersection of the Rv0078 and Rv2034 regulon,Antibiotic
76,SG_13,False,0.0044133854,,Single Gene iModulon 13,Single Gene
35,Unc_4,False,0.0035748255,,Uncharacterized iModulon 4,Uncharacterized
51,PhoP,False,0.0034894209000000003,phoP,"Transcription factor that controls response to redox/acid stress, hypoxia, and virulence",Virulence/Persistence
36,Fumarate Reductase,False,0.0034608802,,iModulon enriched with the Fumarate Reductase Gene Ontology term,Central Carbon
56,Fatty Acid Biosynthesis,False,0.0032546593,trcR and Rv1776c and whiB4 ,"iModulon that maps to the intersection of the Rv1033c, Rv1776c, and Rv3681c regulons",Fatty Acid/Cholestrol
14,SG_2,False,0.0031714719000000002,,Single Gene iModulon 2,Single Gene
77,Central Carbon Metabolism,False,0.0025882538000000003,,iModulon enriched with the Central Carbon Metabolism KEGG pathway,Central Carbon
2,IniR,False,0.0023598422,iniR,Transcription factor that regulates the expression of the ini operon (iniBAC),Antibiotic
60,Rv0681,False,0.0016751258,Rv0681,"Transcription with previously unknown function, regulates core fatty acid response",Unknown Function
53,Rv1776c+WhiB4,False,-0.0016413774,Rv1776c and whiB4 ,iModulon that maps to the intersection of the Rv1776c and Rv3681c regulon,Redox
8,IdeR,False,0.0015881661,ideR,Metal-Dependent DNA-Binding protein that controls genes related to iron metabolism,Metal Related
34,MbcA+Rv3249c+Rv3066,False,-0.0015164331,mbcA and Rv3249c and Rv3066,"iModulon that maps to the intersection of the Rv1990c, Rv3249c, and Rv3066 regulons",Virulence/Persistence
6,MarR,False,-0.0007699694,marR,Transcription factor that regulates the response to acid stress,Acid Stress
42,Nicotinate Metabolism,False,-0.00040238380000000003,,iModulon enriched with the nicotinate and nicotinamide metabolism KEGG pathway,Central Carbon
