k,Name,in_iM,gene_weight,Regulator,Function,Category
29,Blal,False,0.0241919479,blaI,"Transcription regulator that regulates genes associated with antibiotic transport, detoxification, and cell wall function",Antibiotic
44,SG_6,False,0.0212808338,,Single Genes iModulon 6,Single Gene
53,Rv1776c+WhiB4,False,0.020745640200000002,Rv1776c and whiB4 ,iModulon that maps to the intersection of the Rv1776c and Rv3681c regulon,Redox
41,Unc_5,False,0.018572329500000002,,Uncharacterized iModulon 5,Uncharacterized
76,SG_13,False,-0.0179169851,,Single Gene iModulon 13,Single Gene
70,Lsr2,False,-0.0171922725,lsr2,Sequence independent transcription factor that controls a wide variety of genes,Antibiotic
17,VirS,False,-0.0171518308,virS,Transcription factor that is activated and responds to acidic environments,Redox
18,Unc_1,False,-0.0165298256,,Uncharacterized iModulon 1,Uncharacterized
55,WhiB7,False,0.0165199749,whiB7,Transcription factor that connects systems for redox homeostasis and antibiotic resistance,Antibiotic
12,Mycofactocin Synthesis Pathway,False,-0.0149591736,,Manually annotated iModulon that captures multiple genes associated with mycofactocin metabolism,Fatty Acid/Cholestrol
24,Salicylate Induced,False,0.014083145,,Manually annotated iModulon where genes were found to change expression when exposed to salicylate,Metal Related
1,Polyketide Synthase Complex,False,-0.013777772700000001,,KEGG Map related to the synthesis of type II polyketide backbone ,Fatty Acid/Cholestrol
46,Rv2621c,False,-0.012412802300000001,Rv2621c,iModulon labeled with predicted regulon with unknown function,Unknown Function
16,Mce3R,False,-0.011966364200000001,mce3R,Transcription factor that regulates the mce3 virulence operon,Virulence/Persistence
75,Unc_9,False,-0.0117986164,,Uncharacterized iModulon 9,Uncharacterized
39,SigC,False,0.011557002700000001,sigC,Sigma Factor that plays a role in organism virulence and lethality,Virulence/Persistence
27,Unc_2,False,-0.011296056700000001,,Uncharacterized iModulon 2,Uncharacterized
23,PrpR,False,-0.0109258683,prpR,Transcription factor that is involved in catabolism of short chain fatty acids via gloxylate and methylcitrate cycle,Central Carbon
34,MbcA+Rv3249c+Rv3066,False,-0.0102325329,mbcA and Rv3249c and Rv3066,"iModulon that maps to the intersection of the Rv1990c, Rv3249c, and Rv3066 regulons",Virulence/Persistence
62,Rv2488c,False,-0.0098373509,Rv2488c,LuxR family transcription factor that regulates genes associated with virulence,Virulence/Persistence
9,SigK,False,0.0097803178,sigK,Sigma Factor involved in the production of antigenic proteins,Unknown Function
77,Central Carbon Metabolism,False,0.0095693576,,iModulon enriched with the Central Carbon Metabolism KEGG pathway,Central Carbon
36,Fumarate Reductase,False,0.009524534500000001,,iModulon enriched with the Fumarate Reductase Gene Ontology term,Central Carbon
52,DevR-2,False,-0.0092224396,devR,Transcription factor that is one of the primary regulators of hypoxia onset response,Redox
79,WhiB4/IdeR,False,-0.008968486500000001,whiB4 or ideR,iModulon that maps to the union of the Rv3681c and Rv2711 regulons,Redox
15,BkaR,False,0.0082054792,bkaR,Transcription factor that regulates genes related to branched-chain keto-acid metabolism,Central Carbon
66,M-box,False,0.008117180600000001,,Magnesium activated non-coding sRNA that regulates the function of genes associated with metal metabolism and virulence,Metal Related
22,SG_3,False,-0.0073727154,,Single Gene iModulon 3,Single Gene
40,KstR2,False,-0.0072352425,kstR2,Transcription factor that regulates a small regulon related to cholesterol utilization,Fatty Acid/Cholestrol
31,ArgR,False,0.007207733,argR,Transcription factor that regulates the L-arginine biosynthesis pathways,Amino Acids
68,Sulfur Metabolism,False,-0.0070362291,,Kegg Map that displays the transport and metabolism of sulfur,Sulfur Metabolism
49,Rv1828/SigH,False,-0.0068152194,Rv1828 or sigH,iModulon that maps to the union of the Rv1828 and Rv3223c regulons,Redox
54,Unc_7,False,0.0067652389000000005,,Uncharacterized iModulon 7,Uncharacterized
65,SG_10,False,0.006724748,,Single Gene iModulon 10,Single Gene
30,HPT-2b Induced,False,-0.0066345288,,iModulon regulates many genes that are activated by HPT-2b (1-hydroxy-5-R-pyridine-2(1H)-thiones),Metal Related
67,Peptidoglycan Biosynthesis,False,0.0063726915,,iModulon enriched with the Peptidoglycan biosyntehsis KEGG pathway,Central Carbon
72,Unc_8,False,-0.006369133700000001,,Uncharacterized iModulon 8,Uncharacterized
19,WhiB6,False,0.0061515398,whiB6,Transcription factor that regulates ESX-1 system membrane transport proteins,Redox
37,Rv3095,False,-0.0058031018,Rv3095,iModulon labeled with predicted regulon with unknown function,Unknown Function
10,RicR,False,-0.005575501,ricR,Copper responsive transcription factor that regulates metal metabolism genes,Metal Related
50,Unc_6,False,-0.005547991,,Uncharacterized iModulon 6,Uncharacterized
2,IniR,False,-0.0054929670000000005,iniR,Transcription factor that regulates the expression of the ini operon (iniBAC),Antibiotic
61,Nucleic Acid Hydrolysis ,False,0.0052115551,,iModulon enriched with the Nucleic Acid Hydrolysis KEGG pathway,Nucleic Acids
25,Rv0078+Rv2034,False,-0.0049671544,Rv0078 and Rv2034,iModulon that maps to the intersection of the Rv0078 and Rv2034 regulon,Antibiotic
33,SG_4,False,-0.0049485345,,Single Gene iModulon 4,Single Gene
56,Fatty Acid Biosynthesis,False,-0.0045031807000000005,trcR and Rv1776c and whiB4 ,"iModulon that maps to the intersection of the Rv1033c, Rv1776c, and Rv3681c regulons",Fatty Acid/Cholestrol
7,GroEL-GroES Complex,False,0.0042087163,,Gene Ontology Term specific to the bacterial chaperonin complex,Amino Acids
74,SG_12,False,0.0041662469,,Single Gene iModulon 12,Single Gene
64,Mce1R,False,-0.0041283781,mce1R,Transcription factor that regulates the mce1 virulence operon,Virulence/Persistence
11,EccE1 KO,False,-0.0039949925,,Single Gene iModulon that captures EccE1 knockout,KO
47,SG_7,False,-0.0038988507,,Single Gene iModulon 7,Single Gene
26,EspL KO,False,0.0034986733,,Single Gene iModulon that captures EspL knockout,KO
6,MarR,False,-0.0030308141,marR,Transcription factor that regulates the response to acid stress,Acid Stress
20,FasR,False,-0.0028396798,fasR,Transcription factor that controls the expression of fatty acid metabolism genes,Fatty Acid/Cholestrol
21,MprA,False,-0.0027443116,mprA,Transcription factor that regulates multiple stress responsive genes,Virulence/Persistence
60,Rv0681,False,-0.0026483676,Rv0681,"Transcription with previously unknown function, regulates core fatty acid response",Unknown Function
45,SigD,False,-0.0021611542000000003,sigD,Sigma Factor that governs the expression of ribosomal genes and plays a role in virulence,Virulence/Persistence
69,Rv0135+Rv1019,False,-0.0021141666,Rv0135c and Rv1019,iModulon that maps to the intersection of the Rv0135c and Rv1019 regulons,Nucleic Acids
28,WhiB1,False,0.0021076027,whiB1,"Transcription repressor that is redox responsive, found to be nitric oxide sensitive",Redox
13,SG_1,False,0.0020933595,,Single Gene iModulon 1,Single Gene
48,Leucine Related,False,-0.0017256586000000001,,Manually annotated iModulon with gene related to leucine metabolism,Amino Acids
43,LysG,False,-0.0016963112000000001,lsyG,Transcription factor that controls the expression of LysE and requires lysine or histidine for activation ,Amino Acids
58,Zur,False,0.0016929948,zur,Transcription factor that is activated by and regulates the metabolism of zinc,Metal Related
32,Unc_3,False,0.0016463097000000001,,Uncharacterized iModulon 3,Uncharacterized
8,IdeR,False,-0.0015748944,ideR,Metal-Dependent DNA-Binding protein that controls genes related to iron metabolism,Metal Related
35,Unc_4,False,0.0015292615,,Uncharacterized iModulon 4,Uncharacterized
57,SG_8,False,0.0012755905,,Single Gene iModulon 8,Single Gene
14,SG_2,False,-0.0012179823000000002,,Single Gene iModulon 2,Single Gene
73,SG_11,False,0.0012177208,,Single Gene iModulon 11,Single Gene
78,Positive Regulation of Growth,False,0.0009501333,,iModulon enriched with the Positive Regulation of Growth Gene Ontology term,Growth
38,SG_5,False,0.000907964,,Single Gene iModulon 5,Single Gene
0,SigH,False,-0.0006636458,sigH,Sigma Factor involved in heat shock and oxidative stress response,Virulence/Persistence
3,PyrR,False,0.0005626506,pyrR,Transcription factor that regulates the expression of pyrimidine nucleotide operons,Nucleic Acids
5,DevR-1,False,0.00046094200000000005,devR,Transcription factor that is one of the primary regulators of hypoxia onset response,Redox
59,Rv0576,False,-0.0003911771,Rv0576,Possible ArsR family transcription factor that regulates genes related to virulence,Virulence/Persistence
71,PDIM;PGL Synthesis,False,-0.0003820949,,Manually annotated iModulon that captures genes associated with PDIM and PGL synthesis,Virulence/Persistence
51,PhoP,False,-0.00012379090000000001,phoP,"Transcription factor that controls response to redox/acid stress, hypoxia, and virulence",Virulence/Persistence
4,WhiB4,False,0.00011707300000000001,whiB4,Redox-Responsive transcription regulator that regulates protection response during infection,Redox
42,Nicotinate Metabolism,False,9.36475e-05,,iModulon enriched with the nicotinate and nicotinamide metabolism KEGG pathway,Central Carbon
63,SG_9,False,-8.22709e-05,,Single Gene iModulon 9,Single Gene
