k,Name,in_iM,gene_weight,Regulator,Function,Category
13,SG_1,False,0.047339789300000004,,Single Gene iModulon 1,Single Gene
46,Rv2621c,False,0.0234255178,Rv2621c,iModulon labeled with predicted regulon with unknown function,Unknown Function
2,IniR,False,0.021319988,iniR,Transcription factor that regulates the expression of the ini operon (iniBAC),Antibiotic
47,SG_7,False,0.0204000248,,Single Gene iModulon 7,Single Gene
29,Blal,False,0.018555897300000002,blaI,"Transcription regulator that regulates genes associated with antibiotic transport, detoxification, and cell wall function",Antibiotic
79,WhiB4/IdeR,False,-0.0168724042,whiB4 or ideR,iModulon that maps to the union of the Rv3681c and Rv2711 regulons,Redox
66,M-box,False,-0.0161582244,,Magnesium activated non-coding sRNA that regulates the function of genes associated with metal metabolism and virulence,Metal Related
59,Rv0576,False,-0.0157982666,Rv0576,Possible ArsR family transcription factor that regulates genes related to virulence,Virulence/Persistence
67,Peptidoglycan Biosynthesis,False,-0.0157381443,,iModulon enriched with the Peptidoglycan biosyntehsis KEGG pathway,Central Carbon
65,SG_10,False,-0.0146364196,,Single Gene iModulon 10,Single Gene
38,SG_5,False,0.0140135534,,Single Gene iModulon 5,Single Gene
69,Rv0135+Rv1019,False,-0.014010662,Rv0135c and Rv1019,iModulon that maps to the intersection of the Rv0135c and Rv1019 regulons,Nucleic Acids
30,HPT-2b Induced,False,0.0139157481,,iModulon regulates many genes that are activated by HPT-2b (1-hydroxy-5-R-pyridine-2(1H)-thiones),Metal Related
35,Unc_4,False,0.0134638206,,Uncharacterized iModulon 4,Uncharacterized
0,SigH,False,-0.0131907141,sigH,Sigma Factor involved in heat shock and oxidative stress response,Virulence/Persistence
76,SG_13,False,0.012737172000000001,,Single Gene iModulon 13,Single Gene
14,SG_2,False,0.012321066,,Single Gene iModulon 2,Single Gene
48,Leucine Related,False,0.0111148976,,Manually annotated iModulon with gene related to leucine metabolism,Amino Acids
4,WhiB4,False,-0.0104894703,whiB4,Redox-Responsive transcription regulator that regulates protection response during infection,Redox
70,Lsr2,False,-0.0095637099,lsr2,Sequence independent transcription factor that controls a wide variety of genes,Antibiotic
68,Sulfur Metabolism,False,-0.0092927049,,Kegg Map that displays the transport and metabolism of sulfur,Sulfur Metabolism
28,WhiB1,False,-0.0086518398,whiB1,"Transcription repressor that is redox responsive, found to be nitric oxide sensitive",Redox
55,WhiB7,False,-0.0083493109,whiB7,Transcription factor that connects systems for redox homeostasis and antibiotic resistance,Antibiotic
10,RicR,False,0.0082602326,ricR,Copper responsive transcription factor that regulates metal metabolism genes,Metal Related
63,SG_9,False,0.008152892,,Single Gene iModulon 9,Single Gene
36,Fumarate Reductase,False,0.0080338443,,iModulon enriched with the Fumarate Reductase Gene Ontology term,Central Carbon
12,Mycofactocin Synthesis Pathway,False,-0.0078673774,,Manually annotated iModulon that captures multiple genes associated with mycofactocin metabolism,Fatty Acid/Cholestrol
27,Unc_2,False,-0.0076733063,,Uncharacterized iModulon 2,Uncharacterized
34,MbcA+Rv3249c+Rv3066,False,0.007624873900000001,mbcA and Rv3249c and Rv3066,"iModulon that maps to the intersection of the Rv1990c, Rv3249c, and Rv3066 regulons",Virulence/Persistence
39,SigC,False,0.0073700337000000005,sigC,Sigma Factor that plays a role in organism virulence and lethality,Virulence/Persistence
52,DevR-2,False,0.0073525634000000005,devR,Transcription factor that is one of the primary regulators of hypoxia onset response,Redox
18,Unc_1,False,-0.0071901445000000005,,Uncharacterized iModulon 1,Uncharacterized
33,SG_4,False,-0.0069941993,,Single Gene iModulon 4,Single Gene
49,Rv1828/SigH,False,0.006975503300000001,Rv1828 or sigH,iModulon that maps to the union of the Rv1828 and Rv3223c regulons,Redox
44,SG_6,False,0.006922338300000001,,Single Genes iModulon 6,Single Gene
72,Unc_8,False,0.0065694836,,Uncharacterized iModulon 8,Uncharacterized
26,EspL KO,False,-0.0061205248,,Single Gene iModulon that captures EspL knockout,KO
43,LysG,False,-0.0060842458000000006,lsyG,Transcription factor that controls the expression of LysE and requires lysine or histidine for activation ,Amino Acids
19,WhiB6,False,-0.005714741000000001,whiB6,Transcription factor that regulates ESX-1 system membrane transport proteins,Redox
5,DevR-1,False,-0.0052553718,devR,Transcription factor that is one of the primary regulators of hypoxia onset response,Redox
54,Unc_7,False,0.0052326636000000004,,Uncharacterized iModulon 7,Uncharacterized
3,PyrR,False,0.0050826903000000005,pyrR,Transcription factor that regulates the expression of pyrimidine nucleotide operons,Nucleic Acids
16,Mce3R,False,-0.0050331852,mce3R,Transcription factor that regulates the mce3 virulence operon,Virulence/Persistence
32,Unc_3,False,0.0049746223,,Uncharacterized iModulon 3,Uncharacterized
23,PrpR,False,0.0047106116,prpR,Transcription factor that is involved in catabolism of short chain fatty acids via gloxylate and methylcitrate cycle,Central Carbon
57,SG_8,False,-0.0045065317,,Single Gene iModulon 8,Single Gene
51,PhoP,False,0.004432208,phoP,"Transcription factor that controls response to redox/acid stress, hypoxia, and virulence",Virulence/Persistence
71,PDIM;PGL Synthesis,False,-0.004329052,,Manually annotated iModulon that captures genes associated with PDIM and PGL synthesis,Virulence/Persistence
53,Rv1776c+WhiB4,False,0.0043168325,Rv1776c and whiB4 ,iModulon that maps to the intersection of the Rv1776c and Rv3681c regulon,Redox
7,GroEL-GroES Complex,False,-0.0043017056000000005,,Gene Ontology Term specific to the bacterial chaperonin complex,Amino Acids
45,SigD,False,-0.00414208,sigD,Sigma Factor that governs the expression of ribosomal genes and plays a role in virulence,Virulence/Persistence
22,SG_3,False,-0.0039282553,,Single Gene iModulon 3,Single Gene
78,Positive Regulation of Growth,False,0.0039109562,,iModulon enriched with the Positive Regulation of Growth Gene Ontology term,Growth
20,FasR,False,-0.0038127316,fasR,Transcription factor that controls the expression of fatty acid metabolism genes,Fatty Acid/Cholestrol
15,BkaR,False,0.0037981390000000003,bkaR,Transcription factor that regulates genes related to branched-chain keto-acid metabolism,Central Carbon
21,MprA,False,-0.0036716322000000003,mprA,Transcription factor that regulates multiple stress responsive genes,Virulence/Persistence
40,KstR2,False,-0.0036181549,kstR2,Transcription factor that regulates a small regulon related to cholesterol utilization,Fatty Acid/Cholestrol
73,SG_11,False,-0.0034011494,,Single Gene iModulon 11,Single Gene
42,Nicotinate Metabolism,False,-0.0033775521000000003,,iModulon enriched with the nicotinate and nicotinamide metabolism KEGG pathway,Central Carbon
61,Nucleic Acid Hydrolysis ,False,-0.0033249705,,iModulon enriched with the Nucleic Acid Hydrolysis KEGG pathway,Nucleic Acids
17,VirS,False,-0.0032169251000000003,virS,Transcription factor that is activated and responds to acidic environments,Redox
9,SigK,False,0.0031676322,sigK,Sigma Factor involved in the production of antigenic proteins,Unknown Function
60,Rv0681,False,0.0030648474,Rv0681,"Transcription with previously unknown function, regulates core fatty acid response",Unknown Function
58,Zur,False,0.0029943712,zur,Transcription factor that is activated by and regulates the metabolism of zinc,Metal Related
31,ArgR,False,-0.0024553454,argR,Transcription factor that regulates the L-arginine biosynthesis pathways,Amino Acids
64,Mce1R,False,0.0024094252000000003,mce1R,Transcription factor that regulates the mce1 virulence operon,Virulence/Persistence
74,SG_12,False,0.0020865046,,Single Gene iModulon 12,Single Gene
6,MarR,False,-0.0018265519000000001,marR,Transcription factor that regulates the response to acid stress,Acid Stress
37,Rv3095,False,0.0018226594,Rv3095,iModulon labeled with predicted regulon with unknown function,Unknown Function
11,EccE1 KO,False,-0.0017810994,,Single Gene iModulon that captures EccE1 knockout,KO
50,Unc_6,False,0.0017582370000000002,,Uncharacterized iModulon 6,Uncharacterized
24,Salicylate Induced,False,-0.0014593553,,Manually annotated iModulon where genes were found to change expression when exposed to salicylate,Metal Related
41,Unc_5,False,0.0013562815000000002,,Uncharacterized iModulon 5,Uncharacterized
62,Rv2488c,False,-0.0011567803000000002,Rv2488c,LuxR family transcription factor that regulates genes associated with virulence,Virulence/Persistence
77,Central Carbon Metabolism,False,-0.0011471933,,iModulon enriched with the Central Carbon Metabolism KEGG pathway,Central Carbon
25,Rv0078+Rv2034,False,0.0009157436,Rv0078 and Rv2034,iModulon that maps to the intersection of the Rv0078 and Rv2034 regulon,Antibiotic
75,Unc_9,False,-0.0006572603,,Uncharacterized iModulon 9,Uncharacterized
1,Polyketide Synthase Complex,False,0.0005563170000000001,,KEGG Map related to the synthesis of type II polyketide backbone ,Fatty Acid/Cholestrol
56,Fatty Acid Biosynthesis,False,-0.0004911873,trcR and Rv1776c and whiB4 ,"iModulon that maps to the intersection of the Rv1033c, Rv1776c, and Rv3681c regulons",Fatty Acid/Cholestrol
8,IdeR,False,-0.00037399870000000003,ideR,Metal-Dependent DNA-Binding protein that controls genes related to iron metabolism,Metal Related
