k,Name,in_iM,gene_weight,Regulator,Function,Category
75,Unc_9,False,-0.024387997600000003,,Uncharacterized iModulon 9,Uncharacterized
64,Mce1R,False,0.0234503354,mce1R,Transcription factor that regulates the mce1 virulence operon,Virulence/Persistence
46,Rv2621c,False,-0.0226074616,Rv2621c,iModulon labeled with predicted regulon with unknown function,Unknown Function
38,SG_5,False,0.0216812086,,Single Gene iModulon 5,Single Gene
18,Unc_1,False,0.020292531200000002,,Uncharacterized iModulon 1,Uncharacterized
24,Salicylate Induced,False,0.019618388100000002,,Manually annotated iModulon where genes were found to change expression when exposed to salicylate,Metal Related
53,Rv1776c+WhiB4,False,-0.0191875074,Rv1776c and whiB4 ,iModulon that maps to the intersection of the Rv1776c and Rv3681c regulon,Redox
57,SG_8,False,0.01745691,,Single Gene iModulon 8,Single Gene
39,SigC,False,0.0171656668,sigC,Sigma Factor that plays a role in organism virulence and lethality,Virulence/Persistence
7,GroEL-GroES Complex,False,-0.0169659988,,Gene Ontology Term specific to the bacterial chaperonin complex,Amino Acids
71,PDIM;PGL Synthesis,False,0.0166992714,,Manually annotated iModulon that captures genes associated with PDIM and PGL synthesis,Virulence/Persistence
37,Rv3095,False,-0.015726096800000002,Rv3095,iModulon labeled with predicted regulon with unknown function,Unknown Function
69,Rv0135+Rv1019,False,-0.0155187486,Rv0135c and Rv1019,iModulon that maps to the intersection of the Rv0135c and Rv1019 regulons,Nucleic Acids
40,KstR2,False,-0.0145243638,kstR2,Transcription factor that regulates a small regulon related to cholesterol utilization,Fatty Acid/Cholestrol
47,SG_7,False,0.0132211189,,Single Gene iModulon 7,Single Gene
34,MbcA+Rv3249c+Rv3066,False,0.0130207638,mbcA and Rv3249c and Rv3066,"iModulon that maps to the intersection of the Rv1990c, Rv3249c, and Rv3066 regulons",Virulence/Persistence
13,SG_1,False,-0.012848186400000001,,Single Gene iModulon 1,Single Gene
66,M-box,False,-0.012705181900000001,,Magnesium activated non-coding sRNA that regulates the function of genes associated with metal metabolism and virulence,Metal Related
21,MprA,False,-0.0118059687,mprA,Transcription factor that regulates multiple stress responsive genes,Virulence/Persistence
1,Polyketide Synthase Complex,False,0.0115461049,,KEGG Map related to the synthesis of type II polyketide backbone ,Fatty Acid/Cholestrol
48,Leucine Related,False,0.0113300077,,Manually annotated iModulon with gene related to leucine metabolism,Amino Acids
16,Mce3R,False,0.0112682127,mce3R,Transcription factor that regulates the mce3 virulence operon,Virulence/Persistence
4,WhiB4,False,0.010439356700000001,whiB4,Redox-Responsive transcription regulator that regulates protection response during infection,Redox
59,Rv0576,False,0.0101993069,Rv0576,Possible ArsR family transcription factor that regulates genes related to virulence,Virulence/Persistence
17,VirS,False,0.0094760902,virS,Transcription factor that is activated and responds to acidic environments,Redox
41,Unc_5,False,-0.0093144964,,Uncharacterized iModulon 5,Uncharacterized
31,ArgR,False,0.0092360132,argR,Transcription factor that regulates the L-arginine biosynthesis pathways,Amino Acids
22,SG_3,False,-0.0082813911,,Single Gene iModulon 3,Single Gene
72,Unc_8,False,0.0082668165,,Uncharacterized iModulon 8,Uncharacterized
10,RicR,False,-0.007876227900000001,ricR,Copper responsive transcription factor that regulates metal metabolism genes,Metal Related
74,SG_12,False,-0.0075675840000000005,,Single Gene iModulon 12,Single Gene
68,Sulfur Metabolism,False,-0.0075673269,,Kegg Map that displays the transport and metabolism of sulfur,Sulfur Metabolism
30,HPT-2b Induced,False,-0.0074780714,,iModulon regulates many genes that are activated by HPT-2b (1-hydroxy-5-R-pyridine-2(1H)-thiones),Metal Related
49,Rv1828/SigH,False,-0.0072679666,Rv1828 or sigH,iModulon that maps to the union of the Rv1828 and Rv3223c regulons,Redox
9,SigK,False,0.007172881000000001,sigK,Sigma Factor involved in the production of antigenic proteins,Unknown Function
67,Peptidoglycan Biosynthesis,False,-0.0067284583,,iModulon enriched with the Peptidoglycan biosyntehsis KEGG pathway,Central Carbon
77,Central Carbon Metabolism,False,0.0066224597000000005,,iModulon enriched with the Central Carbon Metabolism KEGG pathway,Central Carbon
14,SG_2,False,-0.0062453074,,Single Gene iModulon 2,Single Gene
35,Unc_4,False,0.0058500733000000004,,Uncharacterized iModulon 4,Uncharacterized
15,BkaR,False,0.0054054422,bkaR,Transcription factor that regulates genes related to branched-chain keto-acid metabolism,Central Carbon
25,Rv0078+Rv2034,False,0.0050978995,Rv0078 and Rv2034,iModulon that maps to the intersection of the Rv0078 and Rv2034 regulon,Antibiotic
76,SG_13,False,0.0048934416,,Single Gene iModulon 13,Single Gene
61,Nucleic Acid Hydrolysis ,False,0.0048907744,,iModulon enriched with the Nucleic Acid Hydrolysis KEGG pathway,Nucleic Acids
65,SG_10,False,-0.0048424678,,Single Gene iModulon 10,Single Gene
20,FasR,False,-0.0047159397,fasR,Transcription factor that controls the expression of fatty acid metabolism genes,Fatty Acid/Cholestrol
3,PyrR,False,-0.0045322936,pyrR,Transcription factor that regulates the expression of pyrimidine nucleotide operons,Nucleic Acids
63,SG_9,False,-0.004380986700000001,,Single Gene iModulon 9,Single Gene
43,LysG,False,0.004286815,lsyG,Transcription factor that controls the expression of LysE and requires lysine or histidine for activation ,Amino Acids
50,Unc_6,False,0.0041371896000000005,,Uncharacterized iModulon 6,Uncharacterized
52,DevR-2,False,-0.0037552014000000002,devR,Transcription factor that is one of the primary regulators of hypoxia onset response,Redox
23,PrpR,False,0.0036813697,prpR,Transcription factor that is involved in catabolism of short chain fatty acids via gloxylate and methylcitrate cycle,Central Carbon
27,Unc_2,False,-0.0035187922000000003,,Uncharacterized iModulon 2,Uncharacterized
55,WhiB7,False,0.0033966449,whiB7,Transcription factor that connects systems for redox homeostasis and antibiotic resistance,Antibiotic
28,WhiB1,False,-0.0031546339000000003,whiB1,"Transcription repressor that is redox responsive, found to be nitric oxide sensitive",Redox
42,Nicotinate Metabolism,False,-0.0028774494,,iModulon enriched with the nicotinate and nicotinamide metabolism KEGG pathway,Central Carbon
51,PhoP,False,0.0026247974,phoP,"Transcription factor that controls response to redox/acid stress, hypoxia, and virulence",Virulence/Persistence
29,Blal,False,-0.0024491784,blaI,"Transcription regulator that regulates genes associated with antibiotic transport, detoxification, and cell wall function",Antibiotic
33,SG_4,False,-0.0022761924,,Single Gene iModulon 4,Single Gene
8,IdeR,False,-0.0021936256,ideR,Metal-Dependent DNA-Binding protein that controls genes related to iron metabolism,Metal Related
6,MarR,False,-0.0020769156,marR,Transcription factor that regulates the response to acid stress,Acid Stress
56,Fatty Acid Biosynthesis,False,-0.0020631679,trcR and Rv1776c and whiB4 ,"iModulon that maps to the intersection of the Rv1033c, Rv1776c, and Rv3681c regulons",Fatty Acid/Cholestrol
19,WhiB6,False,-0.002009766,whiB6,Transcription factor that regulates ESX-1 system membrane transport proteins,Redox
5,DevR-1,False,0.0019758626,devR,Transcription factor that is one of the primary regulators of hypoxia onset response,Redox
2,IniR,False,0.0017428105,iniR,Transcription factor that regulates the expression of the ini operon (iniBAC),Antibiotic
12,Mycofactocin Synthesis Pathway,False,-0.0017157731000000001,,Manually annotated iModulon that captures multiple genes associated with mycofactocin metabolism,Fatty Acid/Cholestrol
62,Rv2488c,False,0.0015028181,Rv2488c,LuxR family transcription factor that regulates genes associated with virulence,Virulence/Persistence
54,Unc_7,False,-0.0012927004,,Uncharacterized iModulon 7,Uncharacterized
11,EccE1 KO,False,0.0012779509,,Single Gene iModulon that captures EccE1 knockout,KO
78,Positive Regulation of Growth,False,-0.0012007327,,iModulon enriched with the Positive Regulation of Growth Gene Ontology term,Growth
58,Zur,False,0.0011464873,zur,Transcription factor that is activated by and regulates the metabolism of zinc,Metal Related
0,SigH,False,-0.0010164266,sigH,Sigma Factor involved in heat shock and oxidative stress response,Virulence/Persistence
60,Rv0681,False,0.0009579677,Rv0681,"Transcription with previously unknown function, regulates core fatty acid response",Unknown Function
70,Lsr2,False,-0.0007957985000000001,lsr2,Sequence independent transcription factor that controls a wide variety of genes,Antibiotic
79,WhiB4/IdeR,False,-0.0005861186,whiB4 or ideR,iModulon that maps to the union of the Rv3681c and Rv2711 regulons,Redox
73,SG_11,False,-0.000558144,,Single Gene iModulon 11,Single Gene
32,Unc_3,False,0.0004907433,,Uncharacterized iModulon 3,Uncharacterized
45,SigD,False,-0.0003980453,sigD,Sigma Factor that governs the expression of ribosomal genes and plays a role in virulence,Virulence/Persistence
26,EspL KO,False,0.0002713193,,Single Gene iModulon that captures EspL knockout,KO
44,SG_6,False,0.00014322020000000001,,Single Genes iModulon 6,Single Gene
36,Fumarate Reductase,False,0.0001060298,,iModulon enriched with the Fumarate Reductase Gene Ontology term,Central Carbon
