k,Name,in_iM,gene_weight,Regulator,Function,Category
35,Unc_4,False,0.047710890400000004,,Uncharacterized iModulon 4,Uncharacterized
64,Mce1R,False,0.0209722015,mce1R,Transcription factor that regulates the mce1 virulence operon,Virulence/Persistence
77,Central Carbon Metabolism,False,0.0209276064,,iModulon enriched with the Central Carbon Metabolism KEGG pathway,Central Carbon
29,Blal,False,0.0184624761,blaI,"Transcription regulator that regulates genes associated with antibiotic transport, detoxification, and cell wall function",Antibiotic
39,SigC,False,-0.0166724154,sigC,Sigma Factor that plays a role in organism virulence and lethality,Virulence/Persistence
46,Rv2621c,False,0.0154306,Rv2621c,iModulon labeled with predicted regulon with unknown function,Unknown Function
65,SG_10,False,0.014788285000000002,,Single Gene iModulon 10,Single Gene
68,Sulfur Metabolism,False,0.0144255476,,Kegg Map that displays the transport and metabolism of sulfur,Sulfur Metabolism
21,MprA,False,-0.0143805172,mprA,Transcription factor that regulates multiple stress responsive genes,Virulence/Persistence
28,WhiB1,False,0.013686701800000001,whiB1,"Transcription repressor that is redox responsive, found to be nitric oxide sensitive",Redox
72,Unc_8,False,0.012823802,,Uncharacterized iModulon 8,Uncharacterized
34,MbcA+Rv3249c+Rv3066,False,-0.012312897100000001,mbcA and Rv3249c and Rv3066,"iModulon that maps to the intersection of the Rv1990c, Rv3249c, and Rv3066 regulons",Virulence/Persistence
47,SG_7,False,-0.0121471397,,Single Gene iModulon 7,Single Gene
27,Unc_2,False,-0.0118708791,,Uncharacterized iModulon 2,Uncharacterized
10,RicR,False,-0.0114354939,ricR,Copper responsive transcription factor that regulates metal metabolism genes,Metal Related
33,SG_4,False,0.0103841482,,Single Gene iModulon 4,Single Gene
6,MarR,False,0.0096384593,marR,Transcription factor that regulates the response to acid stress,Acid Stress
7,GroEL-GroES Complex,False,0.0092926916,,Gene Ontology Term specific to the bacterial chaperonin complex,Amino Acids
48,Leucine Related,False,-0.0091812141,,Manually annotated iModulon with gene related to leucine metabolism,Amino Acids
4,WhiB4,False,0.0089163055,whiB4,Redox-Responsive transcription regulator that regulates protection response during infection,Redox
32,Unc_3,False,0.0087457209,,Uncharacterized iModulon 3,Uncharacterized
40,KstR2,False,0.0081547788,kstR2,Transcription factor that regulates a small regulon related to cholesterol utilization,Fatty Acid/Cholestrol
56,Fatty Acid Biosynthesis,False,-0.0081479944,trcR and Rv1776c and whiB4 ,"iModulon that maps to the intersection of the Rv1033c, Rv1776c, and Rv3681c regulons",Fatty Acid/Cholestrol
60,Rv0681,False,-0.0078960509,Rv0681,"Transcription with previously unknown function, regulates core fatty acid response",Unknown Function
58,Zur,False,0.0078230086,zur,Transcription factor that is activated by and regulates the metabolism of zinc,Metal Related
59,Rv0576,False,-0.0074559286,Rv0576,Possible ArsR family transcription factor that regulates genes related to virulence,Virulence/Persistence
70,Lsr2,False,-0.0072888719000000005,lsr2,Sequence independent transcription factor that controls a wide variety of genes,Antibiotic
25,Rv0078+Rv2034,False,0.0070669326,Rv0078 and Rv2034,iModulon that maps to the intersection of the Rv0078 and Rv2034 regulon,Antibiotic
23,PrpR,False,-0.0069876009,prpR,Transcription factor that is involved in catabolism of short chain fatty acids via gloxylate and methylcitrate cycle,Central Carbon
61,Nucleic Acid Hydrolysis ,False,-0.0065302705,,iModulon enriched with the Nucleic Acid Hydrolysis KEGG pathway,Nucleic Acids
0,SigH,False,0.0064425682,sigH,Sigma Factor involved in heat shock and oxidative stress response,Virulence/Persistence
26,EspL KO,False,0.0062108889,,Single Gene iModulon that captures EspL knockout,KO
1,Polyketide Synthase Complex,False,0.0062064505,,KEGG Map related to the synthesis of type II polyketide backbone ,Fatty Acid/Cholestrol
41,Unc_5,False,-0.006155892400000001,,Uncharacterized iModulon 5,Uncharacterized
75,Unc_9,False,0.0061242844,,Uncharacterized iModulon 9,Uncharacterized
11,EccE1 KO,False,0.0056981339,,Single Gene iModulon that captures EccE1 knockout,KO
76,SG_13,False,0.005643317100000001,,Single Gene iModulon 13,Single Gene
3,PyrR,False,0.0055029038,pyrR,Transcription factor that regulates the expression of pyrimidine nucleotide operons,Nucleic Acids
17,VirS,False,-0.0054888791,virS,Transcription factor that is activated and responds to acidic environments,Redox
37,Rv3095,False,0.0054520911000000005,Rv3095,iModulon labeled with predicted regulon with unknown function,Unknown Function
13,SG_1,False,0.0049570264,,Single Gene iModulon 1,Single Gene
62,Rv2488c,False,0.0045470575,Rv2488c,LuxR family transcription factor that regulates genes associated with virulence,Virulence/Persistence
22,SG_3,False,0.0043442021,,Single Gene iModulon 3,Single Gene
69,Rv0135+Rv1019,False,0.0040288968,Rv0135c and Rv1019,iModulon that maps to the intersection of the Rv0135c and Rv1019 regulons,Nucleic Acids
16,Mce3R,False,-0.004018423,mce3R,Transcription factor that regulates the mce3 virulence operon,Virulence/Persistence
15,BkaR,False,0.0039020378,bkaR,Transcription factor that regulates genes related to branched-chain keto-acid metabolism,Central Carbon
50,Unc_6,False,0.003824271,,Uncharacterized iModulon 6,Uncharacterized
78,Positive Regulation of Growth,False,-0.0037547735,,iModulon enriched with the Positive Regulation of Growth Gene Ontology term,Growth
19,WhiB6,False,-0.0036837728,whiB6,Transcription factor that regulates ESX-1 system membrane transport proteins,Redox
43,LysG,False,-0.0036533452,lsyG,Transcription factor that controls the expression of LysE and requires lysine or histidine for activation ,Amino Acids
42,Nicotinate Metabolism,False,-0.0036111096,,iModulon enriched with the nicotinate and nicotinamide metabolism KEGG pathway,Central Carbon
49,Rv1828/SigH,False,-0.0034470495,Rv1828 or sigH,iModulon that maps to the union of the Rv1828 and Rv3223c regulons,Redox
18,Unc_1,False,0.0028842627,,Uncharacterized iModulon 1,Uncharacterized
44,SG_6,False,-0.0028686816000000003,,Single Genes iModulon 6,Single Gene
45,SigD,False,-0.0027874869,sigD,Sigma Factor that governs the expression of ribosomal genes and plays a role in virulence,Virulence/Persistence
24,Salicylate Induced,False,-0.0024019214,,Manually annotated iModulon where genes were found to change expression when exposed to salicylate,Metal Related
2,IniR,False,0.0023980118,iniR,Transcription factor that regulates the expression of the ini operon (iniBAC),Antibiotic
67,Peptidoglycan Biosynthesis,False,-0.0022834208000000003,,iModulon enriched with the Peptidoglycan biosyntehsis KEGG pathway,Central Carbon
73,SG_11,False,0.0022034316000000003,,Single Gene iModulon 11,Single Gene
55,WhiB7,False,0.0020550129,whiB7,Transcription factor that connects systems for redox homeostasis and antibiotic resistance,Antibiotic
79,WhiB4/IdeR,False,-0.0020503219000000002,whiB4 or ideR,iModulon that maps to the union of the Rv3681c and Rv2711 regulons,Redox
51,PhoP,False,0.0018635969,phoP,"Transcription factor that controls response to redox/acid stress, hypoxia, and virulence",Virulence/Persistence
12,Mycofactocin Synthesis Pathway,False,0.0018280819000000002,,Manually annotated iModulon that captures multiple genes associated with mycofactocin metabolism,Fatty Acid/Cholestrol
57,SG_8,False,-0.0017148478,,Single Gene iModulon 8,Single Gene
54,Unc_7,False,0.0017094869000000002,,Uncharacterized iModulon 7,Uncharacterized
5,DevR-1,False,0.0016791206,devR,Transcription factor that is one of the primary regulators of hypoxia onset response,Redox
30,HPT-2b Induced,False,-0.0016405942,,iModulon regulates many genes that are activated by HPT-2b (1-hydroxy-5-R-pyridine-2(1H)-thiones),Metal Related
14,SG_2,False,-0.0015840543,,Single Gene iModulon 2,Single Gene
36,Fumarate Reductase,False,0.0014774323,,iModulon enriched with the Fumarate Reductase Gene Ontology term,Central Carbon
53,Rv1776c+WhiB4,False,0.0013531215,Rv1776c and whiB4 ,iModulon that maps to the intersection of the Rv1776c and Rv3681c regulon,Redox
9,SigK,False,0.0012295758,sigK,Sigma Factor involved in the production of antigenic proteins,Unknown Function
38,SG_5,False,0.0010279405000000001,,Single Gene iModulon 5,Single Gene
74,SG_12,False,-0.0009395566,,Single Gene iModulon 12,Single Gene
31,ArgR,False,0.0009084204,argR,Transcription factor that regulates the L-arginine biosynthesis pathways,Amino Acids
8,IdeR,False,-0.0008636482,ideR,Metal-Dependent DNA-Binding protein that controls genes related to iron metabolism,Metal Related
71,PDIM;PGL Synthesis,False,-0.0005001759,,Manually annotated iModulon that captures genes associated with PDIM and PGL synthesis,Virulence/Persistence
52,DevR-2,False,-0.00036903930000000004,devR,Transcription factor that is one of the primary regulators of hypoxia onset response,Redox
66,M-box,False,0.0003528391,,Magnesium activated non-coding sRNA that regulates the function of genes associated with metal metabolism and virulence,Metal Related
20,FasR,False,0.0002670624,fasR,Transcription factor that controls the expression of fatty acid metabolism genes,Fatty Acid/Cholestrol
63,SG_9,False,-0.00018910510000000002,,Single Gene iModulon 9,Single Gene
