k,Name,in_iM,gene_weight,Regulator,Function,Category
39,SigC,False,0.018088966300000002,sigC,Sigma Factor that plays a role in organism virulence and lethality,Virulence/Persistence
1,Polyketide Synthase Complex,False,-0.0177529529,,KEGG Map related to the synthesis of type II polyketide backbone ,Fatty Acid/Cholestrol
70,Lsr2,False,-0.0153051543,lsr2,Sequence independent transcription factor that controls a wide variety of genes,Antibiotic
12,Mycofactocin Synthesis Pathway,False,-0.0149846504,,Manually annotated iModulon that captures multiple genes associated with mycofactocin metabolism,Fatty Acid/Cholestrol
42,Nicotinate Metabolism,False,-0.014716909600000001,,iModulon enriched with the nicotinate and nicotinamide metabolism KEGG pathway,Central Carbon
79,WhiB4/IdeR,False,0.014080828200000001,whiB4 or ideR,iModulon that maps to the union of the Rv3681c and Rv2711 regulons,Redox
58,Zur,False,-0.0139559616,zur,Transcription factor that is activated by and regulates the metabolism of zinc,Metal Related
18,Unc_1,False,0.013624896000000001,,Uncharacterized iModulon 1,Uncharacterized
75,Unc_9,False,-0.013363118600000001,,Uncharacterized iModulon 9,Uncharacterized
4,WhiB4,False,-0.0131977924,whiB4,Redox-Responsive transcription regulator that regulates protection response during infection,Redox
27,Unc_2,False,-0.0124868963,,Uncharacterized iModulon 2,Uncharacterized
21,MprA,False,0.012368581600000001,mprA,Transcription factor that regulates multiple stress responsive genes,Virulence/Persistence
62,Rv2488c,False,-0.011684761,Rv2488c,LuxR family transcription factor that regulates genes associated with virulence,Virulence/Persistence
49,Rv1828/SigH,False,-0.011024380200000001,Rv1828 or sigH,iModulon that maps to the union of the Rv1828 and Rv3223c regulons,Redox
10,RicR,False,-0.0098370459,ricR,Copper responsive transcription factor that regulates metal metabolism genes,Metal Related
57,SG_8,False,0.009806125300000001,,Single Gene iModulon 8,Single Gene
55,WhiB7,False,-0.009749409700000001,whiB7,Transcription factor that connects systems for redox homeostasis and antibiotic resistance,Antibiotic
25,Rv0078+Rv2034,False,-0.0097390549,Rv0078 and Rv2034,iModulon that maps to the intersection of the Rv0078 and Rv2034 regulon,Antibiotic
40,KstR2,False,-0.0093098537,kstR2,Transcription factor that regulates a small regulon related to cholesterol utilization,Fatty Acid/Cholestrol
44,SG_6,False,0.0093043656,,Single Genes iModulon 6,Single Gene
45,SigD,False,-0.009054687,sigD,Sigma Factor that governs the expression of ribosomal genes and plays a role in virulence,Virulence/Persistence
46,Rv2621c,False,-0.0086403264,Rv2621c,iModulon labeled with predicted regulon with unknown function,Unknown Function
16,Mce3R,False,0.007999441500000001,mce3R,Transcription factor that regulates the mce3 virulence operon,Virulence/Persistence
6,MarR,False,-0.0079344424,marR,Transcription factor that regulates the response to acid stress,Acid Stress
7,GroEL-GroES Complex,False,-0.0076534925,,Gene Ontology Term specific to the bacterial chaperonin complex,Amino Acids
41,Unc_5,False,-0.0071226896,,Uncharacterized iModulon 5,Uncharacterized
64,Mce1R,False,-0.0070606593,mce1R,Transcription factor that regulates the mce1 virulence operon,Virulence/Persistence
17,VirS,False,0.0070589095,virS,Transcription factor that is activated and responds to acidic environments,Redox
31,ArgR,False,-0.0068807927,argR,Transcription factor that regulates the L-arginine biosynthesis pathways,Amino Acids
73,SG_11,False,-0.0067122882,,Single Gene iModulon 11,Single Gene
24,Salicylate Induced,False,-0.0063976402000000005,,Manually annotated iModulon where genes were found to change expression when exposed to salicylate,Metal Related
69,Rv0135+Rv1019,False,-0.0062287697,Rv0135c and Rv1019,iModulon that maps to the intersection of the Rv0135c and Rv1019 regulons,Nucleic Acids
26,EspL KO,False,-0.0059890762,,Single Gene iModulon that captures EspL knockout,KO
15,BkaR,False,0.0059163372,bkaR,Transcription factor that regulates genes related to branched-chain keto-acid metabolism,Central Carbon
29,Blal,False,-0.0058377853,blaI,"Transcription regulator that regulates genes associated with antibiotic transport, detoxification, and cell wall function",Antibiotic
33,SG_4,False,-0.005318956200000001,,Single Gene iModulon 4,Single Gene
36,Fumarate Reductase,False,-0.005232793800000001,,iModulon enriched with the Fumarate Reductase Gene Ontology term,Central Carbon
61,Nucleic Acid Hydrolysis ,False,-0.0051305169,,iModulon enriched with the Nucleic Acid Hydrolysis KEGG pathway,Nucleic Acids
47,SG_7,False,-0.0047590954,,Single Gene iModulon 7,Single Gene
51,PhoP,False,-0.0047068269,phoP,"Transcription factor that controls response to redox/acid stress, hypoxia, and virulence",Virulence/Persistence
43,LysG,False,-0.0046795052000000005,lsyG,Transcription factor that controls the expression of LysE and requires lysine or histidine for activation ,Amino Acids
72,Unc_8,False,-0.0046706277,,Uncharacterized iModulon 8,Uncharacterized
23,PrpR,False,0.0043844478,prpR,Transcription factor that is involved in catabolism of short chain fatty acids via gloxylate and methylcitrate cycle,Central Carbon
53,Rv1776c+WhiB4,False,0.0043616783000000004,Rv1776c and whiB4 ,iModulon that maps to the intersection of the Rv1776c and Rv3681c regulon,Redox
59,Rv0576,False,-0.0043326726,Rv0576,Possible ArsR family transcription factor that regulates genes related to virulence,Virulence/Persistence
54,Unc_7,False,-0.0042945188,,Uncharacterized iModulon 7,Uncharacterized
74,SG_12,False,-0.0042942318,,Single Gene iModulon 12,Single Gene
76,SG_13,False,0.0042421626,,Single Gene iModulon 13,Single Gene
50,Unc_6,False,0.0042413965,,Uncharacterized iModulon 6,Uncharacterized
14,SG_2,False,0.004166032,,Single Gene iModulon 2,Single Gene
5,DevR-1,False,-0.004164806,devR,Transcription factor that is one of the primary regulators of hypoxia onset response,Redox
66,M-box,False,-0.0039283386,,Magnesium activated non-coding sRNA that regulates the function of genes associated with metal metabolism and virulence,Metal Related
60,Rv0681,False,0.0038905026000000003,Rv0681,"Transcription with previously unknown function, regulates core fatty acid response",Unknown Function
77,Central Carbon Metabolism,False,0.0037244186,,iModulon enriched with the Central Carbon Metabolism KEGG pathway,Central Carbon
67,Peptidoglycan Biosynthesis,False,-0.0037171789,,iModulon enriched with the Peptidoglycan biosyntehsis KEGG pathway,Central Carbon
65,SG_10,False,-0.003658334,,Single Gene iModulon 10,Single Gene
48,Leucine Related,False,-0.0033589923,,Manually annotated iModulon with gene related to leucine metabolism,Amino Acids
28,WhiB1,False,-0.0033491727000000003,whiB1,"Transcription repressor that is redox responsive, found to be nitric oxide sensitive",Redox
37,Rv3095,False,-0.0031956436,Rv3095,iModulon labeled with predicted regulon with unknown function,Unknown Function
22,SG_3,False,0.0029007329,,Single Gene iModulon 3,Single Gene
71,PDIM;PGL Synthesis,False,0.0024583743000000003,,Manually annotated iModulon that captures genes associated with PDIM and PGL synthesis,Virulence/Persistence
20,FasR,False,-0.0023813673000000002,fasR,Transcription factor that controls the expression of fatty acid metabolism genes,Fatty Acid/Cholestrol
11,EccE1 KO,False,0.0022910523,,Single Gene iModulon that captures EccE1 knockout,KO
0,SigH,False,0.0021858378,sigH,Sigma Factor involved in heat shock and oxidative stress response,Virulence/Persistence
32,Unc_3,False,-0.0021597632,,Uncharacterized iModulon 3,Uncharacterized
35,Unc_4,False,0.0019896146,,Uncharacterized iModulon 4,Uncharacterized
56,Fatty Acid Biosynthesis,False,-0.0019098700000000001,trcR and Rv1776c and whiB4 ,"iModulon that maps to the intersection of the Rv1033c, Rv1776c, and Rv3681c regulons",Fatty Acid/Cholestrol
52,DevR-2,False,0.0018897235,devR,Transcription factor that is one of the primary regulators of hypoxia onset response,Redox
34,MbcA+Rv3249c+Rv3066,False,-0.0014663717,mbcA and Rv3249c and Rv3066,"iModulon that maps to the intersection of the Rv1990c, Rv3249c, and Rv3066 regulons",Virulence/Persistence
13,SG_1,False,0.0012877812,,Single Gene iModulon 1,Single Gene
3,PyrR,False,-0.0011867713,pyrR,Transcription factor that regulates the expression of pyrimidine nucleotide operons,Nucleic Acids
19,WhiB6,False,0.0010612131000000001,whiB6,Transcription factor that regulates ESX-1 system membrane transport proteins,Redox
9,SigK,False,-0.0009971125,sigK,Sigma Factor involved in the production of antigenic proteins,Unknown Function
78,Positive Regulation of Growth,False,-0.0006603094,,iModulon enriched with the Positive Regulation of Growth Gene Ontology term,Growth
38,SG_5,False,0.0006125333000000001,,Single Gene iModulon 5,Single Gene
68,Sulfur Metabolism,False,-0.00046724580000000003,,Kegg Map that displays the transport and metabolism of sulfur,Sulfur Metabolism
30,HPT-2b Induced,False,-0.00043866440000000004,,iModulon regulates many genes that are activated by HPT-2b (1-hydroxy-5-R-pyridine-2(1H)-thiones),Metal Related
2,IniR,False,-0.00036836270000000003,iniR,Transcription factor that regulates the expression of the ini operon (iniBAC),Antibiotic
8,IdeR,False,-0.0003406018,ideR,Metal-Dependent DNA-Binding protein that controls genes related to iron metabolism,Metal Related
63,SG_9,False,0.0002733357,,Single Gene iModulon 9,Single Gene
