k,Name,in_iM,gene_weight,Regulator,Function,Category
76,SG_13,False,-0.0367785408,,Single Gene iModulon 13,Single Gene
75,Unc_9,False,0.0348041482,,Uncharacterized iModulon 9,Uncharacterized
14,SG_2,False,-0.0313339414,,Single Gene iModulon 2,Single Gene
28,WhiB1,False,-0.0278157622,whiB1,"Transcription repressor that is redox responsive, found to be nitric oxide sensitive",Redox
57,SG_8,False,0.0267777914,,Single Gene iModulon 8,Single Gene
44,SG_6,False,0.025374498800000003,,Single Genes iModulon 6,Single Gene
21,MprA,False,0.0252590743,mprA,Transcription factor that regulates multiple stress responsive genes,Virulence/Persistence
34,MbcA+Rv3249c+Rv3066,False,0.0252428024,mbcA and Rv3249c and Rv3066,"iModulon that maps to the intersection of the Rv1990c, Rv3249c, and Rv3066 regulons",Virulence/Persistence
68,Sulfur Metabolism,False,-0.0217016407,,Kegg Map that displays the transport and metabolism of sulfur,Sulfur Metabolism
70,Lsr2,False,-0.021243908000000002,lsr2,Sequence independent transcription factor that controls a wide variety of genes,Antibiotic
6,MarR,False,0.0204323627,marR,Transcription factor that regulates the response to acid stress,Acid Stress
40,KstR2,False,-0.0191355954,kstR2,Transcription factor that regulates a small regulon related to cholesterol utilization,Fatty Acid/Cholestrol
1,Polyketide Synthase Complex,False,0.018908219100000002,,KEGG Map related to the synthesis of type II polyketide backbone ,Fatty Acid/Cholestrol
78,Positive Regulation of Growth,False,0.0182794537,,iModulon enriched with the Positive Regulation of Growth Gene Ontology term,Growth
16,Mce3R,False,0.016511778,mce3R,Transcription factor that regulates the mce3 virulence operon,Virulence/Persistence
69,Rv0135+Rv1019,False,-0.014104799000000001,Rv0135c and Rv1019,iModulon that maps to the intersection of the Rv0135c and Rv1019 regulons,Nucleic Acids
2,IniR,False,0.014083294500000001,iniR,Transcription factor that regulates the expression of the ini operon (iniBAC),Antibiotic
15,BkaR,False,-0.0137468077,bkaR,Transcription factor that regulates genes related to branched-chain keto-acid metabolism,Central Carbon
23,PrpR,False,0.0130166633,prpR,Transcription factor that is involved in catabolism of short chain fatty acids via gloxylate and methylcitrate cycle,Central Carbon
72,Unc_8,False,-0.0129665925,,Uncharacterized iModulon 8,Uncharacterized
37,Rv3095,False,-0.0129372422,Rv3095,iModulon labeled with predicted regulon with unknown function,Unknown Function
13,SG_1,False,-0.0127587454,,Single Gene iModulon 1,Single Gene
38,SG_5,False,-0.0121776912,,Single Gene iModulon 5,Single Gene
60,Rv0681,False,-0.0116160264,Rv0681,"Transcription with previously unknown function, regulates core fatty acid response",Unknown Function
51,PhoP,False,0.011596055400000001,phoP,"Transcription factor that controls response to redox/acid stress, hypoxia, and virulence",Virulence/Persistence
22,SG_3,False,-0.011303774800000001,,Single Gene iModulon 3,Single Gene
65,SG_10,False,0.0110227016,,Single Gene iModulon 10,Single Gene
74,SG_12,False,-0.010845061900000001,,Single Gene iModulon 12,Single Gene
12,Mycofactocin Synthesis Pathway,False,-0.0102165866,,Manually annotated iModulon that captures multiple genes associated with mycofactocin metabolism,Fatty Acid/Cholestrol
3,PyrR,False,-0.009764680900000001,pyrR,Transcription factor that regulates the expression of pyrimidine nucleotide operons,Nucleic Acids
27,Unc_2,False,-0.009554632700000001,,Uncharacterized iModulon 2,Uncharacterized
20,FasR,False,-0.0094409399,fasR,Transcription factor that controls the expression of fatty acid metabolism genes,Fatty Acid/Cholestrol
63,SG_9,False,-0.0093973747,,Single Gene iModulon 9,Single Gene
50,Unc_6,False,0.009337278400000001,,Uncharacterized iModulon 6,Uncharacterized
10,RicR,False,-0.009101883600000001,ricR,Copper responsive transcription factor that regulates metal metabolism genes,Metal Related
45,SigD,False,-0.0090472529,sigD,Sigma Factor that governs the expression of ribosomal genes and plays a role in virulence,Virulence/Persistence
49,Rv1828/SigH,False,0.0076232682,Rv1828 or sigH,iModulon that maps to the union of the Rv1828 and Rv3223c regulons,Redox
30,HPT-2b Induced,False,0.0069163893,,iModulon regulates many genes that are activated by HPT-2b (1-hydroxy-5-R-pyridine-2(1H)-thiones),Metal Related
9,SigK,False,0.0068047998000000005,sigK,Sigma Factor involved in the production of antigenic proteins,Unknown Function
79,WhiB4/IdeR,False,-0.0066944579,whiB4 or ideR,iModulon that maps to the union of the Rv3681c and Rv2711 regulons,Redox
66,M-box,False,0.0065474278,,Magnesium activated non-coding sRNA that regulates the function of genes associated with metal metabolism and virulence,Metal Related
59,Rv0576,False,-0.0063987315,Rv0576,Possible ArsR family transcription factor that regulates genes related to virulence,Virulence/Persistence
8,IdeR,False,0.0060433862000000005,ideR,Metal-Dependent DNA-Binding protein that controls genes related to iron metabolism,Metal Related
19,WhiB6,False,-0.0058493839,whiB6,Transcription factor that regulates ESX-1 system membrane transport proteins,Redox
55,WhiB7,False,0.0055666566,whiB7,Transcription factor that connects systems for redox homeostasis and antibiotic resistance,Antibiotic
33,SG_4,False,-0.0054817945000000005,,Single Gene iModulon 4,Single Gene
36,Fumarate Reductase,False,-0.0053837479,,iModulon enriched with the Fumarate Reductase Gene Ontology term,Central Carbon
52,DevR-2,False,-0.0051572461,devR,Transcription factor that is one of the primary regulators of hypoxia onset response,Redox
54,Unc_7,False,0.005131221,,Uncharacterized iModulon 7,Uncharacterized
31,ArgR,False,0.0048216563,argR,Transcription factor that regulates the L-arginine biosynthesis pathways,Amino Acids
39,SigC,False,-0.0046247864,sigC,Sigma Factor that plays a role in organism virulence and lethality,Virulence/Persistence
64,Mce1R,False,0.0043751878,mce1R,Transcription factor that regulates the mce1 virulence operon,Virulence/Persistence
53,Rv1776c+WhiB4,False,-0.0042803273,Rv1776c and whiB4 ,iModulon that maps to the intersection of the Rv1776c and Rv3681c regulon,Redox
42,Nicotinate Metabolism,False,0.0039028404,,iModulon enriched with the nicotinate and nicotinamide metabolism KEGG pathway,Central Carbon
47,SG_7,False,0.0037782319000000003,,Single Gene iModulon 7,Single Gene
56,Fatty Acid Biosynthesis,False,-0.0037236616000000003,trcR and Rv1776c and whiB4 ,"iModulon that maps to the intersection of the Rv1033c, Rv1776c, and Rv3681c regulons",Fatty Acid/Cholestrol
17,VirS,False,0.0037014582,virS,Transcription factor that is activated and responds to acidic environments,Redox
18,Unc_1,False,-0.0032057192,,Uncharacterized iModulon 1,Uncharacterized
43,LysG,False,-0.0029785175,lsyG,Transcription factor that controls the expression of LysE and requires lysine or histidine for activation ,Amino Acids
24,Salicylate Induced,False,0.0027729323,,Manually annotated iModulon where genes were found to change expression when exposed to salicylate,Metal Related
29,Blal,False,-0.0027541685,blaI,"Transcription regulator that regulates genes associated with antibiotic transport, detoxification, and cell wall function",Antibiotic
67,Peptidoglycan Biosynthesis,False,-0.0025587272000000003,,iModulon enriched with the Peptidoglycan biosyntehsis KEGG pathway,Central Carbon
32,Unc_3,False,-0.002519091,,Uncharacterized iModulon 3,Uncharacterized
58,Zur,False,0.0025165509,zur,Transcription factor that is activated by and regulates the metabolism of zinc,Metal Related
71,PDIM;PGL Synthesis,False,-0.0024250895000000002,,Manually annotated iModulon that captures genes associated with PDIM and PGL synthesis,Virulence/Persistence
41,Unc_5,False,0.0023226752000000002,,Uncharacterized iModulon 5,Uncharacterized
35,Unc_4,False,0.0023197565000000002,,Uncharacterized iModulon 4,Uncharacterized
46,Rv2621c,False,0.0019414783,Rv2621c,iModulon labeled with predicted regulon with unknown function,Unknown Function
7,GroEL-GroES Complex,False,-0.0016592739,,Gene Ontology Term specific to the bacterial chaperonin complex,Amino Acids
73,SG_11,False,0.0016294654,,Single Gene iModulon 11,Single Gene
26,EspL KO,False,0.0015775341,,Single Gene iModulon that captures EspL knockout,KO
48,Leucine Related,False,0.0015231157,,Manually annotated iModulon with gene related to leucine metabolism,Amino Acids
4,WhiB4,False,0.0014322081,whiB4,Redox-Responsive transcription regulator that regulates protection response during infection,Redox
25,Rv0078+Rv2034,False,0.0008881447,Rv0078 and Rv2034,iModulon that maps to the intersection of the Rv0078 and Rv2034 regulon,Antibiotic
62,Rv2488c,False,0.0008423421000000001,Rv2488c,LuxR family transcription factor that regulates genes associated with virulence,Virulence/Persistence
77,Central Carbon Metabolism,False,0.0007224912,,iModulon enriched with the Central Carbon Metabolism KEGG pathway,Central Carbon
61,Nucleic Acid Hydrolysis ,False,-0.0005150287,,iModulon enriched with the Nucleic Acid Hydrolysis KEGG pathway,Nucleic Acids
11,EccE1 KO,False,-0.0002751121,,Single Gene iModulon that captures EccE1 knockout,KO
0,SigH,False,-0.0001275887,sigH,Sigma Factor involved in heat shock and oxidative stress response,Virulence/Persistence
5,DevR-1,False,9.2812e-05,devR,Transcription factor that is one of the primary regulators of hypoxia onset response,Redox
