k,Name,in_iM,gene_weight,Regulator,Function,Category
19,WhiB6,True,0.23290860130000002,whiB6,Transcription factor that regulates ESX-1 system membrane transport proteins,Redox
77,Central Carbon Metabolism,False,-0.0197751216,,iModulon enriched with the Central Carbon Metabolism KEGG pathway,Central Carbon
36,Fumarate Reductase,False,0.0185388624,,iModulon enriched with the Fumarate Reductase Gene Ontology term,Central Carbon
14,SG_2,False,-0.013662954100000001,,Single Gene iModulon 2,Single Gene
42,Nicotinate Metabolism,False,-0.0122927928,,iModulon enriched with the nicotinate and nicotinamide metabolism KEGG pathway,Central Carbon
65,SG_10,False,-0.0113070859,,Single Gene iModulon 10,Single Gene
53,Rv1776c+WhiB4,False,-0.0109650354,Rv1776c and whiB4 ,iModulon that maps to the intersection of the Rv1776c and Rv3681c regulon,Redox
71,PDIM;PGL Synthesis,False,-0.0104268254,,Manually annotated iModulon that captures genes associated with PDIM and PGL synthesis,Virulence/Persistence
60,Rv0681,False,-0.0103785577,Rv0681,"Transcription with previously unknown function, regulates core fatty acid response",Unknown Function
41,Unc_5,False,0.0102050796,,Uncharacterized iModulon 5,Uncharacterized
66,M-box,False,0.0096874313,,Magnesium activated non-coding sRNA that regulates the function of genes associated with metal metabolism and virulence,Metal Related
10,RicR,False,-0.0096402342,ricR,Copper responsive transcription factor that regulates metal metabolism genes,Metal Related
45,SigD,False,0.009466609,sigD,Sigma Factor that governs the expression of ribosomal genes and plays a role in virulence,Virulence/Persistence
27,Unc_2,False,-0.0089996515,,Uncharacterized iModulon 2,Uncharacterized
59,Rv0576,False,0.0089100827,Rv0576,Possible ArsR family transcription factor that regulates genes related to virulence,Virulence/Persistence
30,HPT-2b Induced,False,0.0082424241,,iModulon regulates many genes that are activated by HPT-2b (1-hydroxy-5-R-pyridine-2(1H)-thiones),Metal Related
2,IniR,False,-0.00822247,iniR,Transcription factor that regulates the expression of the ini operon (iniBAC),Antibiotic
40,KstR2,False,-0.008210854,kstR2,Transcription factor that regulates a small regulon related to cholesterol utilization,Fatty Acid/Cholestrol
7,GroEL-GroES Complex,False,0.008167549100000001,,Gene Ontology Term specific to the bacterial chaperonin complex,Amino Acids
6,MarR,False,-0.0081218829,marR,Transcription factor that regulates the response to acid stress,Acid Stress
62,Rv2488c,False,0.0078710884,Rv2488c,LuxR family transcription factor that regulates genes associated with virulence,Virulence/Persistence
70,Lsr2,False,-0.007415711100000001,lsr2,Sequence independent transcription factor that controls a wide variety of genes,Antibiotic
46,Rv2621c,False,-0.006718364,Rv2621c,iModulon labeled with predicted regulon with unknown function,Unknown Function
16,Mce3R,False,-0.006618984200000001,mce3R,Transcription factor that regulates the mce3 virulence operon,Virulence/Persistence
47,SG_7,False,0.006494845700000001,,Single Gene iModulon 7,Single Gene
31,ArgR,False,-0.0063446001,argR,Transcription factor that regulates the L-arginine biosynthesis pathways,Amino Acids
12,Mycofactocin Synthesis Pathway,False,-0.0057359434,,Manually annotated iModulon that captures multiple genes associated with mycofactocin metabolism,Fatty Acid/Cholestrol
64,Mce1R,False,0.0056730579,mce1R,Transcription factor that regulates the mce1 virulence operon,Virulence/Persistence
50,Unc_6,False,-0.0054525974,,Uncharacterized iModulon 6,Uncharacterized
23,PrpR,False,-0.0053868396,prpR,Transcription factor that is involved in catabolism of short chain fatty acids via gloxylate and methylcitrate cycle,Central Carbon
78,Positive Regulation of Growth,False,-0.0053424535,,iModulon enriched with the Positive Regulation of Growth Gene Ontology term,Growth
24,Salicylate Induced,False,-0.0050498544000000005,,Manually annotated iModulon where genes were found to change expression when exposed to salicylate,Metal Related
58,Zur,False,-0.0050355627,zur,Transcription factor that is activated by and regulates the metabolism of zinc,Metal Related
20,FasR,False,-0.0048197859,fasR,Transcription factor that controls the expression of fatty acid metabolism genes,Fatty Acid/Cholestrol
39,SigC,False,0.0048147910000000006,sigC,Sigma Factor that plays a role in organism virulence and lethality,Virulence/Persistence
18,Unc_1,False,0.0047967296,,Uncharacterized iModulon 1,Uncharacterized
44,SG_6,False,-0.0047715143,,Single Genes iModulon 6,Single Gene
54,Unc_7,False,0.004706654,,Uncharacterized iModulon 7,Uncharacterized
79,WhiB4/IdeR,False,0.0043269661,whiB4 or ideR,iModulon that maps to the union of the Rv3681c and Rv2711 regulons,Redox
21,MprA,False,-0.0041650851,mprA,Transcription factor that regulates multiple stress responsive genes,Virulence/Persistence
57,SG_8,False,-0.0041121511,,Single Gene iModulon 8,Single Gene
15,BkaR,False,0.0039872683,bkaR,Transcription factor that regulates genes related to branched-chain keto-acid metabolism,Central Carbon
51,PhoP,False,0.0038887215,phoP,"Transcription factor that controls response to redox/acid stress, hypoxia, and virulence",Virulence/Persistence
68,Sulfur Metabolism,False,-0.0038130029,,Kegg Map that displays the transport and metabolism of sulfur,Sulfur Metabolism
61,Nucleic Acid Hydrolysis ,False,-0.0036496036,,iModulon enriched with the Nucleic Acid Hydrolysis KEGG pathway,Nucleic Acids
34,MbcA+Rv3249c+Rv3066,False,-0.0036463389,mbcA and Rv3249c and Rv3066,"iModulon that maps to the intersection of the Rv1990c, Rv3249c, and Rv3066 regulons",Virulence/Persistence
17,VirS,False,-0.0029979345,virS,Transcription factor that is activated and responds to acidic environments,Redox
25,Rv0078+Rv2034,False,-0.0029482804000000003,Rv0078 and Rv2034,iModulon that maps to the intersection of the Rv0078 and Rv2034 regulon,Antibiotic
76,SG_13,False,0.0029254167,,Single Gene iModulon 13,Single Gene
48,Leucine Related,False,0.0028809883000000002,,Manually annotated iModulon with gene related to leucine metabolism,Amino Acids
55,WhiB7,False,0.0026860386,whiB7,Transcription factor that connects systems for redox homeostasis and antibiotic resistance,Antibiotic
1,Polyketide Synthase Complex,False,0.0026315282000000002,,KEGG Map related to the synthesis of type II polyketide backbone ,Fatty Acid/Cholestrol
26,EspL KO,False,0.0025930826000000002,,Single Gene iModulon that captures EspL knockout,KO
43,LysG,False,-0.0024536824,lsyG,Transcription factor that controls the expression of LysE and requires lysine or histidine for activation ,Amino Acids
9,SigK,False,0.0024412726,sigK,Sigma Factor involved in the production of antigenic proteins,Unknown Function
0,SigH,False,0.0023744429,sigH,Sigma Factor involved in heat shock and oxidative stress response,Virulence/Persistence
29,Blal,False,-0.0022041487,blaI,"Transcription regulator that regulates genes associated with antibiotic transport, detoxification, and cell wall function",Antibiotic
52,DevR-2,False,0.0019489833000000002,devR,Transcription factor that is one of the primary regulators of hypoxia onset response,Redox
8,IdeR,False,-0.0018756590000000002,ideR,Metal-Dependent DNA-Binding protein that controls genes related to iron metabolism,Metal Related
5,DevR-1,False,-0.0017718545,devR,Transcription factor that is one of the primary regulators of hypoxia onset response,Redox
38,SG_5,False,0.0017239796,,Single Gene iModulon 5,Single Gene
73,SG_11,False,0.0017148895,,Single Gene iModulon 11,Single Gene
4,WhiB4,False,-0.0015555797,whiB4,Redox-Responsive transcription regulator that regulates protection response during infection,Redox
56,Fatty Acid Biosynthesis,False,0.0015065893000000001,trcR and Rv1776c and whiB4 ,"iModulon that maps to the intersection of the Rv1033c, Rv1776c, and Rv3681c regulons",Fatty Acid/Cholestrol
28,WhiB1,False,0.0013931261,whiB1,"Transcription repressor that is redox responsive, found to be nitric oxide sensitive",Redox
75,Unc_9,False,-0.0012911495,,Uncharacterized iModulon 9,Uncharacterized
32,Unc_3,False,0.0012194552,,Uncharacterized iModulon 3,Uncharacterized
35,Unc_4,False,0.0010794679,,Uncharacterized iModulon 4,Uncharacterized
13,SG_1,False,-0.0009513711,,Single Gene iModulon 1,Single Gene
69,Rv0135+Rv1019,False,0.0009382303000000001,Rv0135c and Rv1019,iModulon that maps to the intersection of the Rv0135c and Rv1019 regulons,Nucleic Acids
74,SG_12,False,0.0008190216000000001,,Single Gene iModulon 12,Single Gene
11,EccE1 KO,False,-0.0004269662,,Single Gene iModulon that captures EccE1 knockout,KO
3,PyrR,False,-0.0004269114,pyrR,Transcription factor that regulates the expression of pyrimidine nucleotide operons,Nucleic Acids
72,Unc_8,False,0.00040754750000000003,,Uncharacterized iModulon 8,Uncharacterized
49,Rv1828/SigH,False,-0.00037126,Rv1828 or sigH,iModulon that maps to the union of the Rv1828 and Rv3223c regulons,Redox
22,SG_3,False,0.00035046160000000003,,Single Gene iModulon 3,Single Gene
63,SG_9,False,0.00025089270000000003,,Single Gene iModulon 9,Single Gene
37,Rv3095,False,-0.00014839360000000002,Rv3095,iModulon labeled with predicted regulon with unknown function,Unknown Function
67,Peptidoglycan Biosynthesis,False,0.0001325594,,iModulon enriched with the Peptidoglycan biosyntehsis KEGG pathway,Central Carbon
33,SG_4,False,2.10313e-05,,Single Gene iModulon 4,Single Gene
