k,Name,in_iM,gene_weight,Regulator,Function,Category
75,Unc_9,False,0.040479234600000004,,Uncharacterized iModulon 9,Uncharacterized
35,Unc_4,False,0.036853161,,Uncharacterized iModulon 4,Uncharacterized
1,Polyketide Synthase Complex,False,-0.0337552195,,KEGG Map related to the synthesis of type II polyketide backbone ,Fatty Acid/Cholestrol
45,SigD,False,-0.027298952300000002,sigD,Sigma Factor that governs the expression of ribosomal genes and plays a role in virulence,Virulence/Persistence
25,Rv0078+Rv2034,False,-0.023804687600000003,Rv0078 and Rv2034,iModulon that maps to the intersection of the Rv0078 and Rv2034 regulon,Antibiotic
78,Positive Regulation of Growth,False,-0.0210612089,,iModulon enriched with the Positive Regulation of Growth Gene Ontology term,Growth
77,Central Carbon Metabolism,False,0.0199603736,,iModulon enriched with the Central Carbon Metabolism KEGG pathway,Central Carbon
37,Rv3095,False,-0.0198160649,Rv3095,iModulon labeled with predicted regulon with unknown function,Unknown Function
39,SigC,False,0.019305671700000002,sigC,Sigma Factor that plays a role in organism virulence and lethality,Virulence/Persistence
76,SG_13,False,0.0189027005,,Single Gene iModulon 13,Single Gene
43,LysG,False,0.018541925600000002,lsyG,Transcription factor that controls the expression of LysE and requires lysine or histidine for activation ,Amino Acids
32,Unc_3,False,-0.0176317648,,Uncharacterized iModulon 3,Uncharacterized
72,Unc_8,False,-0.0160341247,,Uncharacterized iModulon 8,Uncharacterized
27,Unc_2,False,0.015604535400000001,,Uncharacterized iModulon 2,Uncharacterized
33,SG_4,False,0.015244592900000001,,Single Gene iModulon 4,Single Gene
16,Mce3R,False,-0.014964892,mce3R,Transcription factor that regulates the mce3 virulence operon,Virulence/Persistence
68,Sulfur Metabolism,False,0.0148881829,,Kegg Map that displays the transport and metabolism of sulfur,Sulfur Metabolism
18,Unc_1,False,-0.0142083403,,Uncharacterized iModulon 1,Uncharacterized
13,SG_1,False,0.0141732586,,Single Gene iModulon 1,Single Gene
47,SG_7,False,0.0141054287,,Single Gene iModulon 7,Single Gene
49,Rv1828/SigH,False,0.0140863496,Rv1828 or sigH,iModulon that maps to the union of the Rv1828 and Rv3223c regulons,Redox
57,SG_8,False,0.0140842085,,Single Gene iModulon 8,Single Gene
60,Rv0681,False,-0.0140029664,Rv0681,"Transcription with previously unknown function, regulates core fatty acid response",Unknown Function
40,KstR2,False,-0.0136706706,kstR2,Transcription factor that regulates a small regulon related to cholesterol utilization,Fatty Acid/Cholestrol
58,Zur,False,-0.0132691495,zur,Transcription factor that is activated by and regulates the metabolism of zinc,Metal Related
9,SigK,False,0.012959147800000001,sigK,Sigma Factor involved in the production of antigenic proteins,Unknown Function
73,SG_11,False,0.012043094,,Single Gene iModulon 11,Single Gene
21,MprA,False,0.0117003883,mprA,Transcription factor that regulates multiple stress responsive genes,Virulence/Persistence
4,WhiB4,False,-0.0115528157,whiB4,Redox-Responsive transcription regulator that regulates protection response during infection,Redox
6,MarR,False,-0.01099284,marR,Transcription factor that regulates the response to acid stress,Acid Stress
36,Fumarate Reductase,False,0.0107515456,,iModulon enriched with the Fumarate Reductase Gene Ontology term,Central Carbon
61,Nucleic Acid Hydrolysis ,False,-0.0105517336,,iModulon enriched with the Nucleic Acid Hydrolysis KEGG pathway,Nucleic Acids
44,SG_6,False,0.010259903400000001,,Single Genes iModulon 6,Single Gene
63,SG_9,False,-0.0099986863,,Single Gene iModulon 9,Single Gene
10,RicR,False,0.0099649134,ricR,Copper responsive transcription factor that regulates metal metabolism genes,Metal Related
38,SG_5,False,-0.0091747632,,Single Gene iModulon 5,Single Gene
20,FasR,False,0.0089821499,fasR,Transcription factor that controls the expression of fatty acid metabolism genes,Fatty Acid/Cholestrol
50,Unc_6,False,-0.0084300881,,Uncharacterized iModulon 6,Uncharacterized
30,HPT-2b Induced,False,-0.0083402799,,iModulon regulates many genes that are activated by HPT-2b (1-hydroxy-5-R-pyridine-2(1H)-thiones),Metal Related
64,Mce1R,False,0.008218659500000001,mce1R,Transcription factor that regulates the mce1 virulence operon,Virulence/Persistence
52,DevR-2,False,-0.0081509656,devR,Transcription factor that is one of the primary regulators of hypoxia onset response,Redox
0,SigH,False,0.0080556191,sigH,Sigma Factor involved in heat shock and oxidative stress response,Virulence/Persistence
34,MbcA+Rv3249c+Rv3066,False,-0.0079286656,mbcA and Rv3249c and Rv3066,"iModulon that maps to the intersection of the Rv1990c, Rv3249c, and Rv3066 regulons",Virulence/Persistence
7,GroEL-GroES Complex,False,-0.007010059700000001,,Gene Ontology Term specific to the bacterial chaperonin complex,Amino Acids
17,VirS,False,0.006741791600000001,virS,Transcription factor that is activated and responds to acidic environments,Redox
8,IdeR,False,-0.0067038095,ideR,Metal-Dependent DNA-Binding protein that controls genes related to iron metabolism,Metal Related
65,SG_10,False,0.0063337936,,Single Gene iModulon 10,Single Gene
54,Unc_7,False,0.0061344961,,Uncharacterized iModulon 7,Uncharacterized
11,EccE1 KO,False,0.005841252700000001,,Single Gene iModulon that captures EccE1 knockout,KO
71,PDIM;PGL Synthesis,False,0.0057049434,,Manually annotated iModulon that captures genes associated with PDIM and PGL synthesis,Virulence/Persistence
66,M-box,False,-0.0053780715000000005,,Magnesium activated non-coding sRNA that regulates the function of genes associated with metal metabolism and virulence,Metal Related
26,EspL KO,False,-0.0052890588,,Single Gene iModulon that captures EspL knockout,KO
31,ArgR,False,-0.0052455877,argR,Transcription factor that regulates the L-arginine biosynthesis pathways,Amino Acids
69,Rv0135+Rv1019,False,0.0052284715,Rv0135c and Rv1019,iModulon that maps to the intersection of the Rv0135c and Rv1019 regulons,Nucleic Acids
59,Rv0576,False,0.0045336416,Rv0576,Possible ArsR family transcription factor that regulates genes related to virulence,Virulence/Persistence
70,Lsr2,False,0.0041687588,lsr2,Sequence independent transcription factor that controls a wide variety of genes,Antibiotic
23,PrpR,False,-0.0041233362,prpR,Transcription factor that is involved in catabolism of short chain fatty acids via gloxylate and methylcitrate cycle,Central Carbon
14,SG_2,False,0.0033710685000000002,,Single Gene iModulon 2,Single Gene
15,BkaR,False,-0.0032265243000000002,bkaR,Transcription factor that regulates genes related to branched-chain keto-acid metabolism,Central Carbon
28,WhiB1,False,0.0032196371,whiB1,"Transcription repressor that is redox responsive, found to be nitric oxide sensitive",Redox
41,Unc_5,False,-0.0029908862,,Uncharacterized iModulon 5,Uncharacterized
19,WhiB6,False,-0.0027706993000000003,whiB6,Transcription factor that regulates ESX-1 system membrane transport proteins,Redox
24,Salicylate Induced,False,-0.0026693913000000002,,Manually annotated iModulon where genes were found to change expression when exposed to salicylate,Metal Related
42,Nicotinate Metabolism,False,-0.0025797901000000002,,iModulon enriched with the nicotinate and nicotinamide metabolism KEGG pathway,Central Carbon
62,Rv2488c,False,-0.0024347708,Rv2488c,LuxR family transcription factor that regulates genes associated with virulence,Virulence/Persistence
74,SG_12,False,-0.0021875266,,Single Gene iModulon 12,Single Gene
67,Peptidoglycan Biosynthesis,False,-0.0020163315000000003,,iModulon enriched with the Peptidoglycan biosyntehsis KEGG pathway,Central Carbon
51,PhoP,False,0.0019075267000000001,phoP,"Transcription factor that controls response to redox/acid stress, hypoxia, and virulence",Virulence/Persistence
5,DevR-1,False,-0.0017886702,devR,Transcription factor that is one of the primary regulators of hypoxia onset response,Redox
48,Leucine Related,False,-0.0017525802,,Manually annotated iModulon with gene related to leucine metabolism,Amino Acids
2,IniR,False,0.0017042952,iniR,Transcription factor that regulates the expression of the ini operon (iniBAC),Antibiotic
79,WhiB4/IdeR,False,0.0013377934,whiB4 or ideR,iModulon that maps to the union of the Rv3681c and Rv2711 regulons,Redox
3,PyrR,False,0.0009062602000000001,pyrR,Transcription factor that regulates the expression of pyrimidine nucleotide operons,Nucleic Acids
55,WhiB7,False,0.0007802064,whiB7,Transcription factor that connects systems for redox homeostasis and antibiotic resistance,Antibiotic
46,Rv2621c,False,0.0006432631000000001,Rv2621c,iModulon labeled with predicted regulon with unknown function,Unknown Function
29,Blal,False,-0.0006243778,blaI,"Transcription regulator that regulates genes associated with antibiotic transport, detoxification, and cell wall function",Antibiotic
53,Rv1776c+WhiB4,False,0.0005058685,Rv1776c and whiB4 ,iModulon that maps to the intersection of the Rv1776c and Rv3681c regulon,Redox
56,Fatty Acid Biosynthesis,False,-0.0004569657,trcR and Rv1776c and whiB4 ,"iModulon that maps to the intersection of the Rv1033c, Rv1776c, and Rv3681c regulons",Fatty Acid/Cholestrol
22,SG_3,False,0.0003999963,,Single Gene iModulon 3,Single Gene
12,Mycofactocin Synthesis Pathway,False,-0.0001256222,,Manually annotated iModulon that captures multiple genes associated with mycofactocin metabolism,Fatty Acid/Cholestrol
