k,Name,in_iM,gene_weight,Regulator,Function,Category
18,Unc_1,False,-0.0474389568,,Uncharacterized iModulon 1,Uncharacterized
9,SigK,False,0.044240877000000005,sigK,Sigma Factor involved in the production of antigenic proteins,Unknown Function
50,Unc_6,False,0.034450817,,Uncharacterized iModulon 6,Uncharacterized
77,Central Carbon Metabolism,False,-0.0340041888,,iModulon enriched with the Central Carbon Metabolism KEGG pathway,Central Carbon
78,Positive Regulation of Growth,False,0.0328605437,,iModulon enriched with the Positive Regulation of Growth Gene Ontology term,Growth
6,MarR,False,-0.031047721,marR,Transcription factor that regulates the response to acid stress,Acid Stress
1,Polyketide Synthase Complex,False,-0.026254611,,KEGG Map related to the synthesis of type II polyketide backbone ,Fatty Acid/Cholestrol
7,GroEL-GroES Complex,False,0.0245500672,,Gene Ontology Term specific to the bacterial chaperonin complex,Amino Acids
40,KstR2,False,0.023824259,kstR2,Transcription factor that regulates a small regulon related to cholesterol utilization,Fatty Acid/Cholestrol
67,Peptidoglycan Biosynthesis,False,-0.0213464542,,iModulon enriched with the Peptidoglycan biosyntehsis KEGG pathway,Central Carbon
63,SG_9,False,-0.0206222149,,Single Gene iModulon 9,Single Gene
44,SG_6,False,0.019353008300000002,,Single Genes iModulon 6,Single Gene
10,RicR,False,0.018735415000000002,ricR,Copper responsive transcription factor that regulates metal metabolism genes,Metal Related
68,Sulfur Metabolism,False,-0.0176285061,,Kegg Map that displays the transport and metabolism of sulfur,Sulfur Metabolism
55,WhiB7,False,-0.016956254400000002,whiB7,Transcription factor that connects systems for redox homeostasis and antibiotic resistance,Antibiotic
15,BkaR,False,-0.0167044092,bkaR,Transcription factor that regulates genes related to branched-chain keto-acid metabolism,Central Carbon
19,WhiB6,False,-0.015338916900000001,whiB6,Transcription factor that regulates ESX-1 system membrane transport proteins,Redox
30,HPT-2b Induced,False,-0.0148273284,,iModulon regulates many genes that are activated by HPT-2b (1-hydroxy-5-R-pyridine-2(1H)-thiones),Metal Related
38,SG_5,False,0.0140775703,,Single Gene iModulon 5,Single Gene
28,WhiB1,False,-0.013648596800000001,whiB1,"Transcription repressor that is redox responsive, found to be nitric oxide sensitive",Redox
65,SG_10,False,0.0135140989,,Single Gene iModulon 10,Single Gene
8,IdeR,False,0.013059832,ideR,Metal-Dependent DNA-Binding protein that controls genes related to iron metabolism,Metal Related
21,MprA,False,0.0130583865,mprA,Transcription factor that regulates multiple stress responsive genes,Virulence/Persistence
52,DevR-2,False,-0.0125998224,devR,Transcription factor that is one of the primary regulators of hypoxia onset response,Redox
22,SG_3,False,-0.0118445938,,Single Gene iModulon 3,Single Gene
43,LysG,False,0.0117565475,lsyG,Transcription factor that controls the expression of LysE and requires lysine or histidine for activation ,Amino Acids
42,Nicotinate Metabolism,False,-0.0117195321,,iModulon enriched with the nicotinate and nicotinamide metabolism KEGG pathway,Central Carbon
24,Salicylate Induced,False,0.0114791332,,Manually annotated iModulon where genes were found to change expression when exposed to salicylate,Metal Related
76,SG_13,False,0.0113969754,,Single Gene iModulon 13,Single Gene
73,SG_11,False,0.0113458558,,Single Gene iModulon 11,Single Gene
69,Rv0135+Rv1019,False,-0.0111439677,Rv0135c and Rv1019,iModulon that maps to the intersection of the Rv0135c and Rv1019 regulons,Nucleic Acids
56,Fatty Acid Biosynthesis,False,-0.0109689157,trcR and Rv1776c and whiB4 ,"iModulon that maps to the intersection of the Rv1033c, Rv1776c, and Rv3681c regulons",Fatty Acid/Cholestrol
45,SigD,False,-0.0106529751,sigD,Sigma Factor that governs the expression of ribosomal genes and plays a role in virulence,Virulence/Persistence
29,Blal,False,0.010497345,blaI,"Transcription regulator that regulates genes associated with antibiotic transport, detoxification, and cell wall function",Antibiotic
20,FasR,False,0.0101155979,fasR,Transcription factor that controls the expression of fatty acid metabolism genes,Fatty Acid/Cholestrol
3,PyrR,False,0.0098185272,pyrR,Transcription factor that regulates the expression of pyrimidine nucleotide operons,Nucleic Acids
0,SigH,False,-0.0093081612,sigH,Sigma Factor involved in heat shock and oxidative stress response,Virulence/Persistence
59,Rv0576,False,0.008882306100000001,Rv0576,Possible ArsR family transcription factor that regulates genes related to virulence,Virulence/Persistence
70,Lsr2,False,-0.0086486158,lsr2,Sequence independent transcription factor that controls a wide variety of genes,Antibiotic
53,Rv1776c+WhiB4,False,0.007748021700000001,Rv1776c and whiB4 ,iModulon that maps to the intersection of the Rv1776c and Rv3681c regulon,Redox
60,Rv0681,False,0.0074481124,Rv0681,"Transcription with previously unknown function, regulates core fatty acid response",Unknown Function
46,Rv2621c,False,0.0074467441,Rv2621c,iModulon labeled with predicted regulon with unknown function,Unknown Function
12,Mycofactocin Synthesis Pathway,False,-0.0073713644,,Manually annotated iModulon that captures multiple genes associated with mycofactocin metabolism,Fatty Acid/Cholestrol
17,VirS,False,0.0068849692,virS,Transcription factor that is activated and responds to acidic environments,Redox
13,SG_1,False,-0.0067314043,,Single Gene iModulon 1,Single Gene
31,ArgR,False,0.0066940902,argR,Transcription factor that regulates the L-arginine biosynthesis pathways,Amino Acids
23,PrpR,False,0.0065636777,prpR,Transcription factor that is involved in catabolism of short chain fatty acids via gloxylate and methylcitrate cycle,Central Carbon
4,WhiB4,False,-0.0063657058,whiB4,Redox-Responsive transcription regulator that regulates protection response during infection,Redox
47,SG_7,False,0.006280900900000001,,Single Gene iModulon 7,Single Gene
57,SG_8,False,-0.0059959288000000005,,Single Gene iModulon 8,Single Gene
2,IniR,False,0.0057442294,iniR,Transcription factor that regulates the expression of the ini operon (iniBAC),Antibiotic
32,Unc_3,False,-0.0053952312,,Uncharacterized iModulon 3,Uncharacterized
71,PDIM;PGL Synthesis,False,-0.0052509313,,Manually annotated iModulon that captures genes associated with PDIM and PGL synthesis,Virulence/Persistence
14,SG_2,False,0.0051749191000000005,,Single Gene iModulon 2,Single Gene
48,Leucine Related,False,0.0048676504,,Manually annotated iModulon with gene related to leucine metabolism,Amino Acids
74,SG_12,False,-0.0048014149,,Single Gene iModulon 12,Single Gene
11,EccE1 KO,False,-0.0047123034,,Single Gene iModulon that captures EccE1 knockout,KO
72,Unc_8,False,0.0045700646,,Uncharacterized iModulon 8,Uncharacterized
62,Rv2488c,False,-0.0044254624,Rv2488c,LuxR family transcription factor that regulates genes associated with virulence,Virulence/Persistence
58,Zur,False,0.0039692456,zur,Transcription factor that is activated by and regulates the metabolism of zinc,Metal Related
35,Unc_4,False,0.003863978,,Uncharacterized iModulon 4,Uncharacterized
27,Unc_2,False,0.0038124202,,Uncharacterized iModulon 2,Uncharacterized
61,Nucleic Acid Hydrolysis ,False,0.0036196972000000003,,iModulon enriched with the Nucleic Acid Hydrolysis KEGG pathway,Nucleic Acids
49,Rv1828/SigH,False,-0.0034350898,Rv1828 or sigH,iModulon that maps to the union of the Rv1828 and Rv3223c regulons,Redox
37,Rv3095,False,0.0028658769,Rv3095,iModulon labeled with predicted regulon with unknown function,Unknown Function
54,Unc_7,False,-0.0025552814,,Uncharacterized iModulon 7,Uncharacterized
34,MbcA+Rv3249c+Rv3066,False,0.0023890829,mbcA and Rv3249c and Rv3066,"iModulon that maps to the intersection of the Rv1990c, Rv3249c, and Rv3066 regulons",Virulence/Persistence
36,Fumarate Reductase,False,-0.0014955008000000001,,iModulon enriched with the Fumarate Reductase Gene Ontology term,Central Carbon
16,Mce3R,False,-0.0014772382000000001,mce3R,Transcription factor that regulates the mce3 virulence operon,Virulence/Persistence
66,M-box,False,-0.0012168233,,Magnesium activated non-coding sRNA that regulates the function of genes associated with metal metabolism and virulence,Metal Related
39,SigC,False,0.0011083131000000001,sigC,Sigma Factor that plays a role in organism virulence and lethality,Virulence/Persistence
26,EspL KO,False,0.0009899912,,Single Gene iModulon that captures EspL knockout,KO
79,WhiB4/IdeR,False,-0.0008787010000000001,whiB4 or ideR,iModulon that maps to the union of the Rv3681c and Rv2711 regulons,Redox
25,Rv0078+Rv2034,False,0.0007762077,Rv0078 and Rv2034,iModulon that maps to the intersection of the Rv0078 and Rv2034 regulon,Antibiotic
41,Unc_5,False,-0.0005967001000000001,,Uncharacterized iModulon 5,Uncharacterized
51,PhoP,False,0.0005233445,phoP,"Transcription factor that controls response to redox/acid stress, hypoxia, and virulence",Virulence/Persistence
75,Unc_9,False,-0.0005158367,,Uncharacterized iModulon 9,Uncharacterized
64,Mce1R,False,0.000389371,mce1R,Transcription factor that regulates the mce1 virulence operon,Virulence/Persistence
5,DevR-1,False,0.0001413833,devR,Transcription factor that is one of the primary regulators of hypoxia onset response,Redox
33,SG_4,False,4.42412e-05,,Single Gene iModulon 4,Single Gene
