k,Name,in_iM,gene_weight,Regulator,Function,Category
41,Unc_5,False,0.0588404737,,Uncharacterized iModulon 5,Uncharacterized
60,Rv0681,False,-0.034620337200000004,Rv0681,"Transcription with previously unknown function, regulates core fatty acid response",Unknown Function
22,SG_3,False,0.021362569300000002,,Single Gene iModulon 3,Single Gene
7,GroEL-GroES Complex,False,-0.0197116211,,Gene Ontology Term specific to the bacterial chaperonin complex,Amino Acids
28,WhiB1,False,-0.019410477500000002,whiB1,"Transcription repressor that is redox responsive, found to be nitric oxide sensitive",Redox
27,Unc_2,False,0.0185184156,,Uncharacterized iModulon 2,Uncharacterized
76,SG_13,False,-0.0184903598,,Single Gene iModulon 13,Single Gene
29,Blal,False,-0.0183297023,blaI,"Transcription regulator that regulates genes associated with antibiotic transport, detoxification, and cell wall function",Antibiotic
73,SG_11,False,-0.018270850300000002,,Single Gene iModulon 11,Single Gene
32,Unc_3,False,-0.0181529952,,Uncharacterized iModulon 3,Uncharacterized
1,Polyketide Synthase Complex,False,-0.0178661107,,KEGG Map related to the synthesis of type II polyketide backbone ,Fatty Acid/Cholestrol
72,Unc_8,False,0.0172421714,,Uncharacterized iModulon 8,Uncharacterized
79,WhiB4/IdeR,False,0.016138113200000002,whiB4 or ideR,iModulon that maps to the union of the Rv3681c and Rv2711 regulons,Redox
71,PDIM;PGL Synthesis,False,-0.015264157300000001,,Manually annotated iModulon that captures genes associated with PDIM and PGL synthesis,Virulence/Persistence
8,IdeR,False,-0.0133384641,ideR,Metal-Dependent DNA-Binding protein that controls genes related to iron metabolism,Metal Related
33,SG_4,False,0.0132388035,,Single Gene iModulon 4,Single Gene
35,Unc_4,False,0.0129619576,,Uncharacterized iModulon 4,Uncharacterized
20,FasR,False,0.012898901,fasR,Transcription factor that controls the expression of fatty acid metabolism genes,Fatty Acid/Cholestrol
26,EspL KO,False,-0.012542700300000001,,Single Gene iModulon that captures EspL knockout,KO
61,Nucleic Acid Hydrolysis ,False,0.011742755300000001,,iModulon enriched with the Nucleic Acid Hydrolysis KEGG pathway,Nucleic Acids
70,Lsr2,False,0.011549186500000001,lsr2,Sequence independent transcription factor that controls a wide variety of genes,Antibiotic
66,M-box,False,0.011216567200000001,,Magnesium activated non-coding sRNA that regulates the function of genes associated with metal metabolism and virulence,Metal Related
47,SG_7,False,-0.0111303209,,Single Gene iModulon 7,Single Gene
51,PhoP,False,-0.0108220972,phoP,"Transcription factor that controls response to redox/acid stress, hypoxia, and virulence",Virulence/Persistence
25,Rv0078+Rv2034,False,-0.0104831777,Rv0078 and Rv2034,iModulon that maps to the intersection of the Rv0078 and Rv2034 regulon,Antibiotic
48,Leucine Related,False,0.0098054709,,Manually annotated iModulon with gene related to leucine metabolism,Amino Acids
23,PrpR,False,-0.0097817866,prpR,Transcription factor that is involved in catabolism of short chain fatty acids via gloxylate and methylcitrate cycle,Central Carbon
65,SG_10,False,-0.0095325767,,Single Gene iModulon 10,Single Gene
13,SG_1,False,-0.008883975300000001,,Single Gene iModulon 1,Single Gene
31,ArgR,False,0.0088588638,argR,Transcription factor that regulates the L-arginine biosynthesis pathways,Amino Acids
74,SG_12,False,0.0085245648,,Single Gene iModulon 12,Single Gene
59,Rv0576,False,0.0082757976,Rv0576,Possible ArsR family transcription factor that regulates genes related to virulence,Virulence/Persistence
39,SigC,False,-0.0080787598,sigC,Sigma Factor that plays a role in organism virulence and lethality,Virulence/Persistence
45,SigD,False,-0.0079419331,sigD,Sigma Factor that governs the expression of ribosomal genes and plays a role in virulence,Virulence/Persistence
17,VirS,False,-0.0079265199,virS,Transcription factor that is activated and responds to acidic environments,Redox
68,Sulfur Metabolism,False,-0.0078881092,,Kegg Map that displays the transport and metabolism of sulfur,Sulfur Metabolism
78,Positive Regulation of Growth,False,-0.0077539532,,iModulon enriched with the Positive Regulation of Growth Gene Ontology term,Growth
53,Rv1776c+WhiB4,False,-0.0075419461,Rv1776c and whiB4 ,iModulon that maps to the intersection of the Rv1776c and Rv3681c regulon,Redox
44,SG_6,False,-0.0072444227,,Single Genes iModulon 6,Single Gene
30,HPT-2b Induced,False,0.0066814547000000005,,iModulon regulates many genes that are activated by HPT-2b (1-hydroxy-5-R-pyridine-2(1H)-thiones),Metal Related
54,Unc_7,False,-0.0064228241,,Uncharacterized iModulon 7,Uncharacterized
42,Nicotinate Metabolism,False,0.0063176242,,iModulon enriched with the nicotinate and nicotinamide metabolism KEGG pathway,Central Carbon
57,SG_8,False,0.0058264685,,Single Gene iModulon 8,Single Gene
50,Unc_6,False,-0.0054753793,,Uncharacterized iModulon 6,Uncharacterized
46,Rv2621c,False,0.0053181624000000005,Rv2621c,iModulon labeled with predicted regulon with unknown function,Unknown Function
49,Rv1828/SigH,False,-0.0052225181,Rv1828 or sigH,iModulon that maps to the union of the Rv1828 and Rv3223c regulons,Redox
0,SigH,False,-0.005009732,sigH,Sigma Factor involved in heat shock and oxidative stress response,Virulence/Persistence
2,IniR,False,0.0050057881,iniR,Transcription factor that regulates the expression of the ini operon (iniBAC),Antibiotic
24,Salicylate Induced,False,-0.0049393019,,Manually annotated iModulon where genes were found to change expression when exposed to salicylate,Metal Related
67,Peptidoglycan Biosynthesis,False,-0.0047908929000000005,,iModulon enriched with the Peptidoglycan biosyntehsis KEGG pathway,Central Carbon
75,Unc_9,False,-0.0045571839,,Uncharacterized iModulon 9,Uncharacterized
10,RicR,False,-0.0037328993,ricR,Copper responsive transcription factor that regulates metal metabolism genes,Metal Related
40,KstR2,False,0.0037098005000000002,kstR2,Transcription factor that regulates a small regulon related to cholesterol utilization,Fatty Acid/Cholestrol
11,EccE1 KO,False,0.0034629716000000002,,Single Gene iModulon that captures EccE1 knockout,KO
21,MprA,False,0.0032602165,mprA,Transcription factor that regulates multiple stress responsive genes,Virulence/Persistence
58,Zur,False,0.0032508593,zur,Transcription factor that is activated by and regulates the metabolism of zinc,Metal Related
77,Central Carbon Metabolism,False,-0.0030576024,,iModulon enriched with the Central Carbon Metabolism KEGG pathway,Central Carbon
63,SG_9,False,0.0029621268,,Single Gene iModulon 9,Single Gene
69,Rv0135+Rv1019,False,-0.0028497490000000004,Rv0135c and Rv1019,iModulon that maps to the intersection of the Rv0135c and Rv1019 regulons,Nucleic Acids
5,DevR-1,False,0.0028169624000000002,devR,Transcription factor that is one of the primary regulators of hypoxia onset response,Redox
12,Mycofactocin Synthesis Pathway,False,0.002705545,,Manually annotated iModulon that captures multiple genes associated with mycofactocin metabolism,Fatty Acid/Cholestrol
18,Unc_1,False,-0.0025490786,,Uncharacterized iModulon 1,Uncharacterized
62,Rv2488c,False,0.0025150940000000003,Rv2488c,LuxR family transcription factor that regulates genes associated with virulence,Virulence/Persistence
15,BkaR,False,0.0023610477,bkaR,Transcription factor that regulates genes related to branched-chain keto-acid metabolism,Central Carbon
14,SG_2,False,-0.0023398664,,Single Gene iModulon 2,Single Gene
64,Mce1R,False,-0.0020412827,mce1R,Transcription factor that regulates the mce1 virulence operon,Virulence/Persistence
38,SG_5,False,-0.0019412971,,Single Gene iModulon 5,Single Gene
16,Mce3R,False,-0.0018171006,mce3R,Transcription factor that regulates the mce3 virulence operon,Virulence/Persistence
3,PyrR,False,-0.0017123488,pyrR,Transcription factor that regulates the expression of pyrimidine nucleotide operons,Nucleic Acids
6,MarR,False,0.0016816291,marR,Transcription factor that regulates the response to acid stress,Acid Stress
43,LysG,False,-0.0015466096,lsyG,Transcription factor that controls the expression of LysE and requires lysine or histidine for activation ,Amino Acids
36,Fumarate Reductase,False,0.0012672779000000001,,iModulon enriched with the Fumarate Reductase Gene Ontology term,Central Carbon
9,SigK,False,0.0010743414,sigK,Sigma Factor involved in the production of antigenic proteins,Unknown Function
52,DevR-2,False,-0.0009104665,devR,Transcription factor that is one of the primary regulators of hypoxia onset response,Redox
34,MbcA+Rv3249c+Rv3066,False,-0.0008836135000000001,mbcA and Rv3249c and Rv3066,"iModulon that maps to the intersection of the Rv1990c, Rv3249c, and Rv3066 regulons",Virulence/Persistence
37,Rv3095,False,-0.0008050739,Rv3095,iModulon labeled with predicted regulon with unknown function,Unknown Function
56,Fatty Acid Biosynthesis,False,-0.0006625675,trcR and Rv1776c and whiB4 ,"iModulon that maps to the intersection of the Rv1033c, Rv1776c, and Rv3681c regulons",Fatty Acid/Cholestrol
55,WhiB7,False,0.000411674,whiB7,Transcription factor that connects systems for redox homeostasis and antibiotic resistance,Antibiotic
4,WhiB4,False,0.0003278422,whiB4,Redox-Responsive transcription regulator that regulates protection response during infection,Redox
19,WhiB6,False,0.00029719500000000004,whiB6,Transcription factor that regulates ESX-1 system membrane transport proteins,Redox
