k,Name,in_iM,gene_weight,Regulator,Function,Category
28,WhiB1,False,0.0333098235,whiB1,"Transcription repressor that is redox responsive, found to be nitric oxide sensitive",Redox
49,Rv1828/SigH,False,-0.0216428611,Rv1828 or sigH,iModulon that maps to the union of the Rv1828 and Rv3223c regulons,Redox
24,Salicylate Induced,False,-0.021080967500000002,,Manually annotated iModulon where genes were found to change expression when exposed to salicylate,Metal Related
43,LysG,False,-0.0194688049,lsyG,Transcription factor that controls the expression of LysE and requires lysine or histidine for activation ,Amino Acids
0,SigH,False,0.0174784499,sigH,Sigma Factor involved in heat shock and oxidative stress response,Virulence/Persistence
69,Rv0135+Rv1019,False,-0.016950557300000002,Rv0135c and Rv1019,iModulon that maps to the intersection of the Rv0135c and Rv1019 regulons,Nucleic Acids
6,MarR,False,0.015810727400000002,marR,Transcription factor that regulates the response to acid stress,Acid Stress
55,WhiB7,False,0.0147233719,whiB7,Transcription factor that connects systems for redox homeostasis and antibiotic resistance,Antibiotic
27,Unc_2,False,0.0124377971,,Uncharacterized iModulon 2,Uncharacterized
30,HPT-2b Induced,False,-0.0118765552,,iModulon regulates many genes that are activated by HPT-2b (1-hydroxy-5-R-pyridine-2(1H)-thiones),Metal Related
17,VirS,False,-0.0112506424,virS,Transcription factor that is activated and responds to acidic environments,Redox
48,Leucine Related,False,0.010886703000000001,,Manually annotated iModulon with gene related to leucine metabolism,Amino Acids
1,Polyketide Synthase Complex,False,-0.010609381400000001,,KEGG Map related to the synthesis of type II polyketide backbone ,Fatty Acid/Cholestrol
2,IniR,False,-0.0104975261,iniR,Transcription factor that regulates the expression of the ini operon (iniBAC),Antibiotic
64,Mce1R,False,0.0103780372,mce1R,Transcription factor that regulates the mce1 virulence operon,Virulence/Persistence
44,SG_6,False,-0.010175689600000001,,Single Genes iModulon 6,Single Gene
23,PrpR,False,-0.010079589600000001,prpR,Transcription factor that is involved in catabolism of short chain fatty acids via gloxylate and methylcitrate cycle,Central Carbon
58,Zur,False,-0.0099163901,zur,Transcription factor that is activated by and regulates the metabolism of zinc,Metal Related
36,Fumarate Reductase,False,0.0090812017,,iModulon enriched with the Fumarate Reductase Gene Ontology term,Central Carbon
57,SG_8,False,-0.009046630600000001,,Single Gene iModulon 8,Single Gene
60,Rv0681,False,-0.0087919307,Rv0681,"Transcription with previously unknown function, regulates core fatty acid response",Unknown Function
59,Rv0576,False,0.008703998400000001,Rv0576,Possible ArsR family transcription factor that regulates genes related to virulence,Virulence/Persistence
52,DevR-2,False,0.0082356963,devR,Transcription factor that is one of the primary regulators of hypoxia onset response,Redox
26,EspL KO,False,0.0076506382000000005,,Single Gene iModulon that captures EspL knockout,KO
66,M-box,False,0.0076183711,,Magnesium activated non-coding sRNA that regulates the function of genes associated with metal metabolism and virulence,Metal Related
63,SG_9,False,0.0070497191,,Single Gene iModulon 9,Single Gene
33,SG_4,False,0.0068121506000000005,,Single Gene iModulon 4,Single Gene
29,Blal,False,-0.0067596339,blaI,"Transcription regulator that regulates genes associated with antibiotic transport, detoxification, and cell wall function",Antibiotic
39,SigC,False,0.006383205800000001,sigC,Sigma Factor that plays a role in organism virulence and lethality,Virulence/Persistence
42,Nicotinate Metabolism,False,-0.0062863780000000005,,iModulon enriched with the nicotinate and nicotinamide metabolism KEGG pathway,Central Carbon
70,Lsr2,False,-0.006141775,lsr2,Sequence independent transcription factor that controls a wide variety of genes,Antibiotic
25,Rv0078+Rv2034,False,-0.005730438500000001,Rv0078 and Rv2034,iModulon that maps to the intersection of the Rv0078 and Rv2034 regulon,Antibiotic
79,WhiB4/IdeR,False,-0.0057284856,whiB4 or ideR,iModulon that maps to the union of the Rv3681c and Rv2711 regulons,Redox
68,Sulfur Metabolism,False,-0.005450843,,Kegg Map that displays the transport and metabolism of sulfur,Sulfur Metabolism
9,SigK,False,0.0053831957,sigK,Sigma Factor involved in the production of antigenic proteins,Unknown Function
46,Rv2621c,False,0.005325879,Rv2621c,iModulon labeled with predicted regulon with unknown function,Unknown Function
72,Unc_8,False,0.0049970953000000005,,Uncharacterized iModulon 8,Uncharacterized
8,IdeR,False,-0.004918627300000001,ideR,Metal-Dependent DNA-Binding protein that controls genes related to iron metabolism,Metal Related
22,SG_3,False,0.0048316698000000005,,Single Gene iModulon 3,Single Gene
47,SG_7,False,-0.004507451,,Single Gene iModulon 7,Single Gene
12,Mycofactocin Synthesis Pathway,False,0.0044601766,,Manually annotated iModulon that captures multiple genes associated with mycofactocin metabolism,Fatty Acid/Cholestrol
78,Positive Regulation of Growth,False,0.0044387141,,iModulon enriched with the Positive Regulation of Growth Gene Ontology term,Growth
5,DevR-1,False,-0.0043681467000000005,devR,Transcription factor that is one of the primary regulators of hypoxia onset response,Redox
21,MprA,False,-0.0042366412,mprA,Transcription factor that regulates multiple stress responsive genes,Virulence/Persistence
18,Unc_1,False,0.0040033644,,Uncharacterized iModulon 1,Uncharacterized
71,PDIM;PGL Synthesis,False,-0.0038620602,,Manually annotated iModulon that captures genes associated with PDIM and PGL synthesis,Virulence/Persistence
67,Peptidoglycan Biosynthesis,False,-0.0036404443,,iModulon enriched with the Peptidoglycan biosyntehsis KEGG pathway,Central Carbon
74,SG_12,False,0.0032759721000000003,,Single Gene iModulon 12,Single Gene
7,GroEL-GroES Complex,False,0.0032178623000000003,,Gene Ontology Term specific to the bacterial chaperonin complex,Amino Acids
77,Central Carbon Metabolism,False,-0.0030709485,,iModulon enriched with the Central Carbon Metabolism KEGG pathway,Central Carbon
20,FasR,False,0.0029330831,fasR,Transcription factor that controls the expression of fatty acid metabolism genes,Fatty Acid/Cholestrol
19,WhiB6,False,0.0028644483,whiB6,Transcription factor that regulates ESX-1 system membrane transport proteins,Redox
56,Fatty Acid Biosynthesis,False,-0.0028056011,trcR and Rv1776c and whiB4 ,"iModulon that maps to the intersection of the Rv1033c, Rv1776c, and Rv3681c regulons",Fatty Acid/Cholestrol
34,MbcA+Rv3249c+Rv3066,False,0.0027231371,mbcA and Rv3249c and Rv3066,"iModulon that maps to the intersection of the Rv1990c, Rv3249c, and Rv3066 regulons",Virulence/Persistence
11,EccE1 KO,False,-0.0026675478,,Single Gene iModulon that captures EccE1 knockout,KO
14,SG_2,False,-0.0025931789,,Single Gene iModulon 2,Single Gene
40,KstR2,False,0.0024895674,kstR2,Transcription factor that regulates a small regulon related to cholesterol utilization,Fatty Acid/Cholestrol
75,Unc_9,False,0.0023475826,,Uncharacterized iModulon 9,Uncharacterized
31,ArgR,False,-0.0022913095000000002,argR,Transcription factor that regulates the L-arginine biosynthesis pathways,Amino Acids
35,Unc_4,False,-0.0022197444,,Uncharacterized iModulon 4,Uncharacterized
73,SG_11,False,0.0019825193,,Single Gene iModulon 11,Single Gene
50,Unc_6,False,0.0019122391,,Uncharacterized iModulon 6,Uncharacterized
65,SG_10,False,-0.0018470811,,Single Gene iModulon 10,Single Gene
76,SG_13,False,0.0018412180000000002,,Single Gene iModulon 13,Single Gene
16,Mce3R,False,0.001814243,mce3R,Transcription factor that regulates the mce3 virulence operon,Virulence/Persistence
15,BkaR,False,-0.0017893134,bkaR,Transcription factor that regulates genes related to branched-chain keto-acid metabolism,Central Carbon
10,RicR,False,-0.0017829498,ricR,Copper responsive transcription factor that regulates metal metabolism genes,Metal Related
51,PhoP,False,0.0017267515,phoP,"Transcription factor that controls response to redox/acid stress, hypoxia, and virulence",Virulence/Persistence
13,SG_1,False,-0.0015837173,,Single Gene iModulon 1,Single Gene
45,SigD,False,0.0015447694,sigD,Sigma Factor that governs the expression of ribosomal genes and plays a role in virulence,Virulence/Persistence
3,PyrR,False,-0.0014129176,pyrR,Transcription factor that regulates the expression of pyrimidine nucleotide operons,Nucleic Acids
61,Nucleic Acid Hydrolysis ,False,-0.0013297012,,iModulon enriched with the Nucleic Acid Hydrolysis KEGG pathway,Nucleic Acids
54,Unc_7,False,-0.0010718747,,Uncharacterized iModulon 7,Uncharacterized
41,Unc_5,False,-0.0007146121,,Uncharacterized iModulon 5,Uncharacterized
32,Unc_3,False,0.00031271,,Uncharacterized iModulon 3,Uncharacterized
62,Rv2488c,False,-0.0002245116,Rv2488c,LuxR family transcription factor that regulates genes associated with virulence,Virulence/Persistence
53,Rv1776c+WhiB4,False,0.00017031350000000002,Rv1776c and whiB4 ,iModulon that maps to the intersection of the Rv1776c and Rv3681c regulon,Redox
37,Rv3095,False,0.0001441719,Rv3095,iModulon labeled with predicted regulon with unknown function,Unknown Function
4,WhiB4,False,7.77195e-05,whiB4,Redox-Responsive transcription regulator that regulates protection response during infection,Redox
38,SG_5,False,-4.42823e-05,,Single Gene iModulon 5,Single Gene
