k,Name,in_iM,gene_weight,Regulator,Function,Category
70,Lsr2,True,0.059927962,lsr2,Sequence independent transcription factor that controls a wide variety of genes,Antibiotic
68,Sulfur Metabolism,False,-0.033145676400000004,,Kegg Map that displays the transport and metabolism of sulfur,Sulfur Metabolism
35,Unc_4,False,0.0296806955,,Uncharacterized iModulon 4,Uncharacterized
53,Rv1776c+WhiB4,False,-0.0228046503,Rv1776c and whiB4 ,iModulon that maps to the intersection of the Rv1776c and Rv3681c regulon,Redox
55,WhiB7,False,-0.019274697,whiB7,Transcription factor that connects systems for redox homeostasis and antibiotic resistance,Antibiotic
69,Rv0135+Rv1019,False,0.016736394300000002,Rv0135c and Rv1019,iModulon that maps to the intersection of the Rv0135c and Rv1019 regulons,Nucleic Acids
43,LysG,False,0.0159919011,lsyG,Transcription factor that controls the expression of LysE and requires lysine or histidine for activation ,Amino Acids
64,Mce1R,False,0.0155865394,mce1R,Transcription factor that regulates the mce1 virulence operon,Virulence/Persistence
30,HPT-2b Induced,False,0.0154489451,,iModulon regulates many genes that are activated by HPT-2b (1-hydroxy-5-R-pyridine-2(1H)-thiones),Metal Related
13,SG_1,False,0.013477058,,Single Gene iModulon 1,Single Gene
76,SG_13,False,-0.0134584542,,Single Gene iModulon 13,Single Gene
42,Nicotinate Metabolism,False,0.0134115955,,iModulon enriched with the nicotinate and nicotinamide metabolism KEGG pathway,Central Carbon
25,Rv0078+Rv2034,False,0.0133830298,Rv0078 and Rv2034,iModulon that maps to the intersection of the Rv0078 and Rv2034 regulon,Antibiotic
0,SigH,False,-0.012655889200000001,sigH,Sigma Factor involved in heat shock and oxidative stress response,Virulence/Persistence
34,MbcA+Rv3249c+Rv3066,False,-0.0125690824,mbcA and Rv3249c and Rv3066,"iModulon that maps to the intersection of the Rv1990c, Rv3249c, and Rv3066 regulons",Virulence/Persistence
37,Rv3095,False,0.012424457000000002,Rv3095,iModulon labeled with predicted regulon with unknown function,Unknown Function
60,Rv0681,False,-0.0109699944,Rv0681,"Transcription with previously unknown function, regulates core fatty acid response",Unknown Function
78,Positive Regulation of Growth,False,0.0096903087,,iModulon enriched with the Positive Regulation of Growth Gene Ontology term,Growth
11,EccE1 KO,False,-0.009625451,,Single Gene iModulon that captures EccE1 knockout,KO
41,Unc_5,False,0.009541805700000001,,Uncharacterized iModulon 5,Uncharacterized
50,Unc_6,False,0.0095078495,,Uncharacterized iModulon 6,Uncharacterized
22,SG_3,False,-0.0093272747,,Single Gene iModulon 3,Single Gene
58,Zur,False,-0.0093017013,zur,Transcription factor that is activated by and regulates the metabolism of zinc,Metal Related
65,SG_10,False,-0.0092557248,,Single Gene iModulon 10,Single Gene
14,SG_2,False,0.0089828042,,Single Gene iModulon 2,Single Gene
38,SG_5,False,-0.0082529656,,Single Gene iModulon 5,Single Gene
24,Salicylate Induced,False,0.008030665000000001,,Manually annotated iModulon where genes were found to change expression when exposed to salicylate,Metal Related
26,EspL KO,False,-0.0079492487,,Single Gene iModulon that captures EspL knockout,KO
40,KstR2,False,-0.0077775935,kstR2,Transcription factor that regulates a small regulon related to cholesterol utilization,Fatty Acid/Cholestrol
16,Mce3R,False,-0.007700419000000001,mce3R,Transcription factor that regulates the mce3 virulence operon,Virulence/Persistence
75,Unc_9,False,0.0075822206,,Uncharacterized iModulon 9,Uncharacterized
67,Peptidoglycan Biosynthesis,False,0.0072244594,,iModulon enriched with the Peptidoglycan biosyntehsis KEGG pathway,Central Carbon
66,M-box,False,-0.0071976738,,Magnesium activated non-coding sRNA that regulates the function of genes associated with metal metabolism and virulence,Metal Related
59,Rv0576,False,0.0069297987,Rv0576,Possible ArsR family transcription factor that regulates genes related to virulence,Virulence/Persistence
33,SG_4,False,0.0068945472,,Single Gene iModulon 4,Single Gene
74,SG_12,False,0.0064544919000000004,,Single Gene iModulon 12,Single Gene
46,Rv2621c,False,-0.0063084759,Rv2621c,iModulon labeled with predicted regulon with unknown function,Unknown Function
77,Central Carbon Metabolism,False,0.0062666744,,iModulon enriched with the Central Carbon Metabolism KEGG pathway,Central Carbon
1,Polyketide Synthase Complex,False,0.0061962605,,KEGG Map related to the synthesis of type II polyketide backbone ,Fatty Acid/Cholestrol
32,Unc_3,False,-0.0060583689000000005,,Uncharacterized iModulon 3,Uncharacterized
45,SigD,False,0.005529467000000001,sigD,Sigma Factor that governs the expression of ribosomal genes and plays a role in virulence,Virulence/Persistence
3,PyrR,False,-0.0049055729,pyrR,Transcription factor that regulates the expression of pyrimidine nucleotide operons,Nucleic Acids
8,IdeR,False,-0.0048197917,ideR,Metal-Dependent DNA-Binding protein that controls genes related to iron metabolism,Metal Related
57,SG_8,False,0.0047787899,,Single Gene iModulon 8,Single Gene
17,VirS,False,-0.0047255524,virS,Transcription factor that is activated and responds to acidic environments,Redox
61,Nucleic Acid Hydrolysis ,False,-0.0045895833,,iModulon enriched with the Nucleic Acid Hydrolysis KEGG pathway,Nucleic Acids
23,PrpR,False,0.004473175,prpR,Transcription factor that is involved in catabolism of short chain fatty acids via gloxylate and methylcitrate cycle,Central Carbon
79,WhiB4/IdeR,False,-0.0044431127,whiB4 or ideR,iModulon that maps to the union of the Rv3681c and Rv2711 regulons,Redox
20,FasR,False,-0.0043904649,fasR,Transcription factor that controls the expression of fatty acid metabolism genes,Fatty Acid/Cholestrol
36,Fumarate Reductase,False,-0.0042581727,,iModulon enriched with the Fumarate Reductase Gene Ontology term,Central Carbon
49,Rv1828/SigH,False,0.0040714624,Rv1828 or sigH,iModulon that maps to the union of the Rv1828 and Rv3223c regulons,Redox
54,Unc_7,False,0.003844698,,Uncharacterized iModulon 7,Uncharacterized
21,MprA,False,-0.0038167915,mprA,Transcription factor that regulates multiple stress responsive genes,Virulence/Persistence
6,MarR,False,0.0037963094,marR,Transcription factor that regulates the response to acid stress,Acid Stress
47,SG_7,False,0.0037856104,,Single Gene iModulon 7,Single Gene
72,Unc_8,False,0.0037843271,,Uncharacterized iModulon 8,Uncharacterized
31,ArgR,False,0.0036551006000000003,argR,Transcription factor that regulates the L-arginine biosynthesis pathways,Amino Acids
5,DevR-1,False,-0.0035596606000000003,devR,Transcription factor that is one of the primary regulators of hypoxia onset response,Redox
9,SigK,False,-0.0034103464,sigK,Sigma Factor involved in the production of antigenic proteins,Unknown Function
51,PhoP,False,-0.0030031358,phoP,"Transcription factor that controls response to redox/acid stress, hypoxia, and virulence",Virulence/Persistence
2,IniR,False,0.0028513346000000003,iniR,Transcription factor that regulates the expression of the ini operon (iniBAC),Antibiotic
12,Mycofactocin Synthesis Pathway,False,-0.0027640195,,Manually annotated iModulon that captures multiple genes associated with mycofactocin metabolism,Fatty Acid/Cholestrol
27,Unc_2,False,-0.0027005138,,Uncharacterized iModulon 2,Uncharacterized
56,Fatty Acid Biosynthesis,False,0.0026746145000000002,trcR and Rv1776c and whiB4 ,"iModulon that maps to the intersection of the Rv1033c, Rv1776c, and Rv3681c regulons",Fatty Acid/Cholestrol
63,SG_9,False,0.0026494265,,Single Gene iModulon 9,Single Gene
39,SigC,False,0.00224989,sigC,Sigma Factor that plays a role in organism virulence and lethality,Virulence/Persistence
28,WhiB1,False,0.0022213697,whiB1,"Transcription repressor that is redox responsive, found to be nitric oxide sensitive",Redox
10,RicR,False,0.0020560624,ricR,Copper responsive transcription factor that regulates metal metabolism genes,Metal Related
73,SG_11,False,-0.0019316812,,Single Gene iModulon 11,Single Gene
48,Leucine Related,False,0.0016857957000000002,,Manually annotated iModulon with gene related to leucine metabolism,Amino Acids
52,DevR-2,False,-0.0014040362,devR,Transcription factor that is one of the primary regulators of hypoxia onset response,Redox
4,WhiB4,False,-0.0013206663,whiB4,Redox-Responsive transcription regulator that regulates protection response during infection,Redox
44,SG_6,False,-0.0011137316,,Single Genes iModulon 6,Single Gene
62,Rv2488c,False,-0.0010882277,Rv2488c,LuxR family transcription factor that regulates genes associated with virulence,Virulence/Persistence
19,WhiB6,False,0.0009792561,whiB6,Transcription factor that regulates ESX-1 system membrane transport proteins,Redox
15,BkaR,False,0.0009372390000000001,bkaR,Transcription factor that regulates genes related to branched-chain keto-acid metabolism,Central Carbon
71,PDIM;PGL Synthesis,False,-0.0007030464000000001,,Manually annotated iModulon that captures genes associated with PDIM and PGL synthesis,Virulence/Persistence
29,Blal,False,-0.0002469733,blaI,"Transcription regulator that regulates genes associated with antibiotic transport, detoxification, and cell wall function",Antibiotic
18,Unc_1,False,0.00023490510000000002,,Uncharacterized iModulon 1,Uncharacterized
7,GroEL-GroES Complex,False,0.0001019194,,Gene Ontology Term specific to the bacterial chaperonin complex,Amino Acids
