k,Name,in_iM,gene_weight,Regulator,Function,Category
75,Unc_9,False,-0.0152155185,,Uncharacterized iModulon 9,Uncharacterized
66,M-box,False,-0.015118788000000001,,Magnesium activated non-coding sRNA that regulates the function of genes associated with metal metabolism and virulence,Metal Related
32,Unc_3,False,0.0135584655,,Uncharacterized iModulon 3,Uncharacterized
2,IniR,False,-0.012256098,iniR,Transcription factor that regulates the expression of the ini operon (iniBAC),Antibiotic
42,Nicotinate Metabolism,False,-0.0120504533,,iModulon enriched with the nicotinate and nicotinamide metabolism KEGG pathway,Central Carbon
55,WhiB7,False,0.011788796300000001,whiB7,Transcription factor that connects systems for redox homeostasis and antibiotic resistance,Antibiotic
0,SigH,False,-0.0113121216,sigH,Sigma Factor involved in heat shock and oxidative stress response,Virulence/Persistence
69,Rv0135+Rv1019,False,-0.0111459217,Rv0135c and Rv1019,iModulon that maps to the intersection of the Rv0135c and Rv1019 regulons,Nucleic Acids
3,PyrR,False,0.0109416034,pyrR,Transcription factor that regulates the expression of pyrimidine nucleotide operons,Nucleic Acids
24,Salicylate Induced,False,-0.0103119935,,Manually annotated iModulon where genes were found to change expression when exposed to salicylate,Metal Related
10,RicR,False,-0.009943987500000001,ricR,Copper responsive transcription factor that regulates metal metabolism genes,Metal Related
74,SG_12,False,0.0096254187,,Single Gene iModulon 12,Single Gene
48,Leucine Related,False,-0.0096104562,,Manually annotated iModulon with gene related to leucine metabolism,Amino Acids
52,DevR-2,False,0.009325187300000001,devR,Transcription factor that is one of the primary regulators of hypoxia onset response,Redox
68,Sulfur Metabolism,False,0.0091746769,,Kegg Map that displays the transport and metabolism of sulfur,Sulfur Metabolism
12,Mycofactocin Synthesis Pathway,False,-0.0089564882,,Manually annotated iModulon that captures multiple genes associated with mycofactocin metabolism,Fatty Acid/Cholestrol
28,WhiB1,False,0.0088392421,whiB1,"Transcription repressor that is redox responsive, found to be nitric oxide sensitive",Redox
27,Unc_2,False,-0.008820921800000001,,Uncharacterized iModulon 2,Uncharacterized
5,DevR-1,False,-0.007894183,devR,Transcription factor that is one of the primary regulators of hypoxia onset response,Redox
43,LysG,False,-0.007750167200000001,lsyG,Transcription factor that controls the expression of LysE and requires lysine or histidine for activation ,Amino Acids
11,EccE1 KO,False,-0.0075083016,,Single Gene iModulon that captures EccE1 knockout,KO
58,Zur,False,-0.0073295062000000005,zur,Transcription factor that is activated by and regulates the metabolism of zinc,Metal Related
26,EspL KO,False,0.0072109038000000006,,Single Gene iModulon that captures EspL knockout,KO
70,Lsr2,False,-0.0070281531,lsr2,Sequence independent transcription factor that controls a wide variety of genes,Antibiotic
13,SG_1,False,-0.0068506805,,Single Gene iModulon 1,Single Gene
44,SG_6,False,-0.0067920868,,Single Genes iModulon 6,Single Gene
56,Fatty Acid Biosynthesis,False,-0.006729890400000001,trcR and Rv1776c and whiB4 ,"iModulon that maps to the intersection of the Rv1033c, Rv1776c, and Rv3681c regulons",Fatty Acid/Cholestrol
14,SG_2,False,-0.0066945715000000005,,Single Gene iModulon 2,Single Gene
61,Nucleic Acid Hydrolysis ,False,-0.0065275715,,iModulon enriched with the Nucleic Acid Hydrolysis KEGG pathway,Nucleic Acids
71,PDIM;PGL Synthesis,False,-0.0063725715,,Manually annotated iModulon that captures genes associated with PDIM and PGL synthesis,Virulence/Persistence
22,SG_3,False,-0.0061498734,,Single Gene iModulon 3,Single Gene
72,Unc_8,False,-0.0061206176,,Uncharacterized iModulon 8,Uncharacterized
51,PhoP,False,-0.0060099843,phoP,"Transcription factor that controls response to redox/acid stress, hypoxia, and virulence",Virulence/Persistence
19,WhiB6,False,-0.0058343389,whiB6,Transcription factor that regulates ESX-1 system membrane transport proteins,Redox
53,Rv1776c+WhiB4,False,-0.0058019163,Rv1776c and whiB4 ,iModulon that maps to the intersection of the Rv1776c and Rv3681c regulon,Redox
60,Rv0681,False,-0.005637599,Rv0681,"Transcription with previously unknown function, regulates core fatty acid response",Unknown Function
4,WhiB4,False,-0.0055922832,whiB4,Redox-Responsive transcription regulator that regulates protection response during infection,Redox
59,Rv0576,False,-0.0055620119,Rv0576,Possible ArsR family transcription factor that regulates genes related to virulence,Virulence/Persistence
31,ArgR,False,-0.0055223829,argR,Transcription factor that regulates the L-arginine biosynthesis pathways,Amino Acids
33,SG_4,False,-0.0054588148000000005,,Single Gene iModulon 4,Single Gene
17,VirS,False,-0.005424815600000001,virS,Transcription factor that is activated and responds to acidic environments,Redox
57,SG_8,False,-0.0053988112,,Single Gene iModulon 8,Single Gene
65,SG_10,False,-0.0053319022,,Single Gene iModulon 10,Single Gene
15,BkaR,False,-0.005225957000000001,bkaR,Transcription factor that regulates genes related to branched-chain keto-acid metabolism,Central Carbon
1,Polyketide Synthase Complex,False,0.0051819532000000005,,KEGG Map related to the synthesis of type II polyketide backbone ,Fatty Acid/Cholestrol
8,IdeR,False,-0.0049420422,ideR,Metal-Dependent DNA-Binding protein that controls genes related to iron metabolism,Metal Related
41,Unc_5,False,0.0046380019,,Uncharacterized iModulon 5,Uncharacterized
76,SG_13,False,0.0045085919,,Single Gene iModulon 13,Single Gene
45,SigD,False,-0.0044882151,sigD,Sigma Factor that governs the expression of ribosomal genes and plays a role in virulence,Virulence/Persistence
62,Rv2488c,False,0.0042486056,Rv2488c,LuxR family transcription factor that regulates genes associated with virulence,Virulence/Persistence
35,Unc_4,False,-0.0038829569,,Uncharacterized iModulon 4,Uncharacterized
73,SG_11,False,-0.0038825706000000003,,Single Gene iModulon 11,Single Gene
38,SG_5,False,0.0038442554,,Single Gene iModulon 5,Single Gene
50,Unc_6,False,0.0037106322000000002,,Uncharacterized iModulon 6,Uncharacterized
9,SigK,False,0.0036538153,sigK,Sigma Factor involved in the production of antigenic proteins,Unknown Function
37,Rv3095,False,0.003502551,Rv3095,iModulon labeled with predicted regulon with unknown function,Unknown Function
46,Rv2621c,False,0.0034279735,Rv2621c,iModulon labeled with predicted regulon with unknown function,Unknown Function
18,Unc_1,False,-0.0033567585000000002,,Uncharacterized iModulon 1,Uncharacterized
23,PrpR,False,0.0031771481000000003,prpR,Transcription factor that is involved in catabolism of short chain fatty acids via gloxylate and methylcitrate cycle,Central Carbon
40,KstR2,False,-0.0031258952,kstR2,Transcription factor that regulates a small regulon related to cholesterol utilization,Fatty Acid/Cholestrol
77,Central Carbon Metabolism,False,-0.002782164,,iModulon enriched with the Central Carbon Metabolism KEGG pathway,Central Carbon
79,WhiB4/IdeR,False,0.0027202408,whiB4 or ideR,iModulon that maps to the union of the Rv3681c and Rv2711 regulons,Redox
6,MarR,False,-0.0027019471,marR,Transcription factor that regulates the response to acid stress,Acid Stress
30,HPT-2b Induced,False,0.0027014594,,iModulon regulates many genes that are activated by HPT-2b (1-hydroxy-5-R-pyridine-2(1H)-thiones),Metal Related
64,Mce1R,False,-0.0019688364,mce1R,Transcription factor that regulates the mce1 virulence operon,Virulence/Persistence
20,FasR,False,0.0018493609,fasR,Transcription factor that controls the expression of fatty acid metabolism genes,Fatty Acid/Cholestrol
16,Mce3R,False,0.0017177124,mce3R,Transcription factor that regulates the mce3 virulence operon,Virulence/Persistence
47,SG_7,False,0.0017162195000000001,,Single Gene iModulon 7,Single Gene
36,Fumarate Reductase,False,-0.0013264653,,iModulon enriched with the Fumarate Reductase Gene Ontology term,Central Carbon
29,Blal,False,0.0012982076,blaI,"Transcription regulator that regulates genes associated with antibiotic transport, detoxification, and cell wall function",Antibiotic
49,Rv1828/SigH,False,0.0011689582,Rv1828 or sigH,iModulon that maps to the union of the Rv1828 and Rv3223c regulons,Redox
54,Unc_7,False,-0.0010697428,,Uncharacterized iModulon 7,Uncharacterized
21,MprA,False,0.0010683735,mprA,Transcription factor that regulates multiple stress responsive genes,Virulence/Persistence
34,MbcA+Rv3249c+Rv3066,False,-0.0008691318,mbcA and Rv3249c and Rv3066,"iModulon that maps to the intersection of the Rv1990c, Rv3249c, and Rv3066 regulons",Virulence/Persistence
7,GroEL-GroES Complex,False,-0.0007500343,,Gene Ontology Term specific to the bacterial chaperonin complex,Amino Acids
63,SG_9,False,0.0005471672000000001,,Single Gene iModulon 9,Single Gene
67,Peptidoglycan Biosynthesis,False,-0.00027815610000000003,,iModulon enriched with the Peptidoglycan biosyntehsis KEGG pathway,Central Carbon
78,Positive Regulation of Growth,False,-0.0002525684,,iModulon enriched with the Positive Regulation of Growth Gene Ontology term,Growth
25,Rv0078+Rv2034,False,4.62343e-05,Rv0078 and Rv2034,iModulon that maps to the intersection of the Rv0078 and Rv2034 regulon,Antibiotic
39,SigC,False,3.32701e-05,sigC,Sigma Factor that plays a role in organism virulence and lethality,Virulence/Persistence
