k,Name,in_iM,gene_weight,Regulator,Function,Category
68,Sulfur Metabolism,True,0.1257979287,,Kegg Map that displays the transport and metabolism of sulfur,Sulfur Metabolism
73,SG_11,False,0.0587808966,,Single Gene iModulon 11,Single Gene
13,SG_1,False,0.0427097705,,Single Gene iModulon 1,Single Gene
66,M-box,False,0.042296106300000004,,Magnesium activated non-coding sRNA that regulates the function of genes associated with metal metabolism and virulence,Metal Related
27,Unc_2,False,0.0405575187,,Uncharacterized iModulon 2,Uncharacterized
69,Rv0135+Rv1019,False,0.0396200028,Rv0135c and Rv1019,iModulon that maps to the intersection of the Rv0135c and Rv1019 regulons,Nucleic Acids
16,Mce3R,False,0.035088593200000004,mce3R,Transcription factor that regulates the mce3 virulence operon,Virulence/Persistence
72,Unc_8,False,0.0335154092,,Uncharacterized iModulon 8,Uncharacterized
31,ArgR,False,-0.032701983000000004,argR,Transcription factor that regulates the L-arginine biosynthesis pathways,Amino Acids
11,EccE1 KO,False,-0.0303469026,,Single Gene iModulon that captures EccE1 knockout,KO
43,LysG,False,-0.0276886551,lsyG,Transcription factor that controls the expression of LysE and requires lysine or histidine for activation ,Amino Acids
34,MbcA+Rv3249c+Rv3066,False,-0.026774242700000003,mbcA and Rv3249c and Rv3066,"iModulon that maps to the intersection of the Rv1990c, Rv3249c, and Rv3066 regulons",Virulence/Persistence
33,SG_4,False,-0.0264872017,,Single Gene iModulon 4,Single Gene
46,Rv2621c,False,-0.025894659100000002,Rv2621c,iModulon labeled with predicted regulon with unknown function,Unknown Function
7,GroEL-GroES Complex,False,-0.025596311400000002,,Gene Ontology Term specific to the bacterial chaperonin complex,Amino Acids
2,IniR,False,0.0254831511,iniR,Transcription factor that regulates the expression of the ini operon (iniBAC),Antibiotic
39,SigC,False,-0.0240371734,sigC,Sigma Factor that plays a role in organism virulence and lethality,Virulence/Persistence
23,PrpR,False,-0.0235155661,prpR,Transcription factor that is involved in catabolism of short chain fatty acids via gloxylate and methylcitrate cycle,Central Carbon
56,Fatty Acid Biosynthesis,False,-0.023085410900000002,trcR and Rv1776c and whiB4 ,"iModulon that maps to the intersection of the Rv1033c, Rv1776c, and Rv3681c regulons",Fatty Acid/Cholestrol
71,PDIM;PGL Synthesis,False,0.0229209293,,Manually annotated iModulon that captures genes associated with PDIM and PGL synthesis,Virulence/Persistence
20,FasR,False,-0.0226908657,fasR,Transcription factor that controls the expression of fatty acid metabolism genes,Fatty Acid/Cholestrol
14,SG_2,False,-0.0218912157,,Single Gene iModulon 2,Single Gene
45,SigD,False,0.0215032248,sigD,Sigma Factor that governs the expression of ribosomal genes and plays a role in virulence,Virulence/Persistence
22,SG_3,False,-0.020855219600000002,,Single Gene iModulon 3,Single Gene
54,Unc_7,False,-0.019210549400000002,,Uncharacterized iModulon 7,Uncharacterized
38,SG_5,False,0.0187824239,,Single Gene iModulon 5,Single Gene
41,Unc_5,False,-0.017939784,,Uncharacterized iModulon 5,Uncharacterized
30,HPT-2b Induced,False,0.0170203231,,iModulon regulates many genes that are activated by HPT-2b (1-hydroxy-5-R-pyridine-2(1H)-thiones),Metal Related
3,PyrR,False,-0.0168198133,pyrR,Transcription factor that regulates the expression of pyrimidine nucleotide operons,Nucleic Acids
1,Polyketide Synthase Complex,False,-0.0159899126,,KEGG Map related to the synthesis of type II polyketide backbone ,Fatty Acid/Cholestrol
48,Leucine Related,False,0.015174278400000001,,Manually annotated iModulon with gene related to leucine metabolism,Amino Acids
70,Lsr2,False,0.0150881999,lsr2,Sequence independent transcription factor that controls a wide variety of genes,Antibiotic
77,Central Carbon Metabolism,False,0.015062762300000001,,iModulon enriched with the Central Carbon Metabolism KEGG pathway,Central Carbon
0,SigH,False,-0.0146944699,sigH,Sigma Factor involved in heat shock and oxidative stress response,Virulence/Persistence
67,Peptidoglycan Biosynthesis,False,-0.0142513012,,iModulon enriched with the Peptidoglycan biosyntehsis KEGG pathway,Central Carbon
53,Rv1776c+WhiB4,False,-0.014246501100000001,Rv1776c and whiB4 ,iModulon that maps to the intersection of the Rv1776c and Rv3681c regulon,Redox
10,RicR,False,0.0141122498,ricR,Copper responsive transcription factor that regulates metal metabolism genes,Metal Related
36,Fumarate Reductase,False,0.0128762728,,iModulon enriched with the Fumarate Reductase Gene Ontology term,Central Carbon
78,Positive Regulation of Growth,False,0.0106818454,,iModulon enriched with the Positive Regulation of Growth Gene Ontology term,Growth
74,SG_12,False,0.0104659229,,Single Gene iModulon 12,Single Gene
24,Salicylate Induced,False,-0.0104307674,,Manually annotated iModulon where genes were found to change expression when exposed to salicylate,Metal Related
12,Mycofactocin Synthesis Pathway,False,0.0097647111,,Manually annotated iModulon that captures multiple genes associated with mycofactocin metabolism,Fatty Acid/Cholestrol
17,VirS,False,-0.009759403,virS,Transcription factor that is activated and responds to acidic environments,Redox
37,Rv3095,False,0.0088595106,Rv3095,iModulon labeled with predicted regulon with unknown function,Unknown Function
76,SG_13,False,0.0086776313,,Single Gene iModulon 13,Single Gene
25,Rv0078+Rv2034,False,-0.0082231846,Rv0078 and Rv2034,iModulon that maps to the intersection of the Rv0078 and Rv2034 regulon,Antibiotic
42,Nicotinate Metabolism,False,0.0081865822,,iModulon enriched with the nicotinate and nicotinamide metabolism KEGG pathway,Central Carbon
64,Mce1R,False,-0.0077864946,mce1R,Transcription factor that regulates the mce1 virulence operon,Virulence/Persistence
6,MarR,False,0.0075786921,marR,Transcription factor that regulates the response to acid stress,Acid Stress
19,WhiB6,False,0.0068096897000000005,whiB6,Transcription factor that regulates ESX-1 system membrane transport proteins,Redox
58,Zur,False,0.006362147,zur,Transcription factor that is activated by and regulates the metabolism of zinc,Metal Related
55,WhiB7,False,-0.0063613883000000005,whiB7,Transcription factor that connects systems for redox homeostasis and antibiotic resistance,Antibiotic
18,Unc_1,False,-0.0056023816,,Uncharacterized iModulon 1,Uncharacterized
65,SG_10,False,-0.0054157355,,Single Gene iModulon 10,Single Gene
60,Rv0681,False,0.005380109,Rv0681,"Transcription with previously unknown function, regulates core fatty acid response",Unknown Function
62,Rv2488c,False,0.0052787814,Rv2488c,LuxR family transcription factor that regulates genes associated with virulence,Virulence/Persistence
21,MprA,False,0.005220039100000001,mprA,Transcription factor that regulates multiple stress responsive genes,Virulence/Persistence
26,EspL KO,False,-0.0047406796000000005,,Single Gene iModulon that captures EspL knockout,KO
51,PhoP,False,-0.0045304097,phoP,"Transcription factor that controls response to redox/acid stress, hypoxia, and virulence",Virulence/Persistence
15,BkaR,False,-0.0040806397,bkaR,Transcription factor that regulates genes related to branched-chain keto-acid metabolism,Central Carbon
8,IdeR,False,0.0033088298,ideR,Metal-Dependent DNA-Binding protein that controls genes related to iron metabolism,Metal Related
61,Nucleic Acid Hydrolysis ,False,-0.0032734170000000003,,iModulon enriched with the Nucleic Acid Hydrolysis KEGG pathway,Nucleic Acids
79,WhiB4/IdeR,False,0.0029464873,whiB4 or ideR,iModulon that maps to the union of the Rv3681c and Rv2711 regulons,Redox
59,Rv0576,False,-0.002896065,Rv0576,Possible ArsR family transcription factor that regulates genes related to virulence,Virulence/Persistence
44,SG_6,False,0.0027208538,,Single Genes iModulon 6,Single Gene
49,Rv1828/SigH,False,0.0025342775,Rv1828 or sigH,iModulon that maps to the union of the Rv1828 and Rv3223c regulons,Redox
32,Unc_3,False,-0.0024867857000000003,,Uncharacterized iModulon 3,Uncharacterized
52,DevR-2,False,0.0024573613,devR,Transcription factor that is one of the primary regulators of hypoxia onset response,Redox
40,KstR2,False,0.0021786331,kstR2,Transcription factor that regulates a small regulon related to cholesterol utilization,Fatty Acid/Cholestrol
63,SG_9,False,0.0019611179,,Single Gene iModulon 9,Single Gene
9,SigK,False,-0.0017225149000000002,sigK,Sigma Factor involved in the production of antigenic proteins,Unknown Function
5,DevR-1,False,0.0014974279,devR,Transcription factor that is one of the primary regulators of hypoxia onset response,Redox
4,WhiB4,False,-0.0014563045,whiB4,Redox-Responsive transcription regulator that regulates protection response during infection,Redox
50,Unc_6,False,0.0011356233,,Uncharacterized iModulon 6,Uncharacterized
35,Unc_4,False,0.0011286783,,Uncharacterized iModulon 4,Uncharacterized
47,SG_7,False,-0.0011128259,,Single Gene iModulon 7,Single Gene
28,WhiB1,False,0.0010122336,whiB1,"Transcription repressor that is redox responsive, found to be nitric oxide sensitive",Redox
57,SG_8,False,0.0007824938,,Single Gene iModulon 8,Single Gene
75,Unc_9,False,-0.000346304,,Uncharacterized iModulon 9,Uncharacterized
29,Blal,False,0.0001996505,blaI,"Transcription regulator that regulates genes associated with antibiotic transport, detoxification, and cell wall function",Antibiotic
