k,Name,in_iM,gene_weight,Regulator,Function,Category
62,Rv2488c,True,0.35169186220000004,Rv2488c,LuxR family transcription factor that regulates genes associated with virulence,Virulence/Persistence
43,LysG,False,-0.029963961600000002,lsyG,Transcription factor that controls the expression of LysE and requires lysine or histidine for activation ,Amino Acids
18,Unc_1,False,0.0271378211,,Uncharacterized iModulon 1,Uncharacterized
54,Unc_7,False,0.0268939355,,Uncharacterized iModulon 7,Uncharacterized
65,SG_10,False,0.0233389095,,Single Gene iModulon 10,Single Gene
8,IdeR,False,0.0206179051,ideR,Metal-Dependent DNA-Binding protein that controls genes related to iron metabolism,Metal Related
49,Rv1828/SigH,False,-0.0196238262,Rv1828 or sigH,iModulon that maps to the union of the Rv1828 and Rv3223c regulons,Redox
45,SigD,False,0.017490767,sigD,Sigma Factor that governs the expression of ribosomal genes and plays a role in virulence,Virulence/Persistence
22,SG_3,False,-0.0174351326,,Single Gene iModulon 3,Single Gene
35,Unc_4,False,-0.0172555553,,Uncharacterized iModulon 4,Uncharacterized
9,SigK,False,0.0165335751,sigK,Sigma Factor involved in the production of antigenic proteins,Unknown Function
79,WhiB4/IdeR,False,-0.0151296634,whiB4 or ideR,iModulon that maps to the union of the Rv3681c and Rv2711 regulons,Redox
16,Mce3R,False,-0.0151295896,mce3R,Transcription factor that regulates the mce3 virulence operon,Virulence/Persistence
31,ArgR,False,-0.0150778088,argR,Transcription factor that regulates the L-arginine biosynthesis pathways,Amino Acids
76,SG_13,False,-0.0146216096,,Single Gene iModulon 13,Single Gene
48,Leucine Related,False,-0.0138370249,,Manually annotated iModulon with gene related to leucine metabolism,Amino Acids
60,Rv0681,False,-0.0133678084,Rv0681,"Transcription with previously unknown function, regulates core fatty acid response",Unknown Function
3,PyrR,False,0.0130410509,pyrR,Transcription factor that regulates the expression of pyrimidine nucleotide operons,Nucleic Acids
1,Polyketide Synthase Complex,False,-0.012553438600000001,,KEGG Map related to the synthesis of type II polyketide backbone ,Fatty Acid/Cholestrol
71,PDIM;PGL Synthesis,False,0.012533168,,Manually annotated iModulon that captures genes associated with PDIM and PGL synthesis,Virulence/Persistence
40,KstR2,False,-0.0121647773,kstR2,Transcription factor that regulates a small regulon related to cholesterol utilization,Fatty Acid/Cholestrol
53,Rv1776c+WhiB4,False,0.011641079300000001,Rv1776c and whiB4 ,iModulon that maps to the intersection of the Rv1776c and Rv3681c regulon,Redox
13,SG_1,False,0.0114182489,,Single Gene iModulon 1,Single Gene
67,Peptidoglycan Biosynthesis,False,0.0108054889,,iModulon enriched with the Peptidoglycan biosyntehsis KEGG pathway,Central Carbon
25,Rv0078+Rv2034,False,0.0092516804,Rv0078 and Rv2034,iModulon that maps to the intersection of the Rv0078 and Rv2034 regulon,Antibiotic
42,Nicotinate Metabolism,False,0.0084552062,,iModulon enriched with the nicotinate and nicotinamide metabolism KEGG pathway,Central Carbon
46,Rv2621c,False,0.0076080447,Rv2621c,iModulon labeled with predicted regulon with unknown function,Unknown Function
68,Sulfur Metabolism,False,-0.0075544973,,Kegg Map that displays the transport and metabolism of sulfur,Sulfur Metabolism
70,Lsr2,False,-0.0075504676,lsr2,Sequence independent transcription factor that controls a wide variety of genes,Antibiotic
29,Blal,False,0.0074601841,blaI,"Transcription regulator that regulates genes associated with antibiotic transport, detoxification, and cell wall function",Antibiotic
59,Rv0576,False,-0.0074384458,Rv0576,Possible ArsR family transcription factor that regulates genes related to virulence,Virulence/Persistence
27,Unc_2,False,0.007138284900000001,,Uncharacterized iModulon 2,Uncharacterized
37,Rv3095,False,-0.0070734725000000005,Rv3095,iModulon labeled with predicted regulon with unknown function,Unknown Function
39,SigC,False,0.0067458996,sigC,Sigma Factor that plays a role in organism virulence and lethality,Virulence/Persistence
24,Salicylate Induced,False,-0.0064697775,,Manually annotated iModulon where genes were found to change expression when exposed to salicylate,Metal Related
64,Mce1R,False,0.0061657856,mce1R,Transcription factor that regulates the mce1 virulence operon,Virulence/Persistence
51,PhoP,False,0.0060224484,phoP,"Transcription factor that controls response to redox/acid stress, hypoxia, and virulence",Virulence/Persistence
15,BkaR,False,-0.0059860559,bkaR,Transcription factor that regulates genes related to branched-chain keto-acid metabolism,Central Carbon
5,DevR-1,False,-0.0059822406,devR,Transcription factor that is one of the primary regulators of hypoxia onset response,Redox
78,Positive Regulation of Growth,False,0.0058921998,,iModulon enriched with the Positive Regulation of Growth Gene Ontology term,Growth
41,Unc_5,False,-0.0057445505,,Uncharacterized iModulon 5,Uncharacterized
10,RicR,False,0.0055157892,ricR,Copper responsive transcription factor that regulates metal metabolism genes,Metal Related
50,Unc_6,False,0.0054788325,,Uncharacterized iModulon 6,Uncharacterized
36,Fumarate Reductase,False,-0.0054372679,,iModulon enriched with the Fumarate Reductase Gene Ontology term,Central Carbon
66,M-box,False,0.0051472287,,Magnesium activated non-coding sRNA that regulates the function of genes associated with metal metabolism and virulence,Metal Related
23,PrpR,False,-0.0051226001,prpR,Transcription factor that is involved in catabolism of short chain fatty acids via gloxylate and methylcitrate cycle,Central Carbon
33,SG_4,False,0.0046130459,,Single Gene iModulon 4,Single Gene
77,Central Carbon Metabolism,False,-0.0043802387000000005,,iModulon enriched with the Central Carbon Metabolism KEGG pathway,Central Carbon
38,SG_5,False,-0.0043542404,,Single Gene iModulon 5,Single Gene
14,SG_2,False,0.0040836438,,Single Gene iModulon 2,Single Gene
11,EccE1 KO,False,-0.0039500502,,Single Gene iModulon that captures EccE1 knockout,KO
17,VirS,False,0.0038734237,virS,Transcription factor that is activated and responds to acidic environments,Redox
32,Unc_3,False,0.0037126012000000003,,Uncharacterized iModulon 3,Uncharacterized
28,WhiB1,False,-0.0036682285,whiB1,"Transcription repressor that is redox responsive, found to be nitric oxide sensitive",Redox
56,Fatty Acid Biosynthesis,False,0.0033087412,trcR and Rv1776c and whiB4 ,"iModulon that maps to the intersection of the Rv1033c, Rv1776c, and Rv3681c regulons",Fatty Acid/Cholestrol
52,DevR-2,False,0.0031863814,devR,Transcription factor that is one of the primary regulators of hypoxia onset response,Redox
44,SG_6,False,-0.0031777761000000002,,Single Genes iModulon 6,Single Gene
6,MarR,False,-0.0031337823,marR,Transcription factor that regulates the response to acid stress,Acid Stress
21,MprA,False,-0.0029492231,mprA,Transcription factor that regulates multiple stress responsive genes,Virulence/Persistence
74,SG_12,False,0.0025491517,,Single Gene iModulon 12,Single Gene
75,Unc_9,False,-0.0024532103,,Uncharacterized iModulon 9,Uncharacterized
4,WhiB4,False,-0.0023502367,whiB4,Redox-Responsive transcription regulator that regulates protection response during infection,Redox
72,Unc_8,False,0.0022793963,,Uncharacterized iModulon 8,Uncharacterized
61,Nucleic Acid Hydrolysis ,False,-0.0022527259,,iModulon enriched with the Nucleic Acid Hydrolysis KEGG pathway,Nucleic Acids
20,FasR,False,-0.0022343893,fasR,Transcription factor that controls the expression of fatty acid metabolism genes,Fatty Acid/Cholestrol
58,Zur,False,0.0021833979,zur,Transcription factor that is activated by and regulates the metabolism of zinc,Metal Related
69,Rv0135+Rv1019,False,-0.0019489074,Rv0135c and Rv1019,iModulon that maps to the intersection of the Rv0135c and Rv1019 regulons,Nucleic Acids
12,Mycofactocin Synthesis Pathway,False,-0.0015543391,,Manually annotated iModulon that captures multiple genes associated with mycofactocin metabolism,Fatty Acid/Cholestrol
47,SG_7,False,0.0015364968,,Single Gene iModulon 7,Single Gene
57,SG_8,False,0.0012696719,,Single Gene iModulon 8,Single Gene
55,WhiB7,False,-0.0012184095000000001,whiB7,Transcription factor that connects systems for redox homeostasis and antibiotic resistance,Antibiotic
2,IniR,False,-0.0011320739,iniR,Transcription factor that regulates the expression of the ini operon (iniBAC),Antibiotic
0,SigH,False,-0.0011131884000000001,sigH,Sigma Factor involved in heat shock and oxidative stress response,Virulence/Persistence
63,SG_9,False,-0.0009580352,,Single Gene iModulon 9,Single Gene
73,SG_11,False,-0.0009501834000000001,,Single Gene iModulon 11,Single Gene
26,EspL KO,False,0.0008446064,,Single Gene iModulon that captures EspL knockout,KO
30,HPT-2b Induced,False,-0.0006296625,,iModulon regulates many genes that are activated by HPT-2b (1-hydroxy-5-R-pyridine-2(1H)-thiones),Metal Related
7,GroEL-GroES Complex,False,0.0003996087,,Gene Ontology Term specific to the bacterial chaperonin complex,Amino Acids
19,WhiB6,False,0.0003007623,whiB6,Transcription factor that regulates ESX-1 system membrane transport proteins,Redox
34,MbcA+Rv3249c+Rv3066,False,-0.0001916458,mbcA and Rv3249c and Rv3066,"iModulon that maps to the intersection of the Rv1990c, Rv3249c, and Rv3066 regulons",Virulence/Persistence
