k,Name,in_iM,gene_weight,Regulator,Function,Category
67,Peptidoglycan Biosynthesis,False,0.0271025812,,iModulon enriched with the Peptidoglycan biosyntehsis KEGG pathway,Central Carbon
42,Nicotinate Metabolism,False,0.0194606499,,iModulon enriched with the nicotinate and nicotinamide metabolism KEGG pathway,Central Carbon
78,Positive Regulation of Growth,False,-0.014201766400000001,,iModulon enriched with the Positive Regulation of Growth Gene Ontology term,Growth
72,Unc_8,False,0.014177576400000001,,Uncharacterized iModulon 8,Uncharacterized
49,Rv1828/SigH,False,-0.0130868518,Rv1828 or sigH,iModulon that maps to the union of the Rv1828 and Rv3223c regulons,Redox
15,BkaR,False,0.0128766368,bkaR,Transcription factor that regulates genes related to branched-chain keto-acid metabolism,Central Carbon
53,Rv1776c+WhiB4,False,-0.0117602906,Rv1776c and whiB4 ,iModulon that maps to the intersection of the Rv1776c and Rv3681c regulon,Redox
34,MbcA+Rv3249c+Rv3066,False,-0.0115831632,mbcA and Rv3249c and Rv3066,"iModulon that maps to the intersection of the Rv1990c, Rv3249c, and Rv3066 regulons",Virulence/Persistence
14,SG_2,False,-0.010994440500000001,,Single Gene iModulon 2,Single Gene
41,Unc_5,False,0.0107220319,,Uncharacterized iModulon 5,Uncharacterized
16,Mce3R,False,-0.0101910002,mce3R,Transcription factor that regulates the mce3 virulence operon,Virulence/Persistence
59,Rv0576,False,-0.0101621106,Rv0576,Possible ArsR family transcription factor that regulates genes related to virulence,Virulence/Persistence
22,SG_3,False,0.0098312208,,Single Gene iModulon 3,Single Gene
33,SG_4,False,-0.0092489214,,Single Gene iModulon 4,Single Gene
51,PhoP,False,-0.0091396853,phoP,"Transcription factor that controls response to redox/acid stress, hypoxia, and virulence",Virulence/Persistence
21,MprA,False,-0.0091202925,mprA,Transcription factor that regulates multiple stress responsive genes,Virulence/Persistence
29,Blal,False,-0.0087822034,blaI,"Transcription regulator that regulates genes associated with antibiotic transport, detoxification, and cell wall function",Antibiotic
48,Leucine Related,False,0.0086766419,,Manually annotated iModulon with gene related to leucine metabolism,Amino Acids
77,Central Carbon Metabolism,False,0.0085403883,,iModulon enriched with the Central Carbon Metabolism KEGG pathway,Central Carbon
79,WhiB4/IdeR,False,0.0082801332,whiB4 or ideR,iModulon that maps to the union of the Rv3681c and Rv2711 regulons,Redox
76,SG_13,False,-0.0079701409,,Single Gene iModulon 13,Single Gene
65,SG_10,False,0.0079309943,,Single Gene iModulon 10,Single Gene
18,Unc_1,False,0.007572021700000001,,Uncharacterized iModulon 1,Uncharacterized
47,SG_7,False,0.0063152011,,Single Gene iModulon 7,Single Gene
36,Fumarate Reductase,False,0.006153518100000001,,iModulon enriched with the Fumarate Reductase Gene Ontology term,Central Carbon
19,WhiB6,False,0.0061509303,whiB6,Transcription factor that regulates ESX-1 system membrane transport proteins,Redox
3,PyrR,False,0.0059525244,pyrR,Transcription factor that regulates the expression of pyrimidine nucleotide operons,Nucleic Acids
70,Lsr2,False,0.0058458428,lsr2,Sequence independent transcription factor that controls a wide variety of genes,Antibiotic
38,SG_5,False,-0.0058438926,,Single Gene iModulon 5,Single Gene
6,MarR,False,0.0058298427,marR,Transcription factor that regulates the response to acid stress,Acid Stress
62,Rv2488c,False,0.0058259431000000006,Rv2488c,LuxR family transcription factor that regulates genes associated with virulence,Virulence/Persistence
60,Rv0681,False,0.0057479417,Rv0681,"Transcription with previously unknown function, regulates core fatty acid response",Unknown Function
4,WhiB4,False,-0.0055491653000000005,whiB4,Redox-Responsive transcription regulator that regulates protection response during infection,Redox
55,WhiB7,False,-0.0053663876000000004,whiB7,Transcription factor that connects systems for redox homeostasis and antibiotic resistance,Antibiotic
2,IniR,False,-0.005306071000000001,iniR,Transcription factor that regulates the expression of the ini operon (iniBAC),Antibiotic
75,Unc_9,False,-0.0052886805,,Uncharacterized iModulon 9,Uncharacterized
1,Polyketide Synthase Complex,False,-0.0052698002,,KEGG Map related to the synthesis of type II polyketide backbone ,Fatty Acid/Cholestrol
74,SG_12,False,-0.0050944722,,Single Gene iModulon 12,Single Gene
35,Unc_4,False,0.0050634821,,Uncharacterized iModulon 4,Uncharacterized
37,Rv3095,False,-0.0050150096,Rv3095,iModulon labeled with predicted regulon with unknown function,Unknown Function
61,Nucleic Acid Hydrolysis ,False,-0.0046961546,,iModulon enriched with the Nucleic Acid Hydrolysis KEGG pathway,Nucleic Acids
40,KstR2,False,0.0042781550000000005,kstR2,Transcription factor that regulates a small regulon related to cholesterol utilization,Fatty Acid/Cholestrol
39,SigC,False,-0.0040841096,sigC,Sigma Factor that plays a role in organism virulence and lethality,Virulence/Persistence
27,Unc_2,False,0.0040180401,,Uncharacterized iModulon 2,Uncharacterized
46,Rv2621c,False,0.0037678378000000003,Rv2621c,iModulon labeled with predicted regulon with unknown function,Unknown Function
58,Zur,False,-0.0036864367,zur,Transcription factor that is activated by and regulates the metabolism of zinc,Metal Related
26,EspL KO,False,-0.0035475078,,Single Gene iModulon that captures EspL knockout,KO
68,Sulfur Metabolism,False,0.0035382833000000002,,Kegg Map that displays the transport and metabolism of sulfur,Sulfur Metabolism
71,PDIM;PGL Synthesis,False,0.0034509016,,Manually annotated iModulon that captures genes associated with PDIM and PGL synthesis,Virulence/Persistence
31,ArgR,False,0.0033012019,argR,Transcription factor that regulates the L-arginine biosynthesis pathways,Amino Acids
8,IdeR,False,-0.0032231543000000003,ideR,Metal-Dependent DNA-Binding protein that controls genes related to iron metabolism,Metal Related
25,Rv0078+Rv2034,False,-0.0031946337,Rv0078 and Rv2034,iModulon that maps to the intersection of the Rv0078 and Rv2034 regulon,Antibiotic
12,Mycofactocin Synthesis Pathway,False,0.0030717572,,Manually annotated iModulon that captures multiple genes associated with mycofactocin metabolism,Fatty Acid/Cholestrol
45,SigD,False,0.0030653552,sigD,Sigma Factor that governs the expression of ribosomal genes and plays a role in virulence,Virulence/Persistence
11,EccE1 KO,False,-0.0026493090000000003,,Single Gene iModulon that captures EccE1 knockout,KO
50,Unc_6,False,-0.002557751,,Uncharacterized iModulon 6,Uncharacterized
30,HPT-2b Induced,False,-0.0023835128000000002,,iModulon regulates many genes that are activated by HPT-2b (1-hydroxy-5-R-pyridine-2(1H)-thiones),Metal Related
44,SG_6,False,0.0023083970000000002,,Single Genes iModulon 6,Single Gene
32,Unc_3,False,-0.0021046990000000002,,Uncharacterized iModulon 3,Uncharacterized
7,GroEL-GroES Complex,False,0.0020726877,,Gene Ontology Term specific to the bacterial chaperonin complex,Amino Acids
66,M-box,False,-0.0017785368,,Magnesium activated non-coding sRNA that regulates the function of genes associated with metal metabolism and virulence,Metal Related
54,Unc_7,False,0.0015936121000000001,,Uncharacterized iModulon 7,Uncharacterized
56,Fatty Acid Biosynthesis,False,-0.001574494,trcR and Rv1776c and whiB4 ,"iModulon that maps to the intersection of the Rv1033c, Rv1776c, and Rv3681c regulons",Fatty Acid/Cholestrol
28,WhiB1,False,0.0014610930000000001,whiB1,"Transcription repressor that is redox responsive, found to be nitric oxide sensitive",Redox
69,Rv0135+Rv1019,False,0.0014343546,Rv0135c and Rv1019,iModulon that maps to the intersection of the Rv0135c and Rv1019 regulons,Nucleic Acids
9,SigK,False,-0.0011009193,sigK,Sigma Factor involved in the production of antigenic proteins,Unknown Function
10,RicR,False,0.0010608884,ricR,Copper responsive transcription factor that regulates metal metabolism genes,Metal Related
5,DevR-1,False,0.0009227567000000001,devR,Transcription factor that is one of the primary regulators of hypoxia onset response,Redox
43,LysG,False,0.0008863868,lsyG,Transcription factor that controls the expression of LysE and requires lysine or histidine for activation ,Amino Acids
57,SG_8,False,-0.0007829104000000001,,Single Gene iModulon 8,Single Gene
64,Mce1R,False,-0.0007672144,mce1R,Transcription factor that regulates the mce1 virulence operon,Virulence/Persistence
13,SG_1,False,0.0007331917,,Single Gene iModulon 1,Single Gene
63,SG_9,False,-0.0007091664,,Single Gene iModulon 9,Single Gene
52,DevR-2,False,0.0006649227,devR,Transcription factor that is one of the primary regulators of hypoxia onset response,Redox
0,SigH,False,0.0005774071,sigH,Sigma Factor involved in heat shock and oxidative stress response,Virulence/Persistence
20,FasR,False,0.0004394835,fasR,Transcription factor that controls the expression of fatty acid metabolism genes,Fatty Acid/Cholestrol
17,VirS,False,0.00027271530000000003,virS,Transcription factor that is activated and responds to acidic environments,Redox
24,Salicylate Induced,False,0.00018072540000000002,,Manually annotated iModulon where genes were found to change expression when exposed to salicylate,Metal Related
23,PrpR,False,7.94829e-05,prpR,Transcription factor that is involved in catabolism of short chain fatty acids via gloxylate and methylcitrate cycle,Central Carbon
73,SG_11,False,-3.79428e-05,,Single Gene iModulon 11,Single Gene
