k,Name,in_iM,gene_weight,Regulator,Function,Category
72,Unc_8,False,0.025187054400000002,,Uncharacterized iModulon 8,Uncharacterized
54,Unc_7,False,0.0232261427,,Uncharacterized iModulon 7,Uncharacterized
44,SG_6,False,0.0202308949,,Single Genes iModulon 6,Single Gene
57,SG_8,False,-0.0201961204,,Single Gene iModulon 8,Single Gene
33,SG_4,False,0.020011570700000002,,Single Gene iModulon 4,Single Gene
69,Rv0135+Rv1019,False,-0.0184909397,Rv0135c and Rv1019,iModulon that maps to the intersection of the Rv0135c and Rv1019 regulons,Nucleic Acids
21,MprA,False,-0.0182605341,mprA,Transcription factor that regulates multiple stress responsive genes,Virulence/Persistence
34,MbcA+Rv3249c+Rv3066,False,-0.0172935452,mbcA and Rv3249c and Rv3066,"iModulon that maps to the intersection of the Rv1990c, Rv3249c, and Rv3066 regulons",Virulence/Persistence
60,Rv0681,False,-0.0164543205,Rv0681,"Transcription with previously unknown function, regulates core fatty acid response",Unknown Function
38,SG_5,False,0.0162513692,,Single Gene iModulon 5,Single Gene
77,Central Carbon Metabolism,False,-0.0155274811,,iModulon enriched with the Central Carbon Metabolism KEGG pathway,Central Carbon
22,SG_3,False,0.015055109700000001,,Single Gene iModulon 3,Single Gene
28,WhiB1,False,-0.0136784365,whiB1,"Transcription repressor that is redox responsive, found to be nitric oxide sensitive",Redox
30,HPT-2b Induced,False,-0.0134750198,,iModulon regulates many genes that are activated by HPT-2b (1-hydroxy-5-R-pyridine-2(1H)-thiones),Metal Related
13,SG_1,False,-0.0133298258,,Single Gene iModulon 1,Single Gene
65,SG_10,False,0.013247190300000001,,Single Gene iModulon 10,Single Gene
70,Lsr2,False,-0.012775088,lsr2,Sequence independent transcription factor that controls a wide variety of genes,Antibiotic
50,Unc_6,False,-0.012329431600000001,,Uncharacterized iModulon 6,Uncharacterized
37,Rv3095,False,0.012259408500000001,Rv3095,iModulon labeled with predicted regulon with unknown function,Unknown Function
41,Unc_5,False,0.0115642003,,Uncharacterized iModulon 5,Uncharacterized
46,Rv2621c,False,-0.011552309200000001,Rv2621c,iModulon labeled with predicted regulon with unknown function,Unknown Function
2,IniR,False,0.0111302395,iniR,Transcription factor that regulates the expression of the ini operon (iniBAC),Antibiotic
16,Mce3R,False,0.0108146927,mce3R,Transcription factor that regulates the mce3 virulence operon,Virulence/Persistence
62,Rv2488c,False,0.0107804969,Rv2488c,LuxR family transcription factor that regulates genes associated with virulence,Virulence/Persistence
52,DevR-2,False,-0.0107219422,devR,Transcription factor that is one of the primary regulators of hypoxia onset response,Redox
42,Nicotinate Metabolism,False,-0.010685988300000001,,iModulon enriched with the nicotinate and nicotinamide metabolism KEGG pathway,Central Carbon
66,M-box,False,-0.009342945600000001,,Magnesium activated non-coding sRNA that regulates the function of genes associated with metal metabolism and virulence,Metal Related
78,Positive Regulation of Growth,False,-0.0092787948,,iModulon enriched with the Positive Regulation of Growth Gene Ontology term,Growth
26,EspL KO,False,-0.0090505037,,Single Gene iModulon that captures EspL knockout,KO
27,Unc_2,False,-0.0089261366,,Uncharacterized iModulon 2,Uncharacterized
68,Sulfur Metabolism,False,0.0083371846,,Kegg Map that displays the transport and metabolism of sulfur,Sulfur Metabolism
5,DevR-1,False,0.0081129963,devR,Transcription factor that is one of the primary regulators of hypoxia onset response,Redox
61,Nucleic Acid Hydrolysis ,False,-0.007833033100000001,,iModulon enriched with the Nucleic Acid Hydrolysis KEGG pathway,Nucleic Acids
23,PrpR,False,0.0075391458,prpR,Transcription factor that is involved in catabolism of short chain fatty acids via gloxylate and methylcitrate cycle,Central Carbon
75,Unc_9,False,0.0071245020000000004,,Uncharacterized iModulon 9,Uncharacterized
1,Polyketide Synthase Complex,False,-0.006922788,,KEGG Map related to the synthesis of type II polyketide backbone ,Fatty Acid/Cholestrol
73,SG_11,False,-0.0068819138,,Single Gene iModulon 11,Single Gene
56,Fatty Acid Biosynthesis,False,0.0068320267,trcR and Rv1776c and whiB4 ,"iModulon that maps to the intersection of the Rv1033c, Rv1776c, and Rv3681c regulons",Fatty Acid/Cholestrol
14,SG_2,False,0.006342824,,Single Gene iModulon 2,Single Gene
7,GroEL-GroES Complex,False,-0.0063234652,,Gene Ontology Term specific to the bacterial chaperonin complex,Amino Acids
40,KstR2,False,-0.0059735112,kstR2,Transcription factor that regulates a small regulon related to cholesterol utilization,Fatty Acid/Cholestrol
29,Blal,False,0.0059280481000000005,blaI,"Transcription regulator that regulates genes associated with antibiotic transport, detoxification, and cell wall function",Antibiotic
67,Peptidoglycan Biosynthesis,False,0.0058425272,,iModulon enriched with the Peptidoglycan biosyntehsis KEGG pathway,Central Carbon
3,PyrR,False,0.0057923873,pyrR,Transcription factor that regulates the expression of pyrimidine nucleotide operons,Nucleic Acids
74,SG_12,False,-0.0057807753,,Single Gene iModulon 12,Single Gene
49,Rv1828/SigH,False,-0.0053440281,Rv1828 or sigH,iModulon that maps to the union of the Rv1828 and Rv3223c regulons,Redox
48,Leucine Related,False,0.0052443623,,Manually annotated iModulon with gene related to leucine metabolism,Amino Acids
36,Fumarate Reductase,False,0.0050941630000000005,,iModulon enriched with the Fumarate Reductase Gene Ontology term,Central Carbon
0,SigH,False,-0.0050591873,sigH,Sigma Factor involved in heat shock and oxidative stress response,Virulence/Persistence
39,SigC,False,0.004953587000000001,sigC,Sigma Factor that plays a role in organism virulence and lethality,Virulence/Persistence
43,LysG,False,0.0044813599,lsyG,Transcription factor that controls the expression of LysE and requires lysine or histidine for activation ,Amino Acids
15,BkaR,False,0.004414763600000001,bkaR,Transcription factor that regulates genes related to branched-chain keto-acid metabolism,Central Carbon
31,ArgR,False,0.0044141693000000004,argR,Transcription factor that regulates the L-arginine biosynthesis pathways,Amino Acids
55,WhiB7,False,-0.0043783928,whiB7,Transcription factor that connects systems for redox homeostasis and antibiotic resistance,Antibiotic
32,Unc_3,False,-0.0043579626,,Uncharacterized iModulon 3,Uncharacterized
20,FasR,False,-0.0042989012,fasR,Transcription factor that controls the expression of fatty acid metabolism genes,Fatty Acid/Cholestrol
45,SigD,False,-0.0042808592,sigD,Sigma Factor that governs the expression of ribosomal genes and plays a role in virulence,Virulence/Persistence
25,Rv0078+Rv2034,False,-0.0041367148,Rv0078 and Rv2034,iModulon that maps to the intersection of the Rv0078 and Rv2034 regulon,Antibiotic
53,Rv1776c+WhiB4,False,-0.0040110665,Rv1776c and whiB4 ,iModulon that maps to the intersection of the Rv1776c and Rv3681c regulon,Redox
9,SigK,False,-0.0038785441000000003,sigK,Sigma Factor involved in the production of antigenic proteins,Unknown Function
63,SG_9,False,0.0038390833,,Single Gene iModulon 9,Single Gene
35,Unc_4,False,-0.0036617997,,Uncharacterized iModulon 4,Uncharacterized
12,Mycofactocin Synthesis Pathway,False,-0.0036459962,,Manually annotated iModulon that captures multiple genes associated with mycofactocin metabolism,Fatty Acid/Cholestrol
18,Unc_1,False,-0.0035077927000000003,,Uncharacterized iModulon 1,Uncharacterized
4,WhiB4,False,0.0034497491000000003,whiB4,Redox-Responsive transcription regulator that regulates protection response during infection,Redox
76,SG_13,False,0.0033275672,,Single Gene iModulon 13,Single Gene
79,WhiB4/IdeR,False,-0.0032871661000000003,whiB4 or ideR,iModulon that maps to the union of the Rv3681c and Rv2711 regulons,Redox
64,Mce1R,False,0.003115398,mce1R,Transcription factor that regulates the mce1 virulence operon,Virulence/Persistence
19,WhiB6,False,0.0028498932,whiB6,Transcription factor that regulates ESX-1 system membrane transport proteins,Redox
11,EccE1 KO,False,0.0026575746,,Single Gene iModulon that captures EccE1 knockout,KO
58,Zur,False,0.0026224862,zur,Transcription factor that is activated by and regulates the metabolism of zinc,Metal Related
47,SG_7,False,0.0025570391,,Single Gene iModulon 7,Single Gene
71,PDIM;PGL Synthesis,False,0.0020761427000000002,,Manually annotated iModulon that captures genes associated with PDIM and PGL synthesis,Virulence/Persistence
10,RicR,False,-0.0020020715,ricR,Copper responsive transcription factor that regulates metal metabolism genes,Metal Related
8,IdeR,False,0.0019000615000000002,ideR,Metal-Dependent DNA-Binding protein that controls genes related to iron metabolism,Metal Related
17,VirS,False,-0.0011559756,virS,Transcription factor that is activated and responds to acidic environments,Redox
6,MarR,False,-0.0009713505,marR,Transcription factor that regulates the response to acid stress,Acid Stress
59,Rv0576,False,-0.0007999293,Rv0576,Possible ArsR family transcription factor that regulates genes related to virulence,Virulence/Persistence
24,Salicylate Induced,False,0.00036466410000000004,,Manually annotated iModulon where genes were found to change expression when exposed to salicylate,Metal Related
51,PhoP,False,-0.0002206772,phoP,"Transcription factor that controls response to redox/acid stress, hypoxia, and virulence",Virulence/Persistence
