k,Name,in_iM,gene_weight,Regulator,Function,Category
56,Fatty Acid Biosynthesis,True,0.12446203900000001,trcR and Rv1776c and whiB4 ,"iModulon that maps to the intersection of the Rv1033c, Rv1776c, and Rv3681c regulons",Fatty Acid/Cholestrol
55,WhiB7,True,0.1010712188,whiB7,Transcription factor that connects systems for redox homeostasis and antibiotic resistance,Antibiotic
25,Rv0078+Rv2034,False,0.0532190452,Rv0078 and Rv2034,iModulon that maps to the intersection of the Rv0078 and Rv2034 regulon,Antibiotic
2,IniR,False,0.0473281224,iniR,Transcription factor that regulates the expression of the ini operon (iniBAC),Antibiotic
30,HPT-2b Induced,False,0.0298467319,,iModulon regulates many genes that are activated by HPT-2b (1-hydroxy-5-R-pyridine-2(1H)-thiones),Metal Related
54,Unc_7,False,0.0284256172,,Uncharacterized iModulon 7,Uncharacterized
27,Unc_2,False,-0.0278134253,,Uncharacterized iModulon 2,Uncharacterized
12,Mycofactocin Synthesis Pathway,False,0.022955324000000003,,Manually annotated iModulon that captures multiple genes associated with mycofactocin metabolism,Fatty Acid/Cholestrol
50,Unc_6,False,0.022854671,,Uncharacterized iModulon 6,Uncharacterized
23,PrpR,False,0.0223469391,prpR,Transcription factor that is involved in catabolism of short chain fatty acids via gloxylate and methylcitrate cycle,Central Carbon
31,ArgR,False,-0.022195802,argR,Transcription factor that regulates the L-arginine biosynthesis pathways,Amino Acids
17,VirS,False,0.0220544293,virS,Transcription factor that is activated and responds to acidic environments,Redox
73,SG_11,False,0.0218805896,,Single Gene iModulon 11,Single Gene
69,Rv0135+Rv1019,False,-0.0173612539,Rv0135c and Rv1019,iModulon that maps to the intersection of the Rv0135c and Rv1019 regulons,Nucleic Acids
47,SG_7,False,0.017359534200000002,,Single Gene iModulon 7,Single Gene
24,Salicylate Induced,False,-0.0170696259,,Manually annotated iModulon where genes were found to change expression when exposed to salicylate,Metal Related
39,SigC,False,-0.016440868100000002,sigC,Sigma Factor that plays a role in organism virulence and lethality,Virulence/Persistence
42,Nicotinate Metabolism,False,0.016365013,,iModulon enriched with the nicotinate and nicotinamide metabolism KEGG pathway,Central Carbon
21,MprA,False,0.014764546000000002,mprA,Transcription factor that regulates multiple stress responsive genes,Virulence/Persistence
41,Unc_5,False,0.013724081400000001,,Uncharacterized iModulon 5,Uncharacterized
5,DevR-1,False,-0.0129054306,devR,Transcription factor that is one of the primary regulators of hypoxia onset response,Redox
52,DevR-2,False,0.0127446535,devR,Transcription factor that is one of the primary regulators of hypoxia onset response,Redox
43,LysG,False,-0.012477869800000001,lsyG,Transcription factor that controls the expression of LysE and requires lysine or histidine for activation ,Amino Acids
48,Leucine Related,False,-0.012418891100000001,,Manually annotated iModulon with gene related to leucine metabolism,Amino Acids
75,Unc_9,False,-0.0120927414,,Uncharacterized iModulon 9,Uncharacterized
67,Peptidoglycan Biosynthesis,False,-0.012054041000000001,,iModulon enriched with the Peptidoglycan biosyntehsis KEGG pathway,Central Carbon
35,Unc_4,False,-0.0116898473,,Uncharacterized iModulon 4,Uncharacterized
26,EspL KO,False,-0.0115414169,,Single Gene iModulon that captures EspL knockout,KO
38,SG_5,False,0.0114396694,,Single Gene iModulon 5,Single Gene
9,SigK,False,0.0112757431,sigK,Sigma Factor involved in the production of antigenic proteins,Unknown Function
65,SG_10,False,-0.0112716637,,Single Gene iModulon 10,Single Gene
37,Rv3095,False,-0.010904685,Rv3095,iModulon labeled with predicted regulon with unknown function,Unknown Function
77,Central Carbon Metabolism,False,-0.0107812181,,iModulon enriched with the Central Carbon Metabolism KEGG pathway,Central Carbon
10,RicR,False,-0.010548817700000001,ricR,Copper responsive transcription factor that regulates metal metabolism genes,Metal Related
78,Positive Regulation of Growth,False,-0.010167657600000001,,iModulon enriched with the Positive Regulation of Growth Gene Ontology term,Growth
4,WhiB4,False,-0.0096692159,whiB4,Redox-Responsive transcription regulator that regulates protection response during infection,Redox
68,Sulfur Metabolism,False,-0.0093852203,,Kegg Map that displays the transport and metabolism of sulfur,Sulfur Metabolism
11,EccE1 KO,False,-0.0092737099,,Single Gene iModulon that captures EccE1 knockout,KO
18,Unc_1,False,0.0090190294,,Uncharacterized iModulon 1,Uncharacterized
58,Zur,False,-0.0078105216,zur,Transcription factor that is activated by and regulates the metabolism of zinc,Metal Related
62,Rv2488c,False,-0.007640422700000001,Rv2488c,LuxR family transcription factor that regulates genes associated with virulence,Virulence/Persistence
79,WhiB4/IdeR,False,-0.0073122324,whiB4 or ideR,iModulon that maps to the union of the Rv3681c and Rv2711 regulons,Redox
72,Unc_8,False,-0.0073052048,,Uncharacterized iModulon 8,Uncharacterized
57,SG_8,False,0.0071678688,,Single Gene iModulon 8,Single Gene
36,Fumarate Reductase,False,0.0070371265,,iModulon enriched with the Fumarate Reductase Gene Ontology term,Central Carbon
32,Unc_3,False,0.0069151791,,Uncharacterized iModulon 3,Uncharacterized
33,SG_4,False,-0.0067893375,,Single Gene iModulon 4,Single Gene
44,SG_6,False,-0.0066380869,,Single Genes iModulon 6,Single Gene
34,MbcA+Rv3249c+Rv3066,False,-0.0065856209,mbcA and Rv3249c and Rv3066,"iModulon that maps to the intersection of the Rv1990c, Rv3249c, and Rv3066 regulons",Virulence/Persistence
74,SG_12,False,-0.0064824568,,Single Gene iModulon 12,Single Gene
45,SigD,False,0.0060969304000000005,sigD,Sigma Factor that governs the expression of ribosomal genes and plays a role in virulence,Virulence/Persistence
53,Rv1776c+WhiB4,False,-0.0059484410000000005,Rv1776c and whiB4 ,iModulon that maps to the intersection of the Rv1776c and Rv3681c regulon,Redox
14,SG_2,False,-0.0059059797,,Single Gene iModulon 2,Single Gene
13,SG_1,False,-0.0058339087,,Single Gene iModulon 1,Single Gene
7,GroEL-GroES Complex,False,-0.0056164044,,Gene Ontology Term specific to the bacterial chaperonin complex,Amino Acids
46,Rv2621c,False,-0.0054805858,Rv2621c,iModulon labeled with predicted regulon with unknown function,Unknown Function
16,Mce3R,False,-0.0053247302,mce3R,Transcription factor that regulates the mce3 virulence operon,Virulence/Persistence
66,M-box,False,0.0046274436,,Magnesium activated non-coding sRNA that regulates the function of genes associated with metal metabolism and virulence,Metal Related
60,Rv0681,False,0.0044880687,Rv0681,"Transcription with previously unknown function, regulates core fatty acid response",Unknown Function
1,Polyketide Synthase Complex,False,0.0041246098,,KEGG Map related to the synthesis of type II polyketide backbone ,Fatty Acid/Cholestrol
51,PhoP,False,0.0038966671,phoP,"Transcription factor that controls response to redox/acid stress, hypoxia, and virulence",Virulence/Persistence
64,Mce1R,False,0.0038767328,mce1R,Transcription factor that regulates the mce1 virulence operon,Virulence/Persistence
40,KstR2,False,0.0037917432000000003,kstR2,Transcription factor that regulates a small regulon related to cholesterol utilization,Fatty Acid/Cholestrol
3,PyrR,False,0.0034203330000000002,pyrR,Transcription factor that regulates the expression of pyrimidine nucleotide operons,Nucleic Acids
71,PDIM;PGL Synthesis,False,-0.0034085567000000003,,Manually annotated iModulon that captures genes associated with PDIM and PGL synthesis,Virulence/Persistence
59,Rv0576,False,-0.0032733229000000003,Rv0576,Possible ArsR family transcription factor that regulates genes related to virulence,Virulence/Persistence
76,SG_13,False,-0.0031781834,,Single Gene iModulon 13,Single Gene
0,SigH,False,0.0031719385,sigH,Sigma Factor involved in heat shock and oxidative stress response,Virulence/Persistence
61,Nucleic Acid Hydrolysis ,False,-0.0029453020000000003,,iModulon enriched with the Nucleic Acid Hydrolysis KEGG pathway,Nucleic Acids
19,WhiB6,False,-0.0026205415000000003,whiB6,Transcription factor that regulates ESX-1 system membrane transport proteins,Redox
29,Blal,False,0.0021940713000000002,blaI,"Transcription regulator that regulates genes associated with antibiotic transport, detoxification, and cell wall function",Antibiotic
8,IdeR,False,0.0021435793,ideR,Metal-Dependent DNA-Binding protein that controls genes related to iron metabolism,Metal Related
28,WhiB1,False,-0.0021100339,whiB1,"Transcription repressor that is redox responsive, found to be nitric oxide sensitive",Redox
63,SG_9,False,-0.0018583958000000002,,Single Gene iModulon 9,Single Gene
70,Lsr2,False,-0.0013991783000000002,lsr2,Sequence independent transcription factor that controls a wide variety of genes,Antibiotic
6,MarR,False,-0.0012944675,marR,Transcription factor that regulates the response to acid stress,Acid Stress
49,Rv1828/SigH,False,0.0012547298,Rv1828 or sigH,iModulon that maps to the union of the Rv1828 and Rv3223c regulons,Redox
20,FasR,False,0.0009309090000000001,fasR,Transcription factor that controls the expression of fatty acid metabolism genes,Fatty Acid/Cholestrol
22,SG_3,False,-0.0007117766,,Single Gene iModulon 3,Single Gene
15,BkaR,False,-3.68304e-05,bkaR,Transcription factor that regulates genes related to branched-chain keto-acid metabolism,Central Carbon
