k,Name,in_iM,gene_weight,Regulator,Function,Category
28,WhiB1,True,0.0687976929,whiB1,"Transcription repressor that is redox responsive, found to be nitric oxide sensitive",Redox
21,MprA,False,0.0370901006,mprA,Transcription factor that regulates multiple stress responsive genes,Virulence/Persistence
70,Lsr2,False,0.0330101038,lsr2,Sequence independent transcription factor that controls a wide variety of genes,Antibiotic
35,Unc_4,False,0.0282394685,,Uncharacterized iModulon 4,Uncharacterized
77,Central Carbon Metabolism,False,-0.0229748034,,iModulon enriched with the Central Carbon Metabolism KEGG pathway,Central Carbon
68,Sulfur Metabolism,False,-0.0200346894,,Kegg Map that displays the transport and metabolism of sulfur,Sulfur Metabolism
6,MarR,False,-0.016140009900000002,marR,Transcription factor that regulates the response to acid stress,Acid Stress
45,SigD,False,-0.0130223656,sigD,Sigma Factor that governs the expression of ribosomal genes and plays a role in virulence,Virulence/Persistence
39,SigC,False,-0.0120863025,sigC,Sigma Factor that plays a role in organism virulence and lethality,Virulence/Persistence
0,SigH,False,-0.0120220638,sigH,Sigma Factor involved in heat shock and oxidative stress response,Virulence/Persistence
2,IniR,False,-0.0111389261,iniR,Transcription factor that regulates the expression of the ini operon (iniBAC),Antibiotic
7,GroEL-GroES Complex,False,-0.010953857800000001,,Gene Ontology Term specific to the bacterial chaperonin complex,Amino Acids
64,Mce1R,False,0.010788948100000001,mce1R,Transcription factor that regulates the mce1 virulence operon,Virulence/Persistence
24,Salicylate Induced,False,-0.0105752044,,Manually annotated iModulon where genes were found to change expression when exposed to salicylate,Metal Related
27,Unc_2,False,-0.010304342900000001,,Uncharacterized iModulon 2,Uncharacterized
10,RicR,False,-0.0102053404,ricR,Copper responsive transcription factor that regulates metal metabolism genes,Metal Related
67,Peptidoglycan Biosynthesis,False,0.0101218214,,iModulon enriched with the Peptidoglycan biosyntehsis KEGG pathway,Central Carbon
53,Rv1776c+WhiB4,False,-0.0097486299,Rv1776c and whiB4 ,iModulon that maps to the intersection of the Rv1776c and Rv3681c regulon,Redox
41,Unc_5,False,-0.0094428804,,Uncharacterized iModulon 5,Uncharacterized
48,Leucine Related,False,0.0090915062,,Manually annotated iModulon with gene related to leucine metabolism,Amino Acids
34,MbcA+Rv3249c+Rv3066,False,0.008894842200000001,mbcA and Rv3249c and Rv3066,"iModulon that maps to the intersection of the Rv1990c, Rv3249c, and Rv3066 regulons",Virulence/Persistence
26,EspL KO,False,-0.008778552200000001,,Single Gene iModulon that captures EspL knockout,KO
36,Fumarate Reductase,False,0.0087620448,,iModulon enriched with the Fumarate Reductase Gene Ontology term,Central Carbon
25,Rv0078+Rv2034,False,-0.0083934031,Rv0078 and Rv2034,iModulon that maps to the intersection of the Rv0078 and Rv2034 regulon,Antibiotic
11,EccE1 KO,False,-0.0083807606,,Single Gene iModulon that captures EccE1 knockout,KO
66,M-box,False,-0.0080071034,,Magnesium activated non-coding sRNA that regulates the function of genes associated with metal metabolism and virulence,Metal Related
49,Rv1828/SigH,False,-0.0074529292000000006,Rv1828 or sigH,iModulon that maps to the union of the Rv1828 and Rv3223c regulons,Redox
65,SG_10,False,0.007280332600000001,,Single Gene iModulon 10,Single Gene
14,SG_2,False,0.007079735100000001,,Single Gene iModulon 2,Single Gene
4,WhiB4,False,-0.006812317500000001,whiB4,Redox-Responsive transcription regulator that regulates protection response during infection,Redox
69,Rv0135+Rv1019,False,0.0067871906000000004,Rv0135c and Rv1019,iModulon that maps to the intersection of the Rv0135c and Rv1019 regulons,Nucleic Acids
9,SigK,False,-0.0067265400000000005,sigK,Sigma Factor involved in the production of antigenic proteins,Unknown Function
40,KstR2,False,-0.0067214632000000005,kstR2,Transcription factor that regulates a small regulon related to cholesterol utilization,Fatty Acid/Cholestrol
56,Fatty Acid Biosynthesis,False,-0.0060575454,trcR and Rv1776c and whiB4 ,"iModulon that maps to the intersection of the Rv1033c, Rv1776c, and Rv3681c regulons",Fatty Acid/Cholestrol
19,WhiB6,False,0.0059321108,whiB6,Transcription factor that regulates ESX-1 system membrane transport proteins,Redox
74,SG_12,False,0.0058480664,,Single Gene iModulon 12,Single Gene
60,Rv0681,False,0.0057437709,Rv0681,"Transcription with previously unknown function, regulates core fatty acid response",Unknown Function
1,Polyketide Synthase Complex,False,0.005247486500000001,,KEGG Map related to the synthesis of type II polyketide backbone ,Fatty Acid/Cholestrol
18,Unc_1,False,-0.0050591859,,Uncharacterized iModulon 1,Uncharacterized
42,Nicotinate Metabolism,False,0.0050349154,,iModulon enriched with the nicotinate and nicotinamide metabolism KEGG pathway,Central Carbon
43,LysG,False,0.0045585543,lsyG,Transcription factor that controls the expression of LysE and requires lysine or histidine for activation ,Amino Acids
37,Rv3095,False,0.004424754,Rv3095,iModulon labeled with predicted regulon with unknown function,Unknown Function
75,Unc_9,False,0.0043207205,,Uncharacterized iModulon 9,Uncharacterized
23,PrpR,False,0.004236755300000001,prpR,Transcription factor that is involved in catabolism of short chain fatty acids via gloxylate and methylcitrate cycle,Central Carbon
3,PyrR,False,0.0042360441,pyrR,Transcription factor that regulates the expression of pyrimidine nucleotide operons,Nucleic Acids
78,Positive Regulation of Growth,False,0.0040749364000000005,,iModulon enriched with the Positive Regulation of Growth Gene Ontology term,Growth
57,SG_8,False,0.0034752982,,Single Gene iModulon 8,Single Gene
38,SG_5,False,-0.0034133866000000002,,Single Gene iModulon 5,Single Gene
62,Rv2488c,False,-0.0033299032,Rv2488c,LuxR family transcription factor that regulates genes associated with virulence,Virulence/Persistence
20,FasR,False,-0.003147871,fasR,Transcription factor that controls the expression of fatty acid metabolism genes,Fatty Acid/Cholestrol
13,SG_1,False,0.0029482847,,Single Gene iModulon 1,Single Gene
63,SG_9,False,-0.0028720363000000002,,Single Gene iModulon 9,Single Gene
17,VirS,False,-0.0027986486,virS,Transcription factor that is activated and responds to acidic environments,Redox
30,HPT-2b Induced,False,-0.0027535396,,iModulon regulates many genes that are activated by HPT-2b (1-hydroxy-5-R-pyridine-2(1H)-thiones),Metal Related
52,DevR-2,False,-0.0027236102,devR,Transcription factor that is one of the primary regulators of hypoxia onset response,Redox
51,PhoP,False,-0.0022886115,phoP,"Transcription factor that controls response to redox/acid stress, hypoxia, and virulence",Virulence/Persistence
50,Unc_6,False,-0.0020862942,,Uncharacterized iModulon 6,Uncharacterized
5,DevR-1,False,-0.0017947326,devR,Transcription factor that is one of the primary regulators of hypoxia onset response,Redox
15,BkaR,False,0.0016707892,bkaR,Transcription factor that regulates genes related to branched-chain keto-acid metabolism,Central Carbon
55,WhiB7,False,-0.0016281998000000002,whiB7,Transcription factor that connects systems for redox homeostasis and antibiotic resistance,Antibiotic
71,PDIM;PGL Synthesis,False,-0.0015475068,,Manually annotated iModulon that captures genes associated with PDIM and PGL synthesis,Virulence/Persistence
44,SG_6,False,-0.0013817952,,Single Genes iModulon 6,Single Gene
76,SG_13,False,-0.0013811591000000001,,Single Gene iModulon 13,Single Gene
33,SG_4,False,0.0012737054000000001,,Single Gene iModulon 4,Single Gene
8,IdeR,False,0.0011747004,ideR,Metal-Dependent DNA-Binding protein that controls genes related to iron metabolism,Metal Related
58,Zur,False,0.0011222907,zur,Transcription factor that is activated by and regulates the metabolism of zinc,Metal Related
47,SG_7,False,-0.0010737184000000001,,Single Gene iModulon 7,Single Gene
54,Unc_7,False,-0.0010710337000000001,,Uncharacterized iModulon 7,Uncharacterized
16,Mce3R,False,-0.0008495776,mce3R,Transcription factor that regulates the mce3 virulence operon,Virulence/Persistence
79,WhiB4/IdeR,False,-0.0008292513,whiB4 or ideR,iModulon that maps to the union of the Rv3681c and Rv2711 regulons,Redox
22,SG_3,False,-0.0008194760000000001,,Single Gene iModulon 3,Single Gene
61,Nucleic Acid Hydrolysis ,False,-0.0007849377,,iModulon enriched with the Nucleic Acid Hydrolysis KEGG pathway,Nucleic Acids
29,Blal,False,-0.0007445806,blaI,"Transcription regulator that regulates genes associated with antibiotic transport, detoxification, and cell wall function",Antibiotic
46,Rv2621c,False,-0.0003863925,Rv2621c,iModulon labeled with predicted regulon with unknown function,Unknown Function
59,Rv0576,False,-0.00032244580000000004,Rv0576,Possible ArsR family transcription factor that regulates genes related to virulence,Virulence/Persistence
32,Unc_3,False,-0.0003060711,,Uncharacterized iModulon 3,Uncharacterized
31,ArgR,False,-0.00024325100000000002,argR,Transcription factor that regulates the L-arginine biosynthesis pathways,Amino Acids
72,Unc_8,False,6.34806e-05,,Uncharacterized iModulon 8,Uncharacterized
12,Mycofactocin Synthesis Pathway,False,-3.6592e-06,,Manually annotated iModulon that captures multiple genes associated with mycofactocin metabolism,Fatty Acid/Cholestrol
73,SG_11,False,-2.8577e-06,,Single Gene iModulon 11,Single Gene
