k,Name,in_iM,gene_weight,Regulator,Function,Category
42,Nicotinate Metabolism,False,-0.0283542422,,iModulon enriched with the nicotinate and nicotinamide metabolism KEGG pathway,Central Carbon
67,Peptidoglycan Biosynthesis,False,0.0223213332,,iModulon enriched with the Peptidoglycan biosyntehsis KEGG pathway,Central Carbon
64,Mce1R,False,-0.0207017302,mce1R,Transcription factor that regulates the mce1 virulence operon,Virulence/Persistence
18,Unc_1,False,-0.0187711443,,Uncharacterized iModulon 1,Uncharacterized
63,SG_9,False,-0.0172449593,,Single Gene iModulon 9,Single Gene
21,MprA,False,0.0166413719,mprA,Transcription factor that regulates multiple stress responsive genes,Virulence/Persistence
13,SG_1,False,-0.0160212945,,Single Gene iModulon 1,Single Gene
34,MbcA+Rv3249c+Rv3066,False,0.0138242925,mbcA and Rv3249c and Rv3066,"iModulon that maps to the intersection of the Rv1990c, Rv3249c, and Rv3066 regulons",Virulence/Persistence
44,SG_6,False,-0.0131026423,,Single Genes iModulon 6,Single Gene
72,Unc_8,False,0.0122503195,,Uncharacterized iModulon 8,Uncharacterized
70,Lsr2,False,-0.0119798756,lsr2,Sequence independent transcription factor that controls a wide variety of genes,Antibiotic
45,SigD,False,-0.0106882088,sigD,Sigma Factor that governs the expression of ribosomal genes and plays a role in virulence,Virulence/Persistence
54,Unc_7,False,0.010624432100000001,,Uncharacterized iModulon 7,Uncharacterized
74,SG_12,False,0.0101720423,,Single Gene iModulon 12,Single Gene
71,PDIM;PGL Synthesis,False,-0.009949168100000001,,Manually annotated iModulon that captures genes associated with PDIM and PGL synthesis,Virulence/Persistence
39,SigC,False,0.0098382373,sigC,Sigma Factor that plays a role in organism virulence and lethality,Virulence/Persistence
61,Nucleic Acid Hydrolysis ,False,-0.0098257035,,iModulon enriched with the Nucleic Acid Hydrolysis KEGG pathway,Nucleic Acids
2,IniR,False,-0.0098201781,iniR,Transcription factor that regulates the expression of the ini operon (iniBAC),Antibiotic
6,MarR,False,-0.009743672,marR,Transcription factor that regulates the response to acid stress,Acid Stress
56,Fatty Acid Biosynthesis,False,0.0089337387,trcR and Rv1776c and whiB4 ,"iModulon that maps to the intersection of the Rv1033c, Rv1776c, and Rv3681c regulons",Fatty Acid/Cholestrol
31,ArgR,False,-0.0084435971,argR,Transcription factor that regulates the L-arginine biosynthesis pathways,Amino Acids
43,LysG,False,-0.0081886206,lsyG,Transcription factor that controls the expression of LysE and requires lysine or histidine for activation ,Amino Acids
37,Rv3095,False,-0.0081367617,Rv3095,iModulon labeled with predicted regulon with unknown function,Unknown Function
10,RicR,False,0.0080993436,ricR,Copper responsive transcription factor that regulates metal metabolism genes,Metal Related
50,Unc_6,False,-0.0079192,,Uncharacterized iModulon 6,Uncharacterized
25,Rv0078+Rv2034,False,-0.0078748675,Rv0078 and Rv2034,iModulon that maps to the intersection of the Rv0078 and Rv2034 regulon,Antibiotic
33,SG_4,False,-0.007749724800000001,,Single Gene iModulon 4,Single Gene
57,SG_8,False,-0.0077207005,,Single Gene iModulon 8,Single Gene
40,KstR2,False,-0.007708825900000001,kstR2,Transcription factor that regulates a small regulon related to cholesterol utilization,Fatty Acid/Cholestrol
35,Unc_4,False,-0.0074691646000000006,,Uncharacterized iModulon 4,Uncharacterized
62,Rv2488c,False,0.007457101000000001,Rv2488c,LuxR family transcription factor that regulates genes associated with virulence,Virulence/Persistence
14,SG_2,False,0.0073806775,,Single Gene iModulon 2,Single Gene
60,Rv0681,False,0.0073260473,Rv0681,"Transcription with previously unknown function, regulates core fatty acid response",Unknown Function
20,FasR,False,-0.0072901878,fasR,Transcription factor that controls the expression of fatty acid metabolism genes,Fatty Acid/Cholestrol
38,SG_5,False,-0.0069966517,,Single Gene iModulon 5,Single Gene
46,Rv2621c,False,-0.0069683616,Rv2621c,iModulon labeled with predicted regulon with unknown function,Unknown Function
17,VirS,False,-0.0069044192,virS,Transcription factor that is activated and responds to acidic environments,Redox
26,EspL KO,False,0.0068221652,,Single Gene iModulon that captures EspL knockout,KO
15,BkaR,False,0.0066396412,bkaR,Transcription factor that regulates genes related to branched-chain keto-acid metabolism,Central Carbon
48,Leucine Related,False,-0.0064939171000000006,,Manually annotated iModulon with gene related to leucine metabolism,Amino Acids
66,M-box,False,-0.0062125817,,Magnesium activated non-coding sRNA that regulates the function of genes associated with metal metabolism and virulence,Metal Related
55,WhiB7,False,-0.0062074988,whiB7,Transcription factor that connects systems for redox homeostasis and antibiotic resistance,Antibiotic
7,GroEL-GroES Complex,False,-0.005471239,,Gene Ontology Term specific to the bacterial chaperonin complex,Amino Acids
5,DevR-1,False,-0.0054168081,devR,Transcription factor that is one of the primary regulators of hypoxia onset response,Redox
27,Unc_2,False,-0.005351481700000001,,Uncharacterized iModulon 2,Uncharacterized
16,Mce3R,False,-0.0052891377,mce3R,Transcription factor that regulates the mce3 virulence operon,Virulence/Persistence
69,Rv0135+Rv1019,False,-0.0052873807,Rv0135c and Rv1019,iModulon that maps to the intersection of the Rv0135c and Rv1019 regulons,Nucleic Acids
0,SigH,False,0.0047484668,sigH,Sigma Factor involved in heat shock and oxidative stress response,Virulence/Persistence
51,PhoP,False,-0.0045353195,phoP,"Transcription factor that controls response to redox/acid stress, hypoxia, and virulence",Virulence/Persistence
24,Salicylate Induced,False,-0.0040517081,,Manually annotated iModulon where genes were found to change expression when exposed to salicylate,Metal Related
76,SG_13,False,0.0038858946,,Single Gene iModulon 13,Single Gene
3,PyrR,False,0.0037138809,pyrR,Transcription factor that regulates the expression of pyrimidine nucleotide operons,Nucleic Acids
73,SG_11,False,0.0036415405,,Single Gene iModulon 11,Single Gene
22,SG_3,False,0.0033978488,,Single Gene iModulon 3,Single Gene
68,Sulfur Metabolism,False,0.0032809898,,Kegg Map that displays the transport and metabolism of sulfur,Sulfur Metabolism
32,Unc_3,False,0.0032183230000000004,,Uncharacterized iModulon 3,Uncharacterized
29,Blal,False,0.0026273829,blaI,"Transcription regulator that regulates genes associated with antibiotic transport, detoxification, and cell wall function",Antibiotic
23,PrpR,False,0.0023585142,prpR,Transcription factor that is involved in catabolism of short chain fatty acids via gloxylate and methylcitrate cycle,Central Carbon
77,Central Carbon Metabolism,False,-0.0023222196,,iModulon enriched with the Central Carbon Metabolism KEGG pathway,Central Carbon
11,EccE1 KO,False,-0.0022622882,,Single Gene iModulon that captures EccE1 knockout,KO
41,Unc_5,False,0.0021579217,,Uncharacterized iModulon 5,Uncharacterized
9,SigK,False,0.0019869701000000003,sigK,Sigma Factor involved in the production of antigenic proteins,Unknown Function
47,SG_7,False,-0.0019789307,,Single Gene iModulon 7,Single Gene
12,Mycofactocin Synthesis Pathway,False,-0.0019721396,,Manually annotated iModulon that captures multiple genes associated with mycofactocin metabolism,Fatty Acid/Cholestrol
78,Positive Regulation of Growth,False,-0.0017733895000000002,,iModulon enriched with the Positive Regulation of Growth Gene Ontology term,Growth
59,Rv0576,False,-0.0016797032000000001,Rv0576,Possible ArsR family transcription factor that regulates genes related to virulence,Virulence/Persistence
19,WhiB6,False,-0.0015010963,whiB6,Transcription factor that regulates ESX-1 system membrane transport proteins,Redox
1,Polyketide Synthase Complex,False,-0.0014626977,,KEGG Map related to the synthesis of type II polyketide backbone ,Fatty Acid/Cholestrol
49,Rv1828/SigH,False,-0.0013862931,Rv1828 or sigH,iModulon that maps to the union of the Rv1828 and Rv3223c regulons,Redox
28,WhiB1,False,-0.0011935491,whiB1,"Transcription repressor that is redox responsive, found to be nitric oxide sensitive",Redox
36,Fumarate Reductase,False,-0.0010703704,,iModulon enriched with the Fumarate Reductase Gene Ontology term,Central Carbon
30,HPT-2b Induced,False,0.0008676722000000001,,iModulon regulates many genes that are activated by HPT-2b (1-hydroxy-5-R-pyridine-2(1H)-thiones),Metal Related
4,WhiB4,False,-0.0008230092,whiB4,Redox-Responsive transcription regulator that regulates protection response during infection,Redox
52,DevR-2,False,0.0008040608,devR,Transcription factor that is one of the primary regulators of hypoxia onset response,Redox
8,IdeR,False,-0.0006466266000000001,ideR,Metal-Dependent DNA-Binding protein that controls genes related to iron metabolism,Metal Related
65,SG_10,False,-0.0005976546,,Single Gene iModulon 10,Single Gene
75,Unc_9,False,-0.00032832600000000004,,Uncharacterized iModulon 9,Uncharacterized
58,Zur,False,0.0001852278,zur,Transcription factor that is activated by and regulates the metabolism of zinc,Metal Related
79,WhiB4/IdeR,False,-9.8589e-05,whiB4 or ideR,iModulon that maps to the union of the Rv3681c and Rv2711 regulons,Redox
53,Rv1776c+WhiB4,False,-2.74039e-05,Rv1776c and whiB4 ,iModulon that maps to the intersection of the Rv1776c and Rv3681c regulon,Redox
