k,Name,in_iM,gene_weight,Regulator,Function,Category
45,SigD,False,-0.0338623679,sigD,Sigma Factor that governs the expression of ribosomal genes and plays a role in virulence,Virulence/Persistence
22,SG_3,False,-0.0331372608,,Single Gene iModulon 3,Single Gene
34,MbcA+Rv3249c+Rv3066,False,-0.032628866,mbcA and Rv3249c and Rv3066,"iModulon that maps to the intersection of the Rv1990c, Rv3249c, and Rv3066 regulons",Virulence/Persistence
14,SG_2,False,-0.0320364464,,Single Gene iModulon 2,Single Gene
63,SG_9,False,-0.030246792300000002,,Single Gene iModulon 9,Single Gene
73,SG_11,False,0.0291800813,,Single Gene iModulon 11,Single Gene
70,Lsr2,False,-0.0289966109,lsr2,Sequence independent transcription factor that controls a wide variety of genes,Antibiotic
75,Unc_9,False,0.0249250264,,Uncharacterized iModulon 9,Uncharacterized
2,IniR,False,-0.0236182224,iniR,Transcription factor that regulates the expression of the ini operon (iniBAC),Antibiotic
30,HPT-2b Induced,False,-0.0236070903,,iModulon regulates many genes that are activated by HPT-2b (1-hydroxy-5-R-pyridine-2(1H)-thiones),Metal Related
11,EccE1 KO,False,-0.0225639677,,Single Gene iModulon that captures EccE1 knockout,KO
57,SG_8,False,0.022144336900000002,,Single Gene iModulon 8,Single Gene
29,Blal,False,-0.0220010274,blaI,"Transcription regulator that regulates genes associated with antibiotic transport, detoxification, and cell wall function",Antibiotic
39,SigC,False,0.0217139782,sigC,Sigma Factor that plays a role in organism virulence and lethality,Virulence/Persistence
16,Mce3R,False,0.0212897826,mce3R,Transcription factor that regulates the mce3 virulence operon,Virulence/Persistence
46,Rv2621c,False,-0.0212660037,Rv2621c,iModulon labeled with predicted regulon with unknown function,Unknown Function
77,Central Carbon Metabolism,False,-0.0199250571,,iModulon enriched with the Central Carbon Metabolism KEGG pathway,Central Carbon
55,WhiB7,False,0.019683237200000002,whiB7,Transcription factor that connects systems for redox homeostasis and antibiotic resistance,Antibiotic
24,Salicylate Induced,False,-0.0195025077,,Manually annotated iModulon where genes were found to change expression when exposed to salicylate,Metal Related
17,VirS,False,0.0193449297,virS,Transcription factor that is activated and responds to acidic environments,Redox
6,MarR,False,0.0178633826,marR,Transcription factor that regulates the response to acid stress,Acid Stress
5,DevR-1,False,-0.0178337565,devR,Transcription factor that is one of the primary regulators of hypoxia onset response,Redox
67,Peptidoglycan Biosynthesis,False,-0.0178281856,,iModulon enriched with the Peptidoglycan biosyntehsis KEGG pathway,Central Carbon
56,Fatty Acid Biosynthesis,False,-0.017792696,trcR and Rv1776c and whiB4 ,"iModulon that maps to the intersection of the Rv1033c, Rv1776c, and Rv3681c regulons",Fatty Acid/Cholestrol
60,Rv0681,False,-0.0167053004,Rv0681,"Transcription with previously unknown function, regulates core fatty acid response",Unknown Function
19,WhiB6,False,-0.0155495925,whiB6,Transcription factor that regulates ESX-1 system membrane transport proteins,Redox
42,Nicotinate Metabolism,False,-0.0138918908,,iModulon enriched with the nicotinate and nicotinamide metabolism KEGG pathway,Central Carbon
8,IdeR,False,0.0136664999,ideR,Metal-Dependent DNA-Binding protein that controls genes related to iron metabolism,Metal Related
74,SG_12,False,0.0135890487,,Single Gene iModulon 12,Single Gene
49,Rv1828/SigH,False,-0.0118510316,Rv1828 or sigH,iModulon that maps to the union of the Rv1828 and Rv3223c regulons,Redox
61,Nucleic Acid Hydrolysis ,False,-0.011773327,,iModulon enriched with the Nucleic Acid Hydrolysis KEGG pathway,Nucleic Acids
53,Rv1776c+WhiB4,False,0.0113742963,Rv1776c and whiB4 ,iModulon that maps to the intersection of the Rv1776c and Rv3681c regulon,Redox
52,DevR-2,False,0.0112388789,devR,Transcription factor that is one of the primary regulators of hypoxia onset response,Redox
37,Rv3095,False,-0.0111710138,Rv3095,iModulon labeled with predicted regulon with unknown function,Unknown Function
62,Rv2488c,False,0.0111540332,Rv2488c,LuxR family transcription factor that regulates genes associated with virulence,Virulence/Persistence
54,Unc_7,False,0.0107689788,,Uncharacterized iModulon 7,Uncharacterized
12,Mycofactocin Synthesis Pathway,False,0.0104990589,,Manually annotated iModulon that captures multiple genes associated with mycofactocin metabolism,Fatty Acid/Cholestrol
33,SG_4,False,0.0098852978,,Single Gene iModulon 4,Single Gene
27,Unc_2,False,-0.0098807556,,Uncharacterized iModulon 2,Uncharacterized
72,Unc_8,False,0.009627951400000001,,Uncharacterized iModulon 8,Uncharacterized
68,Sulfur Metabolism,False,0.009420113800000001,,Kegg Map that displays the transport and metabolism of sulfur,Sulfur Metabolism
21,MprA,False,0.0086328446,mprA,Transcription factor that regulates multiple stress responsive genes,Virulence/Persistence
10,RicR,False,-0.008245230000000001,ricR,Copper responsive transcription factor that regulates metal metabolism genes,Metal Related
65,SG_10,False,0.0080900244,,Single Gene iModulon 10,Single Gene
44,SG_6,False,0.008068002000000001,,Single Genes iModulon 6,Single Gene
48,Leucine Related,False,0.007993731,,Manually annotated iModulon with gene related to leucine metabolism,Amino Acids
64,Mce1R,False,0.0079237141,mce1R,Transcription factor that regulates the mce1 virulence operon,Virulence/Persistence
36,Fumarate Reductase,False,-0.0073512585,,iModulon enriched with the Fumarate Reductase Gene Ontology term,Central Carbon
15,BkaR,False,0.0071198243,bkaR,Transcription factor that regulates genes related to branched-chain keto-acid metabolism,Central Carbon
40,KstR2,False,0.0070017164,kstR2,Transcription factor that regulates a small regulon related to cholesterol utilization,Fatty Acid/Cholestrol
51,PhoP,False,-0.0061457494,phoP,"Transcription factor that controls response to redox/acid stress, hypoxia, and virulence",Virulence/Persistence
28,WhiB1,False,-0.005633503000000001,whiB1,"Transcription repressor that is redox responsive, found to be nitric oxide sensitive",Redox
26,EspL KO,False,0.0049498809,,Single Gene iModulon that captures EspL knockout,KO
18,Unc_1,False,0.0045215339,,Uncharacterized iModulon 1,Uncharacterized
47,SG_7,False,-0.0042501517,,Single Gene iModulon 7,Single Gene
43,LysG,False,0.004042292,lsyG,Transcription factor that controls the expression of LysE and requires lysine or histidine for activation ,Amino Acids
38,SG_5,False,0.0040025412,,Single Gene iModulon 5,Single Gene
25,Rv0078+Rv2034,False,-0.0035738626000000003,Rv0078 and Rv2034,iModulon that maps to the intersection of the Rv0078 and Rv2034 regulon,Antibiotic
59,Rv0576,False,-0.0034467802,Rv0576,Possible ArsR family transcription factor that regulates genes related to virulence,Virulence/Persistence
31,ArgR,False,0.0034224469000000003,argR,Transcription factor that regulates the L-arginine biosynthesis pathways,Amino Acids
50,Unc_6,False,-0.0033380355000000002,,Uncharacterized iModulon 6,Uncharacterized
23,PrpR,False,0.0029451292,prpR,Transcription factor that is involved in catabolism of short chain fatty acids via gloxylate and methylcitrate cycle,Central Carbon
58,Zur,False,-0.0026922771,zur,Transcription factor that is activated by and regulates the metabolism of zinc,Metal Related
20,FasR,False,-0.0025800294,fasR,Transcription factor that controls the expression of fatty acid metabolism genes,Fatty Acid/Cholestrol
71,PDIM;PGL Synthesis,False,0.0023461895,,Manually annotated iModulon that captures genes associated with PDIM and PGL synthesis,Virulence/Persistence
9,SigK,False,0.0021066637,sigK,Sigma Factor involved in the production of antigenic proteins,Unknown Function
4,WhiB4,False,0.0019907938,whiB4,Redox-Responsive transcription regulator that regulates protection response during infection,Redox
0,SigH,False,0.0015862592,sigH,Sigma Factor involved in heat shock and oxidative stress response,Virulence/Persistence
76,SG_13,False,-0.0014804355,,Single Gene iModulon 13,Single Gene
41,Unc_5,False,-0.0014558540000000001,,Uncharacterized iModulon 5,Uncharacterized
7,GroEL-GroES Complex,False,-0.0013938223,,Gene Ontology Term specific to the bacterial chaperonin complex,Amino Acids
13,SG_1,False,-0.0012015181,,Single Gene iModulon 1,Single Gene
3,PyrR,False,0.0011803101,pyrR,Transcription factor that regulates the expression of pyrimidine nucleotide operons,Nucleic Acids
79,WhiB4/IdeR,False,0.0008788992,whiB4 or ideR,iModulon that maps to the union of the Rv3681c and Rv2711 regulons,Redox
35,Unc_4,False,0.0007637895,,Uncharacterized iModulon 4,Uncharacterized
66,M-box,False,0.0006832146,,Magnesium activated non-coding sRNA that regulates the function of genes associated with metal metabolism and virulence,Metal Related
78,Positive Regulation of Growth,False,-0.00042784290000000004,,iModulon enriched with the Positive Regulation of Growth Gene Ontology term,Growth
1,Polyketide Synthase Complex,False,0.00013620290000000002,,KEGG Map related to the synthesis of type II polyketide backbone ,Fatty Acid/Cholestrol
69,Rv0135+Rv1019,False,-9.059130000000001e-05,Rv0135c and Rv1019,iModulon that maps to the intersection of the Rv0135c and Rv1019 regulons,Nucleic Acids
32,Unc_3,False,-8.25026e-05,,Uncharacterized iModulon 3,Uncharacterized
