k,Name,in_iM,gene_weight,Regulator,Function,Category
12,Mycofactocin Synthesis Pathway,False,-0.0369372436,,Manually annotated iModulon that captures multiple genes associated with mycofactocin metabolism,Fatty Acid/Cholestrol
11,EccE1 KO,False,0.0253446796,,Single Gene iModulon that captures EccE1 knockout,KO
33,SG_4,False,-0.0252478429,,Single Gene iModulon 4,Single Gene
14,SG_2,False,0.0249668433,,Single Gene iModulon 2,Single Gene
44,SG_6,False,0.0247499705,,Single Genes iModulon 6,Single Gene
54,Unc_7,False,0.0214837799,,Uncharacterized iModulon 7,Uncharacterized
78,Positive Regulation of Growth,False,0.0205055148,,iModulon enriched with the Positive Regulation of Growth Gene Ontology term,Growth
15,BkaR,False,-0.019631580200000002,bkaR,Transcription factor that regulates genes related to branched-chain keto-acid metabolism,Central Carbon
75,Unc_9,False,0.0189059975,,Uncharacterized iModulon 9,Uncharacterized
65,SG_10,False,-0.018890610800000002,,Single Gene iModulon 10,Single Gene
13,SG_1,False,0.0180795435,,Single Gene iModulon 1,Single Gene
51,PhoP,False,0.015522438900000001,phoP,"Transcription factor that controls response to redox/acid stress, hypoxia, and virulence",Virulence/Persistence
46,Rv2621c,False,-0.0148401194,Rv2621c,iModulon labeled with predicted regulon with unknown function,Unknown Function
36,Fumarate Reductase,False,-0.0141599767,,iModulon enriched with the Fumarate Reductase Gene Ontology term,Central Carbon
64,Mce1R,False,-0.0140021138,mce1R,Transcription factor that regulates the mce1 virulence operon,Virulence/Persistence
58,Zur,False,0.0136908276,zur,Transcription factor that is activated by and regulates the metabolism of zinc,Metal Related
47,SG_7,False,0.0136188261,,Single Gene iModulon 7,Single Gene
66,M-box,False,-0.0134383183,,Magnesium activated non-coding sRNA that regulates the function of genes associated with metal metabolism and virulence,Metal Related
55,WhiB7,False,-0.0129413214,whiB7,Transcription factor that connects systems for redox homeostasis and antibiotic resistance,Antibiotic
35,Unc_4,False,0.0120944976,,Uncharacterized iModulon 4,Uncharacterized
48,Leucine Related,False,-0.0112366555,,Manually annotated iModulon with gene related to leucine metabolism,Amino Acids
77,Central Carbon Metabolism,False,-0.0110534117,,iModulon enriched with the Central Carbon Metabolism KEGG pathway,Central Carbon
57,SG_8,False,0.0108077202,,Single Gene iModulon 8,Single Gene
53,Rv1776c+WhiB4,False,0.0107123025,Rv1776c and whiB4 ,iModulon that maps to the intersection of the Rv1776c and Rv3681c regulon,Redox
9,SigK,False,0.0104449074,sigK,Sigma Factor involved in the production of antigenic proteins,Unknown Function
3,PyrR,False,-0.0104312254,pyrR,Transcription factor that regulates the expression of pyrimidine nucleotide operons,Nucleic Acids
79,WhiB4/IdeR,False,-0.0101083751,whiB4 or ideR,iModulon that maps to the union of the Rv3681c and Rv2711 regulons,Redox
50,Unc_6,False,-0.0100152431,,Uncharacterized iModulon 6,Uncharacterized
69,Rv0135+Rv1019,False,-0.009469853700000001,Rv0135c and Rv1019,iModulon that maps to the intersection of the Rv0135c and Rv1019 regulons,Nucleic Acids
41,Unc_5,False,-0.009443207700000001,,Uncharacterized iModulon 5,Uncharacterized
17,VirS,False,-0.0093491608,virS,Transcription factor that is activated and responds to acidic environments,Redox
19,WhiB6,False,-0.0091967634,whiB6,Transcription factor that regulates ESX-1 system membrane transport proteins,Redox
30,HPT-2b Induced,False,0.0089785352,,iModulon regulates many genes that are activated by HPT-2b (1-hydroxy-5-R-pyridine-2(1H)-thiones),Metal Related
61,Nucleic Acid Hydrolysis ,False,0.007514499700000001,,iModulon enriched with the Nucleic Acid Hydrolysis KEGG pathway,Nucleic Acids
73,SG_11,False,-0.0074827265,,Single Gene iModulon 11,Single Gene
1,Polyketide Synthase Complex,False,0.0073611223,,KEGG Map related to the synthesis of type II polyketide backbone ,Fatty Acid/Cholestrol
18,Unc_1,False,-0.0072363185,,Uncharacterized iModulon 1,Uncharacterized
63,SG_9,False,-0.0065171176,,Single Gene iModulon 9,Single Gene
40,KstR2,False,-0.0055180854,kstR2,Transcription factor that regulates a small regulon related to cholesterol utilization,Fatty Acid/Cholestrol
34,MbcA+Rv3249c+Rv3066,False,-0.0055167984,mbcA and Rv3249c and Rv3066,"iModulon that maps to the intersection of the Rv1990c, Rv3249c, and Rv3066 regulons",Virulence/Persistence
72,Unc_8,False,-0.0053101271,,Uncharacterized iModulon 8,Uncharacterized
21,MprA,False,0.0052689389,mprA,Transcription factor that regulates multiple stress responsive genes,Virulence/Persistence
45,SigD,False,-0.0052364445,sigD,Sigma Factor that governs the expression of ribosomal genes and plays a role in virulence,Virulence/Persistence
31,ArgR,False,0.0051043803,argR,Transcription factor that regulates the L-arginine biosynthesis pathways,Amino Acids
20,FasR,False,0.0049383503,fasR,Transcription factor that controls the expression of fatty acid metabolism genes,Fatty Acid/Cholestrol
71,PDIM;PGL Synthesis,False,0.0041391158,,Manually annotated iModulon that captures genes associated with PDIM and PGL synthesis,Virulence/Persistence
32,Unc_3,False,-0.004104626,,Uncharacterized iModulon 3,Uncharacterized
74,SG_12,False,-0.0040311111,,Single Gene iModulon 12,Single Gene
38,SG_5,False,0.0039620575,,Single Gene iModulon 5,Single Gene
39,SigC,False,-0.0038767240000000002,sigC,Sigma Factor that plays a role in organism virulence and lethality,Virulence/Persistence
29,Blal,False,0.0037553449,blaI,"Transcription regulator that regulates genes associated with antibiotic transport, detoxification, and cell wall function",Antibiotic
10,RicR,False,-0.0036609578,ricR,Copper responsive transcription factor that regulates metal metabolism genes,Metal Related
49,Rv1828/SigH,False,-0.0036179517,Rv1828 or sigH,iModulon that maps to the union of the Rv1828 and Rv3223c regulons,Redox
7,GroEL-GroES Complex,False,-0.0034101692000000003,,Gene Ontology Term specific to the bacterial chaperonin complex,Amino Acids
60,Rv0681,False,0.0033939813,Rv0681,"Transcription with previously unknown function, regulates core fatty acid response",Unknown Function
6,MarR,False,-0.0033167539000000003,marR,Transcription factor that regulates the response to acid stress,Acid Stress
0,SigH,False,-0.0031910551,sigH,Sigma Factor involved in heat shock and oxidative stress response,Virulence/Persistence
52,DevR-2,False,-0.003131935,devR,Transcription factor that is one of the primary regulators of hypoxia onset response,Redox
37,Rv3095,False,0.0030973476,Rv3095,iModulon labeled with predicted regulon with unknown function,Unknown Function
70,Lsr2,False,0.0030141201,lsr2,Sequence independent transcription factor that controls a wide variety of genes,Antibiotic
42,Nicotinate Metabolism,False,0.0028083580000000004,,iModulon enriched with the nicotinate and nicotinamide metabolism KEGG pathway,Central Carbon
67,Peptidoglycan Biosynthesis,False,-0.0028019545,,iModulon enriched with the Peptidoglycan biosyntehsis KEGG pathway,Central Carbon
23,PrpR,False,0.0026832981000000002,prpR,Transcription factor that is involved in catabolism of short chain fatty acids via gloxylate and methylcitrate cycle,Central Carbon
22,SG_3,False,0.0020741637,,Single Gene iModulon 3,Single Gene
4,WhiB4,False,-0.0018548535,whiB4,Redox-Responsive transcription regulator that regulates protection response during infection,Redox
16,Mce3R,False,-0.0017569041000000001,mce3R,Transcription factor that regulates the mce3 virulence operon,Virulence/Persistence
43,LysG,False,0.0017188018000000001,lsyG,Transcription factor that controls the expression of LysE and requires lysine or histidine for activation ,Amino Acids
26,EspL KO,False,0.0017045934,,Single Gene iModulon that captures EspL knockout,KO
27,Unc_2,False,0.0016719779000000001,,Uncharacterized iModulon 2,Uncharacterized
8,IdeR,False,0.0015711405000000001,ideR,Metal-Dependent DNA-Binding protein that controls genes related to iron metabolism,Metal Related
24,Salicylate Induced,False,-0.0015228292000000001,,Manually annotated iModulon where genes were found to change expression when exposed to salicylate,Metal Related
25,Rv0078+Rv2034,False,-0.0014559506000000001,Rv0078 and Rv2034,iModulon that maps to the intersection of the Rv0078 and Rv2034 regulon,Antibiotic
59,Rv0576,False,0.0013846691,Rv0576,Possible ArsR family transcription factor that regulates genes related to virulence,Virulence/Persistence
56,Fatty Acid Biosynthesis,False,-0.0013172342,trcR and Rv1776c and whiB4 ,"iModulon that maps to the intersection of the Rv1033c, Rv1776c, and Rv3681c regulons",Fatty Acid/Cholestrol
5,DevR-1,False,-0.0013076957,devR,Transcription factor that is one of the primary regulators of hypoxia onset response,Redox
76,SG_13,False,-0.0012998354,,Single Gene iModulon 13,Single Gene
68,Sulfur Metabolism,False,0.0012906845,,Kegg Map that displays the transport and metabolism of sulfur,Sulfur Metabolism
2,IniR,False,-0.0009285625,iniR,Transcription factor that regulates the expression of the ini operon (iniBAC),Antibiotic
62,Rv2488c,False,0.0004075691,Rv2488c,LuxR family transcription factor that regulates genes associated with virulence,Virulence/Persistence
28,WhiB1,False,0.0003077229,whiB1,"Transcription repressor that is redox responsive, found to be nitric oxide sensitive",Redox
