k,Name,in_iM,gene_weight,Regulator,Function,Category
4,WhiB4,True,0.1084138136,whiB4,Redox-Responsive transcription regulator that regulates protection response during infection,Redox
69,Rv0135+Rv1019,False,0.0275298541,Rv0135c and Rv1019,iModulon that maps to the intersection of the Rv0135c and Rv1019 regulons,Nucleic Acids
67,Peptidoglycan Biosynthesis,False,-0.019689093,,iModulon enriched with the Peptidoglycan biosyntehsis KEGG pathway,Central Carbon
2,IniR,False,0.0196455235,iniR,Transcription factor that regulates the expression of the ini operon (iniBAC),Antibiotic
39,SigC,False,-0.017129284800000002,sigC,Sigma Factor that plays a role in organism virulence and lethality,Virulence/Persistence
45,SigD,False,-0.0147923737,sigD,Sigma Factor that governs the expression of ribosomal genes and plays a role in virulence,Virulence/Persistence
59,Rv0576,False,-0.014310451600000001,Rv0576,Possible ArsR family transcription factor that regulates genes related to virulence,Virulence/Persistence
70,Lsr2,False,-0.0140178326,lsr2,Sequence independent transcription factor that controls a wide variety of genes,Antibiotic
56,Fatty Acid Biosynthesis,False,-0.012854159700000001,trcR and Rv1776c and whiB4 ,"iModulon that maps to the intersection of the Rv1033c, Rv1776c, and Rv3681c regulons",Fatty Acid/Cholestrol
29,Blal,False,0.0127268113,blaI,"Transcription regulator that regulates genes associated with antibiotic transport, detoxification, and cell wall function",Antibiotic
75,Unc_9,False,0.012407796,,Uncharacterized iModulon 9,Uncharacterized
34,MbcA+Rv3249c+Rv3066,False,-0.0115584982,mbcA and Rv3249c and Rv3066,"iModulon that maps to the intersection of the Rv1990c, Rv3249c, and Rv3066 regulons",Virulence/Persistence
68,Sulfur Metabolism,False,0.011464785600000001,,Kegg Map that displays the transport and metabolism of sulfur,Sulfur Metabolism
25,Rv0078+Rv2034,False,-0.0110680945,Rv0078 and Rv2034,iModulon that maps to the intersection of the Rv0078 and Rv2034 regulon,Antibiotic
50,Unc_6,False,0.010644589000000001,,Uncharacterized iModulon 6,Uncharacterized
33,SG_4,False,-0.010580017300000001,,Single Gene iModulon 4,Single Gene
16,Mce3R,False,-0.010478602,mce3R,Transcription factor that regulates the mce3 virulence operon,Virulence/Persistence
57,SG_8,False,-0.0100529685,,Single Gene iModulon 8,Single Gene
54,Unc_7,False,-0.009789335000000001,,Uncharacterized iModulon 7,Uncharacterized
12,Mycofactocin Synthesis Pathway,False,0.0097437284,,Manually annotated iModulon that captures multiple genes associated with mycofactocin metabolism,Fatty Acid/Cholestrol
66,M-box,False,-0.0093271953,,Magnesium activated non-coding sRNA that regulates the function of genes associated with metal metabolism and virulence,Metal Related
60,Rv0681,False,0.0084314596,Rv0681,"Transcription with previously unknown function, regulates core fatty acid response",Unknown Function
26,EspL KO,False,-0.0082582917,,Single Gene iModulon that captures EspL knockout,KO
78,Positive Regulation of Growth,False,-0.0078714807,,iModulon enriched with the Positive Regulation of Growth Gene Ontology term,Growth
61,Nucleic Acid Hydrolysis ,False,-0.0076563107,,iModulon enriched with the Nucleic Acid Hydrolysis KEGG pathway,Nucleic Acids
42,Nicotinate Metabolism,False,0.0074364279000000005,,iModulon enriched with the nicotinate and nicotinamide metabolism KEGG pathway,Central Carbon
14,SG_2,False,-0.0073852499,,Single Gene iModulon 2,Single Gene
51,PhoP,False,0.0073491499,phoP,"Transcription factor that controls response to redox/acid stress, hypoxia, and virulence",Virulence/Persistence
52,DevR-2,False,0.0071362255,devR,Transcription factor that is one of the primary regulators of hypoxia onset response,Redox
44,SG_6,False,-0.0070051267,,Single Genes iModulon 6,Single Gene
5,DevR-1,False,-0.0066688598,devR,Transcription factor that is one of the primary regulators of hypoxia onset response,Redox
22,SG_3,False,0.0064673085,,Single Gene iModulon 3,Single Gene
7,GroEL-GroES Complex,False,-0.006323687000000001,,Gene Ontology Term specific to the bacterial chaperonin complex,Amino Acids
28,WhiB1,False,-0.0062683497,whiB1,"Transcription repressor that is redox responsive, found to be nitric oxide sensitive",Redox
48,Leucine Related,False,0.0058373341,,Manually annotated iModulon with gene related to leucine metabolism,Amino Acids
1,Polyketide Synthase Complex,False,-0.005610519400000001,,KEGG Map related to the synthesis of type II polyketide backbone ,Fatty Acid/Cholestrol
13,SG_1,False,-0.0052200101,,Single Gene iModulon 1,Single Gene
53,Rv1776c+WhiB4,False,0.0049741075,Rv1776c and whiB4 ,iModulon that maps to the intersection of the Rv1776c and Rv3681c regulon,Redox
55,WhiB7,False,0.0048664449,whiB7,Transcription factor that connects systems for redox homeostasis and antibiotic resistance,Antibiotic
0,SigH,False,-0.0048415865,sigH,Sigma Factor involved in heat shock and oxidative stress response,Virulence/Persistence
74,SG_12,False,0.0048327984,,Single Gene iModulon 12,Single Gene
41,Unc_5,False,0.0047905698,,Uncharacterized iModulon 5,Uncharacterized
58,Zur,False,-0.004778414700000001,zur,Transcription factor that is activated by and regulates the metabolism of zinc,Metal Related
79,WhiB4/IdeR,False,-0.0047094035,whiB4 or ideR,iModulon that maps to the union of the Rv3681c and Rv2711 regulons,Redox
77,Central Carbon Metabolism,False,0.0044945231,,iModulon enriched with the Central Carbon Metabolism KEGG pathway,Central Carbon
62,Rv2488c,False,0.0043318543,Rv2488c,LuxR family transcription factor that regulates genes associated with virulence,Virulence/Persistence
46,Rv2621c,False,-0.0042449274,Rv2621c,iModulon labeled with predicted regulon with unknown function,Unknown Function
31,ArgR,False,-0.0038181202,argR,Transcription factor that regulates the L-arginine biosynthesis pathways,Amino Acids
8,IdeR,False,0.003780774,ideR,Metal-Dependent DNA-Binding protein that controls genes related to iron metabolism,Metal Related
18,Unc_1,False,0.0037489491,,Uncharacterized iModulon 1,Uncharacterized
49,Rv1828/SigH,False,-0.0036701140000000004,Rv1828 or sigH,iModulon that maps to the union of the Rv1828 and Rv3223c regulons,Redox
47,SG_7,False,-0.0033698349000000002,,Single Gene iModulon 7,Single Gene
73,SG_11,False,0.0031970624000000002,,Single Gene iModulon 11,Single Gene
40,KstR2,False,-0.002971374,kstR2,Transcription factor that regulates a small regulon related to cholesterol utilization,Fatty Acid/Cholestrol
21,MprA,False,0.0029646433,mprA,Transcription factor that regulates multiple stress responsive genes,Virulence/Persistence
15,BkaR,False,0.0025659307,bkaR,Transcription factor that regulates genes related to branched-chain keto-acid metabolism,Central Carbon
17,VirS,False,-0.0025466347,virS,Transcription factor that is activated and responds to acidic environments,Redox
30,HPT-2b Induced,False,-0.0023465945,,iModulon regulates many genes that are activated by HPT-2b (1-hydroxy-5-R-pyridine-2(1H)-thiones),Metal Related
38,SG_5,False,0.0022962451,,Single Gene iModulon 5,Single Gene
71,PDIM;PGL Synthesis,False,-0.002096815,,Manually annotated iModulon that captures genes associated with PDIM and PGL synthesis,Virulence/Persistence
11,EccE1 KO,False,-0.0019108792000000002,,Single Gene iModulon that captures EccE1 knockout,KO
20,FasR,False,-0.0018979952,fasR,Transcription factor that controls the expression of fatty acid metabolism genes,Fatty Acid/Cholestrol
10,RicR,False,0.0018844939,ricR,Copper responsive transcription factor that regulates metal metabolism genes,Metal Related
19,WhiB6,False,0.0018504009,whiB6,Transcription factor that regulates ESX-1 system membrane transport proteins,Redox
24,Salicylate Induced,False,0.0017239586,,Manually annotated iModulon where genes were found to change expression when exposed to salicylate,Metal Related
27,Unc_2,False,0.0015342615,,Uncharacterized iModulon 2,Uncharacterized
72,Unc_8,False,-0.0014323740000000001,,Uncharacterized iModulon 8,Uncharacterized
37,Rv3095,False,-0.0013486425000000001,Rv3095,iModulon labeled with predicted regulon with unknown function,Unknown Function
65,SG_10,False,0.0013068527,,Single Gene iModulon 10,Single Gene
32,Unc_3,False,0.0012840877,,Uncharacterized iModulon 3,Uncharacterized
64,Mce1R,False,0.0012658405,mce1R,Transcription factor that regulates the mce1 virulence operon,Virulence/Persistence
3,PyrR,False,0.000947343,pyrR,Transcription factor that regulates the expression of pyrimidine nucleotide operons,Nucleic Acids
9,SigK,False,-0.0009308596,sigK,Sigma Factor involved in the production of antigenic proteins,Unknown Function
43,LysG,False,-0.0008167372000000001,lsyG,Transcription factor that controls the expression of LysE and requires lysine or histidine for activation ,Amino Acids
35,Unc_4,False,0.0006294180000000001,,Uncharacterized iModulon 4,Uncharacterized
23,PrpR,False,0.0005652054,prpR,Transcription factor that is involved in catabolism of short chain fatty acids via gloxylate and methylcitrate cycle,Central Carbon
63,SG_9,False,0.0002358839,,Single Gene iModulon 9,Single Gene
76,SG_13,False,-0.0002013643,,Single Gene iModulon 13,Single Gene
36,Fumarate Reductase,False,5.84295e-05,,iModulon enriched with the Fumarate Reductase Gene Ontology term,Central Carbon
6,MarR,False,-2.80896e-05,marR,Transcription factor that regulates the response to acid stress,Acid Stress
