k,Name,in_iM,gene_weight,Regulator,Function,Category
33,SG_4,False,0.061994114700000005,,Single Gene iModulon 4,Single Gene
32,Unc_3,False,0.0488718729,,Uncharacterized iModulon 3,Uncharacterized
37,Rv3095,False,-0.0434143317,Rv3095,iModulon labeled with predicted regulon with unknown function,Unknown Function
38,SG_5,False,-0.037900598300000005,,Single Gene iModulon 5,Single Gene
70,Lsr2,False,-0.0350479328,lsr2,Sequence independent transcription factor that controls a wide variety of genes,Antibiotic
57,SG_8,False,0.0345420612,,Single Gene iModulon 8,Single Gene
43,LysG,False,-0.033987626800000004,lsyG,Transcription factor that controls the expression of LysE and requires lysine or histidine for activation ,Amino Acids
71,PDIM;PGL Synthesis,False,0.030479135100000002,,Manually annotated iModulon that captures genes associated with PDIM and PGL synthesis,Virulence/Persistence
48,Leucine Related,False,-0.0299098215,,Manually annotated iModulon with gene related to leucine metabolism,Amino Acids
39,SigC,False,0.0293564007,sigC,Sigma Factor that plays a role in organism virulence and lethality,Virulence/Persistence
14,SG_2,False,0.027509206600000002,,Single Gene iModulon 2,Single Gene
52,DevR-2,False,0.0272852838,devR,Transcription factor that is one of the primary regulators of hypoxia onset response,Redox
29,Blal,False,-0.0269686757,blaI,"Transcription regulator that regulates genes associated with antibiotic transport, detoxification, and cell wall function",Antibiotic
35,Unc_4,False,-0.0252939449,,Uncharacterized iModulon 4,Uncharacterized
13,SG_1,False,-0.0242955119,,Single Gene iModulon 1,Single Gene
2,IniR,False,0.0240668581,iniR,Transcription factor that regulates the expression of the ini operon (iniBAC),Antibiotic
76,SG_13,False,0.0238630007,,Single Gene iModulon 13,Single Gene
21,MprA,False,0.019710980700000002,mprA,Transcription factor that regulates multiple stress responsive genes,Virulence/Persistence
42,Nicotinate Metabolism,False,-0.0195722108,,iModulon enriched with the nicotinate and nicotinamide metabolism KEGG pathway,Central Carbon
18,Unc_1,False,0.0195595723,,Uncharacterized iModulon 1,Uncharacterized
30,HPT-2b Induced,False,0.018471659300000002,,iModulon regulates many genes that are activated by HPT-2b (1-hydroxy-5-R-pyridine-2(1H)-thiones),Metal Related
45,SigD,False,-0.0181461987,sigD,Sigma Factor that governs the expression of ribosomal genes and plays a role in virulence,Virulence/Persistence
44,SG_6,False,-0.0169912731,,Single Genes iModulon 6,Single Gene
36,Fumarate Reductase,False,-0.0166600368,,iModulon enriched with the Fumarate Reductase Gene Ontology term,Central Carbon
72,Unc_8,False,0.0159051945,,Uncharacterized iModulon 8,Uncharacterized
69,Rv0135+Rv1019,False,0.0155522334,Rv0135c and Rv1019,iModulon that maps to the intersection of the Rv0135c and Rv1019 regulons,Nucleic Acids
9,SigK,False,-0.0143754402,sigK,Sigma Factor involved in the production of antigenic proteins,Unknown Function
65,SG_10,False,-0.0142464533,,Single Gene iModulon 10,Single Gene
7,GroEL-GroES Complex,False,0.013146635700000001,,Gene Ontology Term specific to the bacterial chaperonin complex,Amino Acids
12,Mycofactocin Synthesis Pathway,False,-0.013037743400000001,,Manually annotated iModulon that captures multiple genes associated with mycofactocin metabolism,Fatty Acid/Cholestrol
73,SG_11,False,0.0128626711,,Single Gene iModulon 11,Single Gene
40,KstR2,False,-0.0128465903,kstR2,Transcription factor that regulates a small regulon related to cholesterol utilization,Fatty Acid/Cholestrol
5,DevR-1,False,-0.0127112955,devR,Transcription factor that is one of the primary regulators of hypoxia onset response,Redox
0,SigH,False,-0.0123323441,sigH,Sigma Factor involved in heat shock and oxidative stress response,Virulence/Persistence
63,SG_9,False,0.0123276019,,Single Gene iModulon 9,Single Gene
16,Mce3R,False,0.0117916471,mce3R,Transcription factor that regulates the mce3 virulence operon,Virulence/Persistence
15,BkaR,False,0.01160869,bkaR,Transcription factor that regulates genes related to branched-chain keto-acid metabolism,Central Carbon
59,Rv0576,False,-0.0111820384,Rv0576,Possible ArsR family transcription factor that regulates genes related to virulence,Virulence/Persistence
53,Rv1776c+WhiB4,False,-0.0107900804,Rv1776c and whiB4 ,iModulon that maps to the intersection of the Rv1776c and Rv3681c regulon,Redox
79,WhiB4/IdeR,False,-0.0105508569,whiB4 or ideR,iModulon that maps to the union of the Rv3681c and Rv2711 regulons,Redox
22,SG_3,False,0.010380226900000001,,Single Gene iModulon 3,Single Gene
19,WhiB6,False,-0.010214029900000001,whiB6,Transcription factor that regulates ESX-1 system membrane transport proteins,Redox
61,Nucleic Acid Hydrolysis ,False,-0.0101577989,,iModulon enriched with the Nucleic Acid Hydrolysis KEGG pathway,Nucleic Acids
68,Sulfur Metabolism,False,0.0095557847,,Kegg Map that displays the transport and metabolism of sulfur,Sulfur Metabolism
6,MarR,False,-0.0094597655,marR,Transcription factor that regulates the response to acid stress,Acid Stress
77,Central Carbon Metabolism,False,0.0092174903,,iModulon enriched with the Central Carbon Metabolism KEGG pathway,Central Carbon
47,SG_7,False,0.0084076627,,Single Gene iModulon 7,Single Gene
1,Polyketide Synthase Complex,False,-0.0081643982,,KEGG Map related to the synthesis of type II polyketide backbone ,Fatty Acid/Cholestrol
28,WhiB1,False,0.0073149427,whiB1,"Transcription repressor that is redox responsive, found to be nitric oxide sensitive",Redox
34,MbcA+Rv3249c+Rv3066,False,-0.0069096788,mbcA and Rv3249c and Rv3066,"iModulon that maps to the intersection of the Rv1990c, Rv3249c, and Rv3066 regulons",Virulence/Persistence
60,Rv0681,False,0.0068341051000000005,Rv0681,"Transcription with previously unknown function, regulates core fatty acid response",Unknown Function
74,SG_12,False,0.0067850121000000005,,Single Gene iModulon 12,Single Gene
27,Unc_2,False,0.0065070159,,Uncharacterized iModulon 2,Uncharacterized
62,Rv2488c,False,-0.0064643213,Rv2488c,LuxR family transcription factor that regulates genes associated with virulence,Virulence/Persistence
58,Zur,False,0.0055679753,zur,Transcription factor that is activated by and regulates the metabolism of zinc,Metal Related
56,Fatty Acid Biosynthesis,False,-0.0053654764,trcR and Rv1776c and whiB4 ,"iModulon that maps to the intersection of the Rv1033c, Rv1776c, and Rv3681c regulons",Fatty Acid/Cholestrol
10,RicR,False,0.0053307052,ricR,Copper responsive transcription factor that regulates metal metabolism genes,Metal Related
26,EspL KO,False,-0.0049541396,,Single Gene iModulon that captures EspL knockout,KO
46,Rv2621c,False,-0.0048013165000000005,Rv2621c,iModulon labeled with predicted regulon with unknown function,Unknown Function
17,VirS,False,0.0047767855,virS,Transcription factor that is activated and responds to acidic environments,Redox
54,Unc_7,False,-0.0041244245,,Uncharacterized iModulon 7,Uncharacterized
64,Mce1R,False,0.0039973149,mce1R,Transcription factor that regulates the mce1 virulence operon,Virulence/Persistence
78,Positive Regulation of Growth,False,0.00377838,,iModulon enriched with the Positive Regulation of Growth Gene Ontology term,Growth
41,Unc_5,False,-0.0030339797000000003,,Uncharacterized iModulon 5,Uncharacterized
50,Unc_6,False,-0.003008011,,Uncharacterized iModulon 6,Uncharacterized
23,PrpR,False,0.0029058237,prpR,Transcription factor that is involved in catabolism of short chain fatty acids via gloxylate and methylcitrate cycle,Central Carbon
51,PhoP,False,0.002882379,phoP,"Transcription factor that controls response to redox/acid stress, hypoxia, and virulence",Virulence/Persistence
75,Unc_9,False,0.0028803353,,Uncharacterized iModulon 9,Uncharacterized
11,EccE1 KO,False,-0.0024208823,,Single Gene iModulon that captures EccE1 knockout,KO
49,Rv1828/SigH,False,0.0022658303,Rv1828 or sigH,iModulon that maps to the union of the Rv1828 and Rv3223c regulons,Redox
25,Rv0078+Rv2034,False,0.0021367381,Rv0078 and Rv2034,iModulon that maps to the intersection of the Rv0078 and Rv2034 regulon,Antibiotic
67,Peptidoglycan Biosynthesis,False,-0.0020018004,,iModulon enriched with the Peptidoglycan biosyntehsis KEGG pathway,Central Carbon
55,WhiB7,False,0.0018092358,whiB7,Transcription factor that connects systems for redox homeostasis and antibiotic resistance,Antibiotic
3,PyrR,False,0.0015783795000000002,pyrR,Transcription factor that regulates the expression of pyrimidine nucleotide operons,Nucleic Acids
66,M-box,False,0.0013563874,,Magnesium activated non-coding sRNA that regulates the function of genes associated with metal metabolism and virulence,Metal Related
24,Salicylate Induced,False,-0.0012665627,,Manually annotated iModulon where genes were found to change expression when exposed to salicylate,Metal Related
8,IdeR,False,-0.0010463179,ideR,Metal-Dependent DNA-Binding protein that controls genes related to iron metabolism,Metal Related
20,FasR,False,-0.0009928911000000001,fasR,Transcription factor that controls the expression of fatty acid metabolism genes,Fatty Acid/Cholestrol
4,WhiB4,False,0.0009844869,whiB4,Redox-Responsive transcription regulator that regulates protection response during infection,Redox
31,ArgR,False,-0.0009280057,argR,Transcription factor that regulates the L-arginine biosynthesis pathways,Amino Acids
