k,Name,in_iM,gene_weight,Regulator,Function,Category
15,BkaR,False,0.0408200315,bkaR,Transcription factor that regulates genes related to branched-chain keto-acid metabolism,Central Carbon
12,Mycofactocin Synthesis Pathway,False,-0.0330054666,,Manually annotated iModulon that captures multiple genes associated with mycofactocin metabolism,Fatty Acid/Cholestrol
54,Unc_7,False,-0.029435738700000002,,Uncharacterized iModulon 7,Uncharacterized
46,Rv2621c,False,-0.025877229300000002,Rv2621c,iModulon labeled with predicted regulon with unknown function,Unknown Function
51,PhoP,False,-0.0252991361,phoP,"Transcription factor that controls response to redox/acid stress, hypoxia, and virulence",Virulence/Persistence
71,PDIM;PGL Synthesis,False,-0.0250248822,,Manually annotated iModulon that captures genes associated with PDIM and PGL synthesis,Virulence/Persistence
27,Unc_2,False,0.0247995617,,Uncharacterized iModulon 2,Uncharacterized
68,Sulfur Metabolism,False,0.0234548646,,Kegg Map that displays the transport and metabolism of sulfur,Sulfur Metabolism
14,SG_2,False,0.0210781872,,Single Gene iModulon 2,Single Gene
67,Peptidoglycan Biosynthesis,False,0.0188848766,,iModulon enriched with the Peptidoglycan biosyntehsis KEGG pathway,Central Carbon
40,KstR2,False,-0.0180722466,kstR2,Transcription factor that regulates a small regulon related to cholesterol utilization,Fatty Acid/Cholestrol
29,Blal,False,-0.0179790601,blaI,"Transcription regulator that regulates genes associated with antibiotic transport, detoxification, and cell wall function",Antibiotic
43,LysG,False,-0.0178648972,lsyG,Transcription factor that controls the expression of LysE and requires lysine or histidine for activation ,Amino Acids
74,SG_12,False,0.0173007628,,Single Gene iModulon 12,Single Gene
60,Rv0681,False,0.015104215800000001,Rv0681,"Transcription with previously unknown function, regulates core fatty acid response",Unknown Function
34,MbcA+Rv3249c+Rv3066,False,0.0143682014,mbcA and Rv3249c and Rv3066,"iModulon that maps to the intersection of the Rv1990c, Rv3249c, and Rv3066 regulons",Virulence/Persistence
44,SG_6,False,-0.0143289327,,Single Genes iModulon 6,Single Gene
38,SG_5,False,0.013935456,,Single Gene iModulon 5,Single Gene
30,HPT-2b Induced,False,0.013846052400000001,,iModulon regulates many genes that are activated by HPT-2b (1-hydroxy-5-R-pyridine-2(1H)-thiones),Metal Related
73,SG_11,False,0.013834119700000001,,Single Gene iModulon 11,Single Gene
28,WhiB1,False,0.013654082100000001,whiB1,"Transcription repressor that is redox responsive, found to be nitric oxide sensitive",Redox
22,SG_3,False,0.0134471781,,Single Gene iModulon 3,Single Gene
75,Unc_9,False,-0.0119514154,,Uncharacterized iModulon 9,Uncharacterized
55,WhiB7,False,0.0116997461,whiB7,Transcription factor that connects systems for redox homeostasis and antibiotic resistance,Antibiotic
76,SG_13,False,-0.0113312897,,Single Gene iModulon 13,Single Gene
2,IniR,False,0.0111578409,iniR,Transcription factor that regulates the expression of the ini operon (iniBAC),Antibiotic
33,SG_4,False,-0.0095642451,,Single Gene iModulon 4,Single Gene
72,Unc_8,False,0.0095632255,,Uncharacterized iModulon 8,Uncharacterized
50,Unc_6,False,0.0095302599,,Uncharacterized iModulon 6,Uncharacterized
23,PrpR,False,-0.009164044500000001,prpR,Transcription factor that is involved in catabolism of short chain fatty acids via gloxylate and methylcitrate cycle,Central Carbon
48,Leucine Related,False,0.0091127258,,Manually annotated iModulon with gene related to leucine metabolism,Amino Acids
10,RicR,False,0.00889336,ricR,Copper responsive transcription factor that regulates metal metabolism genes,Metal Related
45,SigD,False,-0.0086155585,sigD,Sigma Factor that governs the expression of ribosomal genes and plays a role in virulence,Virulence/Persistence
20,FasR,False,0.0081965638,fasR,Transcription factor that controls the expression of fatty acid metabolism genes,Fatty Acid/Cholestrol
42,Nicotinate Metabolism,False,0.0080478248,,iModulon enriched with the nicotinate and nicotinamide metabolism KEGG pathway,Central Carbon
61,Nucleic Acid Hydrolysis ,False,-0.007985576500000001,,iModulon enriched with the Nucleic Acid Hydrolysis KEGG pathway,Nucleic Acids
79,WhiB4/IdeR,False,-0.007973203,whiB4 or ideR,iModulon that maps to the union of the Rv3681c and Rv2711 regulons,Redox
52,DevR-2,False,-0.0079545104,devR,Transcription factor that is one of the primary regulators of hypoxia onset response,Redox
6,MarR,False,0.007769206900000001,marR,Transcription factor that regulates the response to acid stress,Acid Stress
70,Lsr2,False,-0.0072958808000000005,lsr2,Sequence independent transcription factor that controls a wide variety of genes,Antibiotic
1,Polyketide Synthase Complex,False,-0.0061985798,,KEGG Map related to the synthesis of type II polyketide backbone ,Fatty Acid/Cholestrol
66,M-box,False,-0.0060878405,,Magnesium activated non-coding sRNA that regulates the function of genes associated with metal metabolism and virulence,Metal Related
4,WhiB4,False,-0.005953466,whiB4,Redox-Responsive transcription regulator that regulates protection response during infection,Redox
19,WhiB6,False,-0.0059240472,whiB6,Transcription factor that regulates ESX-1 system membrane transport proteins,Redox
64,Mce1R,False,0.0056734718000000005,mce1R,Transcription factor that regulates the mce1 virulence operon,Virulence/Persistence
49,Rv1828/SigH,False,0.0056511038000000005,Rv1828 or sigH,iModulon that maps to the union of the Rv1828 and Rv3223c regulons,Redox
41,Unc_5,False,0.0056370291000000005,,Uncharacterized iModulon 5,Uncharacterized
58,Zur,False,0.0055012657,zur,Transcription factor that is activated by and regulates the metabolism of zinc,Metal Related
57,SG_8,False,0.0054607598,,Single Gene iModulon 8,Single Gene
18,Unc_1,False,0.0053827386,,Uncharacterized iModulon 1,Uncharacterized
56,Fatty Acid Biosynthesis,False,-0.0051444988,trcR and Rv1776c and whiB4 ,"iModulon that maps to the intersection of the Rv1033c, Rv1776c, and Rv3681c regulons",Fatty Acid/Cholestrol
47,SG_7,False,0.0048165835,,Single Gene iModulon 7,Single Gene
3,PyrR,False,0.0047905109,pyrR,Transcription factor that regulates the expression of pyrimidine nucleotide operons,Nucleic Acids
26,EspL KO,False,0.0047790203,,Single Gene iModulon that captures EspL knockout,KO
63,SG_9,False,-0.0043974659000000004,,Single Gene iModulon 9,Single Gene
21,MprA,False,-0.0041401827,mprA,Transcription factor that regulates multiple stress responsive genes,Virulence/Persistence
77,Central Carbon Metabolism,False,0.0037971542,,iModulon enriched with the Central Carbon Metabolism KEGG pathway,Central Carbon
17,VirS,False,-0.0036902769,virS,Transcription factor that is activated and responds to acidic environments,Redox
35,Unc_4,False,-0.0036062868,,Uncharacterized iModulon 4,Uncharacterized
5,DevR-1,False,0.0032280095,devR,Transcription factor that is one of the primary regulators of hypoxia onset response,Redox
69,Rv0135+Rv1019,False,0.0028209322,Rv0135c and Rv1019,iModulon that maps to the intersection of the Rv0135c and Rv1019 regulons,Nucleic Acids
0,SigH,False,-0.0027408513,sigH,Sigma Factor involved in heat shock and oxidative stress response,Virulence/Persistence
37,Rv3095,False,-0.0026355131,Rv3095,iModulon labeled with predicted regulon with unknown function,Unknown Function
65,SG_10,False,0.0025444692000000002,,Single Gene iModulon 10,Single Gene
62,Rv2488c,False,0.0021870145,Rv2488c,LuxR family transcription factor that regulates genes associated with virulence,Virulence/Persistence
8,IdeR,False,-0.0014191821,ideR,Metal-Dependent DNA-Binding protein that controls genes related to iron metabolism,Metal Related
39,SigC,False,0.0012379597,sigC,Sigma Factor that plays a role in organism virulence and lethality,Virulence/Persistence
59,Rv0576,False,-0.0011553317000000001,Rv0576,Possible ArsR family transcription factor that regulates genes related to virulence,Virulence/Persistence
9,SigK,False,-0.0010367663,sigK,Sigma Factor involved in the production of antigenic proteins,Unknown Function
16,Mce3R,False,0.0009716777,mce3R,Transcription factor that regulates the mce3 virulence operon,Virulence/Persistence
13,SG_1,False,0.0007977375,,Single Gene iModulon 1,Single Gene
11,EccE1 KO,False,-0.0007807894000000001,,Single Gene iModulon that captures EccE1 knockout,KO
7,GroEL-GroES Complex,False,0.0007636247,,Gene Ontology Term specific to the bacterial chaperonin complex,Amino Acids
32,Unc_3,False,-0.0007261902,,Uncharacterized iModulon 3,Uncharacterized
31,ArgR,False,0.0007223487000000001,argR,Transcription factor that regulates the L-arginine biosynthesis pathways,Amino Acids
53,Rv1776c+WhiB4,False,0.0006687611000000001,Rv1776c and whiB4 ,iModulon that maps to the intersection of the Rv1776c and Rv3681c regulon,Redox
78,Positive Regulation of Growth,False,-0.0004919486000000001,,iModulon enriched with the Positive Regulation of Growth Gene Ontology term,Growth
25,Rv0078+Rv2034,False,-0.00047484700000000003,Rv0078 and Rv2034,iModulon that maps to the intersection of the Rv0078 and Rv2034 regulon,Antibiotic
36,Fumarate Reductase,False,0.00020879050000000002,,iModulon enriched with the Fumarate Reductase Gene Ontology term,Central Carbon
24,Salicylate Induced,False,-8.36156e-05,,Manually annotated iModulon where genes were found to change expression when exposed to salicylate,Metal Related
