k,Name,in_iM,gene_weight,Regulator,Function,Category
51,PhoP,False,0.0452523535,phoP,"Transcription factor that controls response to redox/acid stress, hypoxia, and virulence",Virulence/Persistence
66,M-box,False,-0.019548156,,Magnesium activated non-coding sRNA that regulates the function of genes associated with metal metabolism and virulence,Metal Related
70,Lsr2,False,-0.0159567749,lsr2,Sequence independent transcription factor that controls a wide variety of genes,Antibiotic
1,Polyketide Synthase Complex,False,-0.015814058000000002,,KEGG Map related to the synthesis of type II polyketide backbone ,Fatty Acid/Cholestrol
15,BkaR,False,0.015582334100000001,bkaR,Transcription factor that regulates genes related to branched-chain keto-acid metabolism,Central Carbon
17,VirS,False,-0.015191378600000001,virS,Transcription factor that is activated and responds to acidic environments,Redox
7,GroEL-GroES Complex,False,-0.014356421400000001,,Gene Ontology Term specific to the bacterial chaperonin complex,Amino Acids
67,Peptidoglycan Biosynthesis,False,-0.0142290421,,iModulon enriched with the Peptidoglycan biosyntehsis KEGG pathway,Central Carbon
21,MprA,False,0.0136750572,mprA,Transcription factor that regulates multiple stress responsive genes,Virulence/Persistence
24,Salicylate Induced,False,-0.012935830300000001,,Manually annotated iModulon where genes were found to change expression when exposed to salicylate,Metal Related
54,Unc_7,False,0.0128955887,,Uncharacterized iModulon 7,Uncharacterized
78,Positive Regulation of Growth,False,-0.011922064000000001,,iModulon enriched with the Positive Regulation of Growth Gene Ontology term,Growth
55,WhiB7,False,0.0115810459,whiB7,Transcription factor that connects systems for redox homeostasis and antibiotic resistance,Antibiotic
30,HPT-2b Induced,False,-0.0114654453,,iModulon regulates many genes that are activated by HPT-2b (1-hydroxy-5-R-pyridine-2(1H)-thiones),Metal Related
44,SG_6,False,-0.0107487282,,Single Genes iModulon 6,Single Gene
19,WhiB6,False,-0.0105523781,whiB6,Transcription factor that regulates ESX-1 system membrane transport proteins,Redox
58,Zur,False,-0.0105504762,zur,Transcription factor that is activated by and regulates the metabolism of zinc,Metal Related
12,Mycofactocin Synthesis Pathway,False,-0.010187616200000001,,Manually annotated iModulon that captures multiple genes associated with mycofactocin metabolism,Fatty Acid/Cholestrol
6,MarR,False,-0.0098475384,marR,Transcription factor that regulates the response to acid stress,Acid Stress
29,Blal,False,-0.0097170037,blaI,"Transcription regulator that regulates genes associated with antibiotic transport, detoxification, and cell wall function",Antibiotic
48,Leucine Related,False,0.0095286376,,Manually annotated iModulon with gene related to leucine metabolism,Amino Acids
2,IniR,False,0.009485263,iniR,Transcription factor that regulates the expression of the ini operon (iniBAC),Antibiotic
47,SG_7,False,-0.0090756098,,Single Gene iModulon 7,Single Gene
3,PyrR,False,0.0083134477,pyrR,Transcription factor that regulates the expression of pyrimidine nucleotide operons,Nucleic Acids
50,Unc_6,False,-0.0082726216,,Uncharacterized iModulon 6,Uncharacterized
5,DevR-1,False,-0.0081586127,devR,Transcription factor that is one of the primary regulators of hypoxia onset response,Redox
8,IdeR,False,-0.0075384829,ideR,Metal-Dependent DNA-Binding protein that controls genes related to iron metabolism,Metal Related
39,SigC,False,0.0075267032,sigC,Sigma Factor that plays a role in organism virulence and lethality,Virulence/Persistence
26,EspL KO,False,0.0069628822,,Single Gene iModulon that captures EspL knockout,KO
41,Unc_5,False,-0.0068547473,,Uncharacterized iModulon 5,Uncharacterized
37,Rv3095,False,-0.0068472533,Rv3095,iModulon labeled with predicted regulon with unknown function,Unknown Function
27,Unc_2,False,0.0067956295,,Uncharacterized iModulon 2,Uncharacterized
20,FasR,False,0.0064797046,fasR,Transcription factor that controls the expression of fatty acid metabolism genes,Fatty Acid/Cholestrol
14,SG_2,False,-0.0061301968,,Single Gene iModulon 2,Single Gene
45,SigD,False,-0.0060025255000000005,sigD,Sigma Factor that governs the expression of ribosomal genes and plays a role in virulence,Virulence/Persistence
4,WhiB4,False,-0.0059955836,whiB4,Redox-Responsive transcription regulator that regulates protection response during infection,Redox
46,Rv2621c,False,-0.0059197077,Rv2621c,iModulon labeled with predicted regulon with unknown function,Unknown Function
52,DevR-2,False,0.0057705509,devR,Transcription factor that is one of the primary regulators of hypoxia onset response,Redox
25,Rv0078+Rv2034,False,-0.0055011141,Rv0078 and Rv2034,iModulon that maps to the intersection of the Rv0078 and Rv2034 regulon,Antibiotic
42,Nicotinate Metabolism,False,0.0053779772,,iModulon enriched with the nicotinate and nicotinamide metabolism KEGG pathway,Central Carbon
49,Rv1828/SigH,False,0.0049150405000000005,Rv1828 or sigH,iModulon that maps to the union of the Rv1828 and Rv3223c regulons,Redox
74,SG_12,False,0.0048667046000000005,,Single Gene iModulon 12,Single Gene
53,Rv1776c+WhiB4,False,-0.0047889279,Rv1776c and whiB4 ,iModulon that maps to the intersection of the Rv1776c and Rv3681c regulon,Redox
38,SG_5,False,-0.004565792,,Single Gene iModulon 5,Single Gene
79,WhiB4/IdeR,False,0.0044883192,whiB4 or ideR,iModulon that maps to the union of the Rv3681c and Rv2711 regulons,Redox
43,LysG,False,-0.0044830269,lsyG,Transcription factor that controls the expression of LysE and requires lysine or histidine for activation ,Amino Acids
76,SG_13,False,0.0044693298000000005,,Single Gene iModulon 13,Single Gene
77,Central Carbon Metabolism,False,-0.004207244000000001,,iModulon enriched with the Central Carbon Metabolism KEGG pathway,Central Carbon
75,Unc_9,False,-0.0039235898,,Uncharacterized iModulon 9,Uncharacterized
13,SG_1,False,-0.0038836053,,Single Gene iModulon 1,Single Gene
59,Rv0576,False,-0.0038361920000000004,Rv0576,Possible ArsR family transcription factor that regulates genes related to virulence,Virulence/Persistence
69,Rv0135+Rv1019,False,-0.0036793222,Rv0135c and Rv1019,iModulon that maps to the intersection of the Rv0135c and Rv1019 regulons,Nucleic Acids
36,Fumarate Reductase,False,-0.0036495587,,iModulon enriched with the Fumarate Reductase Gene Ontology term,Central Carbon
10,RicR,False,0.0035663834,ricR,Copper responsive transcription factor that regulates metal metabolism genes,Metal Related
35,Unc_4,False,0.0034458583,,Uncharacterized iModulon 4,Uncharacterized
16,Mce3R,False,0.0033723929,mce3R,Transcription factor that regulates the mce3 virulence operon,Virulence/Persistence
34,MbcA+Rv3249c+Rv3066,False,-0.0032975192,mbcA and Rv3249c and Rv3066,"iModulon that maps to the intersection of the Rv1990c, Rv3249c, and Rv3066 regulons",Virulence/Persistence
64,Mce1R,False,-0.0031830312000000003,mce1R,Transcription factor that regulates the mce1 virulence operon,Virulence/Persistence
68,Sulfur Metabolism,False,-0.0031012113,,Kegg Map that displays the transport and metabolism of sulfur,Sulfur Metabolism
72,Unc_8,False,0.0030943878,,Uncharacterized iModulon 8,Uncharacterized
61,Nucleic Acid Hydrolysis ,False,-0.0028715014,,iModulon enriched with the Nucleic Acid Hydrolysis KEGG pathway,Nucleic Acids
31,ArgR,False,0.0028216103,argR,Transcription factor that regulates the L-arginine biosynthesis pathways,Amino Acids
32,Unc_3,False,-0.002720442,,Uncharacterized iModulon 3,Uncharacterized
22,SG_3,False,0.0025074237,,Single Gene iModulon 3,Single Gene
63,SG_9,False,-0.0024552213,,Single Gene iModulon 9,Single Gene
18,Unc_1,False,-0.0023687513,,Uncharacterized iModulon 1,Uncharacterized
71,PDIM;PGL Synthesis,False,0.0023439832,,Manually annotated iModulon that captures genes associated with PDIM and PGL synthesis,Virulence/Persistence
11,EccE1 KO,False,0.0023363824000000003,,Single Gene iModulon that captures EccE1 knockout,KO
0,SigH,False,0.0021999074,sigH,Sigma Factor involved in heat shock and oxidative stress response,Virulence/Persistence
62,Rv2488c,False,0.001954935,Rv2488c,LuxR family transcription factor that regulates genes associated with virulence,Virulence/Persistence
28,WhiB1,False,-0.0019414771,whiB1,"Transcription repressor that is redox responsive, found to be nitric oxide sensitive",Redox
9,SigK,False,-0.0018281029000000002,sigK,Sigma Factor involved in the production of antigenic proteins,Unknown Function
65,SG_10,False,-0.0017913693,,Single Gene iModulon 10,Single Gene
56,Fatty Acid Biosynthesis,False,-0.0017615239000000002,trcR and Rv1776c and whiB4 ,"iModulon that maps to the intersection of the Rv1033c, Rv1776c, and Rv3681c regulons",Fatty Acid/Cholestrol
73,SG_11,False,-0.0017566006,,Single Gene iModulon 11,Single Gene
23,PrpR,False,-0.0006848663,prpR,Transcription factor that is involved in catabolism of short chain fatty acids via gloxylate and methylcitrate cycle,Central Carbon
33,SG_4,False,0.0003560602,,Single Gene iModulon 4,Single Gene
40,KstR2,False,0.00027564850000000004,kstR2,Transcription factor that regulates a small regulon related to cholesterol utilization,Fatty Acid/Cholestrol
60,Rv0681,False,0.0001567285,Rv0681,"Transcription with previously unknown function, regulates core fatty acid response",Unknown Function
57,SG_8,False,9.21721e-05,,Single Gene iModulon 8,Single Gene
