k,Name,in_iM,gene_weight,Regulator,Function,Category
34,MbcA+Rv3249c+Rv3066,False,-0.0243129532,mbcA and Rv3249c and Rv3066,"iModulon that maps to the intersection of the Rv1990c, Rv3249c, and Rv3066 regulons",Virulence/Persistence
66,M-box,False,0.0200336385,,Magnesium activated non-coding sRNA that regulates the function of genes associated with metal metabolism and virulence,Metal Related
10,RicR,False,0.016426894600000002,ricR,Copper responsive transcription factor that regulates metal metabolism genes,Metal Related
22,SG_3,False,-0.0160820854,,Single Gene iModulon 3,Single Gene
9,SigK,False,0.013652305100000001,sigK,Sigma Factor involved in the production of antigenic proteins,Unknown Function
42,Nicotinate Metabolism,False,-0.0129778915,,iModulon enriched with the nicotinate and nicotinamide metabolism KEGG pathway,Central Carbon
41,Unc_5,False,0.0128412115,,Uncharacterized iModulon 5,Uncharacterized
12,Mycofactocin Synthesis Pathway,False,-0.012275938,,Manually annotated iModulon that captures multiple genes associated with mycofactocin metabolism,Fatty Acid/Cholestrol
71,PDIM;PGL Synthesis,False,-0.012058943400000001,,Manually annotated iModulon that captures genes associated with PDIM and PGL synthesis,Virulence/Persistence
67,Peptidoglycan Biosynthesis,False,-0.011250698200000001,,iModulon enriched with the Peptidoglycan biosyntehsis KEGG pathway,Central Carbon
8,IdeR,False,-0.0110126417,ideR,Metal-Dependent DNA-Binding protein that controls genes related to iron metabolism,Metal Related
15,BkaR,False,-0.0108241736,bkaR,Transcription factor that regulates genes related to branched-chain keto-acid metabolism,Central Carbon
46,Rv2621c,False,0.010801084,Rv2621c,iModulon labeled with predicted regulon with unknown function,Unknown Function
44,SG_6,False,-0.0107125017,,Single Genes iModulon 6,Single Gene
26,EspL KO,False,-0.0103395525,,Single Gene iModulon that captures EspL knockout,KO
23,PrpR,False,-0.0094912478,prpR,Transcription factor that is involved in catabolism of short chain fatty acids via gloxylate and methylcitrate cycle,Central Carbon
28,WhiB1,False,0.0094459417,whiB1,"Transcription repressor that is redox responsive, found to be nitric oxide sensitive",Redox
16,Mce3R,False,-0.0090392014,mce3R,Transcription factor that regulates the mce3 virulence operon,Virulence/Persistence
2,IniR,False,0.008984733,iniR,Transcription factor that regulates the expression of the ini operon (iniBAC),Antibiotic
38,SG_5,False,-0.0085090283,,Single Gene iModulon 5,Single Gene
32,Unc_3,False,-0.0083159941,,Uncharacterized iModulon 3,Uncharacterized
19,WhiB6,False,-0.0083107071,whiB6,Transcription factor that regulates ESX-1 system membrane transport proteins,Redox
30,HPT-2b Induced,False,-0.0081694326,,iModulon regulates many genes that are activated by HPT-2b (1-hydroxy-5-R-pyridine-2(1H)-thiones),Metal Related
21,MprA,False,-0.0081570027,mprA,Transcription factor that regulates multiple stress responsive genes,Virulence/Persistence
33,SG_4,False,0.0081433609,,Single Gene iModulon 4,Single Gene
76,SG_13,False,-0.007911942600000001,,Single Gene iModulon 13,Single Gene
24,Salicylate Induced,False,0.0076885351,,Manually annotated iModulon where genes were found to change expression when exposed to salicylate,Metal Related
54,Unc_7,False,-0.0076210932,,Uncharacterized iModulon 7,Uncharacterized
61,Nucleic Acid Hydrolysis ,False,0.0075263702,,iModulon enriched with the Nucleic Acid Hydrolysis KEGG pathway,Nucleic Acids
20,FasR,False,-0.0072190893,fasR,Transcription factor that controls the expression of fatty acid metabolism genes,Fatty Acid/Cholestrol
36,Fumarate Reductase,False,0.0065799903000000005,,iModulon enriched with the Fumarate Reductase Gene Ontology term,Central Carbon
37,Rv3095,False,-0.0062132085,Rv3095,iModulon labeled with predicted regulon with unknown function,Unknown Function
1,Polyketide Synthase Complex,False,-0.0061588681,,KEGG Map related to the synthesis of type II polyketide backbone ,Fatty Acid/Cholestrol
39,SigC,False,0.0061473576,sigC,Sigma Factor that plays a role in organism virulence and lethality,Virulence/Persistence
48,Leucine Related,False,-0.0060494057000000006,,Manually annotated iModulon with gene related to leucine metabolism,Amino Acids
58,Zur,False,-0.005899662,zur,Transcription factor that is activated by and regulates the metabolism of zinc,Metal Related
27,Unc_2,False,-0.0057915359,,Uncharacterized iModulon 2,Uncharacterized
7,GroEL-GroES Complex,False,0.0053598704,,Gene Ontology Term specific to the bacterial chaperonin complex,Amino Acids
35,Unc_4,False,-0.005115228800000001,,Uncharacterized iModulon 4,Uncharacterized
50,Unc_6,False,0.0050992169,,Uncharacterized iModulon 6,Uncharacterized
6,MarR,False,-0.0050451232,marR,Transcription factor that regulates the response to acid stress,Acid Stress
62,Rv2488c,False,-0.0050269581,Rv2488c,LuxR family transcription factor that regulates genes associated with virulence,Virulence/Persistence
79,WhiB4/IdeR,False,-0.004754258700000001,whiB4 or ideR,iModulon that maps to the union of the Rv3681c and Rv2711 regulons,Redox
73,SG_11,False,0.0047412661000000005,,Single Gene iModulon 11,Single Gene
77,Central Carbon Metabolism,False,-0.0044638157,,iModulon enriched with the Central Carbon Metabolism KEGG pathway,Central Carbon
68,Sulfur Metabolism,False,-0.0044068867,,Kegg Map that displays the transport and metabolism of sulfur,Sulfur Metabolism
70,Lsr2,False,0.004294402100000001,lsr2,Sequence independent transcription factor that controls a wide variety of genes,Antibiotic
47,SG_7,False,0.0042364431,,Single Gene iModulon 7,Single Gene
4,WhiB4,False,0.0040331869,whiB4,Redox-Responsive transcription regulator that regulates protection response during infection,Redox
60,Rv0681,False,-0.003535654,Rv0681,"Transcription with previously unknown function, regulates core fatty acid response",Unknown Function
14,SG_2,False,0.0034267638,,Single Gene iModulon 2,Single Gene
3,PyrR,False,-0.0031381571,pyrR,Transcription factor that regulates the expression of pyrimidine nucleotide operons,Nucleic Acids
29,Blal,False,0.0028982733,blaI,"Transcription regulator that regulates genes associated with antibiotic transport, detoxification, and cell wall function",Antibiotic
56,Fatty Acid Biosynthesis,False,-0.0028401218,trcR and Rv1776c and whiB4 ,"iModulon that maps to the intersection of the Rv1033c, Rv1776c, and Rv3681c regulons",Fatty Acid/Cholestrol
13,SG_1,False,-0.0027367799000000003,,Single Gene iModulon 1,Single Gene
31,ArgR,False,0.0027108492,argR,Transcription factor that regulates the L-arginine biosynthesis pathways,Amino Acids
52,DevR-2,False,0.0024627655,devR,Transcription factor that is one of the primary regulators of hypoxia onset response,Redox
64,Mce1R,False,0.0023864549,mce1R,Transcription factor that regulates the mce1 virulence operon,Virulence/Persistence
59,Rv0576,False,0.0023339246,Rv0576,Possible ArsR family transcription factor that regulates genes related to virulence,Virulence/Persistence
53,Rv1776c+WhiB4,False,0.0022192336,Rv1776c and whiB4 ,iModulon that maps to the intersection of the Rv1776c and Rv3681c regulon,Redox
18,Unc_1,False,0.0020555724,,Uncharacterized iModulon 1,Uncharacterized
0,SigH,False,-0.0019999227,sigH,Sigma Factor involved in heat shock and oxidative stress response,Virulence/Persistence
51,PhoP,False,0.0019350365000000002,phoP,"Transcription factor that controls response to redox/acid stress, hypoxia, and virulence",Virulence/Persistence
25,Rv0078+Rv2034,False,-0.0018887224000000002,Rv0078 and Rv2034,iModulon that maps to the intersection of the Rv0078 and Rv2034 regulon,Antibiotic
43,LysG,False,-0.0018544064,lsyG,Transcription factor that controls the expression of LysE and requires lysine or histidine for activation ,Amino Acids
74,SG_12,False,-0.0017524475,,Single Gene iModulon 12,Single Gene
57,SG_8,False,0.0016667422,,Single Gene iModulon 8,Single Gene
63,SG_9,False,0.0014551263,,Single Gene iModulon 9,Single Gene
78,Positive Regulation of Growth,False,-0.0014385514,,iModulon enriched with the Positive Regulation of Growth Gene Ontology term,Growth
5,DevR-1,False,-0.0014066634,devR,Transcription factor that is one of the primary regulators of hypoxia onset response,Redox
55,WhiB7,False,0.0013726349,whiB7,Transcription factor that connects systems for redox homeostasis and antibiotic resistance,Antibiotic
40,KstR2,False,0.0013531787,kstR2,Transcription factor that regulates a small regulon related to cholesterol utilization,Fatty Acid/Cholestrol
49,Rv1828/SigH,False,0.0012785525,Rv1828 or sigH,iModulon that maps to the union of the Rv1828 and Rv3223c regulons,Redox
17,VirS,False,0.0012044444,virS,Transcription factor that is activated and responds to acidic environments,Redox
11,EccE1 KO,False,0.0007281775,,Single Gene iModulon that captures EccE1 knockout,KO
69,Rv0135+Rv1019,False,-0.0005234278,Rv0135c and Rv1019,iModulon that maps to the intersection of the Rv0135c and Rv1019 regulons,Nucleic Acids
45,SigD,False,-0.0003826298,sigD,Sigma Factor that governs the expression of ribosomal genes and plays a role in virulence,Virulence/Persistence
65,SG_10,False,-0.0003486664,,Single Gene iModulon 10,Single Gene
75,Unc_9,False,7.67317e-05,,Uncharacterized iModulon 9,Uncharacterized
72,Unc_8,False,2.5295400000000002e-05,,Uncharacterized iModulon 8,Uncharacterized
