k,Name,in_iM,gene_weight,Regulator,Function,Category
44,SG_6,False,0.0358454879,,Single Genes iModulon 6,Single Gene
26,EspL KO,False,-0.0335428068,,Single Gene iModulon that captures EspL knockout,KO
13,SG_1,False,-0.032608136100000004,,Single Gene iModulon 1,Single Gene
36,Fumarate Reductase,False,0.0307036724,,iModulon enriched with the Fumarate Reductase Gene Ontology term,Central Carbon
16,Mce3R,False,0.028602845000000002,mce3R,Transcription factor that regulates the mce3 virulence operon,Virulence/Persistence
79,WhiB4/IdeR,False,-0.0267221952,whiB4 or ideR,iModulon that maps to the union of the Rv3681c and Rv2711 regulons,Redox
33,SG_4,False,0.0240408443,,Single Gene iModulon 4,Single Gene
22,SG_3,False,-0.0237688497,,Single Gene iModulon 3,Single Gene
24,Salicylate Induced,False,-0.0223286471,,Manually annotated iModulon where genes were found to change expression when exposed to salicylate,Metal Related
55,WhiB7,False,0.0194003936,whiB7,Transcription factor that connects systems for redox homeostasis and antibiotic resistance,Antibiotic
56,Fatty Acid Biosynthesis,False,0.0189358933,trcR and Rv1776c and whiB4 ,"iModulon that maps to the intersection of the Rv1033c, Rv1776c, and Rv3681c regulons",Fatty Acid/Cholestrol
42,Nicotinate Metabolism,False,0.0181536357,,iModulon enriched with the nicotinate and nicotinamide metabolism KEGG pathway,Central Carbon
70,Lsr2,False,-0.0176127858,lsr2,Sequence independent transcription factor that controls a wide variety of genes,Antibiotic
72,Unc_8,False,0.0173559255,,Uncharacterized iModulon 8,Uncharacterized
14,SG_2,False,0.0167519288,,Single Gene iModulon 2,Single Gene
46,Rv2621c,False,-0.0163095851,Rv2621c,iModulon labeled with predicted regulon with unknown function,Unknown Function
39,SigC,False,-0.0160459115,sigC,Sigma Factor that plays a role in organism virulence and lethality,Virulence/Persistence
0,SigH,False,0.0151625196,sigH,Sigma Factor involved in heat shock and oxidative stress response,Virulence/Persistence
69,Rv0135+Rv1019,False,0.014667438500000001,Rv0135c and Rv1019,iModulon that maps to the intersection of the Rv0135c and Rv1019 regulons,Nucleic Acids
45,SigD,False,-0.0145433505,sigD,Sigma Factor that governs the expression of ribosomal genes and plays a role in virulence,Virulence/Persistence
61,Nucleic Acid Hydrolysis ,False,0.0137751057,,iModulon enriched with the Nucleic Acid Hydrolysis KEGG pathway,Nucleic Acids
17,VirS,False,-0.0134985434,virS,Transcription factor that is activated and responds to acidic environments,Redox
75,Unc_9,False,0.013096145100000001,,Uncharacterized iModulon 9,Uncharacterized
25,Rv0078+Rv2034,False,0.0129363176,Rv0078 and Rv2034,iModulon that maps to the intersection of the Rv0078 and Rv2034 regulon,Antibiotic
34,MbcA+Rv3249c+Rv3066,False,0.0127087403,mbcA and Rv3249c and Rv3066,"iModulon that maps to the intersection of the Rv1990c, Rv3249c, and Rv3066 regulons",Virulence/Persistence
19,WhiB6,False,-0.012604557,whiB6,Transcription factor that regulates ESX-1 system membrane transport proteins,Redox
66,M-box,False,0.0117654705,,Magnesium activated non-coding sRNA that regulates the function of genes associated with metal metabolism and virulence,Metal Related
58,Zur,False,0.011511803000000001,zur,Transcription factor that is activated by and regulates the metabolism of zinc,Metal Related
53,Rv1776c+WhiB4,False,-0.0114150837,Rv1776c and whiB4 ,iModulon that maps to the intersection of the Rv1776c and Rv3681c regulon,Redox
6,MarR,False,0.0111102952,marR,Transcription factor that regulates the response to acid stress,Acid Stress
47,SG_7,False,-0.0110201744,,Single Gene iModulon 7,Single Gene
65,SG_10,False,0.0106263318,,Single Gene iModulon 10,Single Gene
51,PhoP,False,-0.0104568187,phoP,"Transcription factor that controls response to redox/acid stress, hypoxia, and virulence",Virulence/Persistence
32,Unc_3,False,-0.0104141517,,Uncharacterized iModulon 3,Uncharacterized
50,Unc_6,False,0.0102918854,,Uncharacterized iModulon 6,Uncharacterized
20,FasR,False,-0.009563346,fasR,Transcription factor that controls the expression of fatty acid metabolism genes,Fatty Acid/Cholestrol
10,RicR,False,-0.009419341500000001,ricR,Copper responsive transcription factor that regulates metal metabolism genes,Metal Related
73,SG_11,False,0.0092089236,,Single Gene iModulon 11,Single Gene
60,Rv0681,False,0.00894436,Rv0681,"Transcription with previously unknown function, regulates core fatty acid response",Unknown Function
76,SG_13,False,-0.0089314826,,Single Gene iModulon 13,Single Gene
7,GroEL-GroES Complex,False,-0.0085065938,,Gene Ontology Term specific to the bacterial chaperonin complex,Amino Acids
67,Peptidoglycan Biosynthesis,False,-0.008411350100000001,,iModulon enriched with the Peptidoglycan biosyntehsis KEGG pathway,Central Carbon
30,HPT-2b Induced,False,-0.008370061600000001,,iModulon regulates many genes that are activated by HPT-2b (1-hydroxy-5-R-pyridine-2(1H)-thiones),Metal Related
31,ArgR,False,0.0078122575,argR,Transcription factor that regulates the L-arginine biosynthesis pathways,Amino Acids
57,SG_8,False,-0.0076954386,,Single Gene iModulon 8,Single Gene
21,MprA,False,-0.007550527400000001,mprA,Transcription factor that regulates multiple stress responsive genes,Virulence/Persistence
54,Unc_7,False,-0.007533649000000001,,Uncharacterized iModulon 7,Uncharacterized
38,SG_5,False,0.0063208691,,Single Gene iModulon 5,Single Gene
40,KstR2,False,-0.0062877953,kstR2,Transcription factor that regulates a small regulon related to cholesterol utilization,Fatty Acid/Cholestrol
43,LysG,False,0.0062174725000000005,lsyG,Transcription factor that controls the expression of LysE and requires lysine or histidine for activation ,Amino Acids
48,Leucine Related,False,0.0060370243,,Manually annotated iModulon with gene related to leucine metabolism,Amino Acids
27,Unc_2,False,-0.005478506,,Uncharacterized iModulon 2,Uncharacterized
23,PrpR,False,-0.005399674100000001,prpR,Transcription factor that is involved in catabolism of short chain fatty acids via gloxylate and methylcitrate cycle,Central Carbon
1,Polyketide Synthase Complex,False,0.0052990781,,KEGG Map related to the synthesis of type II polyketide backbone ,Fatty Acid/Cholestrol
18,Unc_1,False,0.0050005183,,Uncharacterized iModulon 1,Uncharacterized
49,Rv1828/SigH,False,0.004952307,Rv1828 or sigH,iModulon that maps to the union of the Rv1828 and Rv3223c regulons,Redox
3,PyrR,False,-0.0048139131,pyrR,Transcription factor that regulates the expression of pyrimidine nucleotide operons,Nucleic Acids
63,SG_9,False,0.0044161989,,Single Gene iModulon 9,Single Gene
9,SigK,False,-0.0042822295,sigK,Sigma Factor involved in the production of antigenic proteins,Unknown Function
37,Rv3095,False,0.0038235823,Rv3095,iModulon labeled with predicted regulon with unknown function,Unknown Function
8,IdeR,False,0.0037205273,ideR,Metal-Dependent DNA-Binding protein that controls genes related to iron metabolism,Metal Related
64,Mce1R,False,-0.0036673026,mce1R,Transcription factor that regulates the mce1 virulence operon,Virulence/Persistence
12,Mycofactocin Synthesis Pathway,False,-0.0031870636,,Manually annotated iModulon that captures multiple genes associated with mycofactocin metabolism,Fatty Acid/Cholestrol
68,Sulfur Metabolism,False,0.0031625348,,Kegg Map that displays the transport and metabolism of sulfur,Sulfur Metabolism
15,BkaR,False,0.0031439228000000002,bkaR,Transcription factor that regulates genes related to branched-chain keto-acid metabolism,Central Carbon
35,Unc_4,False,0.0029454091,,Uncharacterized iModulon 4,Uncharacterized
28,WhiB1,False,0.0028711193,whiB1,"Transcription repressor that is redox responsive, found to be nitric oxide sensitive",Redox
11,EccE1 KO,False,0.0028064748,,Single Gene iModulon that captures EccE1 knockout,KO
52,DevR-2,False,-0.0026077909,devR,Transcription factor that is one of the primary regulators of hypoxia onset response,Redox
4,WhiB4,False,-0.0023487422,whiB4,Redox-Responsive transcription regulator that regulates protection response during infection,Redox
78,Positive Regulation of Growth,False,-0.0019225725000000002,,iModulon enriched with the Positive Regulation of Growth Gene Ontology term,Growth
74,SG_12,False,0.0018560482,,Single Gene iModulon 12,Single Gene
5,DevR-1,False,-0.0017839154,devR,Transcription factor that is one of the primary regulators of hypoxia onset response,Redox
2,IniR,False,0.0014207175000000001,iniR,Transcription factor that regulates the expression of the ini operon (iniBAC),Antibiotic
41,Unc_5,False,0.0012628960000000001,,Uncharacterized iModulon 5,Uncharacterized
77,Central Carbon Metabolism,False,-0.0012073656,,iModulon enriched with the Central Carbon Metabolism KEGG pathway,Central Carbon
71,PDIM;PGL Synthesis,False,0.0006435698,,Manually annotated iModulon that captures genes associated with PDIM and PGL synthesis,Virulence/Persistence
29,Blal,False,-0.0004609223,blaI,"Transcription regulator that regulates genes associated with antibiotic transport, detoxification, and cell wall function",Antibiotic
62,Rv2488c,False,-0.0003805964,Rv2488c,LuxR family transcription factor that regulates genes associated with virulence,Virulence/Persistence
59,Rv0576,False,9.633640000000001e-05,Rv0576,Possible ArsR family transcription factor that regulates genes related to virulence,Virulence/Persistence
