k,Name,in_iM,gene_weight,Regulator,Function,Category
55,WhiB7,True,0.2913289525,whiB7,Transcription factor that connects systems for redox homeostasis and antibiotic resistance,Antibiotic
56,Fatty Acid Biosynthesis,False,0.034010170400000005,trcR and Rv1776c and whiB4 ,"iModulon that maps to the intersection of the Rv1033c, Rv1776c, and Rv3681c regulons",Fatty Acid/Cholestrol
43,LysG,False,-0.0327999487,lsyG,Transcription factor that controls the expression of LysE and requires lysine or histidine for activation ,Amino Acids
60,Rv0681,False,-0.0294967823,Rv0681,"Transcription with previously unknown function, regulates core fatty acid response",Unknown Function
16,Mce3R,False,-0.0294697852,mce3R,Transcription factor that regulates the mce3 virulence operon,Virulence/Persistence
12,Mycofactocin Synthesis Pathway,False,-0.0281304931,,Manually annotated iModulon that captures multiple genes associated with mycofactocin metabolism,Fatty Acid/Cholestrol
59,Rv0576,False,0.0271091964,Rv0576,Possible ArsR family transcription factor that regulates genes related to virulence,Virulence/Persistence
72,Unc_8,False,-0.024629065800000002,,Uncharacterized iModulon 8,Uncharacterized
53,Rv1776c+WhiB4,False,-0.0242809476,Rv1776c and whiB4 ,iModulon that maps to the intersection of the Rv1776c and Rv3681c regulon,Redox
24,Salicylate Induced,False,0.0204597314,,Manually annotated iModulon where genes were found to change expression when exposed to salicylate,Metal Related
8,IdeR,False,0.019344698,ideR,Metal-Dependent DNA-Binding protein that controls genes related to iron metabolism,Metal Related
29,Blal,False,0.0181868969,blaI,"Transcription regulator that regulates genes associated with antibiotic transport, detoxification, and cell wall function",Antibiotic
71,PDIM;PGL Synthesis,False,0.018002415100000002,,Manually annotated iModulon that captures genes associated with PDIM and PGL synthesis,Virulence/Persistence
50,Unc_6,False,-0.0176360408,,Uncharacterized iModulon 6,Uncharacterized
39,SigC,False,0.017433633100000002,sigC,Sigma Factor that plays a role in organism virulence and lethality,Virulence/Persistence
18,Unc_1,False,-0.0159087425,,Uncharacterized iModulon 1,Uncharacterized
66,M-box,False,-0.0157113473,,Magnesium activated non-coding sRNA that regulates the function of genes associated with metal metabolism and virulence,Metal Related
15,BkaR,False,-0.0151068217,bkaR,Transcription factor that regulates genes related to branched-chain keto-acid metabolism,Central Carbon
30,HPT-2b Induced,False,-0.015006827700000001,,iModulon regulates many genes that are activated by HPT-2b (1-hydroxy-5-R-pyridine-2(1H)-thiones),Metal Related
25,Rv0078+Rv2034,False,-0.0146269832,Rv0078 and Rv2034,iModulon that maps to the intersection of the Rv0078 and Rv2034 regulon,Antibiotic
46,Rv2621c,False,-0.0142421583,Rv2621c,iModulon labeled with predicted regulon with unknown function,Unknown Function
61,Nucleic Acid Hydrolysis ,False,-0.012234081400000001,,iModulon enriched with the Nucleic Acid Hydrolysis KEGG pathway,Nucleic Acids
19,WhiB6,False,0.0119375746,whiB6,Transcription factor that regulates ESX-1 system membrane transport proteins,Redox
32,Unc_3,False,-0.011784444500000001,,Uncharacterized iModulon 3,Uncharacterized
63,SG_9,False,-0.011223129600000001,,Single Gene iModulon 9,Single Gene
23,PrpR,False,0.0112058322,prpR,Transcription factor that is involved in catabolism of short chain fatty acids via gloxylate and methylcitrate cycle,Central Carbon
11,EccE1 KO,False,-0.0109848965,,Single Gene iModulon that captures EccE1 knockout,KO
75,Unc_9,False,-0.0100516275,,Uncharacterized iModulon 9,Uncharacterized
31,ArgR,False,-0.0100082431,argR,Transcription factor that regulates the L-arginine biosynthesis pathways,Amino Acids
27,Unc_2,False,-0.0098422935,,Uncharacterized iModulon 2,Uncharacterized
74,SG_12,False,0.0097658303,,Single Gene iModulon 12,Single Gene
21,MprA,False,-0.008961285900000001,mprA,Transcription factor that regulates multiple stress responsive genes,Virulence/Persistence
4,WhiB4,False,-0.0084728878,whiB4,Redox-Responsive transcription regulator that regulates protection response during infection,Redox
37,Rv3095,False,-0.0081891024,Rv3095,iModulon labeled with predicted regulon with unknown function,Unknown Function
70,Lsr2,False,0.0080423625,lsr2,Sequence independent transcription factor that controls a wide variety of genes,Antibiotic
79,WhiB4/IdeR,False,0.0080000138,whiB4 or ideR,iModulon that maps to the union of the Rv3681c and Rv2711 regulons,Redox
73,SG_11,False,-0.0078083669000000005,,Single Gene iModulon 11,Single Gene
65,SG_10,False,0.007776814000000001,,Single Gene iModulon 10,Single Gene
20,FasR,False,-0.0076731584,fasR,Transcription factor that controls the expression of fatty acid metabolism genes,Fatty Acid/Cholestrol
62,Rv2488c,False,0.0071150480000000006,Rv2488c,LuxR family transcription factor that regulates genes associated with virulence,Virulence/Persistence
41,Unc_5,False,-0.0070902396,,Uncharacterized iModulon 5,Uncharacterized
76,SG_13,False,0.006943804400000001,,Single Gene iModulon 13,Single Gene
6,MarR,False,-0.0066624941,marR,Transcription factor that regulates the response to acid stress,Acid Stress
49,Rv1828/SigH,False,0.0065935319000000004,Rv1828 or sigH,iModulon that maps to the union of the Rv1828 and Rv3223c regulons,Redox
9,SigK,False,-0.0062672063000000005,sigK,Sigma Factor involved in the production of antigenic proteins,Unknown Function
48,Leucine Related,False,-0.0062388477,,Manually annotated iModulon with gene related to leucine metabolism,Amino Acids
22,SG_3,False,-0.0055962377,,Single Gene iModulon 3,Single Gene
57,SG_8,False,0.0048102167,,Single Gene iModulon 8,Single Gene
52,DevR-2,False,0.0046512062,devR,Transcription factor that is one of the primary regulators of hypoxia onset response,Redox
33,SG_4,False,-0.0045255172,,Single Gene iModulon 4,Single Gene
14,SG_2,False,-0.0043319083,,Single Gene iModulon 2,Single Gene
44,SG_6,False,0.0041335044,,Single Genes iModulon 6,Single Gene
35,Unc_4,False,0.0038334935,,Uncharacterized iModulon 4,Uncharacterized
67,Peptidoglycan Biosynthesis,False,0.003816232,,iModulon enriched with the Peptidoglycan biosyntehsis KEGG pathway,Central Carbon
77,Central Carbon Metabolism,False,-0.0037574862,,iModulon enriched with the Central Carbon Metabolism KEGG pathway,Central Carbon
7,GroEL-GroES Complex,False,-0.0036198845,,Gene Ontology Term specific to the bacterial chaperonin complex,Amino Acids
17,VirS,False,-0.0032032667,virS,Transcription factor that is activated and responds to acidic environments,Redox
64,Mce1R,False,-0.0030046810000000004,mce1R,Transcription factor that regulates the mce1 virulence operon,Virulence/Persistence
68,Sulfur Metabolism,False,-0.0029464183000000002,,Kegg Map that displays the transport and metabolism of sulfur,Sulfur Metabolism
0,SigH,False,-0.0027163352,sigH,Sigma Factor involved in heat shock and oxidative stress response,Virulence/Persistence
13,SG_1,False,0.0026646162,,Single Gene iModulon 1,Single Gene
69,Rv0135+Rv1019,False,0.0021505279,Rv0135c and Rv1019,iModulon that maps to the intersection of the Rv0135c and Rv1019 regulons,Nucleic Acids
51,PhoP,False,-0.0020306686,phoP,"Transcription factor that controls response to redox/acid stress, hypoxia, and virulence",Virulence/Persistence
54,Unc_7,False,0.0019255706000000001,,Uncharacterized iModulon 7,Uncharacterized
3,PyrR,False,0.0018663341000000001,pyrR,Transcription factor that regulates the expression of pyrimidine nucleotide operons,Nucleic Acids
40,KstR2,False,0.0014078048,kstR2,Transcription factor that regulates a small regulon related to cholesterol utilization,Fatty Acid/Cholestrol
34,MbcA+Rv3249c+Rv3066,False,-0.0012342778,mbcA and Rv3249c and Rv3066,"iModulon that maps to the intersection of the Rv1990c, Rv3249c, and Rv3066 regulons",Virulence/Persistence
28,WhiB1,False,-0.0011750729,whiB1,"Transcription repressor that is redox responsive, found to be nitric oxide sensitive",Redox
36,Fumarate Reductase,False,0.0011446312,,iModulon enriched with the Fumarate Reductase Gene Ontology term,Central Carbon
38,SG_5,False,0.0011162483000000001,,Single Gene iModulon 5,Single Gene
45,SigD,False,0.0010385896000000001,sigD,Sigma Factor that governs the expression of ribosomal genes and plays a role in virulence,Virulence/Persistence
5,DevR-1,False,0.0010182114000000001,devR,Transcription factor that is one of the primary regulators of hypoxia onset response,Redox
47,SG_7,False,0.0006384969,,Single Gene iModulon 7,Single Gene
1,Polyketide Synthase Complex,False,-0.0005613217000000001,,KEGG Map related to the synthesis of type II polyketide backbone ,Fatty Acid/Cholestrol
58,Zur,False,-0.0004630683,zur,Transcription factor that is activated by and regulates the metabolism of zinc,Metal Related
42,Nicotinate Metabolism,False,0.0004530906,,iModulon enriched with the nicotinate and nicotinamide metabolism KEGG pathway,Central Carbon
78,Positive Regulation of Growth,False,-0.0004068392,,iModulon enriched with the Positive Regulation of Growth Gene Ontology term,Growth
2,IniR,False,9.84505e-05,iniR,Transcription factor that regulates the expression of the ini operon (iniBAC),Antibiotic
26,EspL KO,False,9.770880000000001e-05,,Single Gene iModulon that captures EspL knockout,KO
10,RicR,False,-9.65021e-05,ricR,Copper responsive transcription factor that regulates metal metabolism genes,Metal Related
