k,Name,in_iM,gene_weight,Regulator,Function,Category
54,Unc_7,False,0.06987867390000001,,Uncharacterized iModulon 7,Uncharacterized
3,PyrR,False,0.029353469400000002,pyrR,Transcription factor that regulates the expression of pyrimidine nucleotide operons,Nucleic Acids
20,FasR,False,-0.0175582494,fasR,Transcription factor that controls the expression of fatty acid metabolism genes,Fatty Acid/Cholestrol
31,ArgR,False,-0.0174413541,argR,Transcription factor that regulates the L-arginine biosynthesis pathways,Amino Acids
17,VirS,False,-0.016325688,virS,Transcription factor that is activated and responds to acidic environments,Redox
32,Unc_3,False,0.0155101765,,Uncharacterized iModulon 3,Uncharacterized
75,Unc_9,False,-0.0142306654,,Uncharacterized iModulon 9,Uncharacterized
33,SG_4,False,-0.0136617599,,Single Gene iModulon 4,Single Gene
46,Rv2621c,False,-0.0128598518,Rv2621c,iModulon labeled with predicted regulon with unknown function,Unknown Function
1,Polyketide Synthase Complex,False,-0.012067518400000001,,KEGG Map related to the synthesis of type II polyketide backbone ,Fatty Acid/Cholestrol
22,SG_3,False,-0.0114232245,,Single Gene iModulon 3,Single Gene
2,IniR,False,-0.011248725900000001,iniR,Transcription factor that regulates the expression of the ini operon (iniBAC),Antibiotic
0,SigH,False,-0.010851336000000001,sigH,Sigma Factor involved in heat shock and oxidative stress response,Virulence/Persistence
26,EspL KO,False,0.0107983313,,Single Gene iModulon that captures EspL knockout,KO
37,Rv3095,False,0.0107744296,Rv3095,iModulon labeled with predicted regulon with unknown function,Unknown Function
39,SigC,False,0.0101805848,sigC,Sigma Factor that plays a role in organism virulence and lethality,Virulence/Persistence
16,Mce3R,False,0.0101743437,mce3R,Transcription factor that regulates the mce3 virulence operon,Virulence/Persistence
6,MarR,False,-0.0101074313,marR,Transcription factor that regulates the response to acid stress,Acid Stress
62,Rv2488c,False,-0.0096976661,Rv2488c,LuxR family transcription factor that regulates genes associated with virulence,Virulence/Persistence
4,WhiB4,False,0.0088196844,whiB4,Redox-Responsive transcription regulator that regulates protection response during infection,Redox
59,Rv0576,False,-0.0087907233,Rv0576,Possible ArsR family transcription factor that regulates genes related to virulence,Virulence/Persistence
71,PDIM;PGL Synthesis,False,-0.008598691700000001,,Manually annotated iModulon that captures genes associated with PDIM and PGL synthesis,Virulence/Persistence
74,SG_12,False,0.008407416000000001,,Single Gene iModulon 12,Single Gene
24,Salicylate Induced,False,-0.008023430600000001,,Manually annotated iModulon where genes were found to change expression when exposed to salicylate,Metal Related
78,Positive Regulation of Growth,False,0.007918641,,iModulon enriched with the Positive Regulation of Growth Gene Ontology term,Growth
12,Mycofactocin Synthesis Pathway,False,0.0077161088000000004,,Manually annotated iModulon that captures multiple genes associated with mycofactocin metabolism,Fatty Acid/Cholestrol
42,Nicotinate Metabolism,False,-0.0071405512,,iModulon enriched with the nicotinate and nicotinamide metabolism KEGG pathway,Central Carbon
79,WhiB4/IdeR,False,0.0069060416,whiB4 or ideR,iModulon that maps to the union of the Rv3681c and Rv2711 regulons,Redox
48,Leucine Related,False,-0.0068170348,,Manually annotated iModulon with gene related to leucine metabolism,Amino Acids
58,Zur,False,-0.006775635800000001,zur,Transcription factor that is activated by and regulates the metabolism of zinc,Metal Related
40,KstR2,False,-0.0064209621,kstR2,Transcription factor that regulates a small regulon related to cholesterol utilization,Fatty Acid/Cholestrol
11,EccE1 KO,False,-0.006201756100000001,,Single Gene iModulon that captures EccE1 knockout,KO
76,SG_13,False,-0.0061759984,,Single Gene iModulon 13,Single Gene
34,MbcA+Rv3249c+Rv3066,False,-0.0059988229,mbcA and Rv3249c and Rv3066,"iModulon that maps to the intersection of the Rv1990c, Rv3249c, and Rv3066 regulons",Virulence/Persistence
60,Rv0681,False,0.0059505339,Rv0681,"Transcription with previously unknown function, regulates core fatty acid response",Unknown Function
41,Unc_5,False,0.0056913975000000006,,Uncharacterized iModulon 5,Uncharacterized
10,RicR,False,-0.005688597,ricR,Copper responsive transcription factor that regulates metal metabolism genes,Metal Related
28,WhiB1,False,0.005513844600000001,whiB1,"Transcription repressor that is redox responsive, found to be nitric oxide sensitive",Redox
44,SG_6,False,-0.005152738400000001,,Single Genes iModulon 6,Single Gene
25,Rv0078+Rv2034,False,0.005010447,Rv0078 and Rv2034,iModulon that maps to the intersection of the Rv0078 and Rv2034 regulon,Antibiotic
61,Nucleic Acid Hydrolysis ,False,-0.0050025203,,iModulon enriched with the Nucleic Acid Hydrolysis KEGG pathway,Nucleic Acids
19,WhiB6,False,0.0049631975000000005,whiB6,Transcription factor that regulates ESX-1 system membrane transport proteins,Redox
51,PhoP,False,0.0047919703,phoP,"Transcription factor that controls response to redox/acid stress, hypoxia, and virulence",Virulence/Persistence
14,SG_2,False,0.0046694322,,Single Gene iModulon 2,Single Gene
21,MprA,False,-0.0045240356,mprA,Transcription factor that regulates multiple stress responsive genes,Virulence/Persistence
38,SG_5,False,0.004424761,,Single Gene iModulon 5,Single Gene
72,Unc_8,False,-0.0043376909,,Uncharacterized iModulon 8,Uncharacterized
27,Unc_2,False,0.0043025085,,Uncharacterized iModulon 2,Uncharacterized
68,Sulfur Metabolism,False,0.0041998420000000005,,Kegg Map that displays the transport and metabolism of sulfur,Sulfur Metabolism
23,PrpR,False,-0.0040444385,prpR,Transcription factor that is involved in catabolism of short chain fatty acids via gloxylate and methylcitrate cycle,Central Carbon
47,SG_7,False,-0.0039825415,,Single Gene iModulon 7,Single Gene
45,SigD,False,-0.0039125585,sigD,Sigma Factor that governs the expression of ribosomal genes and plays a role in virulence,Virulence/Persistence
35,Unc_4,False,0.0037227885,,Uncharacterized iModulon 4,Uncharacterized
56,Fatty Acid Biosynthesis,False,-0.0036694479,trcR and Rv1776c and whiB4 ,"iModulon that maps to the intersection of the Rv1033c, Rv1776c, and Rv3681c regulons",Fatty Acid/Cholestrol
63,SG_9,False,0.0036472317,,Single Gene iModulon 9,Single Gene
29,Blal,False,0.0033637112,blaI,"Transcription regulator that regulates genes associated with antibiotic transport, detoxification, and cell wall function",Antibiotic
13,SG_1,False,0.0032027643,,Single Gene iModulon 1,Single Gene
57,SG_8,False,-0.0029447985,,Single Gene iModulon 8,Single Gene
30,HPT-2b Induced,False,0.0025670278,,iModulon regulates many genes that are activated by HPT-2b (1-hydroxy-5-R-pyridine-2(1H)-thiones),Metal Related
64,Mce1R,False,0.0025663909000000003,mce1R,Transcription factor that regulates the mce1 virulence operon,Virulence/Persistence
55,WhiB7,False,-0.0024719554,whiB7,Transcription factor that connects systems for redox homeostasis and antibiotic resistance,Antibiotic
43,LysG,False,-0.0023647976000000003,lsyG,Transcription factor that controls the expression of LysE and requires lysine or histidine for activation ,Amino Acids
5,DevR-1,False,-0.0021975358,devR,Transcription factor that is one of the primary regulators of hypoxia onset response,Redox
77,Central Carbon Metabolism,False,-0.001928755,,iModulon enriched with the Central Carbon Metabolism KEGG pathway,Central Carbon
9,SigK,False,0.0018255781,sigK,Sigma Factor involved in the production of antigenic proteins,Unknown Function
69,Rv0135+Rv1019,False,-0.0017743899,Rv0135c and Rv1019,iModulon that maps to the intersection of the Rv0135c and Rv1019 regulons,Nucleic Acids
65,SG_10,False,-0.0017308690000000001,,Single Gene iModulon 10,Single Gene
7,GroEL-GroES Complex,False,-0.0014788987,,Gene Ontology Term specific to the bacterial chaperonin complex,Amino Acids
18,Unc_1,False,-0.0012262827,,Uncharacterized iModulon 1,Uncharacterized
70,Lsr2,False,0.0011648116,lsr2,Sequence independent transcription factor that controls a wide variety of genes,Antibiotic
73,SG_11,False,0.0008764910000000001,,Single Gene iModulon 11,Single Gene
36,Fumarate Reductase,False,-0.0008140627000000001,,iModulon enriched with the Fumarate Reductase Gene Ontology term,Central Carbon
67,Peptidoglycan Biosynthesis,False,0.0006034691000000001,,iModulon enriched with the Peptidoglycan biosyntehsis KEGG pathway,Central Carbon
66,M-box,False,0.0005243831,,Magnesium activated non-coding sRNA that regulates the function of genes associated with metal metabolism and virulence,Metal Related
50,Unc_6,False,0.0005121834000000001,,Uncharacterized iModulon 6,Uncharacterized
53,Rv1776c+WhiB4,False,0.0003677911,Rv1776c and whiB4 ,iModulon that maps to the intersection of the Rv1776c and Rv3681c regulon,Redox
8,IdeR,False,-0.0003335262,ideR,Metal-Dependent DNA-Binding protein that controls genes related to iron metabolism,Metal Related
49,Rv1828/SigH,False,0.0001586902,Rv1828 or sigH,iModulon that maps to the union of the Rv1828 and Rv3223c regulons,Redox
52,DevR-2,False,-4.36464e-05,devR,Transcription factor that is one of the primary regulators of hypoxia onset response,Redox
15,BkaR,False,-2.70645e-05,bkaR,Transcription factor that regulates genes related to branched-chain keto-acid metabolism,Central Carbon
