k,Name,in_iM,gene_weight,Regulator,Function,Category
75,Unc_9,False,-0.0462087393,,Uncharacterized iModulon 9,Uncharacterized
77,Central Carbon Metabolism,False,0.0331800758,,iModulon enriched with the Central Carbon Metabolism KEGG pathway,Central Carbon
46,Rv2621c,False,-0.0313893106,Rv2621c,iModulon labeled with predicted regulon with unknown function,Unknown Function
78,Positive Regulation of Growth,False,0.0267486897,,iModulon enriched with the Positive Regulation of Growth Gene Ontology term,Growth
70,Lsr2,False,-0.0265454023,lsr2,Sequence independent transcription factor that controls a wide variety of genes,Antibiotic
41,Unc_5,False,0.0215504283,,Uncharacterized iModulon 5,Uncharacterized
24,Salicylate Induced,False,0.0212321144,,Manually annotated iModulon where genes were found to change expression when exposed to salicylate,Metal Related
42,Nicotinate Metabolism,False,-0.0209857213,,iModulon enriched with the nicotinate and nicotinamide metabolism KEGG pathway,Central Carbon
68,Sulfur Metabolism,False,0.0202192178,,Kegg Map that displays the transport and metabolism of sulfur,Sulfur Metabolism
28,WhiB1,False,-0.0198078982,whiB1,"Transcription repressor that is redox responsive, found to be nitric oxide sensitive",Redox
29,Blal,False,0.0190193349,blaI,"Transcription regulator that regulates genes associated with antibiotic transport, detoxification, and cell wall function",Antibiotic
54,Unc_7,False,-0.0174344991,,Uncharacterized iModulon 7,Uncharacterized
61,Nucleic Acid Hydrolysis ,False,0.0168167177,,iModulon enriched with the Nucleic Acid Hydrolysis KEGG pathway,Nucleic Acids
73,SG_11,False,0.0167487947,,Single Gene iModulon 11,Single Gene
16,Mce3R,False,-0.0165144425,mce3R,Transcription factor that regulates the mce3 virulence operon,Virulence/Persistence
64,Mce1R,False,-0.0164501212,mce1R,Transcription factor that regulates the mce1 virulence operon,Virulence/Persistence
31,ArgR,False,-0.015117765100000001,argR,Transcription factor that regulates the L-arginine biosynthesis pathways,Amino Acids
25,Rv0078+Rv2034,False,-0.0140507949,Rv0078 and Rv2034,iModulon that maps to the intersection of the Rv0078 and Rv2034 regulon,Antibiotic
53,Rv1776c+WhiB4,False,0.013732430200000001,Rv1776c and whiB4 ,iModulon that maps to the intersection of the Rv1776c and Rv3681c regulon,Redox
4,WhiB4,False,-0.012615112000000001,whiB4,Redox-Responsive transcription regulator that regulates protection response during infection,Redox
39,SigC,False,-0.012318837800000001,sigC,Sigma Factor that plays a role in organism virulence and lethality,Virulence/Persistence
1,Polyketide Synthase Complex,False,0.012114541500000001,,KEGG Map related to the synthesis of type II polyketide backbone ,Fatty Acid/Cholestrol
67,Peptidoglycan Biosynthesis,False,0.0117428423,,iModulon enriched with the Peptidoglycan biosyntehsis KEGG pathway,Central Carbon
45,SigD,False,-0.011517525800000001,sigD,Sigma Factor that governs the expression of ribosomal genes and plays a role in virulence,Virulence/Persistence
17,VirS,False,0.0108466738,virS,Transcription factor that is activated and responds to acidic environments,Redox
62,Rv2488c,False,-0.010807605100000001,Rv2488c,LuxR family transcription factor that regulates genes associated with virulence,Virulence/Persistence
33,SG_4,False,0.0099555661,,Single Gene iModulon 4,Single Gene
10,RicR,False,-0.0097784954,ricR,Copper responsive transcription factor that regulates metal metabolism genes,Metal Related
26,EspL KO,False,-0.0092250784,,Single Gene iModulon that captures EspL knockout,KO
49,Rv1828/SigH,False,0.0086323254,Rv1828 or sigH,iModulon that maps to the union of the Rv1828 and Rv3223c regulons,Redox
47,SG_7,False,0.0080056523,,Single Gene iModulon 7,Single Gene
74,SG_12,False,-0.0078253748,,Single Gene iModulon 12,Single Gene
66,M-box,False,0.0071817556,,Magnesium activated non-coding sRNA that regulates the function of genes associated with metal metabolism and virulence,Metal Related
59,Rv0576,False,-0.0070114259,Rv0576,Possible ArsR family transcription factor that regulates genes related to virulence,Virulence/Persistence
30,HPT-2b Induced,False,0.0069198504,,iModulon regulates many genes that are activated by HPT-2b (1-hydroxy-5-R-pyridine-2(1H)-thiones),Metal Related
44,SG_6,False,0.006673180700000001,,Single Genes iModulon 6,Single Gene
5,DevR-1,False,-0.006435165400000001,devR,Transcription factor that is one of the primary regulators of hypoxia onset response,Redox
55,WhiB7,False,-0.006416378,whiB7,Transcription factor that connects systems for redox homeostasis and antibiotic resistance,Antibiotic
3,PyrR,False,-0.0058748277,pyrR,Transcription factor that regulates the expression of pyrimidine nucleotide operons,Nucleic Acids
14,SG_2,False,0.00564368,,Single Gene iModulon 2,Single Gene
13,SG_1,False,-0.005570959800000001,,Single Gene iModulon 1,Single Gene
40,KstR2,False,-0.0054238622,kstR2,Transcription factor that regulates a small regulon related to cholesterol utilization,Fatty Acid/Cholestrol
50,Unc_6,False,0.0053664093000000005,,Uncharacterized iModulon 6,Uncharacterized
65,SG_10,False,-0.0052120746,,Single Gene iModulon 10,Single Gene
9,SigK,False,-0.0051669336000000005,sigK,Sigma Factor involved in the production of antigenic proteins,Unknown Function
51,PhoP,False,-0.0046456507,phoP,"Transcription factor that controls response to redox/acid stress, hypoxia, and virulence",Virulence/Persistence
63,SG_9,False,-0.0045302525,,Single Gene iModulon 9,Single Gene
34,MbcA+Rv3249c+Rv3066,False,-0.0044275564,mbcA and Rv3249c and Rv3066,"iModulon that maps to the intersection of the Rv1990c, Rv3249c, and Rv3066 regulons",Virulence/Persistence
48,Leucine Related,False,-0.0041769864,,Manually annotated iModulon with gene related to leucine metabolism,Amino Acids
21,MprA,False,-0.0040543847,mprA,Transcription factor that regulates multiple stress responsive genes,Virulence/Persistence
38,SG_5,False,-0.0039480173,,Single Gene iModulon 5,Single Gene
6,MarR,False,-0.0037589793,marR,Transcription factor that regulates the response to acid stress,Acid Stress
12,Mycofactocin Synthesis Pathway,False,-0.0037083588,,Manually annotated iModulon that captures multiple genes associated with mycofactocin metabolism,Fatty Acid/Cholestrol
32,Unc_3,False,-0.0036685423,,Uncharacterized iModulon 3,Uncharacterized
58,Zur,False,0.0035957337,zur,Transcription factor that is activated by and regulates the metabolism of zinc,Metal Related
35,Unc_4,False,0.0034840714,,Uncharacterized iModulon 4,Uncharacterized
8,IdeR,False,0.0034555808,ideR,Metal-Dependent DNA-Binding protein that controls genes related to iron metabolism,Metal Related
43,LysG,False,-0.0032714743,lsyG,Transcription factor that controls the expression of LysE and requires lysine or histidine for activation ,Amino Acids
79,WhiB4/IdeR,False,-0.0031529606,whiB4 or ideR,iModulon that maps to the union of the Rv3681c and Rv2711 regulons,Redox
37,Rv3095,False,-0.0028345234,Rv3095,iModulon labeled with predicted regulon with unknown function,Unknown Function
57,SG_8,False,-0.0027697642,,Single Gene iModulon 8,Single Gene
15,BkaR,False,0.002712191,bkaR,Transcription factor that regulates genes related to branched-chain keto-acid metabolism,Central Carbon
36,Fumarate Reductase,False,-0.0026416987000000003,,iModulon enriched with the Fumarate Reductase Gene Ontology term,Central Carbon
11,EccE1 KO,False,0.0024823298,,Single Gene iModulon that captures EccE1 knockout,KO
56,Fatty Acid Biosynthesis,False,-0.0022221157,trcR and Rv1776c and whiB4 ,"iModulon that maps to the intersection of the Rv1033c, Rv1776c, and Rv3681c regulons",Fatty Acid/Cholestrol
23,PrpR,False,0.0018676501,prpR,Transcription factor that is involved in catabolism of short chain fatty acids via gloxylate and methylcitrate cycle,Central Carbon
7,GroEL-GroES Complex,False,-0.0017226370000000002,,Gene Ontology Term specific to the bacterial chaperonin complex,Amino Acids
60,Rv0681,False,-0.001661612,Rv0681,"Transcription with previously unknown function, regulates core fatty acid response",Unknown Function
69,Rv0135+Rv1019,False,-0.001606357,Rv0135c and Rv1019,iModulon that maps to the intersection of the Rv0135c and Rv1019 regulons,Nucleic Acids
72,Unc_8,False,-0.0015912784000000001,,Uncharacterized iModulon 8,Uncharacterized
20,FasR,False,0.0015841188,fasR,Transcription factor that controls the expression of fatty acid metabolism genes,Fatty Acid/Cholestrol
2,IniR,False,-0.0015279423000000001,iniR,Transcription factor that regulates the expression of the ini operon (iniBAC),Antibiotic
22,SG_3,False,0.0015147433000000001,,Single Gene iModulon 3,Single Gene
76,SG_13,False,-0.0014497381000000001,,Single Gene iModulon 13,Single Gene
52,DevR-2,False,-0.0011631309,devR,Transcription factor that is one of the primary regulators of hypoxia onset response,Redox
27,Unc_2,False,-0.0008694637,,Uncharacterized iModulon 2,Uncharacterized
19,WhiB6,False,-0.0006926659000000001,whiB6,Transcription factor that regulates ESX-1 system membrane transport proteins,Redox
0,SigH,False,-0.0006619623,sigH,Sigma Factor involved in heat shock and oxidative stress response,Virulence/Persistence
71,PDIM;PGL Synthesis,False,0.0002759877,,Manually annotated iModulon that captures genes associated with PDIM and PGL synthesis,Virulence/Persistence
18,Unc_1,False,-9.925960000000001e-05,,Uncharacterized iModulon 1,Uncharacterized
