k,Name,in_iM,gene_weight,Regulator,Function,Category
16,Mce3R,False,0.015305198800000001,mce3R,Transcription factor that regulates the mce3 virulence operon,Virulence/Persistence
62,Rv2488c,False,-0.0147809259,Rv2488c,LuxR family transcription factor that regulates genes associated with virulence,Virulence/Persistence
38,SG_5,False,-0.012255913,,Single Gene iModulon 5,Single Gene
75,Unc_9,False,-0.012166798900000001,,Uncharacterized iModulon 9,Uncharacterized
28,WhiB1,False,-0.0113230213,whiB1,"Transcription repressor that is redox responsive, found to be nitric oxide sensitive",Redox
77,Central Carbon Metabolism,False,0.0110945642,,iModulon enriched with the Central Carbon Metabolism KEGG pathway,Central Carbon
11,EccE1 KO,False,-0.0104499578,,Single Gene iModulon that captures EccE1 knockout,KO
8,IdeR,False,0.0104058298,ideR,Metal-Dependent DNA-Binding protein that controls genes related to iron metabolism,Metal Related
41,Unc_5,False,-0.0102542472,,Uncharacterized iModulon 5,Uncharacterized
51,PhoP,False,-0.0101903353,phoP,"Transcription factor that controls response to redox/acid stress, hypoxia, and virulence",Virulence/Persistence
36,Fumarate Reductase,False,0.010095179400000001,,iModulon enriched with the Fumarate Reductase Gene Ontology term,Central Carbon
34,MbcA+Rv3249c+Rv3066,False,-0.0091796775,mbcA and Rv3249c and Rv3066,"iModulon that maps to the intersection of the Rv1990c, Rv3249c, and Rv3066 regulons",Virulence/Persistence
31,ArgR,False,-0.0091600802,argR,Transcription factor that regulates the L-arginine biosynthesis pathways,Amino Acids
32,Unc_3,False,-0.0090180651,,Uncharacterized iModulon 3,Uncharacterized
25,Rv0078+Rv2034,False,-0.008991233500000001,Rv0078 and Rv2034,iModulon that maps to the intersection of the Rv0078 and Rv2034 regulon,Antibiotic
71,PDIM;PGL Synthesis,False,-0.008907211600000001,,Manually annotated iModulon that captures genes associated with PDIM and PGL synthesis,Virulence/Persistence
74,SG_12,False,-0.0084326045,,Single Gene iModulon 12,Single Gene
13,SG_1,False,0.0083535742,,Single Gene iModulon 1,Single Gene
26,EspL KO,False,-0.008268154,,Single Gene iModulon that captures EspL knockout,KO
66,M-box,False,0.0082486382,,Magnesium activated non-coding sRNA that regulates the function of genes associated with metal metabolism and virulence,Metal Related
78,Positive Regulation of Growth,False,-0.008128259,,iModulon enriched with the Positive Regulation of Growth Gene Ontology term,Growth
69,Rv0135+Rv1019,False,0.0077106252000000005,Rv0135c and Rv1019,iModulon that maps to the intersection of the Rv0135c and Rv1019 regulons,Nucleic Acids
27,Unc_2,False,-0.007655629200000001,,Uncharacterized iModulon 2,Uncharacterized
35,Unc_4,False,0.0071506396000000005,,Uncharacterized iModulon 4,Uncharacterized
22,SG_3,False,0.0067608131000000005,,Single Gene iModulon 3,Single Gene
30,HPT-2b Induced,False,-0.0067281947000000005,,iModulon regulates many genes that are activated by HPT-2b (1-hydroxy-5-R-pyridine-2(1H)-thiones),Metal Related
60,Rv0681,False,0.0063095716,Rv0681,"Transcription with previously unknown function, regulates core fatty acid response",Unknown Function
24,Salicylate Induced,False,0.0059895262,,Manually annotated iModulon where genes were found to change expression when exposed to salicylate,Metal Related
42,Nicotinate Metabolism,False,0.005824066,,iModulon enriched with the nicotinate and nicotinamide metabolism KEGG pathway,Central Carbon
1,Polyketide Synthase Complex,False,0.005769936000000001,,KEGG Map related to the synthesis of type II polyketide backbone ,Fatty Acid/Cholestrol
29,Blal,False,0.0056843401,blaI,"Transcription regulator that regulates genes associated with antibiotic transport, detoxification, and cell wall function",Antibiotic
72,Unc_8,False,-0.0055603896,,Uncharacterized iModulon 8,Uncharacterized
44,SG_6,False,-0.0055294291,,Single Genes iModulon 6,Single Gene
46,Rv2621c,False,-0.0054794117,Rv2621c,iModulon labeled with predicted regulon with unknown function,Unknown Function
20,FasR,False,0.005334349600000001,fasR,Transcription factor that controls the expression of fatty acid metabolism genes,Fatty Acid/Cholestrol
70,Lsr2,False,-0.0053188951,lsr2,Sequence independent transcription factor that controls a wide variety of genes,Antibiotic
45,SigD,False,-0.0052989693,sigD,Sigma Factor that governs the expression of ribosomal genes and plays a role in virulence,Virulence/Persistence
63,SG_9,False,-0.0051023904,,Single Gene iModulon 9,Single Gene
10,RicR,False,-0.0050269257000000005,ricR,Copper responsive transcription factor that regulates metal metabolism genes,Metal Related
18,Unc_1,False,0.004958723,,Uncharacterized iModulon 1,Uncharacterized
9,SigK,False,0.0049007279,sigK,Sigma Factor involved in the production of antigenic proteins,Unknown Function
48,Leucine Related,False,-0.0047232236000000006,,Manually annotated iModulon with gene related to leucine metabolism,Amino Acids
54,Unc_7,False,0.0044836214,,Uncharacterized iModulon 7,Uncharacterized
43,LysG,False,-0.0043688728000000005,lsyG,Transcription factor that controls the expression of LysE and requires lysine or histidine for activation ,Amino Acids
7,GroEL-GroES Complex,False,-0.0042356543,,Gene Ontology Term specific to the bacterial chaperonin complex,Amino Acids
79,WhiB4/IdeR,False,-0.004160811,whiB4 or ideR,iModulon that maps to the union of the Rv3681c and Rv2711 regulons,Redox
47,SG_7,False,-0.0041352490000000006,,Single Gene iModulon 7,Single Gene
76,SG_13,False,-0.0040932797,,Single Gene iModulon 13,Single Gene
57,SG_8,False,0.0040268642,,Single Gene iModulon 8,Single Gene
68,Sulfur Metabolism,False,0.0039282658000000005,,Kegg Map that displays the transport and metabolism of sulfur,Sulfur Metabolism
49,Rv1828/SigH,False,0.0035514565000000003,Rv1828 or sigH,iModulon that maps to the union of the Rv1828 and Rv3223c regulons,Redox
65,SG_10,False,0.003289854,,Single Gene iModulon 10,Single Gene
58,Zur,False,0.0032231653,zur,Transcription factor that is activated by and regulates the metabolism of zinc,Metal Related
39,SigC,False,-0.0031663105,sigC,Sigma Factor that plays a role in organism virulence and lethality,Virulence/Persistence
17,VirS,False,-0.0030735164000000002,virS,Transcription factor that is activated and responds to acidic environments,Redox
59,Rv0576,False,-0.0028672264,Rv0576,Possible ArsR family transcription factor that regulates genes related to virulence,Virulence/Persistence
64,Mce1R,False,-0.0028181912,mce1R,Transcription factor that regulates the mce1 virulence operon,Virulence/Persistence
12,Mycofactocin Synthesis Pathway,False,0.0027446207,,Manually annotated iModulon that captures multiple genes associated with mycofactocin metabolism,Fatty Acid/Cholestrol
52,DevR-2,False,-0.0026376287,devR,Transcription factor that is one of the primary regulators of hypoxia onset response,Redox
14,SG_2,False,-0.0025901831000000003,,Single Gene iModulon 2,Single Gene
6,MarR,False,-0.002565729,marR,Transcription factor that regulates the response to acid stress,Acid Stress
55,WhiB7,False,-0.0024607529,whiB7,Transcription factor that connects systems for redox homeostasis and antibiotic resistance,Antibiotic
56,Fatty Acid Biosynthesis,False,0.0024026493000000003,trcR and Rv1776c and whiB4 ,"iModulon that maps to the intersection of the Rv1033c, Rv1776c, and Rv3681c regulons",Fatty Acid/Cholestrol
2,IniR,False,-0.0021342587000000002,iniR,Transcription factor that regulates the expression of the ini operon (iniBAC),Antibiotic
73,SG_11,False,-0.0021314641,,Single Gene iModulon 11,Single Gene
61,Nucleic Acid Hydrolysis ,False,-0.0020797928000000003,,iModulon enriched with the Nucleic Acid Hydrolysis KEGG pathway,Nucleic Acids
37,Rv3095,False,-0.0017953104,Rv3095,iModulon labeled with predicted regulon with unknown function,Unknown Function
3,PyrR,False,-0.0017220131000000001,pyrR,Transcription factor that regulates the expression of pyrimidine nucleotide operons,Nucleic Acids
33,SG_4,False,-0.0016202868000000001,,Single Gene iModulon 4,Single Gene
53,Rv1776c+WhiB4,False,-0.0012285089,Rv1776c and whiB4 ,iModulon that maps to the intersection of the Rv1776c and Rv3681c regulon,Redox
23,PrpR,False,0.0011931694000000001,prpR,Transcription factor that is involved in catabolism of short chain fatty acids via gloxylate and methylcitrate cycle,Central Carbon
15,BkaR,False,-0.0011117111,bkaR,Transcription factor that regulates genes related to branched-chain keto-acid metabolism,Central Carbon
19,WhiB6,False,-0.0011105812,whiB6,Transcription factor that regulates ESX-1 system membrane transport proteins,Redox
40,KstR2,False,-0.0008683056000000001,kstR2,Transcription factor that regulates a small regulon related to cholesterol utilization,Fatty Acid/Cholestrol
0,SigH,False,0.0004630519,sigH,Sigma Factor involved in heat shock and oxidative stress response,Virulence/Persistence
5,DevR-1,False,-0.0004481671,devR,Transcription factor that is one of the primary regulators of hypoxia onset response,Redox
21,MprA,False,-0.0003427155,mprA,Transcription factor that regulates multiple stress responsive genes,Virulence/Persistence
50,Unc_6,False,-0.0003030083,,Uncharacterized iModulon 6,Uncharacterized
67,Peptidoglycan Biosynthesis,False,-0.0002081358,,iModulon enriched with the Peptidoglycan biosyntehsis KEGG pathway,Central Carbon
4,WhiB4,False,9.3822e-06,whiB4,Redox-Responsive transcription regulator that regulates protection response during infection,Redox
