k,Name,in_iM,gene_weight,Regulator,Function,Category
36,Fumarate Reductase,False,0.021027178100000002,,iModulon enriched with the Fumarate Reductase Gene Ontology term,Central Carbon
15,BkaR,False,0.0168310827,bkaR,Transcription factor that regulates genes related to branched-chain keto-acid metabolism,Central Carbon
54,Unc_7,False,0.016374856,,Uncharacterized iModulon 7,Uncharacterized
73,SG_11,False,0.0152109271,,Single Gene iModulon 11,Single Gene
69,Rv0135+Rv1019,False,0.014416033200000001,Rv0135c and Rv1019,iModulon that maps to the intersection of the Rv0135c and Rv1019 regulons,Nucleic Acids
68,Sulfur Metabolism,False,0.0132939891,,Kegg Map that displays the transport and metabolism of sulfur,Sulfur Metabolism
67,Peptidoglycan Biosynthesis,False,-0.0131617073,,iModulon enriched with the Peptidoglycan biosyntehsis KEGG pathway,Central Carbon
16,Mce3R,False,0.0126813007,mce3R,Transcription factor that regulates the mce3 virulence operon,Virulence/Persistence
74,SG_12,False,-0.012330803500000001,,Single Gene iModulon 12,Single Gene
24,Salicylate Induced,False,0.0113608413,,Manually annotated iModulon where genes were found to change expression when exposed to salicylate,Metal Related
72,Unc_8,False,-0.0105680246,,Uncharacterized iModulon 8,Uncharacterized
66,M-box,False,0.0104936739,,Magnesium activated non-coding sRNA that regulates the function of genes associated with metal metabolism and virulence,Metal Related
9,SigK,False,0.0098631744,sigK,Sigma Factor involved in the production of antigenic proteins,Unknown Function
77,Central Carbon Metabolism,False,0.0097784576,,iModulon enriched with the Central Carbon Metabolism KEGG pathway,Central Carbon
53,Rv1776c+WhiB4,False,0.008956217800000001,Rv1776c and whiB4 ,iModulon that maps to the intersection of the Rv1776c and Rv3681c regulon,Redox
76,SG_13,False,-0.0087772146,,Single Gene iModulon 13,Single Gene
7,GroEL-GroES Complex,False,-0.0083547586,,Gene Ontology Term specific to the bacterial chaperonin complex,Amino Acids
25,Rv0078+Rv2034,False,-0.0082521658,Rv0078 and Rv2034,iModulon that maps to the intersection of the Rv0078 and Rv2034 regulon,Antibiotic
1,Polyketide Synthase Complex,False,-0.0079967909,,KEGG Map related to the synthesis of type II polyketide backbone ,Fatty Acid/Cholestrol
42,Nicotinate Metabolism,False,0.0078509847,,iModulon enriched with the nicotinate and nicotinamide metabolism KEGG pathway,Central Carbon
32,Unc_3,False,-0.0075088574,,Uncharacterized iModulon 3,Uncharacterized
35,Unc_4,False,-0.0072761504000000005,,Uncharacterized iModulon 4,Uncharacterized
37,Rv3095,False,-0.0072187743,Rv3095,iModulon labeled with predicted regulon with unknown function,Unknown Function
59,Rv0576,False,-0.0069320957,Rv0576,Possible ArsR family transcription factor that regulates genes related to virulence,Virulence/Persistence
79,WhiB4/IdeR,False,-0.0066999728000000005,whiB4 or ideR,iModulon that maps to the union of the Rv3681c and Rv2711 regulons,Redox
23,PrpR,False,-0.00669817,prpR,Transcription factor that is involved in catabolism of short chain fatty acids via gloxylate and methylcitrate cycle,Central Carbon
41,Unc_5,False,0.0063322876,,Uncharacterized iModulon 5,Uncharacterized
49,Rv1828/SigH,False,0.005908076700000001,Rv1828 or sigH,iModulon that maps to the union of the Rv1828 and Rv3223c regulons,Redox
61,Nucleic Acid Hydrolysis ,False,-0.0057649835,,iModulon enriched with the Nucleic Acid Hydrolysis KEGG pathway,Nucleic Acids
60,Rv0681,False,0.0057595400000000005,Rv0681,"Transcription with previously unknown function, regulates core fatty acid response",Unknown Function
13,SG_1,False,-0.0057141706,,Single Gene iModulon 1,Single Gene
34,MbcA+Rv3249c+Rv3066,False,-0.0056122939,mbcA and Rv3249c and Rv3066,"iModulon that maps to the intersection of the Rv1990c, Rv3249c, and Rv3066 regulons",Virulence/Persistence
64,Mce1R,False,-0.0055425940000000005,mce1R,Transcription factor that regulates the mce1 virulence operon,Virulence/Persistence
31,ArgR,False,-0.0050083405,argR,Transcription factor that regulates the L-arginine biosynthesis pathways,Amino Acids
0,SigH,False,-0.0049991546,sigH,Sigma Factor involved in heat shock and oxidative stress response,Virulence/Persistence
33,SG_4,False,0.0049007534,,Single Gene iModulon 4,Single Gene
6,MarR,False,-0.004812511,marR,Transcription factor that regulates the response to acid stress,Acid Stress
63,SG_9,False,0.0047826591,,Single Gene iModulon 9,Single Gene
17,VirS,False,-0.0046427849,virS,Transcription factor that is activated and responds to acidic environments,Redox
78,Positive Regulation of Growth,False,-0.0044790623,,iModulon enriched with the Positive Regulation of Growth Gene Ontology term,Growth
18,Unc_1,False,-0.004296564100000001,,Uncharacterized iModulon 1,Uncharacterized
45,SigD,False,-0.0042799728,sigD,Sigma Factor that governs the expression of ribosomal genes and plays a role in virulence,Virulence/Persistence
5,DevR-1,False,-0.0042304193000000006,devR,Transcription factor that is one of the primary regulators of hypoxia onset response,Redox
10,RicR,False,-0.0041538949,ricR,Copper responsive transcription factor that regulates metal metabolism genes,Metal Related
55,WhiB7,False,0.0039704927,whiB7,Transcription factor that connects systems for redox homeostasis and antibiotic resistance,Antibiotic
21,MprA,False,0.0038935703,mprA,Transcription factor that regulates multiple stress responsive genes,Virulence/Persistence
44,SG_6,False,-0.0036785878,,Single Genes iModulon 6,Single Gene
29,Blal,False,0.0036156093,blaI,"Transcription regulator that regulates genes associated with antibiotic transport, detoxification, and cell wall function",Antibiotic
12,Mycofactocin Synthesis Pathway,False,0.0035658859000000003,,Manually annotated iModulon that captures multiple genes associated with mycofactocin metabolism,Fatty Acid/Cholestrol
20,FasR,False,-0.0033101489,fasR,Transcription factor that controls the expression of fatty acid metabolism genes,Fatty Acid/Cholestrol
50,Unc_6,False,0.0032977238,,Uncharacterized iModulon 6,Uncharacterized
2,IniR,False,0.0030049946,iniR,Transcription factor that regulates the expression of the ini operon (iniBAC),Antibiotic
48,Leucine Related,False,-0.0029176338,,Manually annotated iModulon with gene related to leucine metabolism,Amino Acids
26,EspL KO,False,-0.0028221834,,Single Gene iModulon that captures EspL knockout,KO
58,Zur,False,0.0027838566,zur,Transcription factor that is activated by and regulates the metabolism of zinc,Metal Related
14,SG_2,False,-0.0026825244,,Single Gene iModulon 2,Single Gene
40,KstR2,False,-0.0024148774,kstR2,Transcription factor that regulates a small regulon related to cholesterol utilization,Fatty Acid/Cholestrol
65,SG_10,False,0.0024030460000000003,,Single Gene iModulon 10,Single Gene
43,LysG,False,0.0017984728,lsyG,Transcription factor that controls the expression of LysE and requires lysine or histidine for activation ,Amino Acids
3,PyrR,False,-0.0017693575,pyrR,Transcription factor that regulates the expression of pyrimidine nucleotide operons,Nucleic Acids
57,SG_8,False,0.0016920011,,Single Gene iModulon 8,Single Gene
75,Unc_9,False,0.0016845874000000001,,Uncharacterized iModulon 9,Uncharacterized
39,SigC,False,0.0016328056,sigC,Sigma Factor that plays a role in organism virulence and lethality,Virulence/Persistence
27,Unc_2,False,0.0015581301,,Uncharacterized iModulon 2,Uncharacterized
28,WhiB1,False,-0.0015223536000000001,whiB1,"Transcription repressor that is redox responsive, found to be nitric oxide sensitive",Redox
4,WhiB4,False,-0.0014649300000000001,whiB4,Redox-Responsive transcription regulator that regulates protection response during infection,Redox
70,Lsr2,False,-0.0013953501,lsr2,Sequence independent transcription factor that controls a wide variety of genes,Antibiotic
51,PhoP,False,-0.0012781543,phoP,"Transcription factor that controls response to redox/acid stress, hypoxia, and virulence",Virulence/Persistence
19,WhiB6,False,-0.0012609916000000001,whiB6,Transcription factor that regulates ESX-1 system membrane transport proteins,Redox
30,HPT-2b Induced,False,-0.0010763696,,iModulon regulates many genes that are activated by HPT-2b (1-hydroxy-5-R-pyridine-2(1H)-thiones),Metal Related
38,SG_5,False,-0.0007622894,,Single Gene iModulon 5,Single Gene
8,IdeR,False,-0.0006160720000000001,ideR,Metal-Dependent DNA-Binding protein that controls genes related to iron metabolism,Metal Related
56,Fatty Acid Biosynthesis,False,-0.0005617561,trcR and Rv1776c and whiB4 ,"iModulon that maps to the intersection of the Rv1033c, Rv1776c, and Rv3681c regulons",Fatty Acid/Cholestrol
22,SG_3,False,0.0004704692,,Single Gene iModulon 3,Single Gene
52,DevR-2,False,-0.0003948663,devR,Transcription factor that is one of the primary regulators of hypoxia onset response,Redox
46,Rv2621c,False,0.0003637018,Rv2621c,iModulon labeled with predicted regulon with unknown function,Unknown Function
11,EccE1 KO,False,-0.00033217,,Single Gene iModulon that captures EccE1 knockout,KO
62,Rv2488c,False,-0.000272403,Rv2488c,LuxR family transcription factor that regulates genes associated with virulence,Virulence/Persistence
71,PDIM;PGL Synthesis,False,-0.0002697232,,Manually annotated iModulon that captures genes associated with PDIM and PGL synthesis,Virulence/Persistence
47,SG_7,False,-3.22308e-05,,Single Gene iModulon 7,Single Gene
