k,Name,in_iM,gene_weight,Regulator,Function,Category
49,Rv1828/SigH,True,0.0905428211,Rv1828 or sigH,iModulon that maps to the union of the Rv1828 and Rv3223c regulons,Redox
76,SG_13,False,-0.0295855408,,Single Gene iModulon 13,Single Gene
17,VirS,False,-0.0286279377,virS,Transcription factor that is activated and responds to acidic environments,Redox
36,Fumarate Reductase,False,0.0274996098,,iModulon enriched with the Fumarate Reductase Gene Ontology term,Central Carbon
71,PDIM;PGL Synthesis,False,0.025314962700000002,,Manually annotated iModulon that captures genes associated with PDIM and PGL synthesis,Virulence/Persistence
57,SG_8,False,-0.0222259099,,Single Gene iModulon 8,Single Gene
0,SigH,False,0.0210477731,sigH,Sigma Factor involved in heat shock and oxidative stress response,Virulence/Persistence
54,Unc_7,False,0.020992306000000002,,Uncharacterized iModulon 7,Uncharacterized
72,Unc_8,False,-0.0202057093,,Uncharacterized iModulon 8,Uncharacterized
24,Salicylate Induced,False,-0.0195874101,,Manually annotated iModulon where genes were found to change expression when exposed to salicylate,Metal Related
25,Rv0078+Rv2034,False,0.018856920200000002,Rv0078 and Rv2034,iModulon that maps to the intersection of the Rv0078 and Rv2034 regulon,Antibiotic
39,SigC,False,0.018527792600000002,sigC,Sigma Factor that plays a role in organism virulence and lethality,Virulence/Persistence
79,WhiB4/IdeR,False,-0.015968886,whiB4 or ideR,iModulon that maps to the union of the Rv3681c and Rv2711 regulons,Redox
15,BkaR,False,0.015615300200000001,bkaR,Transcription factor that regulates genes related to branched-chain keto-acid metabolism,Central Carbon
64,Mce1R,False,-0.015578405100000001,mce1R,Transcription factor that regulates the mce1 virulence operon,Virulence/Persistence
16,Mce3R,False,0.0155299283,mce3R,Transcription factor that regulates the mce3 virulence operon,Virulence/Persistence
58,Zur,False,0.0153175249,zur,Transcription factor that is activated by and regulates the metabolism of zinc,Metal Related
46,Rv2621c,False,-0.0147499672,Rv2621c,iModulon labeled with predicted regulon with unknown function,Unknown Function
60,Rv0681,False,-0.014683716400000001,Rv0681,"Transcription with previously unknown function, regulates core fatty acid response",Unknown Function
77,Central Carbon Metabolism,False,0.0145244199,,iModulon enriched with the Central Carbon Metabolism KEGG pathway,Central Carbon
30,HPT-2b Induced,False,-0.0139327727,,iModulon regulates many genes that are activated by HPT-2b (1-hydroxy-5-R-pyridine-2(1H)-thiones),Metal Related
40,KstR2,False,-0.0130636825,kstR2,Transcription factor that regulates a small regulon related to cholesterol utilization,Fatty Acid/Cholestrol
68,Sulfur Metabolism,False,0.012828026400000001,,Kegg Map that displays the transport and metabolism of sulfur,Sulfur Metabolism
73,SG_11,False,0.0126691284,,Single Gene iModulon 11,Single Gene
48,Leucine Related,False,-0.0121453499,,Manually annotated iModulon with gene related to leucine metabolism,Amino Acids
34,MbcA+Rv3249c+Rv3066,False,-0.0115891169,mbcA and Rv3249c and Rv3066,"iModulon that maps to the intersection of the Rv1990c, Rv3249c, and Rv3066 regulons",Virulence/Persistence
75,Unc_9,False,0.0110990479,,Uncharacterized iModulon 9,Uncharacterized
45,SigD,False,0.0109419936,sigD,Sigma Factor that governs the expression of ribosomal genes and plays a role in virulence,Virulence/Persistence
69,Rv0135+Rv1019,False,0.0107495828,Rv0135c and Rv1019,iModulon that maps to the intersection of the Rv0135c and Rv1019 regulons,Nucleic Acids
43,LysG,False,0.0099938039,lsyG,Transcription factor that controls the expression of LysE and requires lysine or histidine for activation ,Amino Acids
18,Unc_1,False,0.0096354755,,Uncharacterized iModulon 1,Uncharacterized
65,SG_10,False,0.0094857207,,Single Gene iModulon 10,Single Gene
41,Unc_5,False,0.0091336076,,Uncharacterized iModulon 5,Uncharacterized
66,M-box,False,-0.0082807515,,Magnesium activated non-coding sRNA that regulates the function of genes associated with metal metabolism and virulence,Metal Related
1,Polyketide Synthase Complex,False,0.0081115453,,KEGG Map related to the synthesis of type II polyketide backbone ,Fatty Acid/Cholestrol
20,FasR,False,0.007902518400000001,fasR,Transcription factor that controls the expression of fatty acid metabolism genes,Fatty Acid/Cholestrol
2,IniR,False,0.0077063842,iniR,Transcription factor that regulates the expression of the ini operon (iniBAC),Antibiotic
59,Rv0576,False,0.0075377351,Rv0576,Possible ArsR family transcription factor that regulates genes related to virulence,Virulence/Persistence
28,WhiB1,False,-0.007051765000000001,whiB1,"Transcription repressor that is redox responsive, found to be nitric oxide sensitive",Redox
35,Unc_4,False,-0.0069721758,,Uncharacterized iModulon 4,Uncharacterized
51,PhoP,False,0.0069147817,phoP,"Transcription factor that controls response to redox/acid stress, hypoxia, and virulence",Virulence/Persistence
11,EccE1 KO,False,-0.006907788000000001,,Single Gene iModulon that captures EccE1 knockout,KO
12,Mycofactocin Synthesis Pathway,False,-0.0068974062,,Manually annotated iModulon that captures multiple genes associated with mycofactocin metabolism,Fatty Acid/Cholestrol
44,SG_6,False,0.0065055304,,Single Genes iModulon 6,Single Gene
61,Nucleic Acid Hydrolysis ,False,-0.0062962533000000005,,iModulon enriched with the Nucleic Acid Hydrolysis KEGG pathway,Nucleic Acids
42,Nicotinate Metabolism,False,-0.0062060247,,iModulon enriched with the nicotinate and nicotinamide metabolism KEGG pathway,Central Carbon
7,GroEL-GroES Complex,False,0.0056212655,,Gene Ontology Term specific to the bacterial chaperonin complex,Amino Acids
3,PyrR,False,0.0054882622,pyrR,Transcription factor that regulates the expression of pyrimidine nucleotide operons,Nucleic Acids
10,RicR,False,0.0052682141,ricR,Copper responsive transcription factor that regulates metal metabolism genes,Metal Related
6,MarR,False,-0.0050929649,marR,Transcription factor that regulates the response to acid stress,Acid Stress
27,Unc_2,False,0.0045964581,,Uncharacterized iModulon 2,Uncharacterized
52,DevR-2,False,-0.0044082338,devR,Transcription factor that is one of the primary regulators of hypoxia onset response,Redox
29,Blal,False,0.0043830793,blaI,"Transcription regulator that regulates genes associated with antibiotic transport, detoxification, and cell wall function",Antibiotic
37,Rv3095,False,0.0039373318,Rv3095,iModulon labeled with predicted regulon with unknown function,Unknown Function
8,IdeR,False,-0.003871203,ideR,Metal-Dependent DNA-Binding protein that controls genes related to iron metabolism,Metal Related
53,Rv1776c+WhiB4,False,-0.0037885037,Rv1776c and whiB4 ,iModulon that maps to the intersection of the Rv1776c and Rv3681c regulon,Redox
78,Positive Regulation of Growth,False,-0.0036220636000000002,,iModulon enriched with the Positive Regulation of Growth Gene Ontology term,Growth
55,WhiB7,False,-0.003484051,whiB7,Transcription factor that connects systems for redox homeostasis and antibiotic resistance,Antibiotic
5,DevR-1,False,-0.0034418767,devR,Transcription factor that is one of the primary regulators of hypoxia onset response,Redox
47,SG_7,False,0.00328567,,Single Gene iModulon 7,Single Gene
9,SigK,False,0.0029370388,sigK,Sigma Factor involved in the production of antigenic proteins,Unknown Function
38,SG_5,False,0.0028210278,,Single Gene iModulon 5,Single Gene
19,WhiB6,False,-0.00270037,whiB6,Transcription factor that regulates ESX-1 system membrane transport proteins,Redox
50,Unc_6,False,0.0024402622,,Uncharacterized iModulon 6,Uncharacterized
23,PrpR,False,0.0021020297000000003,prpR,Transcription factor that is involved in catabolism of short chain fatty acids via gloxylate and methylcitrate cycle,Central Carbon
63,SG_9,False,-0.0015328599,,Single Gene iModulon 9,Single Gene
32,Unc_3,False,-0.0015237507,,Uncharacterized iModulon 3,Uncharacterized
74,SG_12,False,0.0014138892,,Single Gene iModulon 12,Single Gene
21,MprA,False,0.001397374,mprA,Transcription factor that regulates multiple stress responsive genes,Virulence/Persistence
67,Peptidoglycan Biosynthesis,False,-0.0011092414,,iModulon enriched with the Peptidoglycan biosyntehsis KEGG pathway,Central Carbon
26,EspL KO,False,0.0008716256,,Single Gene iModulon that captures EspL knockout,KO
22,SG_3,False,-0.0008716119,,Single Gene iModulon 3,Single Gene
31,ArgR,False,-0.0008676304,argR,Transcription factor that regulates the L-arginine biosynthesis pathways,Amino Acids
56,Fatty Acid Biosynthesis,False,-0.0006197763,trcR and Rv1776c and whiB4 ,"iModulon that maps to the intersection of the Rv1033c, Rv1776c, and Rv3681c regulons",Fatty Acid/Cholestrol
33,SG_4,False,0.0005788428,,Single Gene iModulon 4,Single Gene
70,Lsr2,False,0.0005362078,lsr2,Sequence independent transcription factor that controls a wide variety of genes,Antibiotic
14,SG_2,False,-0.0005352424,,Single Gene iModulon 2,Single Gene
62,Rv2488c,False,-0.00047544810000000004,Rv2488c,LuxR family transcription factor that regulates genes associated with virulence,Virulence/Persistence
4,WhiB4,False,0.000463798,whiB4,Redox-Responsive transcription regulator that regulates protection response during infection,Redox
13,SG_1,False,-0.0003950165,,Single Gene iModulon 1,Single Gene
