k,Name,in_iM,gene_weight,Regulator,Function,Category
34,MbcA+Rv3249c+Rv3066,True,0.43997424150000003,mbcA and Rv3249c and Rv3066,"iModulon that maps to the intersection of the Rv1990c, Rv3249c, and Rv3066 regulons",Virulence/Persistence
69,Rv0135+Rv1019,False,0.0293628132,Rv0135c and Rv1019,iModulon that maps to the intersection of the Rv0135c and Rv1019 regulons,Nucleic Acids
12,Mycofactocin Synthesis Pathway,False,0.0273623783,,Manually annotated iModulon that captures multiple genes associated with mycofactocin metabolism,Fatty Acid/Cholestrol
18,Unc_1,False,-0.022879672900000002,,Uncharacterized iModulon 1,Uncharacterized
32,Unc_3,False,0.021526811,,Uncharacterized iModulon 3,Uncharacterized
33,SG_4,False,0.0201598937,,Single Gene iModulon 4,Single Gene
13,SG_1,False,0.0199570247,,Single Gene iModulon 1,Single Gene
37,Rv3095,False,-0.0189399781,Rv3095,iModulon labeled with predicted regulon with unknown function,Unknown Function
58,Zur,False,-0.0176857618,zur,Transcription factor that is activated by and regulates the metabolism of zinc,Metal Related
44,SG_6,False,-0.0174447237,,Single Genes iModulon 6,Single Gene
9,SigK,False,0.0174143836,sigK,Sigma Factor involved in the production of antigenic proteins,Unknown Function
14,SG_2,False,-0.0168710818,,Single Gene iModulon 2,Single Gene
61,Nucleic Acid Hydrolysis ,False,-0.0166033625,,iModulon enriched with the Nucleic Acid Hydrolysis KEGG pathway,Nucleic Acids
29,Blal,False,-0.0161093746,blaI,"Transcription regulator that regulates genes associated with antibiotic transport, detoxification, and cell wall function",Antibiotic
71,PDIM;PGL Synthesis,False,0.0157762977,,Manually annotated iModulon that captures genes associated with PDIM and PGL synthesis,Virulence/Persistence
27,Unc_2,False,-0.0154840224,,Uncharacterized iModulon 2,Uncharacterized
48,Leucine Related,False,0.0154414912,,Manually annotated iModulon with gene related to leucine metabolism,Amino Acids
50,Unc_6,False,0.015106717300000001,,Uncharacterized iModulon 6,Uncharacterized
70,Lsr2,False,0.0148893223,lsr2,Sequence independent transcription factor that controls a wide variety of genes,Antibiotic
56,Fatty Acid Biosynthesis,False,-0.014503962300000001,trcR and Rv1776c and whiB4 ,"iModulon that maps to the intersection of the Rv1033c, Rv1776c, and Rv3681c regulons",Fatty Acid/Cholestrol
46,Rv2621c,False,0.0140479401,Rv2621c,iModulon labeled with predicted regulon with unknown function,Unknown Function
65,SG_10,False,0.013845793700000001,,Single Gene iModulon 10,Single Gene
51,PhoP,False,-0.013330385600000001,phoP,"Transcription factor that controls response to redox/acid stress, hypoxia, and virulence",Virulence/Persistence
76,SG_13,False,0.0130587119,,Single Gene iModulon 13,Single Gene
62,Rv2488c,False,0.0130562043,Rv2488c,LuxR family transcription factor that regulates genes associated with virulence,Virulence/Persistence
43,LysG,False,-0.0127393637,lsyG,Transcription factor that controls the expression of LysE and requires lysine or histidine for activation ,Amino Acids
26,EspL KO,False,-0.0124944318,,Single Gene iModulon that captures EspL knockout,KO
15,BkaR,False,0.012332746300000001,bkaR,Transcription factor that regulates genes related to branched-chain keto-acid metabolism,Central Carbon
64,Mce1R,False,-0.0123321392,mce1R,Transcription factor that regulates the mce1 virulence operon,Virulence/Persistence
25,Rv0078+Rv2034,False,0.0119581068,Rv0078 and Rv2034,iModulon that maps to the intersection of the Rv0078 and Rv2034 regulon,Antibiotic
8,IdeR,False,-0.0119290303,ideR,Metal-Dependent DNA-Binding protein that controls genes related to iron metabolism,Metal Related
38,SG_5,False,-0.0114476574,,Single Gene iModulon 5,Single Gene
57,SG_8,False,0.0113995669,,Single Gene iModulon 8,Single Gene
24,Salicylate Induced,False,0.011181528100000001,,Manually annotated iModulon where genes were found to change expression when exposed to salicylate,Metal Related
47,SG_7,False,0.0108837785,,Single Gene iModulon 7,Single Gene
39,SigC,False,-0.0093121821,sigC,Sigma Factor that plays a role in organism virulence and lethality,Virulence/Persistence
31,ArgR,False,0.0087184944,argR,Transcription factor that regulates the L-arginine biosynthesis pathways,Amino Acids
21,MprA,False,-0.0087067075,mprA,Transcription factor that regulates multiple stress responsive genes,Virulence/Persistence
75,Unc_9,False,0.0087012148,,Uncharacterized iModulon 9,Uncharacterized
10,RicR,False,-0.007914682400000001,ricR,Copper responsive transcription factor that regulates metal metabolism genes,Metal Related
79,WhiB4/IdeR,False,-0.0075677539,whiB4 or ideR,iModulon that maps to the union of the Rv3681c and Rv2711 regulons,Redox
30,HPT-2b Induced,False,0.0075622286,,iModulon regulates many genes that are activated by HPT-2b (1-hydroxy-5-R-pyridine-2(1H)-thiones),Metal Related
73,SG_11,False,-0.0073690163000000005,,Single Gene iModulon 11,Single Gene
60,Rv0681,False,-0.0069218416,Rv0681,"Transcription with previously unknown function, regulates core fatty acid response",Unknown Function
63,SG_9,False,0.006324763000000001,,Single Gene iModulon 9,Single Gene
42,Nicotinate Metabolism,False,-0.0061403665,,iModulon enriched with the nicotinate and nicotinamide metabolism KEGG pathway,Central Carbon
68,Sulfur Metabolism,False,-0.0059616823,,Kegg Map that displays the transport and metabolism of sulfur,Sulfur Metabolism
1,Polyketide Synthase Complex,False,0.0055907084,,KEGG Map related to the synthesis of type II polyketide backbone ,Fatty Acid/Cholestrol
59,Rv0576,False,0.0055399422,Rv0576,Possible ArsR family transcription factor that regulates genes related to virulence,Virulence/Persistence
67,Peptidoglycan Biosynthesis,False,-0.0053093576,,iModulon enriched with the Peptidoglycan biosyntehsis KEGG pathway,Central Carbon
0,SigH,False,-0.0052946391,sigH,Sigma Factor involved in heat shock and oxidative stress response,Virulence/Persistence
49,Rv1828/SigH,False,0.00507155,Rv1828 or sigH,iModulon that maps to the union of the Rv1828 and Rv3223c regulons,Redox
23,PrpR,False,0.0049306637,prpR,Transcription factor that is involved in catabolism of short chain fatty acids via gloxylate and methylcitrate cycle,Central Carbon
3,PyrR,False,0.0048844304000000005,pyrR,Transcription factor that regulates the expression of pyrimidine nucleotide operons,Nucleic Acids
66,M-box,False,0.0048658567,,Magnesium activated non-coding sRNA that regulates the function of genes associated with metal metabolism and virulence,Metal Related
4,WhiB4,False,-0.0044174206,whiB4,Redox-Responsive transcription regulator that regulates protection response during infection,Redox
11,EccE1 KO,False,-0.0042673262,,Single Gene iModulon that captures EccE1 knockout,KO
41,Unc_5,False,-0.0039070154,,Uncharacterized iModulon 5,Uncharacterized
78,Positive Regulation of Growth,False,-0.0038789678,,iModulon enriched with the Positive Regulation of Growth Gene Ontology term,Growth
6,MarR,False,0.0038533385,marR,Transcription factor that regulates the response to acid stress,Acid Stress
22,SG_3,False,-0.0033308872000000003,,Single Gene iModulon 3,Single Gene
17,VirS,False,-0.0032704368,virS,Transcription factor that is activated and responds to acidic environments,Redox
28,WhiB1,False,-0.0031449382,whiB1,"Transcription repressor that is redox responsive, found to be nitric oxide sensitive",Redox
54,Unc_7,False,0.0031014502,,Uncharacterized iModulon 7,Uncharacterized
77,Central Carbon Metabolism,False,0.0029882255,,iModulon enriched with the Central Carbon Metabolism KEGG pathway,Central Carbon
20,FasR,False,-0.0029881833000000003,fasR,Transcription factor that controls the expression of fatty acid metabolism genes,Fatty Acid/Cholestrol
55,WhiB7,False,-0.0024999096,whiB7,Transcription factor that connects systems for redox homeostasis and antibiotic resistance,Antibiotic
40,KstR2,False,-0.0021144593,kstR2,Transcription factor that regulates a small regulon related to cholesterol utilization,Fatty Acid/Cholestrol
7,GroEL-GroES Complex,False,-0.0017690176,,Gene Ontology Term specific to the bacterial chaperonin complex,Amino Acids
36,Fumarate Reductase,False,0.0016424657,,iModulon enriched with the Fumarate Reductase Gene Ontology term,Central Carbon
45,SigD,False,0.0015311782,sigD,Sigma Factor that governs the expression of ribosomal genes and plays a role in virulence,Virulence/Persistence
74,SG_12,False,-0.0013829827,,Single Gene iModulon 12,Single Gene
5,DevR-1,False,0.001280108,devR,Transcription factor that is one of the primary regulators of hypoxia onset response,Redox
35,Unc_4,False,0.0009704012,,Uncharacterized iModulon 4,Uncharacterized
72,Unc_8,False,0.0009565696,,Uncharacterized iModulon 8,Uncharacterized
2,IniR,False,0.0008936311,iniR,Transcription factor that regulates the expression of the ini operon (iniBAC),Antibiotic
53,Rv1776c+WhiB4,False,0.0008106839000000001,Rv1776c and whiB4 ,iModulon that maps to the intersection of the Rv1776c and Rv3681c regulon,Redox
19,WhiB6,False,0.0007783689000000001,whiB6,Transcription factor that regulates ESX-1 system membrane transport proteins,Redox
52,DevR-2,False,-0.0005071240000000001,devR,Transcription factor that is one of the primary regulators of hypoxia onset response,Redox
16,Mce3R,False,0.00047754890000000004,mce3R,Transcription factor that regulates the mce3 virulence operon,Virulence/Persistence
