k,Name,in_iM,gene_weight,Regulator,Function,Category
41,Unc_5,False,0.0367512833,,Uncharacterized iModulon 5,Uncharacterized
40,KstR2,False,0.0245703777,kstR2,Transcription factor that regulates a small regulon related to cholesterol utilization,Fatty Acid/Cholestrol
22,SG_3,False,-0.0217561051,,Single Gene iModulon 3,Single Gene
78,Positive Regulation of Growth,False,-0.021074682,,iModulon enriched with the Positive Regulation of Growth Gene Ontology term,Growth
66,M-box,False,0.0199916461,,Magnesium activated non-coding sRNA that regulates the function of genes associated with metal metabolism and virulence,Metal Related
75,Unc_9,False,-0.0196077263,,Uncharacterized iModulon 9,Uncharacterized
68,Sulfur Metabolism,False,-0.0174282626,,Kegg Map that displays the transport and metabolism of sulfur,Sulfur Metabolism
15,BkaR,False,-0.017398693,bkaR,Transcription factor that regulates genes related to branched-chain keto-acid metabolism,Central Carbon
70,Lsr2,False,0.0159776326,lsr2,Sequence independent transcription factor that controls a wide variety of genes,Antibiotic
13,SG_1,False,0.0156350013,,Single Gene iModulon 1,Single Gene
74,SG_12,False,0.015548035100000001,,Single Gene iModulon 12,Single Gene
17,VirS,False,0.0142931703,virS,Transcription factor that is activated and responds to acidic environments,Redox
47,SG_7,False,-0.0140371373,,Single Gene iModulon 7,Single Gene
31,ArgR,False,-0.0140363338,argR,Transcription factor that regulates the L-arginine biosynthesis pathways,Amino Acids
14,SG_2,False,0.013390995800000001,,Single Gene iModulon 2,Single Gene
67,Peptidoglycan Biosynthesis,False,-0.0122973838,,iModulon enriched with the Peptidoglycan biosyntehsis KEGG pathway,Central Carbon
51,PhoP,False,0.012179606400000001,phoP,"Transcription factor that controls response to redox/acid stress, hypoxia, and virulence",Virulence/Persistence
34,MbcA+Rv3249c+Rv3066,False,-0.0118749222,mbcA and Rv3249c and Rv3066,"iModulon that maps to the intersection of the Rv1990c, Rv3249c, and Rv3066 regulons",Virulence/Persistence
77,Central Carbon Metabolism,False,-0.011863926,,iModulon enriched with the Central Carbon Metabolism KEGG pathway,Central Carbon
62,Rv2488c,False,0.0117740831,Rv2488c,LuxR family transcription factor that regulates genes associated with virulence,Virulence/Persistence
27,Unc_2,False,-0.011482475300000001,,Uncharacterized iModulon 2,Uncharacterized
16,Mce3R,False,-0.0113953938,mce3R,Transcription factor that regulates the mce3 virulence operon,Virulence/Persistence
65,SG_10,False,-0.011089388700000001,,Single Gene iModulon 10,Single Gene
71,PDIM;PGL Synthesis,False,0.0102313357,,Manually annotated iModulon that captures genes associated with PDIM and PGL synthesis,Virulence/Persistence
20,FasR,False,-0.0102022763,fasR,Transcription factor that controls the expression of fatty acid metabolism genes,Fatty Acid/Cholestrol
32,Unc_3,False,0.010167925500000001,,Uncharacterized iModulon 3,Uncharacterized
33,SG_4,False,-0.0101361522,,Single Gene iModulon 4,Single Gene
79,WhiB4/IdeR,False,-0.0101184376,whiB4 or ideR,iModulon that maps to the union of the Rv3681c and Rv2711 regulons,Redox
18,Unc_1,False,0.0097317008,,Uncharacterized iModulon 1,Uncharacterized
24,Salicylate Induced,False,0.009561262400000001,,Manually annotated iModulon where genes were found to change expression when exposed to salicylate,Metal Related
3,PyrR,False,-0.0093957008,pyrR,Transcription factor that regulates the expression of pyrimidine nucleotide operons,Nucleic Acids
5,DevR-1,False,-0.0088451968,devR,Transcription factor that is one of the primary regulators of hypoxia onset response,Redox
48,Leucine Related,False,-0.008719708500000001,,Manually annotated iModulon with gene related to leucine metabolism,Amino Acids
28,WhiB1,False,-0.008711402200000001,whiB1,"Transcription repressor that is redox responsive, found to be nitric oxide sensitive",Redox
45,SigD,False,0.0083501989,sigD,Sigma Factor that governs the expression of ribosomal genes and plays a role in virulence,Virulence/Persistence
64,Mce1R,False,-0.0071167594,mce1R,Transcription factor that regulates the mce1 virulence operon,Virulence/Persistence
7,GroEL-GroES Complex,False,0.0068047198,,Gene Ontology Term specific to the bacterial chaperonin complex,Amino Acids
8,IdeR,False,-0.006506173400000001,ideR,Metal-Dependent DNA-Binding protein that controls genes related to iron metabolism,Metal Related
46,Rv2621c,False,0.0064873542,Rv2621c,iModulon labeled with predicted regulon with unknown function,Unknown Function
21,MprA,False,0.006467212700000001,mprA,Transcription factor that regulates multiple stress responsive genes,Virulence/Persistence
6,MarR,False,-0.0064246381,marR,Transcription factor that regulates the response to acid stress,Acid Stress
50,Unc_6,False,-0.0062693869,,Uncharacterized iModulon 6,Uncharacterized
12,Mycofactocin Synthesis Pathway,False,-0.006167685500000001,,Manually annotated iModulon that captures multiple genes associated with mycofactocin metabolism,Fatty Acid/Cholestrol
49,Rv1828/SigH,False,0.0058841676,Rv1828 or sigH,iModulon that maps to the union of the Rv1828 and Rv3223c regulons,Redox
52,DevR-2,False,0.0058398564,devR,Transcription factor that is one of the primary regulators of hypoxia onset response,Redox
59,Rv0576,False,0.0055866762000000006,Rv0576,Possible ArsR family transcription factor that regulates genes related to virulence,Virulence/Persistence
1,Polyketide Synthase Complex,False,-0.0051852492,,KEGG Map related to the synthesis of type II polyketide backbone ,Fatty Acid/Cholestrol
4,WhiB4,False,-0.0046876605,whiB4,Redox-Responsive transcription regulator that regulates protection response during infection,Redox
61,Nucleic Acid Hydrolysis ,False,-0.0046025942,,iModulon enriched with the Nucleic Acid Hydrolysis KEGG pathway,Nucleic Acids
39,SigC,False,0.0045124819,sigC,Sigma Factor that plays a role in organism virulence and lethality,Virulence/Persistence
11,EccE1 KO,False,0.0043193910000000005,,Single Gene iModulon that captures EccE1 knockout,KO
9,SigK,False,0.0041103082,sigK,Sigma Factor involved in the production of antigenic proteins,Unknown Function
53,Rv1776c+WhiB4,False,0.0040708364000000006,Rv1776c and whiB4 ,iModulon that maps to the intersection of the Rv1776c and Rv3681c regulon,Redox
73,SG_11,False,-0.0040357341000000005,,Single Gene iModulon 11,Single Gene
36,Fumarate Reductase,False,-0.004005936,,iModulon enriched with the Fumarate Reductase Gene Ontology term,Central Carbon
38,SG_5,False,0.0040029925,,Single Gene iModulon 5,Single Gene
56,Fatty Acid Biosynthesis,False,-0.003983072900000001,trcR and Rv1776c and whiB4 ,"iModulon that maps to the intersection of the Rv1033c, Rv1776c, and Rv3681c regulons",Fatty Acid/Cholestrol
10,RicR,False,0.0038261737000000002,ricR,Copper responsive transcription factor that regulates metal metabolism genes,Metal Related
23,PrpR,False,-0.0037203534,prpR,Transcription factor that is involved in catabolism of short chain fatty acids via gloxylate and methylcitrate cycle,Central Carbon
29,Blal,False,-0.0036745584,blaI,"Transcription regulator that regulates genes associated with antibiotic transport, detoxification, and cell wall function",Antibiotic
69,Rv0135+Rv1019,False,0.0036555441,Rv0135c and Rv1019,iModulon that maps to the intersection of the Rv0135c and Rv1019 regulons,Nucleic Acids
58,Zur,False,-0.0033778870000000004,zur,Transcription factor that is activated by and regulates the metabolism of zinc,Metal Related
30,HPT-2b Induced,False,-0.0032906747,,iModulon regulates many genes that are activated by HPT-2b (1-hydroxy-5-R-pyridine-2(1H)-thiones),Metal Related
19,WhiB6,False,-0.0032892976000000003,whiB6,Transcription factor that regulates ESX-1 system membrane transport proteins,Redox
37,Rv3095,False,-0.0031802986,Rv3095,iModulon labeled with predicted regulon with unknown function,Unknown Function
54,Unc_7,False,-0.0031161298000000003,,Uncharacterized iModulon 7,Uncharacterized
63,SG_9,False,-0.0027469524,,Single Gene iModulon 9,Single Gene
76,SG_13,False,0.0026541246,,Single Gene iModulon 13,Single Gene
72,Unc_8,False,0.0025919346,,Uncharacterized iModulon 8,Uncharacterized
55,WhiB7,False,-0.0024085680000000003,whiB7,Transcription factor that connects systems for redox homeostasis and antibiotic resistance,Antibiotic
42,Nicotinate Metabolism,False,0.0023438214,,iModulon enriched with the nicotinate and nicotinamide metabolism KEGG pathway,Central Carbon
35,Unc_4,False,0.0022890341,,Uncharacterized iModulon 4,Uncharacterized
0,SigH,False,0.0021225865000000003,sigH,Sigma Factor involved in heat shock and oxidative stress response,Virulence/Persistence
2,IniR,False,0.0018028765,iniR,Transcription factor that regulates the expression of the ini operon (iniBAC),Antibiotic
60,Rv0681,False,-0.0012900852000000001,Rv0681,"Transcription with previously unknown function, regulates core fatty acid response",Unknown Function
44,SG_6,False,0.001035329,,Single Genes iModulon 6,Single Gene
26,EspL KO,False,0.0009564316000000001,,Single Gene iModulon that captures EspL knockout,KO
25,Rv0078+Rv2034,False,-0.0008561622,Rv0078 and Rv2034,iModulon that maps to the intersection of the Rv0078 and Rv2034 regulon,Antibiotic
57,SG_8,False,0.000608056,,Single Gene iModulon 8,Single Gene
43,LysG,False,-0.0005326997,lsyG,Transcription factor that controls the expression of LysE and requires lysine or histidine for activation ,Amino Acids
