k,Name,in_iM,gene_weight,Regulator,Function,Category
36,Fumarate Reductase,False,0.0389489707,,iModulon enriched with the Fumarate Reductase Gene Ontology term,Central Carbon
37,Rv3095,False,0.0273360414,Rv3095,iModulon labeled with predicted regulon with unknown function,Unknown Function
55,WhiB7,False,0.0246631809,whiB7,Transcription factor that connects systems for redox homeostasis and antibiotic resistance,Antibiotic
73,SG_11,False,-0.022901671800000002,,Single Gene iModulon 11,Single Gene
34,MbcA+Rv3249c+Rv3066,False,-0.0207324469,mbcA and Rv3249c and Rv3066,"iModulon that maps to the intersection of the Rv1990c, Rv3249c, and Rv3066 regulons",Virulence/Persistence
13,SG_1,False,-0.0187956486,,Single Gene iModulon 1,Single Gene
28,WhiB1,False,-0.0182623441,whiB1,"Transcription repressor that is redox responsive, found to be nitric oxide sensitive",Redox
12,Mycofactocin Synthesis Pathway,False,-0.0176525556,,Manually annotated iModulon that captures multiple genes associated with mycofactocin metabolism,Fatty Acid/Cholestrol
39,SigC,False,-0.0162403951,sigC,Sigma Factor that plays a role in organism virulence and lethality,Virulence/Persistence
79,WhiB4/IdeR,False,-0.0160357818,whiB4 or ideR,iModulon that maps to the union of the Rv3681c and Rv2711 regulons,Redox
29,Blal,False,0.0142369131,blaI,"Transcription regulator that regulates genes associated with antibiotic transport, detoxification, and cell wall function",Antibiotic
38,SG_5,False,0.0137689903,,Single Gene iModulon 5,Single Gene
35,Unc_4,False,-0.013351745000000002,,Uncharacterized iModulon 4,Uncharacterized
44,SG_6,False,0.013344099600000001,,Single Genes iModulon 6,Single Gene
10,RicR,False,-0.0130579803,ricR,Copper responsive transcription factor that regulates metal metabolism genes,Metal Related
21,MprA,False,0.0129654887,mprA,Transcription factor that regulates multiple stress responsive genes,Virulence/Persistence
26,EspL KO,False,-0.0123646033,,Single Gene iModulon that captures EspL knockout,KO
46,Rv2621c,False,0.0120434462,Rv2621c,iModulon labeled with predicted regulon with unknown function,Unknown Function
32,Unc_3,False,0.0116360774,,Uncharacterized iModulon 3,Uncharacterized
71,PDIM;PGL Synthesis,False,-0.0115360099,,Manually annotated iModulon that captures genes associated with PDIM and PGL synthesis,Virulence/Persistence
72,Unc_8,False,-0.011310042900000001,,Uncharacterized iModulon 8,Uncharacterized
68,Sulfur Metabolism,False,-0.0112825178,,Kegg Map that displays the transport and metabolism of sulfur,Sulfur Metabolism
22,SG_3,False,-0.0105672648,,Single Gene iModulon 3,Single Gene
54,Unc_7,False,-0.0093721913,,Uncharacterized iModulon 7,Uncharacterized
31,ArgR,False,0.0090784104,argR,Transcription factor that regulates the L-arginine biosynthesis pathways,Amino Acids
59,Rv0576,False,0.0090309492,Rv0576,Possible ArsR family transcription factor that regulates genes related to virulence,Virulence/Persistence
51,PhoP,False,-0.0084911799,phoP,"Transcription factor that controls response to redox/acid stress, hypoxia, and virulence",Virulence/Persistence
47,SG_7,False,-0.0084201129,,Single Gene iModulon 7,Single Gene
78,Positive Regulation of Growth,False,0.008031644000000001,,iModulon enriched with the Positive Regulation of Growth Gene Ontology term,Growth
20,FasR,False,0.0079296488,fasR,Transcription factor that controls the expression of fatty acid metabolism genes,Fatty Acid/Cholestrol
45,SigD,False,-0.0078668682,sigD,Sigma Factor that governs the expression of ribosomal genes and plays a role in virulence,Virulence/Persistence
24,Salicylate Induced,False,-0.007535449600000001,,Manually annotated iModulon where genes were found to change expression when exposed to salicylate,Metal Related
67,Peptidoglycan Biosynthesis,False,-0.0070480188,,iModulon enriched with the Peptidoglycan biosyntehsis KEGG pathway,Central Carbon
75,Unc_9,False,-0.0070224033000000005,,Uncharacterized iModulon 9,Uncharacterized
8,IdeR,False,0.0069100241,ideR,Metal-Dependent DNA-Binding protein that controls genes related to iron metabolism,Metal Related
7,GroEL-GroES Complex,False,0.0067448228,,Gene Ontology Term specific to the bacterial chaperonin complex,Amino Acids
69,Rv0135+Rv1019,False,-0.006519632300000001,Rv0135c and Rv1019,iModulon that maps to the intersection of the Rv0135c and Rv1019 regulons,Nucleic Acids
2,IniR,False,-0.0064950063,iniR,Transcription factor that regulates the expression of the ini operon (iniBAC),Antibiotic
63,SG_9,False,-0.0064115798,,Single Gene iModulon 9,Single Gene
42,Nicotinate Metabolism,False,-0.0062644027,,iModulon enriched with the nicotinate and nicotinamide metabolism KEGG pathway,Central Carbon
27,Unc_2,False,-0.0062240677000000005,,Uncharacterized iModulon 2,Uncharacterized
30,HPT-2b Induced,False,0.0061385564,,iModulon regulates many genes that are activated by HPT-2b (1-hydroxy-5-R-pyridine-2(1H)-thiones),Metal Related
5,DevR-1,False,-0.005691676200000001,devR,Transcription factor that is one of the primary regulators of hypoxia onset response,Redox
40,KstR2,False,0.0055276782,kstR2,Transcription factor that regulates a small regulon related to cholesterol utilization,Fatty Acid/Cholestrol
65,SG_10,False,-0.0051913242,,Single Gene iModulon 10,Single Gene
15,BkaR,False,-0.0048823697,bkaR,Transcription factor that regulates genes related to branched-chain keto-acid metabolism,Central Carbon
14,SG_2,False,-0.0048562817,,Single Gene iModulon 2,Single Gene
52,DevR-2,False,0.0042510123,devR,Transcription factor that is one of the primary regulators of hypoxia onset response,Redox
4,WhiB4,False,0.0042045149,whiB4,Redox-Responsive transcription regulator that regulates protection response during infection,Redox
61,Nucleic Acid Hydrolysis ,False,0.0041887404,,iModulon enriched with the Nucleic Acid Hydrolysis KEGG pathway,Nucleic Acids
17,VirS,False,-0.0041460360000000005,virS,Transcription factor that is activated and responds to acidic environments,Redox
64,Mce1R,False,0.0041117395,mce1R,Transcription factor that regulates the mce1 virulence operon,Virulence/Persistence
43,LysG,False,0.0041013375,lsyG,Transcription factor that controls the expression of LysE and requires lysine or histidine for activation ,Amino Acids
74,SG_12,False,-0.0040110437,,Single Gene iModulon 12,Single Gene
70,Lsr2,False,0.0036759633,lsr2,Sequence independent transcription factor that controls a wide variety of genes,Antibiotic
57,SG_8,False,0.0035620851,,Single Gene iModulon 8,Single Gene
48,Leucine Related,False,-0.0033835301,,Manually annotated iModulon with gene related to leucine metabolism,Amino Acids
19,WhiB6,False,0.0030156169,whiB6,Transcription factor that regulates ESX-1 system membrane transport proteins,Redox
76,SG_13,False,0.0028371382,,Single Gene iModulon 13,Single Gene
1,Polyketide Synthase Complex,False,-0.0027888906000000002,,KEGG Map related to the synthesis of type II polyketide backbone ,Fatty Acid/Cholestrol
66,M-box,False,0.0025203777,,Magnesium activated non-coding sRNA that regulates the function of genes associated with metal metabolism and virulence,Metal Related
25,Rv0078+Rv2034,False,-0.002433371,Rv0078 and Rv2034,iModulon that maps to the intersection of the Rv0078 and Rv2034 regulon,Antibiotic
18,Unc_1,False,0.0020832303000000003,,Uncharacterized iModulon 1,Uncharacterized
41,Unc_5,False,0.00199918,,Uncharacterized iModulon 5,Uncharacterized
6,MarR,False,-0.0016334433000000001,marR,Transcription factor that regulates the response to acid stress,Acid Stress
3,PyrR,False,-0.0014928886000000001,pyrR,Transcription factor that regulates the expression of pyrimidine nucleotide operons,Nucleic Acids
60,Rv0681,False,0.0013438536,Rv0681,"Transcription with previously unknown function, regulates core fatty acid response",Unknown Function
33,SG_4,False,-0.0013028281,,Single Gene iModulon 4,Single Gene
53,Rv1776c+WhiB4,False,-0.001258449,Rv1776c and whiB4 ,iModulon that maps to the intersection of the Rv1776c and Rv3681c regulon,Redox
62,Rv2488c,False,0.001231897,Rv2488c,LuxR family transcription factor that regulates genes associated with virulence,Virulence/Persistence
9,SigK,False,0.0011336519,sigK,Sigma Factor involved in the production of antigenic proteins,Unknown Function
56,Fatty Acid Biosynthesis,False,-0.0008703836000000001,trcR and Rv1776c and whiB4 ,"iModulon that maps to the intersection of the Rv1033c, Rv1776c, and Rv3681c regulons",Fatty Acid/Cholestrol
77,Central Carbon Metabolism,False,-0.0005253496,,iModulon enriched with the Central Carbon Metabolism KEGG pathway,Central Carbon
58,Zur,False,-0.0004168233,zur,Transcription factor that is activated by and regulates the metabolism of zinc,Metal Related
49,Rv1828/SigH,False,0.00024086230000000002,Rv1828 or sigH,iModulon that maps to the union of the Rv1828 and Rv3223c regulons,Redox
16,Mce3R,False,-0.0002311144,mce3R,Transcription factor that regulates the mce3 virulence operon,Virulence/Persistence
23,PrpR,False,-0.0001106829,prpR,Transcription factor that is involved in catabolism of short chain fatty acids via gloxylate and methylcitrate cycle,Central Carbon
50,Unc_6,False,-4.1914000000000006e-05,,Uncharacterized iModulon 6,Uncharacterized
0,SigH,False,3.82984e-05,sigH,Sigma Factor involved in heat shock and oxidative stress response,Virulence/Persistence
11,EccE1 KO,False,1.5092200000000001e-05,,Single Gene iModulon that captures EccE1 knockout,KO
