k,Name,in_iM,gene_weight,Regulator,Function,Category
35,Unc_4,False,0.0419502608,,Uncharacterized iModulon 4,Uncharacterized
49,Rv1828/SigH,False,0.024464029300000002,Rv1828 or sigH,iModulon that maps to the union of the Rv1828 and Rv3223c regulons,Redox
77,Central Carbon Metabolism,False,-0.0235237108,,iModulon enriched with the Central Carbon Metabolism KEGG pathway,Central Carbon
9,SigK,False,-0.0196395389,sigK,Sigma Factor involved in the production of antigenic proteins,Unknown Function
70,Lsr2,False,0.0170881482,lsr2,Sequence independent transcription factor that controls a wide variety of genes,Antibiotic
69,Rv0135+Rv1019,False,-0.0168785122,Rv0135c and Rv1019,iModulon that maps to the intersection of the Rv0135c and Rv1019 regulons,Nucleic Acids
65,SG_10,False,-0.0160019995,,Single Gene iModulon 10,Single Gene
60,Rv0681,False,-0.015034629300000001,Rv0681,"Transcription with previously unknown function, regulates core fatty acid response",Unknown Function
79,WhiB4/IdeR,False,-0.0149397368,whiB4 or ideR,iModulon that maps to the union of the Rv3681c and Rv2711 regulons,Redox
40,KstR2,False,0.0137153666,kstR2,Transcription factor that regulates a small regulon related to cholesterol utilization,Fatty Acid/Cholestrol
16,Mce3R,False,0.0136862054,mce3R,Transcription factor that regulates the mce3 virulence operon,Virulence/Persistence
18,Unc_1,False,-0.0133763812,,Uncharacterized iModulon 1,Uncharacterized
21,MprA,False,0.0133179226,mprA,Transcription factor that regulates multiple stress responsive genes,Virulence/Persistence
52,DevR-2,False,-0.0124053416,devR,Transcription factor that is one of the primary regulators of hypoxia onset response,Redox
36,Fumarate Reductase,False,-0.0120804662,,iModulon enriched with the Fumarate Reductase Gene Ontology term,Central Carbon
13,SG_1,False,0.011850373400000001,,Single Gene iModulon 1,Single Gene
50,Unc_6,False,-0.011739662100000001,,Uncharacterized iModulon 6,Uncharacterized
64,Mce1R,False,-0.0107067954,mce1R,Transcription factor that regulates the mce1 virulence operon,Virulence/Persistence
66,M-box,False,-0.0106659226,,Magnesium activated non-coding sRNA that regulates the function of genes associated with metal metabolism and virulence,Metal Related
43,LysG,False,0.0105927394,lsyG,Transcription factor that controls the expression of LysE and requires lysine or histidine for activation ,Amino Acids
4,WhiB4,False,-0.0102390721,whiB4,Redox-Responsive transcription regulator that regulates protection response during infection,Redox
27,Unc_2,False,0.0102060307,,Uncharacterized iModulon 2,Uncharacterized
15,BkaR,False,-0.0098570891,bkaR,Transcription factor that regulates genes related to branched-chain keto-acid metabolism,Central Carbon
55,WhiB7,False,-0.009820231700000001,whiB7,Transcription factor that connects systems for redox homeostasis and antibiotic resistance,Antibiotic
25,Rv0078+Rv2034,False,0.0089882424,Rv0078 and Rv2034,iModulon that maps to the intersection of the Rv0078 and Rv2034 regulon,Antibiotic
7,GroEL-GroES Complex,False,0.0088666334,,Gene Ontology Term specific to the bacterial chaperonin complex,Amino Acids
73,SG_11,False,0.0086524658,,Single Gene iModulon 11,Single Gene
1,Polyketide Synthase Complex,False,-0.008259711900000001,,KEGG Map related to the synthesis of type II polyketide backbone ,Fatty Acid/Cholestrol
54,Unc_7,False,0.0078313824,,Uncharacterized iModulon 7,Uncharacterized
57,SG_8,False,0.0078163013,,Single Gene iModulon 8,Single Gene
12,Mycofactocin Synthesis Pathway,False,-0.007642732,,Manually annotated iModulon that captures multiple genes associated with mycofactocin metabolism,Fatty Acid/Cholestrol
20,FasR,False,0.0074322195,fasR,Transcription factor that controls the expression of fatty acid metabolism genes,Fatty Acid/Cholestrol
45,SigD,False,-0.0072117545000000005,sigD,Sigma Factor that governs the expression of ribosomal genes and plays a role in virulence,Virulence/Persistence
78,Positive Regulation of Growth,False,-0.0071141097,,iModulon enriched with the Positive Regulation of Growth Gene Ontology term,Growth
53,Rv1776c+WhiB4,False,-0.006976198,Rv1776c and whiB4 ,iModulon that maps to the intersection of the Rv1776c and Rv3681c regulon,Redox
47,SG_7,False,0.0067258317000000005,,Single Gene iModulon 7,Single Gene
63,SG_9,False,0.006632336000000001,,Single Gene iModulon 9,Single Gene
61,Nucleic Acid Hydrolysis ,False,0.0061623716,,iModulon enriched with the Nucleic Acid Hydrolysis KEGG pathway,Nucleic Acids
68,Sulfur Metabolism,False,-0.006030183000000001,,Kegg Map that displays the transport and metabolism of sulfur,Sulfur Metabolism
6,MarR,False,0.0058796153,marR,Transcription factor that regulates the response to acid stress,Acid Stress
3,PyrR,False,0.0057049288,pyrR,Transcription factor that regulates the expression of pyrimidine nucleotide operons,Nucleic Acids
71,PDIM;PGL Synthesis,False,-0.0056915983000000005,,Manually annotated iModulon that captures genes associated with PDIM and PGL synthesis,Virulence/Persistence
58,Zur,False,0.0055206646,zur,Transcription factor that is activated by and regulates the metabolism of zinc,Metal Related
59,Rv0576,False,-0.0053375275000000005,Rv0576,Possible ArsR family transcription factor that regulates genes related to virulence,Virulence/Persistence
5,DevR-1,False,0.0053060291,devR,Transcription factor that is one of the primary regulators of hypoxia onset response,Redox
48,Leucine Related,False,0.0051152662,,Manually annotated iModulon with gene related to leucine metabolism,Amino Acids
37,Rv3095,False,-0.0049990372000000005,Rv3095,iModulon labeled with predicted regulon with unknown function,Unknown Function
51,PhoP,False,-0.0044762594,phoP,"Transcription factor that controls response to redox/acid stress, hypoxia, and virulence",Virulence/Persistence
75,Unc_9,False,-0.0043883599,,Uncharacterized iModulon 9,Uncharacterized
34,MbcA+Rv3249c+Rv3066,False,0.0042290923,mbcA and Rv3249c and Rv3066,"iModulon that maps to the intersection of the Rv1990c, Rv3249c, and Rv3066 regulons",Virulence/Persistence
76,SG_13,False,0.0042186834,,Single Gene iModulon 13,Single Gene
38,SG_5,False,-0.004053237,,Single Gene iModulon 5,Single Gene
22,SG_3,False,0.0039008676000000003,,Single Gene iModulon 3,Single Gene
24,Salicylate Induced,False,-0.0037989729,,Manually annotated iModulon where genes were found to change expression when exposed to salicylate,Metal Related
67,Peptidoglycan Biosynthesis,False,0.0035027911,,iModulon enriched with the Peptidoglycan biosyntehsis KEGG pathway,Central Carbon
74,SG_12,False,-0.0033536622,,Single Gene iModulon 12,Single Gene
29,Blal,False,0.0031851099,blaI,"Transcription regulator that regulates genes associated with antibiotic transport, detoxification, and cell wall function",Antibiotic
19,WhiB6,False,-0.0030140649,whiB6,Transcription factor that regulates ESX-1 system membrane transport proteins,Redox
2,IniR,False,-0.002945123,iniR,Transcription factor that regulates the expression of the ini operon (iniBAC),Antibiotic
14,SG_2,False,0.0028161143000000003,,Single Gene iModulon 2,Single Gene
32,Unc_3,False,-0.0025140749,,Uncharacterized iModulon 3,Uncharacterized
31,ArgR,False,0.002457517,argR,Transcription factor that regulates the L-arginine biosynthesis pathways,Amino Acids
26,EspL KO,False,0.0023117298,,Single Gene iModulon that captures EspL knockout,KO
28,WhiB1,False,-0.0021661047,whiB1,"Transcription repressor that is redox responsive, found to be nitric oxide sensitive",Redox
11,EccE1 KO,False,-0.0021373694,,Single Gene iModulon that captures EccE1 knockout,KO
62,Rv2488c,False,0.0020373525000000003,Rv2488c,LuxR family transcription factor that regulates genes associated with virulence,Virulence/Persistence
39,SigC,False,0.0016829127,sigC,Sigma Factor that plays a role in organism virulence and lethality,Virulence/Persistence
10,RicR,False,0.0016655683,ricR,Copper responsive transcription factor that regulates metal metabolism genes,Metal Related
56,Fatty Acid Biosynthesis,False,0.0016319011,trcR and Rv1776c and whiB4 ,"iModulon that maps to the intersection of the Rv1033c, Rv1776c, and Rv3681c regulons",Fatty Acid/Cholestrol
0,SigH,False,0.0015167557,sigH,Sigma Factor involved in heat shock and oxidative stress response,Virulence/Persistence
8,IdeR,False,0.0013259805,ideR,Metal-Dependent DNA-Binding protein that controls genes related to iron metabolism,Metal Related
30,HPT-2b Induced,False,0.0012586748,,iModulon regulates many genes that are activated by HPT-2b (1-hydroxy-5-R-pyridine-2(1H)-thiones),Metal Related
72,Unc_8,False,0.0011973241,,Uncharacterized iModulon 8,Uncharacterized
46,Rv2621c,False,0.0010796598,Rv2621c,iModulon labeled with predicted regulon with unknown function,Unknown Function
17,VirS,False,0.0009730012,virS,Transcription factor that is activated and responds to acidic environments,Redox
42,Nicotinate Metabolism,False,0.0008835833000000001,,iModulon enriched with the nicotinate and nicotinamide metabolism KEGG pathway,Central Carbon
41,Unc_5,False,0.0008555029,,Uncharacterized iModulon 5,Uncharacterized
23,PrpR,False,0.0007362966,prpR,Transcription factor that is involved in catabolism of short chain fatty acids via gloxylate and methylcitrate cycle,Central Carbon
44,SG_6,False,0.0005367508000000001,,Single Genes iModulon 6,Single Gene
33,SG_4,False,0.0003428171,,Single Gene iModulon 4,Single Gene
