k,Name,in_iM,gene_weight,Regulator,Function,Category
64,Mce1R,True,0.13386568000000001,mce1R,Transcription factor that regulates the mce1 virulence operon,Virulence/Persistence
35,Unc_4,True,0.06733603810000001,,Uncharacterized iModulon 4,Uncharacterized
36,Fumarate Reductase,False,-0.0534184944,,iModulon enriched with the Fumarate Reductase Gene Ontology term,Central Carbon
77,Central Carbon Metabolism,False,-0.0377049296,,iModulon enriched with the Central Carbon Metabolism KEGG pathway,Central Carbon
67,Peptidoglycan Biosynthesis,False,-0.0334911711,,iModulon enriched with the Peptidoglycan biosyntehsis KEGG pathway,Central Carbon
41,Unc_5,False,-0.0302083709,,Uncharacterized iModulon 5,Uncharacterized
1,Polyketide Synthase Complex,False,-0.021660511400000002,,KEGG Map related to the synthesis of type II polyketide backbone ,Fatty Acid/Cholestrol
68,Sulfur Metabolism,False,-0.0203675944,,Kegg Map that displays the transport and metabolism of sulfur,Sulfur Metabolism
17,VirS,False,-0.0162013058,virS,Transcription factor that is activated and responds to acidic environments,Redox
61,Nucleic Acid Hydrolysis ,False,0.0142526934,,iModulon enriched with the Nucleic Acid Hydrolysis KEGG pathway,Nucleic Acids
52,DevR-2,False,-0.0137419735,devR,Transcription factor that is one of the primary regulators of hypoxia onset response,Redox
71,PDIM;PGL Synthesis,False,0.013672864500000001,,Manually annotated iModulon that captures genes associated with PDIM and PGL synthesis,Virulence/Persistence
28,WhiB1,False,-0.0135836383,whiB1,"Transcription repressor that is redox responsive, found to be nitric oxide sensitive",Redox
78,Positive Regulation of Growth,False,0.0134259588,,iModulon enriched with the Positive Regulation of Growth Gene Ontology term,Growth
55,WhiB7,False,0.013363669100000001,whiB7,Transcription factor that connects systems for redox homeostasis and antibiotic resistance,Antibiotic
25,Rv0078+Rv2034,False,0.0133235499,Rv0078 and Rv2034,iModulon that maps to the intersection of the Rv0078 and Rv2034 regulon,Antibiotic
57,SG_8,False,0.0124644783,,Single Gene iModulon 8,Single Gene
63,SG_9,False,0.0112219445,,Single Gene iModulon 9,Single Gene
7,GroEL-GroES Complex,False,0.011042011400000001,,Gene Ontology Term specific to the bacterial chaperonin complex,Amino Acids
72,Unc_8,False,0.010787350900000001,,Uncharacterized iModulon 8,Uncharacterized
40,KstR2,False,-0.0099872992,kstR2,Transcription factor that regulates a small regulon related to cholesterol utilization,Fatty Acid/Cholestrol
76,SG_13,False,0.0085142584,,Single Gene iModulon 13,Single Gene
9,SigK,False,0.0083614151,sigK,Sigma Factor involved in the production of antigenic proteins,Unknown Function
18,Unc_1,False,0.0080415331,,Uncharacterized iModulon 1,Uncharacterized
16,Mce3R,False,0.0077511151,mce3R,Transcription factor that regulates the mce3 virulence operon,Virulence/Persistence
4,WhiB4,False,0.007352258,whiB4,Redox-Responsive transcription regulator that regulates protection response during infection,Redox
5,DevR-1,False,0.0071085543,devR,Transcription factor that is one of the primary regulators of hypoxia onset response,Redox
70,Lsr2,False,0.0070932847,lsr2,Sequence independent transcription factor that controls a wide variety of genes,Antibiotic
30,HPT-2b Induced,False,-0.0068527580000000005,,iModulon regulates many genes that are activated by HPT-2b (1-hydroxy-5-R-pyridine-2(1H)-thiones),Metal Related
66,M-box,False,-0.0064939224,,Magnesium activated non-coding sRNA that regulates the function of genes associated with metal metabolism and virulence,Metal Related
38,SG_5,False,-0.0062573083,,Single Gene iModulon 5,Single Gene
58,Zur,False,0.0062519412000000005,zur,Transcription factor that is activated by and regulates the metabolism of zinc,Metal Related
79,WhiB4/IdeR,False,0.0060732981,whiB4 or ideR,iModulon that maps to the union of the Rv3681c and Rv2711 regulons,Redox
74,SG_12,False,-0.00606685,,Single Gene iModulon 12,Single Gene
12,Mycofactocin Synthesis Pathway,False,-0.005972457400000001,,Manually annotated iModulon that captures multiple genes associated with mycofactocin metabolism,Fatty Acid/Cholestrol
59,Rv0576,False,-0.0058080892,Rv0576,Possible ArsR family transcription factor that regulates genes related to virulence,Virulence/Persistence
15,BkaR,False,-0.0054121306000000004,bkaR,Transcription factor that regulates genes related to branched-chain keto-acid metabolism,Central Carbon
10,RicR,False,0.0053137834,ricR,Copper responsive transcription factor that regulates metal metabolism genes,Metal Related
23,PrpR,False,0.0052631739,prpR,Transcription factor that is involved in catabolism of short chain fatty acids via gloxylate and methylcitrate cycle,Central Carbon
14,SG_2,False,0.0050406372,,Single Gene iModulon 2,Single Gene
49,Rv1828/SigH,False,-0.0049495741000000005,Rv1828 or sigH,iModulon that maps to the union of the Rv1828 and Rv3223c regulons,Redox
60,Rv0681,False,0.004878817000000001,Rv0681,"Transcription with previously unknown function, regulates core fatty acid response",Unknown Function
11,EccE1 KO,False,0.0048698252000000004,,Single Gene iModulon that captures EccE1 knockout,KO
39,SigC,False,-0.0048455182,sigC,Sigma Factor that plays a role in organism virulence and lethality,Virulence/Persistence
34,MbcA+Rv3249c+Rv3066,False,-0.0047596735000000005,mbcA and Rv3249c and Rv3066,"iModulon that maps to the intersection of the Rv1990c, Rv3249c, and Rv3066 regulons",Virulence/Persistence
73,SG_11,False,0.0045115174,,Single Gene iModulon 11,Single Gene
27,Unc_2,False,0.0042245757,,Uncharacterized iModulon 2,Uncharacterized
37,Rv3095,False,-0.0041923643,Rv3095,iModulon labeled with predicted regulon with unknown function,Unknown Function
31,ArgR,False,0.0040651997,argR,Transcription factor that regulates the L-arginine biosynthesis pathways,Amino Acids
75,Unc_9,False,0.0038670201,,Uncharacterized iModulon 9,Uncharacterized
13,SG_1,False,-0.0036409529,,Single Gene iModulon 1,Single Gene
33,SG_4,False,-0.0035280607,,Single Gene iModulon 4,Single Gene
44,SG_6,False,0.0034602456,,Single Genes iModulon 6,Single Gene
29,Blal,False,0.0033897534000000003,blaI,"Transcription regulator that regulates genes associated with antibiotic transport, detoxification, and cell wall function",Antibiotic
0,SigH,False,-0.0032700287,sigH,Sigma Factor involved in heat shock and oxidative stress response,Virulence/Persistence
54,Unc_7,False,0.0028597387,,Uncharacterized iModulon 7,Uncharacterized
24,Salicylate Induced,False,-0.002656335,,Manually annotated iModulon where genes were found to change expression when exposed to salicylate,Metal Related
51,PhoP,False,0.0026428889000000002,phoP,"Transcription factor that controls response to redox/acid stress, hypoxia, and virulence",Virulence/Persistence
50,Unc_6,False,0.0021900164,,Uncharacterized iModulon 6,Uncharacterized
3,PyrR,False,-0.0021877748000000002,pyrR,Transcription factor that regulates the expression of pyrimidine nucleotide operons,Nucleic Acids
48,Leucine Related,False,-0.0021575612,,Manually annotated iModulon with gene related to leucine metabolism,Amino Acids
56,Fatty Acid Biosynthesis,False,0.0020559137,trcR and Rv1776c and whiB4 ,"iModulon that maps to the intersection of the Rv1033c, Rv1776c, and Rv3681c regulons",Fatty Acid/Cholestrol
20,FasR,False,0.0020004674000000003,fasR,Transcription factor that controls the expression of fatty acid metabolism genes,Fatty Acid/Cholestrol
21,MprA,False,0.0018234787000000001,mprA,Transcription factor that regulates multiple stress responsive genes,Virulence/Persistence
6,MarR,False,0.0016703453,marR,Transcription factor that regulates the response to acid stress,Acid Stress
47,SG_7,False,-0.0015656026000000001,,Single Gene iModulon 7,Single Gene
53,Rv1776c+WhiB4,False,-0.0015176774,Rv1776c and whiB4 ,iModulon that maps to the intersection of the Rv1776c and Rv3681c regulon,Redox
22,SG_3,False,-0.0013985471,,Single Gene iModulon 3,Single Gene
42,Nicotinate Metabolism,False,-0.0013950832000000002,,iModulon enriched with the nicotinate and nicotinamide metabolism KEGG pathway,Central Carbon
8,IdeR,False,-0.0012126012,ideR,Metal-Dependent DNA-Binding protein that controls genes related to iron metabolism,Metal Related
26,EspL KO,False,0.0011483791,,Single Gene iModulon that captures EspL knockout,KO
46,Rv2621c,False,0.0010929929,Rv2621c,iModulon labeled with predicted regulon with unknown function,Unknown Function
43,LysG,False,0.0009876501,lsyG,Transcription factor that controls the expression of LysE and requires lysine or histidine for activation ,Amino Acids
19,WhiB6,False,0.0007672213,whiB6,Transcription factor that regulates ESX-1 system membrane transport proteins,Redox
2,IniR,False,-0.0003666858,iniR,Transcription factor that regulates the expression of the ini operon (iniBAC),Antibiotic
69,Rv0135+Rv1019,False,-0.0002862173,Rv0135c and Rv1019,iModulon that maps to the intersection of the Rv0135c and Rv1019 regulons,Nucleic Acids
65,SG_10,False,0.0002050714,,Single Gene iModulon 10,Single Gene
62,Rv2488c,False,0.0001369517,Rv2488c,LuxR family transcription factor that regulates genes associated with virulence,Virulence/Persistence
45,SigD,False,9.724480000000001e-05,sigD,Sigma Factor that governs the expression of ribosomal genes and plays a role in virulence,Virulence/Persistence
32,Unc_3,False,-5.29008e-05,,Uncharacterized iModulon 3,Uncharacterized
